id,text,username,retweets,date
969743403,"@howardowens Right. http://is.gd/4w1V In '98, Palin voted for state amendment to Constitution defining marriage between 1 man & 1 woman.",ccadelago,0,2008-10-22 00:59:10
969743193,Drew Griffin wins Sean Hannity's title as World's Biggest Sycophant for this interview/Fox audition with Palin : http://tinyurl.com/68vwq6,cnc916,0,2008-10-22 00:58:58
969743141,Penguin running for office against Batman (1960s Adam West) sounds a lot like McCain/ Palin haha http://tinyurl.com/3lnxqs,davidamusin,0,2008-10-22 00:58:50
969742248,"Need a cosutme? Free Biden, Obama, McCain and Palin masks. http://tinyurl.com/5r2h9h",ltlmrmd,0,2008-10-22 00:58:04
969742115,"Hah! I just saw the best spoof on the McCain- Palin campaign.... ""McSame-Failin'"" Hah! I laughed out loud.",Gazerella,0,2008-10-22 00:57:52
969742026,@duncanriley thanks for the palin link! uploading it to Crikey's US election page now! ;),stokely,0,2008-10-22 00:57:47
969741320,@ayse Palin is seriously scaring me now. She really couldn't have passed American Government.,Karoli,0,2008-10-22 00:57:09
969741216,@Sarah_ Palin Enjoyed the transcript of the interview... thanx for the link : ),AirPigz,0,2008-10-22 00:57:04
969741107,"""he hates Palin as much as you do!"" Am I that bad? Do I really? Hmm...",robdb,0,2008-10-22 00:56:56
969740714,palin thinks being vp means being in charge of the senate. OK. WOW.,Teii,0,2008-10-22 00:56:30
969740578,"Girls speaking out against Sarah Palin , moving stuff http://tinyurl.com/5s233c thx @poshy",karllong,0,2008-10-22 00:56:20
969740576,"Reading: ""YouTube - A Messsage For Sarah Palin "" (http://tinyurl.com/5hoasp)",Deb_Prothero,0,2008-10-22 00:56:21
969740564,Is it wrong that I consider McCain- Palin signs halloween decorations. They're frightening...,james_s_white,0,2008-10-22 00:56:16
969740454,"Sweet Jeebus. Palin says VP is ""in charge of the Senate."" Can someone please hand this woman a copy of the Constitution? http://is.gd/4uON",ayse,0,2008-10-22 00:56:10
969740409,"Just read Sarah Palin thinks the VP is in charge of Congress. Ding dong....nobody's home. No, really, really, nobody's home. WTF",tgodfrey99,0,2008-10-22 00:56:12
969740041,Drew Griffin did a horrible job on the Palin interview. Are they engaged or something?,steve_boyd,0,2008-10-22 00:55:49
969740037,"Las Vegas paper calls Sarah Palin ""MOOSALINI"" http://snurl.com/4kyhv --- clever.",Meryl333,0,2008-10-22 00:55:50
969740010,@duncanriley Thanks for the Palin report! Can't wait to get through 11/4. Such an awesome history making time we're living in.,SaraAbrams,0,2008-10-22 00:55:49
969739997,"Palin , again, demonstrates a lack of understanding about what a VP actually does: http://tinyurl.com/5px4hq",talkingorange,0,2008-10-22 00:55:47
969739983,Listening To Palin for the next 2 weeks in the unfiltered Media is going to destroy McCains chanes,Bruce4Obama,0,2008-10-22 00:55:47
969739582,State Paid for Palin Family Travel; Expenses Reportedly Doctored: AP: Gov. Palin charged state for kid.. http://tinyurl.com/6qwgfe,channelone,0,2008-10-22 00:55:22
969739298,@LUKEFANDERS Vote Mccain- Palin all the way in '08 Baby!!!,YIRMASTER,0,2008-10-22 00:55:06
969739177,@duncanriley have you got an alternative link to AP vs. Palin ? is.gd gives 500 error,crispin_harris,0,2008-10-22 00:55:00
969738976,TPM Election Central | Talking Points Memo | Poll: Palin Is Now The Top Concern Voters Have About Mc.. http://tinyurl.com/6qmljf,TwitLinksRSS,0,2008-10-22 00:54:47
969738783,What to do in case McCain- Palin win: http://tinyurl.com/486jvy,Winking_Buddha,0,2008-10-22 00:54:35
969738415,"Is Sarah Palin aware that her husband has ties with the Alaska Independence Party when she says she likes visiting ""pro America"" areas? HUH?",HyperDF,0,2008-10-22 00:54:15
969738245,"twHILLARY> CNN: Clinton backers by her side, Palin makes pitch to women voters: Gov. Palin .. http://tinyurl.com/5qgcd5",twHILLARY,0,2008-10-22 00:54:03
969738215,"twHILLARY> CNN: Clinton backers by her side, Palin makes pitch to women voters: Gov. Palin .. http://tinyurl.com/55939e",twHILLARY,0,2008-10-22 00:54:06
969738132,"don't many Christians view Halloween as an ""evil"" holiday? I guess Palin likes NYC now and it's not one of those ""unAmerican"" places.",Goldyzbox,0,2008-10-22 00:54:01
969738008,Nice day today. Got a lot accomplished. Haven't heard about Palin one time!,lindag1966,0,2008-10-22 00:53:54
969737949,Palin talked about faith and God again today. The god she worships is Satan. There is nothing Christian about this woman,danmpls,0,2008-10-22 00:53:51
969737931,"Pretty funny how shots of Tina Fey appear in an ""official"" AP image feed of Sarah Palin . http://tinyurl.com/6o94ld",ohmytodd,0,2008-10-22 00:53:51
969737855,Palin dont know what roll VP IS,fdwlovebug,0,2008-10-22 00:53:46
969737771,"Showed girlfriend a video. She posts it. Friend sees it, tweets it. Other friend retweets it. I end up watching again. Hey Sarah Palin !",lavidalibre,0,2008-10-22 00:53:40
969737756,@gruber I'm betting that John McCain *hates* Sarah Palin . A deep and profound hatred. He wishes he picked Mitt Romney who he merely detests.,chrisfahey,0,2008-10-22 00:53:39
969737592,Not surprising at all. Palin been guilty of abusing her power for years.http://tinyurl.com/5gjv6x,Nubian_Queen,0,2008-10-22 00:53:32
969737428,Sarahcuda Lays Out The Five Biden Scenarios: Sarah Palin lays out five scenarios in which Senator Oba.. http://tinyurl.com/5akwoz,rc_sarasota,0,2008-10-22 00:53:21
969737244,"Reading: "" Palin Opposes Colo. Amendment That Would Benefit Special Needs Kids - TalkLeft: The Politics Of Crime"" (http://tinyurl.com/639 ...",HuffPostPol,0,2008-10-22 00:53:12
969737241,"Reading: "" Palin Opposes Colo. Amendment That Would Benefit Special Needs Kids - TalkLeft: The Politics Of Crime"" (http://tinyurl.com/63958e)",TalkLeft,0,2008-10-22 00:53:12
969737153,"Newsweek: Is Palin Making Plans?: For 2012, I mean. I ask because she's contradicted.. http://tinyurl.com/5d9hcl -HuffNewswire",HuffPostPol,0,2008-10-22 00:53:06
969737151,"Newsweek: Is Palin Making Plans?: For 2012, I mean. I ask because she's contradicted.. http://tinyurl.com/5d9hcl",HuffNewswire,0,2008-10-22 00:53:06
969737133,"Breaking News: AP: Palin Charged State For Her Children's Travel: ANCHORAGE, Alaska - Gov. S.. http://tinyurl.com/6xp4ll",QueensOnly,0,2008-10-22 00:53:06
969737114,"Wow - this video, done by young girls talking to Sarah Palin is pretty powerful: http://tinyurl.com/5wo6lt",stefsull,0,2008-10-22 00:53:05
969737106,Sarahcuda Lays Out The Five Biden Scenarios: Sarah Palin lays out five scenarios in which Senator .. http://tinyurl.com/5akwoz,CommsForCause,0,2008-10-22 00:53:04
969736874,"Seriously, this is the funniest thing in YouTube today Sarah Palin remixed (all her bs in a song) http://tinyurl.com/4rbq9o",HyperDF,0,2008-10-22 00:52:53
969736708,"A. Sullivan: Cocoon Watch: ""McCain's choice of Palin brought his polling numbers above O.. http://tinyurl.com/6cbmqw -HuffNewswire",HuffPostPol,0,2008-10-22 00:52:44
969736703,"A. Sullivan: Cocoon Watch: ""McCain's choice of Palin brought his polling numbers above O.. http://tinyurl.com/6cbmqw",HuffNewswire,0,2008-10-22 00:52:44
969736680,"Dear Gov. Palin : after election, might want to visit Constitution Museum in Philly.Might actually learn something.http://tinyurl.com/5rx ...",DearRobot,0,2008-10-22 00:52:38
969736591,"@ccadelago You're link isn't opening, but I've said before Palin doesn't know what Federalist means, and she's inconsistent.",howardowens,0,2008-10-22 00:52:34
969736322,CBS NEWS - Palin Children Traveled On Alaska's Dime: Gov. Sarah Palin charged the state f.. http://u.mavrev.com/9xo,USABreakingNews,0,2008-10-22 00:52:23
969736152,"CNN: Clinton backers by her side, Palin makes pitch to women voters: Gov. Palin appealed to wome.. http://tinyurl.com/55lszx -HuffNewswire",HuffPostPol,0,2008-10-22 00:52:12
969736151,"CNN: Clinton backers by her side, Palin makes pitch to women voters: Gov. Palin appealed to wome.. http://tinyurl.com/55lszx",HuffNewswire,0,2008-10-22 00:52:12
969736131,"Dear Gov. Palin : after election, might want to visit Constitution Museum in Philly.Might actually learn something.http://tinyurl.com/5rxedz",data4all,0,2008-10-22 00:52:10
969735927,"Sarah Palin , tell this girl to ""choose life"" - rape as ""a tactic of war"" http://tinyurl.com/5zuhof",drewctaylor,0,2008-10-22 00:51:58
969735704,This incl Palin &Bristol 5d trip in NYC posh hotel RT @HarlemWriter AP INVESTIGATION: Alaska funded Palin kids' travel http://snipr.com/4kw2q,Alheri,0,2008-10-22 00:51:49
969735538,Stephen Baldwin responds to being Sarah Palin 's fave over Alex - Video: http://tinyurl.com/5s5hrr,BlogsForMcCain,0,2008-10-22 00:51:36
969735521,William Harryman: Family Guy - McCain- Palin Button http://tinyurl.com/69acua,ffholic,0,2008-10-22 00:51:38
969735417,New blog post: Reblog: Jon Stewart on Sara Palin http://tinyurl.com/64xal4,thejeffbyrnes,0,2008-10-22 00:51:31
969735411,"[DSM-Register] McCain, Palin plan Iowa trips this weekend: Republican presidential no.. http://tinyurl.com/6xfk4x",DesMoinesNews,0,2008-10-22 00:51:30
969735297,ABC NEWS - State Paid for Palin Family Travel; Expenses Reportedly Doctored: AP: Gov. Pal.. http://u.mavrev.com/9wz,USABreakingNews,0,2008-10-22 00:51:21
969734878,GOOGLE NEWS - Palin agrees with Biden that Obama presidency will create crisis - Chris.. http://u.mavrev.com/9wp,USABreakingNews,0,2008-10-22 00:51:00
969734460,"Breaking News: AP: Palin Charged State For Her Children's Travel: ANCHORAGE, Alaska - Gov. S.. http://tinyurl.com/6xp4ll",TBOcom,0,2008-10-22 00:50:37
969734408,Palin is the new G.W.B.,drinkbourbon,0,2008-10-22 00:50:34
969734245,Just picked up my father who attended a Sarah Palin rally.,RandyPawlowski,0,2008-10-22 00:50:21
969734051,"Palin : ‘I’m Not Going To Call’ Obama ‘A Socialist,’ But He Believes I.. http://tinyurl.com/5l6p5f -thinkpr ...",HuffPostPol,0,2008-10-22 00:50:15
969734048,"Palin : ‘I’m Not Going To Call’ Obama ‘A Socialist,’ But He Believes I.. http://tinyurl.com/5l6p5f",thinkprogress_i,0,2008-10-22 00:50:15
969734000,Palin Claims The Vice President Is ‘In Charge Of The U.S. Senate’: http://tinyurl.com/5mcyv6,allisonkilkenny,0,2008-10-22 00:50:08
969733751,"@NObama4thisMama Hate to rain on your talking point parade, peaches - but as a joke writer - I assure you - I LOVE Palin . Low lying fruit.",TinaDupuy,0,2008-10-22 00:50:01
969733692,yea Palin has more experience in spreading Hate,fdwlovebug,0,2008-10-22 00:49:54
969733506,"Every day, I thank John McCain for giving us Palin (AKA the Senate Boss). It makes landslide so much closer! http://tinyurl.com/5rxedz",data4all,0,2008-10-22 00:49:47
969733336,#mcweek McClellan agrees with grimes' Blake quote that bush and palin alike in that they scoff ideas and intellectuals,CindyRoyal,0,2008-10-22 00:49:35
969732799,"Seriously, this is the funniest thing in YouTube today Sarah Palin remixed (all her bs in a song) http://tinyurl.com/4rbq9o",HyperDF,0,2008-10-22 00:49:09
969732200,Sarah Palin says she has more experience than Obama. Oh really?,CharliePDean,0,2008-10-22 00:48:35
969732091,How low will Palin McCain go to get WhiteHouse And power over poor & middle class,fdwlovebug,0,2008-10-22 00:48:30
969732075,"AP: Palin charged state for kids' travel and ammended expense reports to justify. Tsk, tsk Sarah. Those are the people's hard-earned tax $$$",jporter,0,2008-10-22 00:48:30
969731854,"On McCain, Voters More Worried About Palin Than Iraq, Economy: ANCHORAGE, Alaska — A new MS.. http://tinyurl.com/6r9yx2",AmerIndp,0,2008-10-22 00:48:15
969731649,"Wow, have you seen this? AP INVESTIGATION: Alaska funded Palin kids' travelANCHOR.. http://bit.ly/4cXmaA",Fi2W,0,2008-10-22 00:48:05
969731024,Major Palin story breaking http://bit.ly/QSjc4,seisenstadt,0,2008-10-22 00:47:31
969730805,I hope Sarah Palin does more interviews.,winipoo,0,2008-10-22 00:47:17
969730748,"SARAH PALIN ""REMIXED"" (all her BS in a song) http://tinyurl.com/4rbq9o Seriously, this is the funniest thing in YouTube!",HyperDF,0,2008-10-22 00:47:18
969730357,@NObama4thisMama You're talking about Obama supporters focusing on Palin well you're a McCain supporter focused on Obama....,KrystineAlaina,0,2008-10-22 00:46:59
969730294,Obama Biden will Unite USA McCain Palin will devidr USA,fdwlovebug,0,2008-10-22 00:46:51
969730062,Was curious to see Palin post show up on twitter election page but page is now going so fast it was waaay gone. Wonder how fast by 11/4.,alexrosen,0,2008-10-22 00:46:41
969729886,Palin Charged State For Kids' Travel : Alaska Gov. Sarah Palin charged the state for her children to .. http://tinyurl.com/5dlrjo,11AliveNews,0,2008-10-22 00:46:33
969729876,AP may have just killed Palin . http://is.gd/4vJY,duncanriley,0,2008-10-22 00:46:29
969729848,wow... AP investigation into Palin . She is getting the Bill Clinton treatment. http://tinyurl.com/56jdzg,jamesbressi,0,2008-10-22 00:46:30
969729839,Sarah Palin believes in run-on sentences. http://www.cnn.com/2008/POLITICS/10/21/palin.sitroom.transcript/index.html,jill_hw,0,2008-10-22 00:46:31
969729687,"read the kilkenny email ... what a blow to Sarah ""Barracuda"" Palin , go read it!",multihulky,0,2008-10-22 00:46:22
969729620,@Sarah_ Palin cuz he is an elite leftist and Sarah isn't,trekker4ever,0,2008-10-22 00:46:16
969729571,"RT @lizwebpage Somebody get this out of my head, PLEASE? http://blip.fm/~id9v (Sarah Palin ""I Wanna Lay Pipe"")",BrettGreene,0,2008-10-22 00:46:15
969729524,"st: Dailymotion - Family Guy - McCainPalin Scene - PRICELESS, a video from iphone3gtv. mccain, palin .. http://tinyurl.com/6rqd4y",top_video,0,2008-10-22 00:46:10
969729479,Keith (KO) asks: Is Sarah Palin smarter than a third grader? Naaaaah. http://tinyurl.com/6q6nxg,HVGeenen,0,2008-10-22 00:46:12
969729404,"SARAH PALIN ""REMIXED"" (all her BS in a song) http://tinyurl.com/4rbq9o Seriously, this is the funniest thing in YouTube!",HyperDF,0,2008-10-22 00:46:06
969728970,Sarah Palin art - heh. http://tinyurl.com/6n57x4,DaveWaldon1908,0,2008-10-22 00:45:42
969728761,@bottomline when will mccain and palin stop bringing down the human race - by ugliness and racism,Tagsma,0,2008-10-22 00:45:30
969728486,"Obama surrounds himself with knowledgeable experts on healthcare, economy, war, environment. McCain chose Palin . Who would you trust?",tech_sherpa,0,2008-10-22 00:45:11
969728057,Swing voters breaking for Obama. New WSJ poll Obama 52% to McC at 42% Top concern in poll of concern on McC side Palin not qualified,charliemartin,0,2008-10-22 00:44:52
969727966,Are Democrats Better at Political Satire Than Republicans? : With the Sarah Palin -skewering SNL ascendant.. http://tinyurl.com/5epnrf,QueensOnly,0,2008-10-22 00:44:47
969727654,I have to agree. This is a stupid CNN reporter on a hatchet job on Palin . C'mon. http://tinyurl.com/5fcapa,glucas,0,2008-10-22 00:44:28
969727436,"Palin thinks paying for rape kits is too expensive, but has the state pay (more) for her kids' travel? http://bit.ly/2TwkAP",deirdresm,0,2008-10-22 00:44:15
969726373,"Clinton backers by her side, Palin makes pitch to women voters http://tinyurl.com/6ayyrw",QueensOnly,0,2008-10-22 00:43:16
969726275,@cracked so if I go at Palin do I need to get a lobotomy?,simasays,0,2008-10-22 00:43:07
969725909,"@Sarah_ Palin because Bible prophecy is coming true. Bad is being called good, and that which is Good is being called bad. Come quickly, Lord",iStones,0,2008-10-22 00:42:46
969725466,"SARAH PALIN ""REMIXED"" (all her BS in a song) http://tinyurl.com/4rbq9o Seriously, this is the funniest thing in YouTube!",HyperDF,0,2008-10-22 00:42:24
969725372,"Palin claims VP is ""in charge of the US Senate"" http://tinyurl.com/6fd7x4",m2meow,0,2008-10-22 00:42:18
969725238,Palin /Quayle 2012!They're a team of mavericks Chuck the Teacher would vote for. #current,TinaDupuy,0,2008-10-22 00:42:09
969724959,"@howardowens Yeah. Same as Obama, no? Palin said in debates that she wouldn't restrict rights, but check this... http://is.gd/4w1V",ccadelago,0,2008-10-22 00:41:55
969724657,"Palin claims VP is ""in charge of the US Senate"" http://tinyurl.com/6fd7x4",m2meow,0,2008-10-22 00:41:37
969724635,"Hardball: Chris Matthews has Bill Maher on. Maher calls Bachmann and Palin ""Beavis and Butthead""",MNHeadhunter,0,2008-10-22 00:41:35
969724427,"Identi.ca: Ouch, Bill Mahr, calling Bachmann and Palin ""Beavis and Butthead""",kflanagan,0,2008-10-22 00:41:25
969724398,wants to tell Sarah Palin that the Vice President does not run the Senate.,elyse_yo,0,2008-10-22 00:41:23
969724375,"Fact: There are more people in Bergen County, New Jersey than there are in the entire state of Alaska. This is Sarah Palin 's ""experience.""",simplyarthur,0,2008-10-22 00:41:19
969723993,haha. Palin posters @http://tinyurl.com/5u9e6d (the Obama-inspired one at the bottom is great!),garrett,0,2008-10-22 00:41:01
969723672,Palin has more time in government then Obama and she is only running for VP. BTW loved her on SNL last week...=),VoteMcCain,0,2008-10-22 00:40:42
969723611,@NObama4thisMama you got anything else ..... Your slightly annoying and repetitive - kind of like Sarah Palin :),Tagsma,0,2008-10-22 00:40:39
969723455,Huckleberries Online: Quotable Quote (DFO): I hate myself a tiny bit for liking Palin about 10 time.. http://tinyurl.com/62ea3a,washingtonBNN,0,2008-10-22 00:40:30
969723452,Palin to take the heat for McCain. McCain's GOP orthodox economic policies are worrying for small business too.,christopherhire,0,2008-10-22 00:40:31
969723351,"Was Palin 's $6 billion windfall tax on big oil and additional $1,200 payment to each Alaskan some sort of spread the wealth socialism plan?",alexrosen,0,2008-10-22 00:40:24
969723324,"Palin says the VP is ""in charge"" of the U.S. Senate. Nothing she could say would surprise us.",maxgladwell,0,2008-10-22 00:40:20
969723309,Palin says she wants to run the senate,Bruce4Obama,0,2008-10-22 00:40:20
969723207,God i cringe every time i hear Sarah Palin try to explone the role of the vice president.,Solo_Jeff,0,2008-10-22 00:40:17
969723135,"@josephpred LOL I'd rather vote for gaffe-a-minute Biden than ""I have no idea what the VP does"" Palin .",Dangerangel,0,2008-10-22 00:40:13
969722841,"SARAH PALIN ""REMIXED"" (all her BS in a song) http://tinyurl.com/4rbq9o Seriously, this is the funniest thing in YouTube!",HyperDF,0,2008-10-22 00:39:57
969722828,"Balloon Juice: Palin on CNN: Number of comments: 10Post your comments. Personally, I have to comp.. http://tinyurl.com/6gmqhm",westvirginiaBNN,0,2008-10-22 00:39:56
969722826,Palin 's kids travel on tax dollars... http://tinyurl.com/5h2u7g,divrchk,0,2008-10-22 00:39:59
969722686,West Virginia Blue: Palin is a horrible surrogate: I'm watching Sarah Palin 's interview on CNN .. http://tinyurl.com/62whtn,westvirginiaBNN,0,2008-10-22 00:39:50
969722578,"SARAH PALIN ""REMIXED"" (all her BS in a song) http://tinyurl.com/4rbq9o Seriously, this is the funniest thing in YouTube!",HyperDF,0,2008-10-22 00:39:45
969722319,SoonerThought: Palin STILL Has No Idea What A Vice President Does: From ThinkProgress:Q: Brandon Garc.. http://tinyurl.com/6a98ln,oklahomaBNN,0,2008-10-22 00:39:27
969722313,Does anyone else think Palin smells like Bait & Switch?,christopherhire,0,2008-10-22 00:39:30
969722250,Palin is a good comedy sketch - but do you want that for a VP,Tagsma,0,2008-10-22 00:39:26
969722051,"SARAH PALIN ""REMIXED"" (all her BS in a song) http://tinyurl.com/4rbq9o Seriously, this is the funniest thing in YouTube!",HyperDF,0,2008-10-22 00:39:16
969721869,"SARAH PALIN ""REMIXED"" (all her BS in a song) http://tinyurl.com/4rbq9o Seriously, this is the funniest thing in YouTube!",HyperDF,0,2008-10-22 00:39:04
969721416,"You read about the Obama art trend, here comes the Sarah Palin art trend: http://tinyurl.com/5u9e6d",artcity,0,2008-10-22 00:38:38
969721236,Poll: Palin Is Now The Top Concern Voters Have About McCain http://tinyurl.com/6qmljf,Phyrdancer,0,2008-10-22 00:38:33
969721220,"Sarah Palin charged Alaska $21,012 for her 3 daughters' 64 1-way & 12 round-trip commercial flights + luxury hotel rooms since 2006 YEOW!!!",CreativeArtSoul,0,2008-10-22 00:38:29
969721092,"Palin was a stupid pick two months ago, and continues to be so. And none of her ridiculous rhetoric will change my mind.",audiophilia,0,2008-10-22 00:38:24
969721088,"Palin more worrisome to voters than Iraq, the economy: http://tinyurl.com/6r9yx2",jepaco,0,2008-10-22 00:38:25
969721046,"RedStateBlues: Palin tells school kids the Vice President is ""in charge of the Senate"": On Chris Matthews.. http://tinyurl.com/5pgvq6",utahBNN,0,2008-10-22 00:38:24
969720655,Obama up by 10 in latest NBC/WSJ poll. Palin is now biggest concern voters have about McCain.: NBC ju.. http://tinyurl.com/6jljmm -ameri ...,HuffPostPol,0,2008-10-22 00:38:02
969720654,Obama up by 10 in latest NBC/WSJ poll. Palin is now biggest concern voters have about McCain.: NBC ju.. http://tinyurl.com/6jljmm,americablog,0,2008-10-22 00:38:02
969720647,Palin has so much more executive experience than Obama it's ridiculous. Obama shouldn't even be in this race.,gapebeezan,0,2008-10-22 00:38:02
969720283,Palin under investigation for billing the state for her kids to travel with her http://tinyurl.com/6nktla luxury hotels what??,mollyluise,0,2008-10-22 00:37:41
969720059,"SARAH PALIN ""REMIXED"" (all her BS in a song) http://tinyurl.com/4rbq9o Seriously, this is the funniest thing in YouTube!",HyperDF,0,2008-10-22 00:37:25
969719861,Las Vegas Gleaner: Palin terrorizes Nevada and the nation -- does that make her a ... TERRORIST!?!: Num.. http://tinyurl.com/62zsz5,nevadaBNN,0,2008-10-22 00:37:18
969719805,Palin is a joke and a liar.,Jacki62,0,2008-10-22 00:37:10
969719428,Fresh Moose (Why Sarah Palin is a locavore.): When John McCain chose Sarah Palin as his running mate.. http://tinyurl.com/67ebcr,freerepublic,0,2008-10-22 00:36:54
969719422,Palin has no knowledge of economics. Palin has no knowledge of Washington. Palin has no knowledge of military administration. Worrying.,christopherhire,0,2008-10-22 00:36:54
969719228,Retweeting @gruber : Sarah Palin now more of a drag on McCain ticket than George W. Bush: http://xrl.us/ounta,AshleyAngell,0,2008-10-22 00:36:44
969719202,** CNN: Transcript of Sarah Palin interview with CNN ~ http://www.cnn.com/2008/POLITICS/10/21/palin.sitroom.transcript/index.html,toriblaseCNN,0,2008-10-22 00:36:40
969719143,Obama up by 10 in latest NBC/WSJ poll. Palin is now biggest concern voters have about McCain. /AMERICAblog ... http://tinyurl.com/6jljmm,souplady,0,2008-10-22 00:36:38
969718980,Rt @exador23 Is this Pork you're looking for McCain? http://ur1.ca/a1f hotel & flights for Palin & kids to watch their father in a snowmobi,ursulas,0,2008-10-22 00:36:29
969718908,"SARAH PALIN ""REMIXED"" (all her BS in a song) http://tinyurl.com/4rbq9o Seriously, this is the funniest thing in YouTube!",HyperDF,0,2008-10-22 00:36:25
969718786,Palin still doesn't understand the role of the VP http://tinyurl.com/6fd7x4,mnblrmkr,0,2008-10-22 00:36:17
969718761,"Alaska funded Sarah Palin kids' travel: ANCHORAGE, Alaska - Gov. Sarah Palin charged the state for h.. http://tinyurl.com/6rr8qf",bostonherald,0,2008-10-22 00:36:14
969718707,Palin needs not appoligize for anything. Cities are full of illegals eating away at our welfare dollars.,snipe61,0,2008-10-22 00:36:14
969718695,"Actually, rommie, what Helen says here was confirmed by new NBC news poll released tonight. Palin is a bigger drag than bush, say voters.",JennyBoylan,0,2008-10-22 00:36:14
969718449,"Palin more worrisome to voters than Iraq, the economy: http://tinyurl.com/6r9yx2 -TWILaura",HuffPostPol,0,2008-10-22 00:35:59
969718444,"Palin more worrisome to voters than Iraq, the economy: http://tinyurl.com/6r9yx2",TWILaura,0,2008-10-22 00:35:59
969718378,"Palin should apologize for ever even thinking she could be VP, she needs to get her head out of her a**",Tagsma,0,2008-10-22 00:35:52
969718259,"Sarah Palin Still Doesn't Understand the Vice President's Role /- Gay news daily: Towleroad.com - ""Hot ... http://tinyurl.com/69jfdf",tlrd,0,2008-10-22 00:35:48
969718250,"This election is so important, everyone needs to get out and vote! We need to vote McCain/ Palin ! Do you want Obama Socialism? I don't",gapebeezan,0,2008-10-22 00:35:47
969718008,"Clinton backers by her side, Palin makes pitch to women voters http://tinyurl.com/6ayyrw",PoliticalTicker,0,2008-10-22 00:35:34
969717904,New poll says Palin 's qualifications to be president rank as voter's top concern about McCain's candidacy http://tr.im/hfw,r0b,0,2008-10-22 00:35:28
969717764,is laughin because sarah palin is one of cassidy reids heroes,T_to_the_revan,0,2008-10-22 00:35:21
969717172,"Today, Palin referenced ""Irma the Restaurant Onwer."" The last thing I want is a veep who confuses Garfield with reality.",jdm0079,0,2008-10-22 00:34:52
969717153,** CNN: Palin apologizes for 'real America' comment ~ http://www.cnn.com/2008/POLITICS/10/21/palin.sitroom/index.html,toriblaseCNN,0,2008-10-22 00:34:51
969717140,Is this the Pork you're looking for McCain? http://ur1.ca/a1f hotel & flights for Palin & kids to watch their father in a snowmobile race.,exador23,0,2008-10-22 00:34:50
969717047,Sarah Palin now more of a drag on McCain ticket than George W. Bush: http://xrl.us/ounta,gruber,0,2008-10-22 00:34:46
969716818,"@mightymur Keep in mind Palin is the woman who couldn't say what newspapers she reads, when she was asked three times.",syntheticjesso,0,2008-10-22 00:34:32
969716781,"@academicdave no worries, we'll get Gov. Palin 's visiting pastor to cast them out",rainie1u,0,2008-10-22 00:34:30
969716540,"""McCain's Folly"" = Sarah Palin",trevorFmartin,0,2008-10-22 00:34:15
