id,text,username,retweets,date
969264942,Oprah to produce The One’s infomercial: After refusing to have Sarah Palin in her show because &#82.. http://tinyurl.com/5nojas,Fausta,0,2008-10-21 18:37:45
969264713,Fact Check: Did Palin denounce McCain’s campaign tactics? « - Blogs from CNN.com http://tinyurl.com/65nq3e,Phyrdancer,0,2008-10-21 18:37:35
969264416,"@ricksanchezcnn Type in Sarah Palin and Terrorist, McCain voted to arm OSAMA BIN LADIN McCAin and Osama Bin Ladin youtube.com",presdennis1,0,2008-10-21 18:37:20
969263754,Palin outlines 'crisis scenarios' if Obama is elected http://tinyurl.com/5k37es,NECN,0,2008-10-21 18:36:57
969263194,Video Secessionist group claims Palin as member http://tinyurl.com/5c5zpw,SuSandStorm,0,2008-10-21 18:36:33
969263063,Just checked out this amazing new Palin interview with Katie Couric... http://tinyurl.com/6hp6gf,HochmanMichael,0,2008-10-21 18:36:27
969262748,"McCain/ Palin pulling Bush's tricks, fear, terror, never nothing good, always bad, just like Bush they need to turn around & see who did this",JackieZ,0,2008-10-21 18:36:14
969262626,"Palin last Friday: ""I LOVE VISITING PRO-AMERICA AREAS OF THIS GREAT NATION"" Huh? So, are there 2 USAs? In short: Palin is dividing the USA!",HyperDF,0,2008-10-21 18:36:07
969262546,Fact Check: Did Palin denounce McCain's campaign tactics? http://tinyurl.com/65nq3e,PoliticalTicker,0,2008-10-21 18:36:04
969262177,@grayfuse that code will loop forever unless your bathroom break does something to palin 's rhetoric... disturbing,aparrish,0,2008-10-21 18:35:46
969261505,THIS JUST OUT.... MCCAIN HATES MCCAIN AND WANTS SOMEONE TO KILL HIM.. PALIN LOOKING DOWN GET RIFFLE BARREL! HOPE SHE TURNS GUN AROUND ON HER!,brianmc73,0,2008-10-21 18:35:21
969260688,sarah palin de biquiiinii uhuuu \o/ http://i28.photobucket.com/albums/c217/fabulisa/sarahpalin.jpg,liviathi,0,2008-10-21 18:34:46
969260312,"@ricksanchezcnnthere are Videos on youtube, how the Alaska ind. party nominated and supported Palin mayoral and governors run'",presdennis1,0,2008-10-21 18:34:31
969260266,@OldManTom Palin has a soul? No way. Totally not buyin' it.,SvenStraatveit,0,2008-10-21 18:34:26
969259311,Unless you've been a U.S. President before: The Presidency will always be learned while on the Job. Only one position exists duh ... #palin,standardsociety,0,2008-10-21 18:33:46
969259276,@kungfugazi Praying for Palin 's soul is a good idea. I sure wouldn't want to have to put up with her in Hell.,tompeyer,0,2008-10-21 18:33:43
969259157,"@joshpaul I don't know the answer - I just know that's what they do in Alaska under Sarah Palin , so it's kinda weird how she mocks socialism",stranahan,0,2008-10-21 18:33:41
969258908,"If you're worried about Palin but like McCain, please consider that more than 1 in 5 presidents have been replaced mid-term by their VP.",joshklein,0,2008-10-21 18:33:30
969258882,"Report: Palin &her family have, over an extended period of time, endeavored to get Trooper Wooten fired from his job as Alaska State Trooper",SuSandStorm,0,2008-10-21 18:33:29
969258314,The wife vetoed dressing up Pixel as Sarah Palin for the weiner dog costume contest.,willreinhardt,0,2008-10-21 18:33:05
969257877,Palin is rocking in Nevada...CNN carried her live....,PA_CABoy,0,2008-10-21 18:32:45
969257765,"How confident are you in Sarah Palin , who can't even face the challenge of a press conference? Apparently, Colin Powell isn't confident...",stranahan,0,2008-10-21 18:32:39
969256939,"Catch up Palin no one cares about Joe the plummer. In my eyes he isn't a plummer.I went to school for welding, he did not go for plumming",Jacki62,0,2008-10-21 18:32:02
969256937,"Wasilla High was named a ""dropout factory"" by the Johns Hopkins study. Quess Palin 's future son-in-law will join the ranks.",SuSandStorm,0,2008-10-21 18:32:01
969256916,"[FreeRepublic] GOPNation.com: Who's fault?: If McCain/ Palin lose, whose fault wi.. http://tinyurl.com/55fdqd",conservatweet,0,2008-10-21 18:32:01
969256785,WEIRD NEWS: Palin Lookalike Strippers to Strut in Pageant http://tinyurl.com/6fbzfc,theledger,0,2008-10-21 18:31:56
969256109,"@hazakaza Loves it. Not going as ""Tina Fey as Sarah Palin "", though?",mattt,0,2008-10-21 18:31:27
969255709,"Catch up Palin no one cares about Joe the plummer. In my eyes he isn't a plummer.I went to school for welding, he did not go for plumming",Jacki62,0,2008-10-21 18:31:11
969255499,I feel very sorry for anyone who votes for Mccain Palin,fdwlovebug,0,2008-10-21 18:31:02
969254789,"""SATURDAY NIGHT LIVE"": Sarah Palin ganha elogios e dá audiência recorde a humorístico http://tinyurl.com/5deuql",gazetadopovo,0,2008-10-21 18:30:32
969254763,"twaboutMCCAIN> Jon Stewart slammed Sarah Palin with her ""real America"" comments. S.. http://tinyurl.com/6race8",twaboutMCCAIN,0,2008-10-21 18:30:32
969254608,"twaboutMCCAIN> Jon Stewart is slammed Sarah Palin with her ""real America"" comments.. http://tinyurl.com/5jl5vs",twaboutMCCAIN,0,2008-10-21 18:30:25
969254152,Sarah Palin strikes me as the sort of woman who thinks her man will turned on by her lilac-scented baby powder.,Balut,0,2008-10-21 18:30:07
969253967,boy with the imaginary life has been coming to the library more often. now he has a job on snl and is responsible for the sarah palin sketch,MissSirenaBella,0,2008-10-21 18:30:01
969253864,"Catch up Palin no one cares about Joe the plummer. In my eyes he isn't a plummer.I went to school for welding, he did not go for plumming",Jacki62,0,2008-10-21 18:29:54
969253729,You know what else I'm not amused with? The fact that I can no longer say 'You betcha' without thinking of Sarah Palin .,mary_lynn_k,0,2008-10-21 18:29:51
969253523,"WP-Blog Update Palin -Hatred Reaching Rabid Level: Why is the Democratic Left, so filled.. http://tinyurl.com/6sy2pf",paulswansen,0,2008-10-21 18:29:40
969253267,[CNN.com]Could ' Palin factor' save McCain? http://tinyurl.com/6ghpb2,azusa_soleil,0,2008-10-21 18:29:27
969253233,"The bear that was killed these are the people voting for McCain, they are stupid, oh but Palin would like them",JackieZ,0,2008-10-21 18:29:24
969253165,"Catch up Palin no one cares about Joe the plummer. In my eyes he isn't a plummer.I went to school for welding, he did not go for plumming",Jacki62,0,2008-10-21 18:29:23
969252923,I am worried I am not American enough anymore. Can you please tell me how to get my Americanism back McCain/ Palin ?,josie,0,2008-10-21 18:29:11
969252655,"""Stop covering Palin until she gives a press conference"" - http://tinyurl.com/5rhvn6",digg,0,2008-10-21 18:28:59
969252335,If the parts of the U.S. that don't support McCain/ Palin are anti-U.S. - then those two bitches have to stop doing photo ops at ground zero.,steve_rousseau,0,2008-10-21 18:28:42
969252296,"@joshpaul No, Palin has them pay taxes, too...this is how she was able to cut taxes there..",stranahan,0,2008-10-21 18:28:43
969251837,Volunteering at the GOP VA office! Go McCain - Palin !,EAHeart,0,2008-10-21 18:28:21
969251753,RT @alizasherman : JUST BLOGGED: Sarah Palin Rockin' It on Saturday Night Live: Sarah Palin on SNL - Weeke.. http://tinyurl.com/6y8p32,Dayngr,0,2008-10-21 18:28:18
969251730,I can't wait to 3pm when CNN runs interview with Palin and asks about AIP and here association in this anti- American group she supports GOP,brianmc73,0,2008-10-21 18:28:14
969251021,"I'm really confused - because this is exactly what Governor Palin does in Alaska. Seems kinda commie, don't it? http://snurl.com/4kjiv",stranahan,0,2008-10-21 18:27:43
969250082,NECN: Palin outlines 'crisis scenarios' if Obama is elected. Palin outlines 'crisis scenarios' if Obama is elected http://wuaala.com/za7,uselabs,0,2008-10-21 18:27:01
969250075,I will try that same Pro America propaganda shit Sarah Palin used. I will only help the Pro Canada provinces. The rest can kiss my arse.,notsteveharper,0,2008-10-21 18:27:00
969249579,JUST BLOGGED: Sarah Palin Rockin' It on Saturday Night Live: Sarah Palin on SNL - Weeke.. http://tinyurl.com/6y8p32,alizasherman,0,2008-10-21 18:26:37
969248412,@ryanlanciaux @joshpollard He's running with Palin . We're going to have the Shrewsbury Feuds '12.,ScottSanz,0,2008-10-21 18:25:45
969248217,She’s got real star quality! Palin ’s rise to Dumbdom http://tinyurl.com/5a8hqj,chickylala,0,2008-10-21 18:25:36
969248205,"@AshleySue i definitely prefer saying ""power glasses"" now over ""sarah palin glasses"". & triangle traffic is always worse than aville traffic",CarolinaMorning,0,2008-10-21 18:25:35
969247930,Palin breaks with McCain on gay marriage http://tinyurl.com/5h6v8z,chickylala,0,2008-10-21 18:25:20
969247700,"Sarah Palin on SNL, a CNN account http://tinyurl.com/6ewurx",HardHardTruth,0,2008-10-21 18:25:12
969247488,Palin ’s attempt to tell us which parts of OUR country are Pro-America? http://tinyurl.com/5jyerj,chickylala,0,2008-10-21 18:25:04
969247318,Palin said McCain supports Regan-like politics. can someone please tell McCain/ Palin Reaganomics (or trickle-down-economics) has failed.,ras_irie,0,2008-10-21 18:24:57
969246326,I pray for Palin 's soul.,Benjamin_Nason,0,2008-10-21 18:24:13
969246092,Not to companies: DON'T have people who sound like Sarah Palin and the mom from Bobby's World callin folks about money! Tanks but no tanks,SaintBoogie,0,2008-10-21 18:24:02
969245251,CNN account of Sarah Palin Behind the Scenes at SNL http://tinyurl.com/6ewurx,HardHardTruth,0,2008-10-21 18:23:26
969245010,"Digg Science: Palin : If Ice Melts, Polar Bears Can Adapt!: Palin : ""These magnificent, cud.. http://tinyurl.com/5858mt",scienceRSS,0,2008-10-21 18:23:15
969244725,"Palin thinks that the VP is ""in charge of the Senate."" Whaaa? http://tinyurl.com/6fd7x4",danaeshell,0,2008-10-21 18:23:05
969244681,She has such a compassion for animals that just one image of Palin shooting a wolf probably killed the Repub tix in her 8 y.o mind.,mickierops,0,2008-10-21 18:23:03
969244334,The Palin ’s Un-American Activities http://tinyurl.com/3rdlhk,chickylala,0,2008-10-21 18:22:50
969243527,@jonathancoulton but Palin =Roslin! http://bit.ly/1BDXka,PenLlawen,0,2008-10-21 18:22:14
969243349,"After playin’ Palin , Tina Fey returns in ‘30 Rock’: NEW YORK – This couldn’t be better if Ti.. http://twurl.nl/q1avgz",mg_palin,0,2008-10-21 18:22:07
969243330,"Tina Fey Pushing ""30 Rock,"" Marveling At Palin : NEW YORK — This couldn’t be better if Tina F.. http://twurl.nl/cmzep4",mg_palin,0,2008-10-21 18:22:05
969243258,"Another reason to want Palin , not Biden, as VP: http://tinyurl.com/57epdd",cyndisstuff,0,2008-10-21 18:22:03
969243177,Palin due on CNN this afternoon: Republican vice presidential nominee Sarah Palin is sitting down .. http://tinyurl.com/6qcjth,usatodayDC,0,2008-10-21 18:22:00
969243113,HAHA!!! Palin steps down!! WOOOOOOOOOOOOOOOOO!!!,whiskey_kitten,0,2008-10-21 18:21:56
969243053,@Sharky123 Any music video featuring you will automatically become my favorite music video... even if Alaska = Palin to me right now.,JohnTCogan,0,2008-10-21 18:21:55
969243032,"After playin’ Palin , Tina Fey returns in ‘30 Rock’: NEW YORK – This couldn’t be better if Tin.. http://tinyurl.com/69j75v",mashget,0,2008-10-21 18:21:54
969242970,Does ProAmerica mean full of hate? McCain/ Palin Hate Mob Videos http://tinyurl.com/6z55h2,chickylala,0,2008-10-21 18:21:51
969242857,Looks like the still haven't briefed Palin in on what the VP job is all about. http://snurl.com/4kjbb,WarnerCrocker,0,2008-10-21 18:21:47
969241922,"@netdoc66 i dont think you're wrong. i'm beginning to think that Palin is like Diana from the miniseries ""V"" ;)",jpsherman,0,2008-10-21 18:21:08
969241797,Palin Wagers on Nevada: The Republican vice presidential candidate stumps for McCain NOW in Reno. W.. http://tinyurl.com/6gt97a,TIMEThePage,0,2008-10-21 18:21:04
969241290,The only thing that makes sense is that the Repub. party picked Palin in an effort to reconnect to their base after Bush and NOT TO WIN.,UnionSt,0,2008-10-21 18:20:40
969241283,Palin ’s IQ is about as high as a pickup’s tailpipe. http://clapboard.org/temp/S... IQ of 83,chickylala,0,2008-10-21 18:20:42
969241080,THE PAGE: Palin Wagers on Nevada: The Republican vice presidential candidate stumps for McCain NO.. http://tinyurl.com/6gt97a,TIME,0,2008-10-21 18:20:33
969240674,"@carolinamorning how funny... it's as if we women who wear glasses now must be wearing ""Sarah Palin "" glasses... no matter how they look! :)",AshleySue,0,2008-10-21 18:20:18
969240493,Alec Baldwin: Palin on SNL: What Did You Expect?: Shared by Bill Alec Baldwin is as classy as he is funn.. http://tinyurl.com/6688ru,billfusz,0,2008-10-21 18:20:10
969240384,Great speech from Palin ....even reporters are digging her,PA_CABoy,0,2008-10-21 18:20:05
969240175,"Jon Stewart slammed Sarah Palin with her ""real America"" comments. She's d*mber than a box of rocks!!! LOL! What was John McCain thinking?",HyperDF,0,2008-10-21 18:19:58
969239864,"Jon Stewart is slammed Sarah Palin with her ""real America"" comments. She's d*mber than a box of rocks!!! LOL! What was John McCain thinking?",HyperDF,0,2008-10-21 18:19:46
969239816,McCain Palin says Jor the Plumber is attacked by Obama. America should be upset because JOE is way behind in paying Taxes,fdwlovebug,0,2008-10-21 18:19:43
969239524,"E veit ein film e må kjøp! ""Nailin' Palin !""",Nordlys,0,2008-10-21 18:19:31
969239520,"""This idea that [Sarah Palin 's] just like you - it's such a narcissistic country. Isn't she just like you? A fuckin' moron."" - Bill Maher",wiredbirds,0,2008-10-21 18:19:30
969239352,"my most recent blog post is turning out to be somewhat popular on the interwebs. for better or worse, it has Mrs. Palin . http://is.gd/4uJy",DonnyW,0,2008-10-21 18:19:24
969238940,Two protesters at Sarah Palin rally http://tinyurl.com/55486h,rgj,0,2008-10-21 18:19:07
969238924,"Palin : ""These magnificent, white bears are doing just fine and dont need protection. If the ice melts, theyll adapt to living on the land.""",MQDuclos,0,2008-10-21 18:19:06
969238832,Blog: Lee Greenwood sings to welcome Sarah Palin to Reno http://tinyurl.com/6qzsp6,rgj,0,2008-10-21 18:18:58
969238795,It kills me that McCain picked palin in one day and I have had to wait over a month for this job opportunity,Rambleredhead,0,2008-10-21 18:18:59
969238607,http://hellotxt.com/i/P4OW - Way to be subtle CNN: Headline about McCain/ Palin embracing Regan Principals w/ pic of overturned bus.,joshpreston,0,2008-10-21 18:18:51
969238521,Chuck Norris can make Sarah Palin shut up,TwittingTa,0,2008-10-21 18:18:48
969238362,"""This idea that [Sarah Palin 's] just like you - it's such a narcissistic country. Isn't she just like you? A fuckin' moron."" - Bill Maher",wiredbirds,0,2008-10-21 18:18:41
969238334,"RT fdevillamil: ""Sarah Palin steps down and is replaced by Debra J Fields http://tinyurl.com/6nvfoa""",als,0,2008-10-21 18:18:40
969238002,Opened my Ballot last night to find that in order to vote for Palin I have to vote for McCain too!?!?! Crap.. I have some thinking to do.,JasonMRuby,0,2008-10-21 18:18:27
969236524,Feminist Hatred Of Salin Palin Out Of Pocket http://twurl.nl/njsx4x,feedack,0,2008-10-21 18:17:26
969236109,"maybe mccain thought he had an ""in"" with palin http://tinyurl.com/62kmle",jaxensmommy,0,2008-10-21 18:17:08
969236097,"Sarah Palin : Dangerous, neo-con fucktard http://www.dailykos.com/storyonly/2008/10/21/123959/11/752/635884",nickmjones,0,2008-10-21 18:17:07
969235905,"Wondering how Sarah Palin thinks Polar Bears can ""adapt"" to living on land if the ice caps melt....",kr1st,0,2008-10-21 18:17:02
969235821,"God dumps McCain: OMG, the final hope that McCain and Palin had for victory is gone.  God has finall.. http://tinyurl.com/5ghrcx",skumora,0,2008-10-21 18:16:58
969235626,"Palin today in NV: ""But I guess the looming crisis that most worries the Obama campaign right now is Joe Biden’s next speaking engagement.""",TeriChristoph,0,2008-10-21 18:16:50
969235609,Sarah Palin the Dumbing down of American Women http://tinyurl.com/4a5zqq,chickylala,0,2008-10-21 18:16:50
969235536,Sarah Palin steps down and is replaced by Debra J Fields http://tinyurl.com/6nvfoa,fdevillamil,0,2008-10-21 18:16:46
969235271,Class b4 trash McCain/ Palin =Trash King w/Michelle http://www.cnn.com/video/#/video/politics/2008/10/09/sot.lkl.michelle.obama.energy.cnn,chickylala,0,2008-10-21 18:16:34
969234909,WWR Blog: West Hollywood Considers Ban On Sarah Palin Drag Queens http://tinyurl.com/6x3ubr,wwr_news,0,2008-10-21 18:16:20
969234774,Sarah Palin makes more sense when she speaks from the heart & not the nasty Repub machine.,PhDee,0,2008-10-21 18:16:13
969234466,"Palin says ""Kenya? Isn't that Barbie's friend? Ya, you betcha!""",airavata,0,2008-10-21 18:16:03
969234210,"CNN, SNL, Powell GOP and Florida You must know McCain and Palin are racists! Obama signs being burned in Chicago, McCain & Palin Laugh,why?",brianmc73,0,2008-10-21 18:15:51
969234043,Meet Sarah Palin ’s radical right-wing pals http://tinyurl.com/3zt2hw,chickylala,0,2008-10-21 18:15:44
969233942,I wonder if Palin can see Russia laughing at McCain from her backyard? http://tinyurl.com/62d4ws,KatDevlon,0,2008-10-21 18:15:40
969233901,"Palin : If Ice Melts, Polar Bears Can Adapt!: Palin : ""These magnificent, cuddly white bears are doing j.. http://tinyurl.com/5858mt",feedzzz,0,2008-10-21 18:15:39
969233817,Sarah Palin ganha elogios e dá audiência recorde a humorístico - mais do que nunca a eleição presidencial americana é um espetáculo de mídia,gnaisse,0,2008-10-21 18:15:36
969233801,"Comment: Palin visit energizes Colorado supporters: Ah, OK. So, you admit that Obama is going to .. http://bit.ly/1Da3WH",denvertalk,0,2008-10-21 18:15:33
969233781,"Every time Palin says ""You betcha!"" a kitten dies :(",airavata,0,2008-10-21 18:15:34
969233538,Is Palin a genius or a moron? http://tinyurl.com/4xhgze,airavata,0,2008-10-21 18:15:25
969233508,@ScottSanz @joshbaltzell there is an obvious joke here about me having never meet Sanz in relation to mccain/ palin :-),joshpollard,0,2008-10-21 18:15:23
969232575,McCain/ Palin neither one said anything bad about race. If they had either one hung out with bombers they would've been hung out to dry!,KyGater,0,2008-10-21 18:14:52
969232547,"Sarah Palin knows how to make love to the camera. The thing is, she isn't very smart.",Jacki62,0,2008-10-21 18:14:48
969232256,"Must....resist....wordplay.... @seriouseats .... ""hautenuts...."" ....Must crush.....Mr Palin .....joke....before....born.....",AndreaWinchestr,0,2008-10-21 18:14:36
969231897,She’s got real star quality! Palin ’s rise to Dumbdom http://tinyurl.com/5a8hqj,chickylala,0,2008-10-21 18:14:21
969231528,Palin as a Robocaller? you betcha! http://tinyurl.com/6qda4q,chickylala,0,2008-10-21 18:14:03
969231509,"@chrisguillebeau eBay? Hey, who put Palin in charge of solving the Iceland crisis? - http://budurl.com/6k97",quimmott,0,2008-10-21 18:14:03
969231084,"An interesting bit of writing on the end times philosophy, Canada's PM and Sarah Palin http://zi.ma/101dde",alainsaffel,0,2008-10-21 18:13:40
969231063,"I think we should put Palin on an ice floe, like an Inuit elder, and let her see if global warming is real or not.",airavata,0,2008-10-21 18:13:41
969230989,"Tina Fey on Sarah Palin 's ""Crazy Voice"" http://tinyurl.com/62kmle",jaxensmommy,0,2008-10-21 18:13:36
969230950,I think Sarah Palin is too smart gor the McCain campaign ...,PhDee,0,2008-10-21 18:13:36
969230685,Obama scares me less than McCain... nobody scares me more than Palin !,ohwowmelody,0,2008-10-21 18:13:25
969230527,"The Sarah Palin name generator gave me ""Blitz Harden Palin ."" I think it got confused somehow with the gay pornstar name generator.",ambrosiamonkey,0,2008-10-21 18:13:19
969230514,She’s got real star quality! Palin ’s rise to Dumbdom http://tinyurl.com/5a8hqj,chickylala,0,2008-10-21 18:13:19
969230498,@marknoble interesting that he put Palin before McCain in his sign,mattcasto,0,2008-10-21 18:13:18
969230166,Republican senator Ted Steven's life long friend Colin powell testifies on his behalf. Sarah palin enemy of the alaska GOP!!,g3t_real,0,2008-10-21 18:13:01
969229630,"Just added 'Sarah Palin SNL Debut: Tina Fey, Weekend Update Alaska Rap Dancing, Baldwin & Wa...' to Vodpod http://tinyurl.com/5craxn",susty,0,2008-10-21 18:12:36
969228764,"People see what they want to see. Somehow, Mike at work says that Palin calling Obama a socialist is a racial comment against him.",AdmiralMemo,0,2008-10-21 18:11:57
969228679,Retweet @versac Sarah Palin jette l'éponge http://tinyurl.com/6nvfoa ;-) ---- Oh putain !!!,Charles_Liebert,0,2008-10-21 18:11:51
969228451,"Oh my frickin' whosiwhatsit, the Palin rap on SNL is hilarious: http://tinyurl.com/5dzrpt",rickbruner,0,2008-10-21 18:11:39
969228239,@lazygenius Check out this link if you didn't earlier http://tinyurl.com/5j5otc Father of Bristol Palin 's baby speaks,SickSpitter,0,2008-10-21 18:11:30
969227941,"Obama is willing to allow the McCain/ Palin mouth steamrollers free reign for 2 days while he goes to her side. That's a good person, folks.",Karoli,0,2008-10-21 18:11:18
969227766,"stand up for sarah palin , she must be doing something right for democrats and republicans to be a fraid of her",g3t_real,0,2008-10-21 18:11:11
969227678,"@MarkWSchumann tx, I feel that Palin , McCain et al should just acknowledge: we redistribute wealth and it's part of our system, period",JillMillerZimon,0,2008-10-21 18:11:06
969227570,"feels a case of Palin tourettes comin' on & it ain't gonna be pretty. ""Tito the builder""? ""A Colombian made in America""? R u F'in kiddin me?",LarryLigouri,0,2008-10-21 18:11:01
969227522,Looks like Sarah Palin practices socialism too... http://tinyurl.com/6g96yf,georgerodriguez,0,2008-10-21 18:10:58
969226785,Sarah Palin and Indiana LG Becky Skillman - http://tinyurl.com/587xwp,HoosierAccess,0,2008-10-21 18:10:27
969226215,"does sarah palin have enimies in the GOP for taking on alaska GOP & Rep Sen stevens life long friend of colin powell?""",g3t_real,0,2008-10-21 18:10:03
969225873,"@dailykos Talk about Obama beinG tested, John McCain has already been tested and failed miserably. He picked a ditsy Sarah Palin !",PhDee,0,2008-10-21 18:09:51
969225818,CAMPAIGN 2008: Palin backs shipping LNG to Japan http://tinyurl.com/5rytc3,celebritypaycut,0,2008-10-21 18:09:49
969225414,I'd be more comfortable with Tina Fey instead of Sarah Palin . CNN SNL,noisufnoc,0,2008-10-21 18:09:31
969224853,"People who get so excited about Palin see her as their ""last great white conservative hope""-scared to death that their maj. is slipping away",JBax52,0,2008-10-21 18:09:07
969224801,"""This idea that [Sarah Palin 's] just like you - it's such a narcissistic country. Isn't she just like you? A fuckin' moron."" - Bill Maher",wiredbirds,0,2008-10-21 18:09:05
969224325,"@g3t_real Palin will shank anyone to further the AIP agenda. It's a verb, ""to shank"". Now who wants lemmonaide?",sblackdiamond,0,2008-10-21 18:08:43
969224223,@luv2shoppe Biden's was saying ALL candidates are tested. Do you think with erractic McCain and SARAH PALIN our enemies won't test us?,stranahan,0,2008-10-21 18:08:41
969223981,"colon powell testifies for Alaskan Rep Sen Steven, a long time friend, palin takes on alasakan GOP",g3t_real,0,2008-10-21 18:08:31
969223882,"Looking at the map of AT&T cell phone coverage and wondering if the areas that aren't covered are what Palin refers to as ""real america"".",ronhubbard,0,2008-10-21 18:08:26
969222913,Sarah Palin jette l'éponge http://tinyurl.com/6nvfoa ;-),versac,0,2008-10-21 18:07:47
969222015,A Polar bear yells at Sarah Palin ! - http://tinyurl.com/4sgzsb,vintagevantage,0,2008-10-21 18:07:07
969221911,"Palin says she, McCain stand for Ronald Reagan's principles",etham_basden,0,2008-10-21 18:07:05
969221825,"Bush is good to have a beer with, Palin 's hot, Obama's middle name is Hussein... all great reasons to vote or not vote for somebody. THINK!",ebb_med,0,2008-10-21 18:06:58
969221415,I guess Mc/ Palin campaign is really desperate for money-- Palin says media will have to pay $15 million for copies of her emails as gov...wow,JBax52,0,2008-10-21 18:06:44
969221214,Palin 's spiritual advisor was the guy with the stuffed monkey.,sempersaint,0,2008-10-21 18:06:35
969220871,does sarah palin have enimies in the GOP for taking on sen stevens of alaska a long time friend of colin powell?,g3t_real,0,2008-10-21 18:06:25
969220300,"""This idea that [Sarah Palin 's] just like you - it's such a narcissistic country. Isn't she just like you? A fuckin' moron."" - Bill Maher",wiredbirds,0,2008-10-21 18:06:03
969220138,Sarah Palin Video set to great contemporary music: http://tinyurl.com/6cxcpu,celiadarling,0,2008-10-21 18:05:55
969219832,So this is what happens when the snake plane crashes into a Biden- Palin -esque debate in Texas http://tinyurl.com/6echza,jpippert,0,2008-10-21 18:05:42
969219790,New Blog Post: Sarah Palin : Let’s Enshrine Bigotry In The Constitution http://tinyurl.com/6opccu,dmataconis,0,2008-10-21 18:05:40
969219470,Funniest part of Palin 's hilarity is that she has no idea we're laughing at her.,sempersaint,0,2008-10-21 18:05:24
969219399,"Dear Sarah Palin , Please get a clue. Sincerely, Daniel DiNicola ( @DanielDiNicola )",DearRobot,0,2008-10-21 18:05:20
969219282,"facts! colin powell testifies for Rep Sen Stevens of Alaska, Palin took on the GOP in alaska, is that reason to ? powells support for obama?",g3t_real,0,2008-10-21 18:05:15
969218836,"So, it's no big deal that Palin wants to charge the mdia $15 million for copies of her emails as gov.???????",JBax52,0,2008-10-21 18:05:02
969218708,"""Video - Moose Ad Hits McCain on Picking Palin "" at http://www.ohiodailyblog.com/node/2509",OhioDailyBlog,0,2008-10-21 18:04:55
