id,text,username,retweets,date
968614821,"'hustler palin ' is being searched right now, http://pawst.com/hustler+palin",pawst,0,2008-10-21 08:22:05
968614629,"McCain Palin Republican Happy Face: Daryl Cagle, MSNBC.com http://tinyurl.com/59825o",TMV,0,2008-10-21 08:21:50
968613261,Goddammit I hate Palin so much. http://tinyurl.com/5pe9s4,DorkmanScott,0,2008-10-21 08:20:01
968612927,Wow Palin lied like the Devil about troopergate. Here's the report http://ktuu.images.worldnow.com/images/incoming/branchflowerreport.pdf,SuSandStorm,0,2008-10-21 08:19:33
968612898,"GOOGLE NEWS - Palin talks economy, taxes in one-on-one interview - 9NEWS.com: BBC News.. http://is.gd/4sZm",USABreakingNews,0,2008-10-21 08:19:29
968612803,"Only a nazzi is a nazzi, but mccarthyism is alive and well in the McCain- Palin campaign Teri Szucs",Teriszucs,0,2008-10-21 08:19:20
968612681,"interesting...from a hs friend ""McCain/ Palin for so many reasons...I don't see how one would support Obama in anyway being a Christian.""",kg,0,2008-10-21 08:19:11
968611934,Sarah Palin 's college years left no lasting impression (Los Angeles Times): In the five years of he.. http://tinyurl.com/6zroll,ElectionWatch,0,2008-10-21 08:17:59
968611082,"Local News: Palin talks taxes, economy during northern Colorado visit: Vice presidentia.. http://tinyurl.com/6s9je9",GreeleyTribune,0,2008-10-21 08:16:46
968611035,Local News: Musgrave looks for payoff from Palin visit: Republican 4th Congressional Di.. http://tinyurl.com/5h2mep,GreeleyTribune,0,2008-10-21 08:16:42
968610176,"Comment: Palin packs in 11,000: To Notenoughkindness: I've just read your post and understand wha.. http://bit.ly/Bw6Ui",denvertalk,0,2008-10-21 08:15:21
968609711,loved the latest Family Guy - especially the McCain/ Palin Nazi reference...,melfneerg,0,2008-10-21 08:14:38
968609591,@pahlkadot we are at the mediaroom spreading an anti palin ad:-) all th ebest for the conference!,ulrike_reinhard,0,2008-10-21 08:14:26
968608446,Unconfirmed Sources Sarah Palin Accuses Democratic Voters of Stealing Election: (Denver : .. http://tinyurl.com/5afovx,ucs,0,2008-10-21 08:12:28
968607420,McCain is Hitler & Palin is Attila,Chy_Chase,0,2008-10-21 08:10:39
968606829,Protesters try to disrupt Palin motorcade http://tinyurl.com/5w88s4,PoliticalTicker,0,2008-10-21 08:09:43
968606689,ablackstormy I wish they would hurry up & turn. Palin is soooo out of her league running for VP,Chy_Chase,0,2008-10-21 08:09:30
968606066,"When Palin ceases to be sort-of hot, only the crazy and stupid will remain. Then the GOP will turn on her, too.",ablackstormy,0,2008-10-21 08:08:23
968605630,Palin should be in hollywood she is the perfect candidate for that but not qualified to be VP,Chy_Chase,0,2008-10-21 08:07:43
968603959,Palin supports amending the US Constitution to ban marriage for same-sex couples http://tinyurl.com/5pe9s4,EricMueller,0,2008-10-21 08:05:13
968602457,Todd Palin was stalking Wooten in troopergate! http://ktuu.images.worldnow.com/images/incoming/branchflowerreport.pdf,SuSandStorm,0,2008-10-21 08:03:04
968602320,"@builders_trans just start with what I know to be true mccain voted yes on the war&he picked palin .obama voted no,picked biden.they both ...",ConqueringLion,0,2008-10-21 08:02:52
968602257,NEW blog post: Palin Jazz Improv http://tinyurl.com/5gkkvp,politicalirony,0,2008-10-21 08:02:47
968602056,"""Who's Nailin' Palin ?"" does not disappoint, my friends.",dubsteppenwolf,0,2008-10-21 08:02:25
968601730,Your awesome Sarah Palin video of the day (shooting a rifle edition) (via Blog) http://bit.ly/WNbXJ,CanadaElects08,0,2008-10-21 08:01:56
968601314,just re-watched all the Palin SNL videos; hilarious: http://www.scottcrevier.com/video/palin/,crevier,0,2008-10-21 08:01:21
968600972,Your awesome Sarah Palin video of the day (shooting a rifle edition): Republican vice presidentia.. http://tinyurl.com/5ut4d4,westernstandard,0,2008-10-21 08:00:54
968600431,rt @ddfreyne Palin song: http://tinyurl.com/6cxcpu,chucker,0,2008-10-21 08:00:13
968600091,@apelad 700 Mole Men? Sounds like the crowd at a McCain rally without Palin . *rimshot* (I weary of this fish-in-barrel shooting),someothercraig,0,2008-10-21 07:59:57
968599522,@usermac Brian no wonder you can't sleep! Thinking about Sarah Palin at this hour is enough to give anyone nightmares!,WorriedNoodle,0,2008-10-21 07:59:02
968596565,#itsnotoveruntil Ian Hislop becomes PM of Great Britain and is then uncovered to have been involved in a romantic affair with Sarah Palin .,jrothwell,0,2008-10-21 07:53:55
968596515,larry walker what controversial tape? more McCain Palin negativity no doubt,Chy_Chase,0,2008-10-21 07:53:50
968595334,"@Chy_Chase So much for Palin 's ""save yourself for marriage"" BS.",Dangerangel,0,2008-10-21 07:51:54
968595092,Why won't Palin release her medical history?-- #of pregs maybe?,Chy_Chase,0,2008-10-21 07:51:32
968594695,Palin eloped because she was pg not to save money..... it runs in the family,Chy_Chase,0,2008-10-21 07:50:54
968594055,#itsnotoveruntil Palin gets Botox and can't wink at us anymore!,CalliCoop,0,2008-10-21 07:50:00
968593981,"Palin et son ""double"" ont fait grimper l'audience d'un show TV (Challenges.fr): LOS ANGELES (Reuters) - L'acteur Alec Baldwin ..",Wikio_LaUne,0,2008-10-21 07:49:53
968593855,"McCain Palin ticket is too erratic, they don't care if they divide the country. They inspire hatred",Chy_Chase,0,2008-10-21 07:49:42
968593523,I'll take Obama over McCain Palin no matter what tests .....,Chy_Chase,0,2008-10-21 07:49:10
968593282,"La première minute (chaste) du vrai porno avec la fausse Sarah Palin : Pas de panique, vous n'êtes .. http://tinyurl.com/5mch6n",ilovepolitics,0,2008-10-21 07:48:49
968592165,Obama's Organizational Skills and Campaign ground game From all Walks of Life (btw Palin they are in the real America also) will win this!,Bruce4Obama,0,2008-10-21 07:47:20
968591262,News: Palin visit energizes Colorado supporters: Armed with homespun rhetoric and sharp words.. http://bit.ly/AV25c,denverpolitics,0,2008-10-21 07:46:02
968590948,"Comment: Palin packs in 11,000: to Notenoughkindess: I empathize with your post I really do...but.. http://bit.ly/3Jublu",denvertalk,0,2008-10-21 07:45:34
968590895,Gov. Palin just broke my Indignant-o-meter I just can't get more indignant about the 'Pro America' crap she's slinging.,shellen,0,2008-10-21 07:45:29
968589448,Just watched the video of Palin being anti American....... wild stuff.,Chy_Chase,0,2008-10-21 07:42:56
968589108,Palin is palin,Chy_Chase,0,2008-10-21 07:42:20
968588968,Plannin nailin palin,brownc9,0,2008-10-21 07:42:05
968587368,Palin being pres is scary. She talks like she didn't break the ethical rules. Palin has no ethics,Chy_Chase,0,2008-10-21 07:39:31
968586684,Bay & Rollings think Palin is the force behind the McCain ticket. McCain should be offended!!,Chy_Chase,0,2008-10-21 07:38:26
968585995,Ed Rollins said after this campaign Palin will be big in Rep. Party but not sure about McCain,Chy_Chase,0,2008-10-21 07:37:25
968585414,ARRA News Service: Sarah Palin appears on 'Saturday Night Live': CNN — Republican vice presidential c.. http://tinyurl.com/6dkl5k,arkansasBNN,0,2008-10-21 07:36:28
968585159,Palin supports amending the US Constitution to ban marriage for same-sex couples http://tinyurl.com/5pe9s4,NoOnProp8,0,2008-10-21 07:36:08
968585039,Get Immediate Regret SNL Recap: Brolin. Palin . Wahlberg. http://tinyurl.com/5boxgt,royalcow,0,2008-10-21 07:35:57
968584354,"@lisarein Todd Palin is an employee of BP? As in, British Petroleum? HA! http://en.wikipedia.org/wiki/Todd_Palin",thepete,0,2008-10-21 07:35:01
968583087,"stepladder award for today goes to Governor Palin . you're the VP candidate, honey. I'm surprised how important you think you are.",miacupcake,0,2008-10-21 07:33:00
968581385,twaboutMCCAIN> is a Commie as defined by the McCain Palin campaign which is the sa.. http://tinyurl.com/6kx8vk,twaboutMCCAIN,0,2008-10-21 07:30:32
968581160,Get Immediate Regret SNL Recap: Brolin. Palin . Wahlberg. http://tinyurl.com/5boxgt,dwheezy,0,2008-10-21 07:30:14
968580808,@useless debate--thanks for the http://tinyurl.com/6cxcpu linnk. it's like palin does sondheim.,morganarae,0,2008-10-21 07:29:47
968580714,thinks Sarah Palin should dress up as Sloth from the Goonies for Halloween. Hey you guys!,frankyarriola,0,2008-10-21 07:29:38
968580670,is a Commie as defined by the McCain Palin campaign which is the same campaign for corporate welfare. Welfare for the rich. WOOOHOOO!,ApothicApples,0,2008-10-21 07:29:34
968579460,A.Sullivan laying out the public record of Palin 's end of Trig-mester leaving conclusions to reader ( @ruraldoctoring ?) http://is.gd/4roN,neuralnomad,0,2008-10-21 07:27:28
968579399,@nickcarnes the only candidates trying to abuse it are John McCain and Sarah Palin,dominickevans,0,2008-10-21 07:27:20
968579132,"Palin has ruined ""you betcha"" for me. I can't even say it myself without cringing.",TheJenATX,0,2008-10-21 07:26:58
968578560,http://bit.ly/4zueJR - This is quite possibly the most amazing Palin video I've ever seen. Pure genius.,gtbarnes,0,2008-10-21 07:25:59
968577348,"is is thinking if Sarah Palin were to become president, I could easily be next.",Miranti,0,2008-10-21 07:24:04
968576393,Palin brings GOP message to Colo. : GRAND JUNCTION -- Fighting to hold on to Colorado and a handful .. http://tinyurl.com/5gjevx,dailycamera,0,2008-10-21 07:22:31
968575975,oh wow... daily show's feature on wasilla was pretty brutal. totally re-emphasizes palin 's lack of experience and partisan douchebaggery.,prophetofdelphi,0,2008-10-21 07:21:53
968575719,I can find news of what Palin was doing 20 minutes ago but I can't find why 5 blocks of MLK was shut down on my way home from band practise.,chavtasticjinx,0,2008-10-21 07:21:30
968575020,"Man, can McCain and his ditzy sidekick, Palin , get any more low and desperate?",brigham,0,2008-10-21 07:20:35
968574906,Logic Lessions with Sarah Palin : Gay Marriage Edition http://tinyurl.com/5umfrz,Truthdig,0,2008-10-21 07:20:26
968574257,LOL Mayor Of Wasilla Doesnt Do Shit. Todd Palin IS In AIP! Go Daily Show!,Bruce4Obama,0,2008-10-21 07:19:40
968574136,"My gma expects me to be impressed that she got palin 's signature. Only way i would be impressed by palin is...nope, never gonna happen.",darajah,0,2008-10-21 07:19:29
968573959,"http://en.wikipedia.org/wiki/Todd_Palin palin 's listed as a ""homemaker"" and an employee of BP. heh",lisarein,0,2008-10-21 07:19:15
968573857,VIDEO Comicul Jon Stewart catre Sarah Palin : F*** You http://tinyurl.com/6adraj,HotNews_ro,0,2008-10-21 07:19:07
968573808,kerpow... @maddow hits McCain/ Palin with Godwin's law and dog whistles,mmDonuts,0,2008-10-21 07:19:03
968573654,Palin 's SNL hotel rider http://is.gd/4sSg,cjguest,0,2008-10-21 07:18:51
968573545,@tomcapote Palin said you arent from the Real America Vote McCain,Bruce4Obama,0,2008-10-21 07:18:41
968573413,Jon Stewart just showed Sarah Palin 's real America: Wasilla.,kamla,0,2008-10-21 07:18:29
968573000,McCain used to be a man who actually cared about fairness. Now he is all about winning. It is sad. Palin was his worst mistake.,brande87,0,2008-10-21 07:17:56
968572459,New blog post: Toned-down Sarah Palin rallies thousands in Loveland http://blog.buckrunoutdoors.com/?p=6561,SRTNCO,0,2008-10-21 07:17:09
968572420,New blog post: Is Colorado patriotic enough for Palin ? http://blog.buckrunoutdoors.com/?p=6557,SRTNCO,0,2008-10-21 07:17:06
968572408,"New blog post: CNN, Obama camp misled on Palin robocall statement http://blog.buckrunoutdoors.com/?p=6555",SRTNCO,0,2008-10-21 07:17:05
968572399,New blog post: LIVE: Sarah Palin rally in Colorado Springs http://blog.buckrunoutdoors.com/?p=6554,SRTNCO,0,2008-10-21 07:17:04
968572242,"New blog post: Todd Palin rouses hunters, gun enthusiasts http://blog.buckrunoutdoors.com/?p=6545",SRTNCO,0,2008-10-21 07:16:50
968571772,@SeekThingsAbove Let's look at Palin 's association with anti-americans http://tinyurl.com/3rdlhk and McCain's http://tinyurl.com/6et7q3,Dangerangel,0,2008-10-21 07:16:08
968569949,Pardon Me Gov Palin i am a Vet with a Wife who is deploying to Iraq on Nov 21'st Would you like to tell Her shes From the non real America?,Bruce4Obama,0,2008-10-21 07:13:30
968569519,Never thought I would see Palin on Gizmodo.. hmm. http://tinyurl.com/5udhum,alanatpresent,0,2008-10-21 07:12:49
968569054,New stuff on pierre-ouellette.tumblr.com/ And how about that Sarah Palin ? What a gal!,PierreO,0,2008-10-21 07:12:02
968568962,"""How Local Teens Beat Sarah Palin Over Skate Park"" - http://tinyurl.com/6ofg2m",digg,0,2008-10-21 07:11:53
968568910,@nickcarnes Agreed!! It should be Palin / McCain She could be U or me and that what America is about..One of our kids could be Pres.,builders_trans,0,2008-10-21 07:11:48
968568219,"Hulu: Saturday Night Live: Update: Palin Rap: Amy steps in for Gov. PalinAdded: October 19, 2008Air.. http://tinyurl.com/5pvzkz",kish_rss,0,2008-10-21 07:10:43
968568189,Hulu: Saturday Night Live: Governor Palin Cold Open: Gov. Palin pays a visit to the showAdded: Octo.. http://tinyurl.com/5hwyka,kish_rss,0,2008-10-21 07:10:40
968567476,@abfdc yes... and Palin is looking to found one in Alaska... along with her husband and the other separatists,paul_silver,0,2008-10-21 07:09:39
968567282,Watching the Daily Show w/my Honey & being reminded why I could never consider Sarah Palin my role model. I guess I'm a fake American.,BelaySlave,0,2008-10-21 07:09:23
968567218,"Ed Henry just suggested on CNN that, if McCain loses on November 4, Palin could be the ""heir apparent"" in 2012? Are you f*ing kidding me?",abfdc,0,2008-10-21 07:09:15
968566999,checking out the snl skit with palin . at the end she should have told the blond that tina would have been better.,jeremycook,0,2008-10-21 07:08:57
968566962,"wow,watching SNL from this weekend.Pain...I mean Palin didn't suck. I'll admit she's a great actress... IOW's she's a great puppet. Still.",matt_k,0,2008-10-21 07:08:53
968566559,@CaptainFog What?? Palin good for us???? speak for yourself please,Cimcie,0,2008-10-21 07:08:15
968566336,Can we have a seperate country for those people who think it's unpatriotic to pay taxes and who think Palin is worthy of being President?,abfdc,0,2008-10-21 07:07:55
968565940,"@petaluma I agree, Palin is another Reagan...she'll run till she wins. Good for her and for us!",CaptainEcon,0,2008-10-21 07:07:20
968565668,"I am never more amazed than when I hear the blind support for McCain/ Palin , and the arguments against Obama from their camp... astounding",paul_silver,0,2008-10-21 07:07:00
968565402,Nailin Paylin Sarah Palin Hustler Porn Video First Look http://tinyurl.com/6mb95x,BPTweeted,0,2008-10-21 07:06:35
968565268,"Every credible media outlet sidestepping it, and Mccain Palin saying nothing about it on their stops. it would be home run stuff for them.",MichaelGTD,0,2008-10-21 07:06:21
968565094,Biden is a 'tag-along' candidate who won't ever go anywhere. Palin is more like Reagan- she will run and run until she wins.,petaluma,0,2008-10-21 07:06:08
968565053,"Center Left - ""Nailin Paylin"": Hustler's Palin Porn Details: WATCH FIRST MINUTE OF NAILIN' PAYLIN VIDEO (SA.. http://tinyurl.com/6zu6wp",skewz,0,2008-10-21 07:06:06
968564712,"@TinaFey It was Palin . She spiked your food to fatten you up and mark your poo with a scent. The hunt is on Fey, then hunt is on.",vojha,0,2008-10-21 07:05:36
968563833,Assumably this is the beginning of Sarah Palin 's national career. She is the kind of candidate who doesn't go away until winning.,petaluma,0,2008-10-21 07:04:23
968563625,"@Hip_M0M been meaning to tell you: your glasses/frames kicks Palin 's frames' ass. LOL, and yes, I am totally biased",wise_diva,0,2008-10-21 07:04:02
968563480,@builders_trans as far as spreading the wealth .I already have.single with no kids and no dependents.its the palin choice that's disturb ...,ConqueringLion,0,2008-10-21 07:03:48
968562545,"@jmackhh well i wasnt talking about sarah palin . i was just saying the republicans are trying to start a civil war, thats all.",OdotJdot,0,2008-10-21 07:02:29
968560257,""" Palin represente ce que le feminisme a essaye de mettre en echec"" http://tinyurl.com/6p6dv4",RSS_Liberation,0,2008-10-21 06:59:33
968558757,@kschnek do you honestly believe Palin is ready to take over the top job should McCain kill over?,voxin2,0,2008-10-21 06:57:13
968555885,@maxcarouse lol! i almost like palin for the hilarity her stupidity inspires-if she wasn't close to destroying time & space as we know it,sienyee,0,2008-10-21 06:52:58
968554004,@walt_gilbert adelman think mcain/ palin too looney tunes for his neocon crazy,naum,0,2008-10-21 06:50:16
968552945,"Message to John McCain, Sarah Palin , and GOP: http://tinyurl.com/59g8gv",a_picazo,0,2008-10-21 06:48:52
968552112,"@darar some racism in that situation, GOP pissed. Palin being dismissed re: her SNL appearance...not a game-changing moment",sendchocolate,0,2008-10-21 06:47:44
968551960,"Ok, wikipedia's not the best source, but I'm tired: http://en.wikipedia.org/wiki/Todd_Palin Todd Palin AIP member 1995-2002",cubetwit,0,2008-10-21 06:47:32
968551934,Watching The Real Sarah Palin vs Sarah Palin on SNL,DevinKing,0,2008-10-21 06:47:31
968551721,@julieperry LOL....If a slice of white bread good actually dance the hustle it would be called Sarah Palin .,VegasVince,0,2008-10-21 06:47:13
968551653,"@socialcoop Or, it's possible that many people actually DO think that Sarah Palin is qualified: Does opposing views = unqualified???",CricketsKnits,0,2008-10-21 06:47:06
968551185,Alaskin independance party leader confirms that Todd Palin was a member!,a_picazo,0,2008-10-21 06:46:27
968550690,"Yes, Todd Palin AIP member from 1995-2002, or so. Looking for link now... ah Google!",cubetwit,0,2008-10-21 06:45:44
968550422,Comment: Palin smiles as 'SNL' mocks her anew: Fey is jealous because Palin is 10 times the woman.. http://bit.ly/2fqfOq,denvertalk,0,2008-10-21 06:45:23
968550421,Sarah Palin hates skater kids. http://tinyurl.com/668v5t,JarrBay,0,2008-10-21 06:45:23
968550220,"http://twitpic.com/hdiu - Those pullin' da late night shift w/ me, this is FUNNY: Obama & Palin do the HUSTLE, Dancing w/ the Stars style!",JuliePerry,0,2008-10-21 06:45:06
968550114,@darar I was referring to the shouts during McCain & Palin rallies that are not being stopped.,sendchocolate,0,2008-10-21 06:44:58
968550067,"Jon Stewart corrispondant interviews ppl in Wasilla, and the head of the AIP tells him how Todd Palin WAS INDEED a member!",a_picazo,0,2008-10-21 06:44:55
968549188,"Missed the news this weekend, saw the Palin thing on SNL just last night. Performance-wise, think it's hilarious. Ü Hip-hop y'all?",rizza1,0,2008-10-21 06:43:32
968548465,"Sharoncobb: First McCain Limits The Viewing Of His Medical Records, Now Palin Won't Release Hers: Wh.. http://tinyurl.com/6ml2ke",tennesseeBNN,0,2008-10-21 06:42:22
968548407,Post Politics: Political News and Views in Tennessee: Sarah Palin The Flashpoint In The Right’s Clas.. http://tinyurl.com/5d6hcw,tennesseeBNN,0,2008-10-21 06:42:18
968548127,"Say Anything: Palin Supports Gay Marriage Amendment: I’m a Sarah Palin fan, but here’.. http://tinyurl.com/5977eb",north_dakotaBNN,0,2008-10-21 06:41:57
968547862,"Despite huge humor potential, Palin on SNL extremely disappointing...not funny at all...remember when Bush Sr. went on...now, that was funny",ethankurz,0,2008-10-21 06:41:34
968547831,"Jax Daily: Photos from the Sarah Palin rally: Throughout the campaign season, Nassau County Republican.. http://tinyurl.com/5md5bt",floridaBNN,0,2008-10-21 06:41:33
968546739,I'll believe it was Palin who shot up bus before an Obama supporter.She has a lot more motive to hate the McCain's campaign.,Veronica19,0,2008-10-21 06:40:06
968546613,"Cognitive Dissidence: Palin For President?: Ok, this is just downright scary.And this just downright.. http://tinyurl.com/5mkf2l",wisconsinBNN,0,2008-10-21 06:39:58
968546528,This is funny. Batmobama. Check out the Palin as Catwoman and McCain as Penguin. http://tinyurl.com/4ozpht,Bitcharonie,0,2008-10-21 06:39:51
968546241,ARRA News Service - Sarah Palin appears on 'Saturday Night Live': CNN — Republican vice p.. http://tinyurl.com/5epgh8,arra,0,2008-10-21 06:39:28
968546046,just heard the scariest thing on cnn. if mccain loses palin is so popular that she might be the heir apparent in 2012.,sagastaki,0,2008-10-21 06:39:11
968546023,"The McCarville Report Online: Five Reasons McCain- Palin Will Sweep Oklahoma: Abortion ~ Barack Obama,.. http://tinyurl.com/5bf2nt",oklahomaBNN,0,2008-10-21 06:39:10
968545072,I have watched the Palin rap way too many times now,bpapa,0,2008-10-21 06:37:50
968544195,can't believe the press and the country are letting Palin get away with not talking to the press. They should stop covering until she does,jalichandra,0,2008-10-21 06:36:36
968543978,"Joe the Plumber knows how to vote, McCain & Palin all the way!",tomcapote,0,2008-10-21 06:36:18
968543964,South Florida Daily Blog: More McCain/ Palin Supporters: http://sbrwse.com/fmB,iain2008,0,2008-10-21 06:36:17
968543827,the unequivocal notion: Sarah Palin 's America: Palin also made a point of mentioning that she loved to v.. http://tinyurl.com/64ujus,idahoBNN,0,2008-10-21 06:36:06
968543394,Sarah Palin : Pants on Fire edition: http://www.cbn.com/cbnnews/467173.aspx,suebob,0,2008-10-21 06:35:34
968542871,@rmichaelthomas the video with palin & terry tate??!? that video made my week. http://tinyurl.com/6c6wdg,ENDLESSYAK,0,2008-10-21 06:34:56
968541130,Retweeting @Mamalogues : Holy cow: shots fired at the McCain/ Palin bus? Talk about a culture of hate: http://www.sacunion.com/mark/?p=67,AMamasBlog,0,2008-10-21 06:32:24
968540658,Watching Amy Poehler do the Palin rap on SNL. Again. It's been in my head all day and it hasn't gotten old yet. Nice Cypress Hill sample.,panthea,0,2008-10-21 06:31:47
968540081,Palin vil forby homoekteskap http://tinyurl.com/6k3p4r,tv2nyhetene,0,2008-10-21 06:31:01
968539916,"McSame (BUSH), Age (Too OLD, THE PAST), health (CANCER), Palin (LIABILITY) ARE THE REASONS McSame will lose the ELECTION",toyardie,0,2008-10-21 06:30:46
968539648,"retweeting @socialcoop Apparently McCain/ Palin Supporters are gaming this poll, so vote now! http://tinyurl.com/67kocc",grl_wndr,0,2008-10-21 06:30:23
968539340,watching the Poehler Palin rap from SNL for like the 10th time. it has yet to make me wanna vomit I'm laughing so hard. memorizing now...,caseywooden,0,2008-10-21 06:30:04
968539196,"Why did Palin spend $28 of fed tax money to build the road to the bridge to nowhere? Yes, she built it.",pundunt,0,2008-10-21 06:29:53
968539192,"Apparently I'm not hard working or patriotic according to Palin .I live in unreal America, where she gets our tax$ to pay for Alaskan bridges",abbrody,0,2008-10-21 06:29:53
968538844,want to hear a joke?...sarah palin :) thought youd like that one..,kaitlynnichols,0,2008-10-21 06:29:20
968538604,want to hear a joke?......sarah palin :)t hought youd enjoy that.,kaitlynnichols,0,2008-10-21 06:29:00
968538529,What Sarah Palin 's Appearance on Saturday Night Live Revealed: I consider myself to be a person .. http://tinyurl.com/67kkfh,womensissues,0,2008-10-21 06:28:53
968538328,@tomcapote Palin raised the sales tax in Wasilla and left the town in debt. She only does well as Gov because of oil revenue.,pundunt,0,2008-10-21 06:28:31
968537965,"@AMamasBlog the only political rally I've been to was the recall for CA Gov Davis, would luv 2 o 2 palin 's rally tomorrow, but need2 work:(",wyndsong,0,2008-10-21 06:28:01
968537955,"The whole Net's aflutter with ""Jon Stewart said 'Fuck you, Sarah Palin !"" traffic. No FUs for Obama, though, because that'd be ""Hate Speech.""",The_Monarch,0,2008-10-21 06:27:59
968537954,@nickcarnes @seekthingsabove John McCain TRASHES Sarah Palin 's experience http://tinyurl.com/65avxy,Dangerangel,0,2008-10-21 06:28:00
968537473,"Why allow a fiscally responsible record like Palin has proven in Alask to continue, Vote Obama!",tomcapote,0,2008-10-21 06:27:14
968537207,>>>NEW COMMERCIAL: an Alaskan Moose talks about Sarah Palin http://tinyurl.com/64wp5d >>>Very funny... PLEASE SHARE>>>,HyperDF,0,2008-10-21 06:26:51
968536669,Was Palin 's turn on SNL a good PR move. Valley PR Blog says 'yes.' - http://tinyurl.com/5odcla,JamesDCook,0,2008-10-21 06:26:03
968536646,>>>NEW COMMERCIAL: a Moose talks about Sarah Palin http://tinyurl.com/64wp5d >>>Very funny... PLEASE SHARE>>>,HyperDF,0,2008-10-21 06:26:01
968536380,Palin is an insult to Smart Women everywhere,Bruce4Obama,0,2008-10-21 06:25:37
968536292,Great SNL updates - so funny about McCain and Obama wandering around blocking camera view. Palin got it wrong about the best Baldwin though.,geriberg,0,2008-10-21 06:25:28
968535772,"SARAH PALIN ""REMIXED"" (all her BS in a song) http://tinyurl.com/4rbq9o Seriously, this is the funniest thing in YouTube!",HyperDF,0,2008-10-21 06:24:47
968535232,"SARAH PALIN ""REMIXED"" (all her BS in a song) http://tinyurl.com/4rbq9o Seriously, this is the funniest thing in YouTube!",HyperDF,0,2008-10-21 06:24:04
968535168,"McSame (BUSH), Age (Too OLD, THE PAST), health (CANCER), Palin (LIABILITY) ARE THE REASONS McSame will lose the ELECTION",toyardie,0,2008-10-21 06:24:02
968534811,"SARAH PALIN ""REMIXED"" (all her BS in a song) http://tinyurl.com/4rbq9o Seriously, this is the funniest thing in YouTube!",HyperDF,0,2008-10-21 06:23:31
968534720,"@gillianr Sadly, I think I'll be able to pull off a fantastic Palin . (Also--was the scariest costume I could think of...)",opheliac9,0,2008-10-21 06:23:25
968534571,"SARAH PALIN ""REMIXED"" (all her BS in a song) http://tinyurl.com/4rbq9o Seriously, this is the funniest thing in YouTube!",HyperDF,0,2008-10-21 06:23:13
