id,text,username,retweets,date
969563856,@avidbookreader Caught final minute of Palin . She is just too dumb for words.,mikecane,0,2008-10-21 22:24:08
969563848,Now he's explaining cloud computing to a room full of web guys. This guy is the Sarah Palin of software development!,redbeard909,0,2008-10-21 22:24:06
969563828,"There's something very fitting about Palin campaigning in Roswell, New Mexico.",dotboom,0,2008-10-21 22:24:04
969563608,"co-worker got this from Palin . What's worse? spelling error or ""Dear Friend"" instead of ""My Friends"" - http://twitpic.com/hgwu",djwaldow,0,2008-10-21 22:23:56
969563291,palin is a disaster!!,szach87129,0,2008-10-21 22:23:40
969563281,"@punkass_mofo haha good points! But Palin keeps saying ""Obama wants to sit down with world leaders!"" and everyone in the crowd ""boo""s. hm.",cathedralheat,0,2008-10-21 22:23:40
969563057,Is Palin a 2012 contender or pretender?: Palin has hinted -- to our mind -- that she is almost assured t.. http://tinyurl.com/5s635u,Publish2,0,2008-10-21 22:23:28
969562888,Palin trying to look like she knows what she is saying...... Oh God help us,Chy_Chase,0,2008-10-21 22:23:20
969562885,RT @Sarah_ Palin : “Everything John McCain has is on the table. He’s an open book.” -- CS,zgirlie,0,2008-10-21 22:23:17
969562782,"PALIN TELLS SND GRADERS THAT THE VP IS IN CHARGE OF UNITED STATES SENATE,.WHA? WTF?..WHO ARE THESE PEOPLE.? SHE DOESNT EVEN KNOW HER JOB",RobotCommando,0,2008-10-21 22:23:13
969562722,"oh lordy, i just got told that i was promoting ""hate"" for putting up a poster against Palin on my FB",ophelia,0,2008-10-21 22:23:08
969562671,@healingsoul I think that Obama is about as socialist as Palin is fascist,joegerstandt,0,2008-10-21 22:23:09
969562657,I'm at the 2008 Internet Librarian meeting in Monterey. Sarah Palin jokes are very big.,mattmchugh,0,2008-10-21 22:23:06
969562547,"Oct. 21, 2008 - Sarah Palin visits to Reno: Vice Presidential Candidate, Sarah Palin , visited the.. http://tinyurl.com/5vslz6",NevadaSagebrush,0,2008-10-21 22:23:05
969562377,Palin & McCain wouldn't have a campaign if they quit bashing Obama Biden.,Chy_Chase,0,2008-10-21 22:22:58
969562194,Thinking its remarkable that Joe the Plumber has done more interviews than Sarah Palin,swedishskier,0,2008-10-21 22:22:48
969562156,"NEWEST PALIN -GAFFE: ""VP Is In Charge Of United States Senate"" I'm not kidding you guys! http://tinyurl.com/5e4y8d Wow!",HyperDF,0,2008-10-21 22:22:45
969561553,mccain loses his temper when he doesn't get his way. Palin takes out anyone who goes against her,Chy_Chase,0,2008-10-21 22:22:14
969561528,"Palin ... what an idiot. Ronald Reagan's policies like EIC were more ""socialist"" than anything Obama has proposed...",Chrys_Naples_FL,0,2008-10-21 22:22:11
969560982,"""... Palin said, after accusing the Obama campaign of 'investigating' Wurzelbacher’s background."" http://is.gd/4tOK",JoeyMcAllister,0,2008-10-21 22:21:49
969560897,Palin doesn't think taxes need to be raised. Well then who is going to pay for the bailout? At least Obama is realistic & will tax the rich,Hellataz,0,2008-10-21 22:21:41
969560802,Pat Buchanon: Palin 's talking to second graders! Chris Matthews: She's talking LIKE a second grader! POW!,andykhouri,0,2008-10-21 22:21:41
969560544,"@AMamasBlog Yes, I supported Hillary, but now I am for McCain/ Palin .",thoughtbeast,0,2008-10-21 22:21:29
969560294,"@cbracy - wow, i sound the opposite of Palin on that one, huh?",jilliancyork,0,2008-10-21 22:21:18
969560293,"After playin' Palin , Tina Fey returns in '30 Rock' http://tinyurl.com/5n34wa",wsvn,0,2008-10-21 22:21:17
969560264,@kjlsomebody Ronnie got tickets to the McCain/ Palin rally in Green tomorrow. I'm gonna wear an American flag sweater and a Giuliani poster.,jmcgaha,0,2008-10-21 22:21:16
969560247,"McCain's cesspool campaign and his choice of far right, extremist Palin as VP will sink his ship! Americans want a positive direction!!!",JBax52,0,2008-10-21 22:21:16
969560186,"NEWEST PALIN -GAFFE: ""VP Is In Charge Of United States Senate"" I'm not kidding you guys! http://tinyurl.com/5e4y8d Wow!",HyperDF,0,2008-10-21 22:21:13
969559985,Palin Cant Defend the Bailout as a form of goverment Socialisim,Bruce4Obama,0,2008-10-21 22:21:01
969559926,"New Hulu MSNBC Decision 08: Palin : Looming Crisis- Biden's Next Speech: Oct. 21: Speaking in Nevada, Sarah Palin hammers ..",cedorris,0,2008-10-21 22:21:00
969559915,finally saw sarah palin on SNL...omg she's unfunny,saramb,0,2008-10-21 22:21:00
969559814,Palin : The Phony Fiscal Conservative. http://tinyurl.com/6oybf5,bigskyman,0,2008-10-21 22:20:55
969559799,Palin is a Robot! Powered by a 16 meg memory stick.,stevenfrzr,0,2008-10-21 22:20:55
969559679,"PALIN TELLS SECOND GRADERS THAT THE VP IS IN CHARGE OF THE UNITED STATES SENATE,...WHA? WTF?....WHO ARE THESE PEOPLE.? SHE DOESNT EVEN KNOW",RobotCommando,0,2008-10-21 22:20:50
969559588,YAHOO! NEWS - AP INVESTIGATION: Palin children traveled on state (AP) : AP - Gov. Sa.. http://is.gd/4vB0,USABreakingNews,0,2008-10-21 22:20:46
969559496,@vividblurry kinda like how sarah palin was suprisingly articulate at the debate?,adam_rosenberg,0,2008-10-21 22:20:44
969559337,@MDLU Watch out! There are a bunch of Palin nuts nearby!,CDReed,0,2008-10-21 22:20:35
969559254,biden so called gaffes don't even compare to what palin says in a serious tone,pamsnet,0,2008-10-21 22:20:30
969558833,Gov. Palin to give Troopergate deposition Friday http://tinyurl.com/6fq4m4,TucsonStar,0,2008-10-21 22:20:12
969558813,Palin is spreading crap on CNN she said she never said Obama is socialist,Jacki62,0,2008-10-21 22:20:13
969558487,"@AMamasBlog He was bored some, but enjoyed seeing Palin . I took him to see Hillary too when she came to Greensboro earlier this year.",thoughtbeast,0,2008-10-21 22:20:01
969558453,"NEWEST PALIN -GAFFE: ""VP Is In Charge Of United States Senate"" I'm not kidding you guys! http://tinyurl.com/5e4y8d Wow!",HyperDF,0,2008-10-21 22:19:58
969558316,An Ode to Palin : Image by Shutterhack via Flickr Came across this earlier in the month and forgot to mentio.. http://tinyurl.com/6jwobh,bosca,0,2008-10-21 22:19:51
969558141,"LA Times: In the five years of her collegiate career, spanning four universities in three states, Palin left behind few traces.",jepaco,0,2008-10-21 22:19:40
969558138,i'm slapping palin ! http://www.slappalin.com/,fonziewonzie,0,2008-10-21 22:19:43
969558061,i can't wait for palin to return to AK and her view of Russia from kitchen window...maybe she can protect us from there...,pamsnet,0,2008-10-21 22:19:39
969558035,Palin on CNN talking more BS. http://tinyurl.com/3rdlhk,bigskyman,0,2008-10-21 22:19:37
969557962,2 McCain& Palin My husband barfs every morning due 2 Agent Orange/Vietnam He served his country-HOW DARE U suggest a Liberal is not patriotic,KathysArt,0,2008-10-21 22:19:35
969557822,CNN - Palin apologizes for 'real America' comment: Republican vice presidential nominee Gov. S.. http://is.gd/4vAE,USABreakingNews,0,2008-10-21 22:19:30
969557803,"AND THANK GOD, NO MORE SPEECHES FROM SARAH PALIN",RobotCommando,0,2008-10-21 22:19:26
969557756,Palin wants to charge the media $15 million for copies of her emails as gov.!!! Wow--they must really be desperate for cash...,JBax52,0,2008-10-21 22:19:26
969557744,Palin doesn't make sense. She criticizes Biden well what about her? Remembering Katie Couric ./.,Chy_Chase,0,2008-10-21 22:19:26
969557597,Sarah Palin just made me vomit in my mouth a little...Damn you CNN!,DynamiteSoul,0,2008-10-21 22:19:18
969557472,@GardenLiving I got the recipe from Sarah Palin . Zing! Sooooo just kidding. :),ResourcefulMom,0,2008-10-21 22:19:11
969557179,Someones gotta volunteer to kill palin . Any takers?,JustAnotherRich,0,2008-10-21 22:18:59
969557072,palin & Todd....1st dude are not bright enough to be in major politics very long. They don't play well w others,Chy_Chase,0,2008-10-21 22:18:54
969556888,AP INVESTIGATION: Palin children traveled on state (AP) http://tinyurl.com/56nek9,NewsHeadlines,0,2008-10-21 22:18:47
969556532,Palin on CNN right now - she still doesn't make any sense to me,tekoppele,0,2008-10-21 22:18:30
969556383,"1717EDT FYI, Sarah Palin interview on CNN right now",saleemkhan,0,2008-10-21 22:18:23
969556186,"I cannot stand to listen to Palin anymore, it is like fingernails screeching on a chalkboard.",Str8MoBn,0,2008-10-21 22:18:15
969556087,Listening to Palin 's BS on CNN. She left Wasilla with a huge deficit and raised sales taxes! http://tinyurl.com/5fwh93,bigskyman,0,2008-10-21 22:18:10
969556051,Three Sarah Palin Haiku http://tinyurl.com/6ktrah,MadKane,0,2008-10-21 22:18:09
969556045,Watching Palin on CNN...it's like one big empty run-on sentence.,LMichellePR,0,2008-10-21 22:18:07
969555881,Palin may remain until she has been in office once. Then she will be done,Chy_Chase,0,2008-10-21 22:18:01
969555819,"NEWEST PALIN -GAFFE: ""VP Is In Charge Of United States Senate"" I'm not kidding you guys! http://tinyurl.com/5e4y8d Wow!",HyperDF,0,2008-10-21 22:17:58
969555674,"Crap... Palin just said ""we're going to drill here."" Someone just put up an oil derrick in my front yard, pushing aside the Obama sign.",CDReed,0,2008-10-21 22:17:51
969555513,"Hate listening to Palin talk, somehow regurgitating talking points loses it's appeal after awhile...",meanjuju,0,2008-10-21 22:17:41
969555458,"Oh Noes. Black is white, up is down. Dogs and cats getting along. Palin is actually giving an interview on CNN. She is faltering badly tho.",MbDenton,0,2008-10-21 22:17:43
969555296,Sarah Palin Will Rule the Senate with an Iron Fist http://tinyurl.com/62k6oj,indecision,0,2008-10-21 22:17:31
969555295,Palin apologizes for 'real America' comment http://twurl.nl/ry4vpp,TheRealMcCain,0,2008-10-21 22:17:34
969555025,"Christianity: By their fruits ye shall know them, and Sarah Palin is a rotton, sour per.. http://tinyurl.com/5vvrsj",top_religion,0,2008-10-21 22:17:22
969554954,Palin B.S.'in again... on CNN,DynamiteSoul,0,2008-10-21 22:17:19
969554887,Palin was found guilty of Ethics violations in Troopergate. More to come too,Chy_Chase,0,2008-10-21 22:17:14
969554814,NEWEST PALIN -GAFFE: VP Is 'In Charge Of United States Senate' I'm not kidding you guys! http://tinyurl.com/5e4y8d,HyperDF,0,2008-10-21 22:17:13
969554758,"Is Palin A 2012 Contender or Pretender? - The Fix: In short: Like her or hate her, Palin remains VERY much i.. http://tinyurl.com/649pbm",Flap,0,2008-10-21 22:17:10
969554730,Palin Claims The VP Is ‘In Charge Of The U.S. Senate' http://twurl.nl/hdhoxc,TheRealMcCain,0,2008-10-21 22:17:06
969554351,"Christianity: By their fruits ye shall know them, and Sarah Palin is a rotton, sour per.. http://tinyurl.com/5vvrsj",top_religion,0,2008-10-21 22:16:54
969553747,"Palin : ""You have to have a sense of humor...or it'll wear you out."" Yes, by all means, don't take this seriously. http://tinyurl.com/6mcck5",csteib,0,2008-10-21 22:16:25
969553670,"So Palin answers the question of why more people come to see her then McCain because she represents reform, so Mccain doesn't stand 4 that?",Hellataz,0,2008-10-21 22:16:19
969553479,Is it necessary for Palin to speak. She may be good for Alaska but for the entire US I think not.,soxxy,0,2008-10-21 22:16:12
969553298,@blanco_1989 Identificar McCain- Palin con los nazis es un puntazo xD Y es fuerte hasta para ellos. Piensa que la campaña aún no ha terminado,GomezOrtiz,0,2008-10-21 22:16:03
969553067,"""What will you do Day 1"" She didn't answer the question. Palin is ignorant.",stevenfrzr,0,2008-10-21 22:15:49
969552961,@SEOAly Very. I'm a proud member of Sarah Palin 's largest group - I have more foreign policy experience than Sarah Palin :P,hjortur,0,2008-10-21 22:15:45
969552930,No it isn't true! wtf McCain Palin are so unqualified we are in trouble if they win,Chy_Chase,0,2008-10-21 22:15:44
969552856,AP INVESTIGATION: Palin children traveled on state (AP) http://www.newstwit.com?p=19056,breakingstories,0,2008-10-21 22:15:40
969552358,"twitterfeed: Todd Palin in Destin? Almost: Todd Palin , husband of vice presidential cand.. http://tinyurl.com/5to739",nwfdailynews,0,2008-10-21 22:15:17
969552271,Just saw my first mccain/ palin bumper sticker. wow.,urbansarah,0,2008-10-21 22:15:13
969552005,"Glad to know, though, that I live in a real portion of America after Palin blessed it. Screw you, Cucamonga.",CDReed,0,2008-10-21 22:15:04
969551440,NEW Anti - Palin commercial at http://www.netioshowblog.com/,BillAlexander,0,2008-10-21 22:14:37
969551320,"NEWEST PALIN -GAFFE: ""VP Is 'In Charge Of United States Senate"" - I'm not kidding you guys! http://tinyurl.com/5e4y8d",HyperDF,0,2008-10-21 22:14:26
969551252,Hard to believe a newspaper as big as the Telegraph would just make up a Palin quote: http://tinyurl.com/6qmkle,jeffpecaro,0,2008-10-21 22:14:26
969551241,Palin talking = Adults in Charlie Brown cartoons.,DynamiteSoul,0,2008-10-21 22:14:25
969551222,This is the 3rd magazine this year that rolling stone has but Barack obama on the cover. WTF do palin please,Chrisdmorgan,0,2008-10-21 22:14:22
969551044,"Wondering if the McCain votes will ID as ""despite Palin "" and ""because of Palin """,robynmcintyre,0,2008-10-21 22:14:17
969551006,Palin is a talking parrot...,Chrys_Naples_FL,0,2008-10-21 22:14:17
969550791,Sarah Palin keeps lying about Troopergate. Palin was found to be guilty of violating the Alaska Executive Branch Ethics,Chy_Chase,0,2008-10-21 22:14:04
969550695,"palin paying tribute 2 feminists who made her run possible. Weird to hear republicans cheering, basically, 4 betty friedan + gloria steinem.",SteveFriess,0,2008-10-21 22:13:59
969550549,familyguy s7e03 - McCain Palin badge on the nazi outfit! Brilliant!,rasmusnutzhorn,0,2008-10-21 22:13:52
969550263,"Guess Palin missed that whole Civic's class thingy..oh, don't 'cha know. http://is.gd/4uON",gcleric,0,2008-10-21 22:13:34
969550251,"Palin says Obama's policies could lead to crises: RENO, Nev.— Republican vice presidential candidat.. http://tinyurl.com/5oqu2m",qctimes,0,2008-10-21 22:13:34
969550071,"Overhearing someone rationalize their guilt for voting for McCain/ Palin - ""how much power does a VP really have?""",nbeyer,0,2008-10-21 22:13:25
969550022,"@mtc I considered going to a Palin Rally just to see, but I decided against it, didn't feel like being the victim of a stoning",meanjuju,0,2008-10-21 22:13:23
969549417,Palin interview is already a joke. Palin is a joke & a smartass mouth she has too.,Chy_Chase,0,2008-10-21 22:12:53
969549290,Watching Palin from comfort of my Henderson home to avoid all those mavericks flying around outside. I think she's coming over for tea after,CDReed,0,2008-10-21 22:12:46
969549272,"sez ... OK, maybe Palin 's America IS the 'real' America. But if it is, then I want a better America.",MickBradley,0,2008-10-21 22:12:42
969548969,NEWEST PALIN -GAFFE: VP Is 'In Charge Of United States Senate' I'm not kidding you guys! http://tinyurl.com/5e4y8d,HyperDF,0,2008-10-21 22:12:32
969548626,"@cyandle - no kidding? Small world...of all the schools. How sad! What sick & twisted examples of Palin 's ""real Americans"". :(",Alysson,0,2008-10-21 22:12:15
969548587,War Between Obama Mamas and Palin Pretties in Lake Worth http://tinyurl.com/5knvp5,MiamiNewTimes,0,2008-10-21 22:12:13
969548559,"Palin doesn't care if she is risking our country, Palin wants to win, she likes power & abuses it",Chy_Chase,0,2008-10-21 22:12:12
969548122,Is Palin cross eyed or is that where her husband keeps his finger,larryslookin,0,2008-10-21 22:11:50
969548116,"Holy crap, Palin actually doing an interview with CNN? Black is white, up is down. Dogs and cats getting along.",cregatron,0,2008-10-21 22:11:50
969548018,"Thought I'd go to Palin event to see if crazyness would break out, @thestrippodcast makes me glad I stayed home.",mtc,0,2008-10-21 22:11:46
969547838,Palin is too stupid to know that she is putting out country at risk,Chy_Chase,0,2008-10-21 22:11:36
969547618,Is Palin cross eyed or is that where he husband keeps his finger,larryslookin,0,2008-10-21 22:11:23
969547468,Is Palin cross eyed or is that where he husband keeps his finger,larryslookin,0,2008-10-21 22:11:16
969547407,Palin says she has more exp than Obama --- Obama has brains tho.... Palin too stupid,Chy_Chase,0,2008-10-21 22:11:14
969547237,"@AMamasBlog I saw Palin when she came to Elon University in Burlington, NC last week. I took my 8-year-old son. I had fun.",thoughtbeast,0,2008-10-21 22:11:03
969546912,a blog all about sarah palin 's clothes. who'da thunk it http://www.theladiesparadise.com/,whatsnext,0,2008-10-21 22:10:48
969546708,FOR THE LOVE OF GOD!!! GET IT RIGHT!!! PALIN NOT BIDEN answered the question correctly about the job of a VP,TranqlMyst,0,2008-10-21 22:10:35
969546581,NEWEST PALIN -GAFFE: VP Is 'In Charge Of United States Senate' I'm not kidding you guys! http://tinyurl.com/5e4y8d,HyperDF,0,2008-10-21 22:10:32
969546469,"Sarah Palin is an idiot, the ""I'll be in charge of the Senate"" video edition: http://tiny.cc/X0VYN",ShelbyKnox,0,2008-10-21 22:10:25
969546302,"Padre de Familia ofende en ""igualdad de oportunidades"" y ahora le ha tocado al tándem McCain- Palin http://is.gd/4vyJ",GomezOrtiz,0,2008-10-21 22:10:17
969546104,Statement from Sen. McCain and Gov. Palin on a second economic stimulus: http://bnonews.com/elections/?id=150,BreakingNews,0,2008-10-21 22:10:07
969546002,Sarah Palin Vs. Polar Bears http://tinyurl.com/5px9nf,owillis,0,2008-10-21 22:10:02
969545876,"Quote of the day (Artie Lang) ""Sarah Palin has a bunch of kids, her daughter is having a kid. They're *all* for drilling in Alaska!""",KristenCarr,0,2008-10-21 22:10:01
969545818,"RT @BeaucoupKevin ""The Vice President is in charge of the senate"" announces Sarah F. Palin : http://tinyurl.com/59yxff (yeah, Kev, I wussed)",calanan,0,2008-10-21 22:09:56
969545785,"Quote of the day (Artie Lang) ""Sarah Palin has a bunch of kids, her daughter is having a kid. They're *all* for drilling in Alaska!""",KristenCarr,0,2008-10-21 22:09:53
969545772,Todd Palin 's 87-year-old Yup'ik grandmother: http://tinyurl.com/63v6jc,curiousyellow,1,2008-10-21 22:09:52
969545301,Looking at: AP INVESTIGATION: Palin children traveled on state http://tinyurl.com/5jfunh,kariek,0,2008-10-21 22:09:31
969545279,I just say an excerpt of a Palin interview on TV. Her grammar is the worst I've heard. I can't believe she graduated from 8th grade.,copperbird7,0,2008-10-21 22:09:29
969545256,@charles_hope Palin doesn't seem to see the need to abide to reality...,EnricCirne,0,2008-10-21 22:09:29
969545096,Palin still doesn't know what the Vice President does: http://ping.fm/Bm2oB (she thinks the VP controls the Senate),matthewfong,0,2008-10-21 22:09:19
969545084,"counted lawn signs on the way home today -- looks like I live in one of those ""anti-American"" areas Palin was talking about.",connolly_ahern,0,2008-10-21 22:09:21
969544424,Worth A Read: Ambitious Sarah Palin is John Edwards of 2008 :: Toby Harnden http://tinyurl.com/6ryfry,dsson,0,2008-10-21 22:08:50
969544349,":: iTunes, iPhone, Sarah Palin , Joe, Halloween, God's, Brightkite, Apple, #bbycds , Yammer, Fable II, #n ... http://simpl.es/SibxU3",currentfm,0,2008-10-21 22:08:44
969544076,"OK. Since technically the VP is the president of the Senate, and she was talking to kids, Palin gets some slack this time.",bobkadrie,0,2008-10-21 22:08:31
969543756,AP INVESTIGATION: Palin children traveled on state http://is.gd/4vyw,austinvotes,0,2008-10-21 22:08:14
969543567,"""He (Biden) mentioned two countries in particular, the Middle East and Russia."" No not Palin , Rep. Heather Wilson (R-NM) on Hardball. Oy.",chadrem,0,2008-10-21 22:08:08
969543548,"@russellsauve if you want to watch their head explode, talk to them about clean coal and Sarah palin .",Ludakit,0,2008-10-21 22:08:08
969543368,@ZenMonkey Palin is such a goddamn nut she scares me.,makare1,0,2008-10-21 22:08:01
969543101,"MBP: Int'l shipment release ANCHORAGE, AK -- DAMN YOU SARAH PALIN , LET MY MACBOOK GO!",mdhughes,0,2008-10-21 22:07:48
969542681,I bet U.S. Senators are Laughing their asses off at Palin 's comments about being in charge of the Senate. What a loser.,copperbird7,0,2008-10-21 22:07:30
969542532,"Hm, Palin says ""Vice President is in charge of the Senate"" http://tinyurl.com/59yxff",shanselman,0,2008-10-21 22:07:24
969541723,Matt Damon has something to say about Sarah Palin : http://tinyurl.com/66hu6w,scribblemethis,0,2008-10-21 22:06:47
969541572,"Sarah Palin 's Eskimo grandmother-in-law: 'She honors my Native side': HOMER, Alaska -.. http://tinyurl.com/5hgo96",freerepublic,0,2008-10-21 22:06:40
969541465,CNNs Griffin Secures Palin Interview [Situation Room now] : News Network Gets 15-Minute Inter.. http://tinyurl.com/6zkg4d,freerepublic,0,2008-10-21 22:06:35
969541176,Sarah Palin : a frightening prospect -- http://twurl.nl/nhscuc,stevekinney,0,2008-10-21 22:06:21
969541140,"Palin last Friday: ""I LOVE VISITING PRO-AMERICA AREAS OF THIS GREAT NATION"" Huh? So, are there 2 USAs? In short: Palin is dividing the USA!",HyperDF,0,2008-10-21 22:06:20
969540848,"no, sarah palin , the VP is not in charge of the senate. even dick cheney doesn't think he's in charge of the senate. but that's a nice story",lilloco,0,2008-10-21 22:06:07
969540734,@yorgle Ack! Your laptop has Palin cooties! *breaks into strategic cootie shot reserve...*,lizreay,0,2008-10-21 22:06:00
969540576,"McCain and Palin glad that there won't be a test when the next pres. takes office. Hopes that if there IS a test, that it's multiple choice.",sckao,0,2008-10-21 22:05:55
969540294,Seeing way 2 many mccain palin stickers @state fair grrr,southpaw20,0,2008-10-21 22:05:40
969540253,@TheFix I hope Palin 's stupid enough to run in 2012. Matter of fact I think she is!,PatTibbs,0,2008-10-21 22:05:38
969539836,@msnbc_tv Palin is taking advice from an unlicensed plumber - I like the advice fm Powell & Buffe in case of Em will she call roto-rooter?,TwinLogic,0,2008-10-21 22:05:24
969539037,Sarah Palin just said she was happy to be on the UNLV campus hmmm we are in HHenderson,JustJulie,0,2008-10-21 22:04:50
969538935,@sofauxboho Comic Sans is the Sarah Palin of fonts.,randomthursday,0,2008-10-21 22:04:45
969538516,@agent_zero Have you seen Palin speak? I don't think anyone has told her yet,JohnnyLovely,0,2008-10-21 22:04:24
969538387,Closing arguments today in Alaskan Sen. Ted Stevens' trial. Prediction-1) Guilty! 2) Impacts national election b/c Palin is Stevens' crony.,diatribalist,0,2008-10-21 22:04:18
969538326,McCain and Palin glad that there won't be a test when the next pres takes office. McCain graduated 894 out of 899 and Palin = 5 colleges,sckao,0,2008-10-21 22:04:15
969538302,More & more republicans are coming out against Palin saying she is not qualified to be VP,Chy_Chase,0,2008-10-21 22:04:14
969538224,"Tina Fey Throws Sarah Palin A Bone And Claims Sarah’s Hotter: Tina baby, it’s not necessary. Every.. http://twurl.nl/lkuncl",Popvine,0,2008-10-21 22:04:12
969537689,Palin thinks violating ethic laws is right? http://tinyurl.com/47brz2 ...yup!,HyperDF,0,2008-10-21 22:03:48
969537648,del.icio.us: Is Palin A 2012 Contender or Pretender? - The Fix http://twurl.nl/dra8ti,PatrickRuffini,0,2008-10-21 22:03:43
969537639,You'd think Palin would have read the Constitution after the last debate. Apparently not. http://tinyurl.com/5j46ay,DoctorHu,0,2008-10-21 22:03:42
969537607,"Palin still hasn't taken serious interviewer questions. Palin is unqualified, uneducated, & not ready to be elected to VP of the US.",Chy_Chase,0,2008-10-21 22:03:44
969537053,Sarah Palin keeps lying about Troopergate. Palin was found to be guilty of violating the Alaska Executive Branch Ethics,Chy_Chase,0,2008-10-21 22:03:19
969536622,"wow, Sara Palin sí está buena! yo no creía",8o_0,0,2008-10-21 22:02:59
969535968,Palin just said she's at unlv. She's not. She's at the henderson pavilion. Oops.,SteveFriess,0,2008-10-21 22:02:28
969535946,"What scares me is Palin only has a bs degree after attending 4 colleges and McCain graduated 894 out of 899,Obama JD in law,Biden law,Obama",kirlee123,0,2008-10-21 22:02:25
969535642,[FreeRepublic] CNNs Griffin Secures Palin Interview [Situation Room now] : New.. http://tinyurl.com/6zkg4d,conservatweet,0,2008-10-21 22:02:15
969535622,"@SissyB I guess he wants to lose. I don't fucking know. THIS is why I said Biden was a mistake. Fortunately, MSM is ignoring him for Palin .",spants,0,2008-10-21 22:02:11
969535535,"[FreeRepublic] ""OBAMA CRISIS NUMBER FIVE"" (Sarah Palin Rocks Reno): ON VIDE.. http://tinyurl.com/66mj8g",conservatweet,0,2008-10-21 22:02:06
969535510,Entire interview of Palin now to be shown on CNN coming up on Wolf Blitzer's show. Tune in guys..this could be an eye opener.,tinapayson,0,2008-10-21 22:02:08
969535468,[FreeRepublic] Todd Palin to pal around with sportsmen today in Colorado: Alaska&#x92.. http://tinyurl.com/5olz9w,conservatweet,0,2008-10-21 22:02:06
969535307,Notice how Obama rally crowds are always good natured?? Mc/ Palin 's are grumpy & angry...hmmm,JBax52,0,2008-10-21 22:01:56
969534883,"omfg - if you visit any blog today, make it this one. Sarah Palin Hates Cupcakes: http://sarahpalinhatescupcakes.blogspot.com/",raquelita,0,2008-10-21 22:01:39
969534714,I wonder if McCain and Palin know the definition of socialism and communism?,kamla,0,2008-10-21 22:01:31
969533847,What about Palin & Katie Couric? Palin is so stupid,Chy_Chase,0,2008-10-21 22:00:53
969533413,I'll take Obama any day over McCain. McCain Palin both are not qualified. Palin talks about Biden.....,Chy_Chase,0,2008-10-21 22:00:32
969533279,Watch CNN for best political news. New Sarah Palin interview to be aired in parts--hope it has some teeth.,tinapayson,0,2008-10-21 22:00:27
