id,text,username,retweets,date
966571777,Sara Palin is really not making sense,laughingchic,0,2008-10-19 21:26:43
966571634,"Joe is NOT a real plumber--and McCain/ Palin are NOT real leaders. They have done nothing but spread hate, fear, & lies to divide Americans",JBax52,0,2008-10-19 21:26:35
966571386,The Sarah Palin on SNL this week wasn't as good as previous weeks.,Jono,0,2008-10-19 21:26:16
966570834,"I don't really watch SNL, nor much like Palin ... but this was fucking hilarious. http://tinyurl.com/5shxfk",CleverPatrick,0,2008-10-19 21:25:37
966570553,"Really funny how Palin has to go back & ""clarify"" every single thing she says--but Dems are never allowed to clarify anything they say.",JBax52,0,2008-10-19 21:25:15
966570035,Feels really weird about liking Sarah Palin on SNL.,_jenfigueroa,0,2008-10-19 21:24:36
966569900,At the palin rally in roswell all this red creeps me out,zerk,0,2008-10-19 21:24:22
966569881,Make no mistake. No McCain/ Palin . http://tinyurl.com/5c5zpw,bigskyman,0,2008-10-19 21:24:24
966569817,@bigskyman Not only that McCain is threatening to sue CNN for running the story on Palin and AIP http://tinyurl.com/4m35c7 McCain = Putin,Dangerangel,0,2008-10-19 21:24:20
966569517,"@rebelliousgirl Palin mentions him everywhere! "" Ya know, Todd and I.."" 1st Gentleman in AK calling the shots @the govnrs office in AK.",Shugsss,0,2008-10-19 21:24:04
966569421,hysterical letter from the father of bristol palin 's baby: http://tinyurl.com/5a5def,daily_crack,0,2008-10-19 21:23:57
966569334,"Reading: SNL recap: Could this be Sarah Palin ’s saxophone moment?: Sarah, Tina. Tina, Sa.. http://tinyurl.com/5z4wec",seacoastonline,0,2008-10-19 21:23:49
966569237,"@jochum tell Kevin the guy from That 70s Show was buying me drinks last night. Also, naked Sarah Palin portrait at the Ale House.",clinard,0,2008-10-19 21:23:42
966569166,"@grumpwurst Powell doesn't have an issue with Palin , he is speaking what he (and I) believes the truth is.. she is not ready to lead at all.",sgraven,0,2008-10-19 21:23:39
966568853,how can mccain question anyone's experience and picked palin .,ConqueringLion,0,2008-10-19 21:23:16
966568811,I've taught people like Palin --she has what I call the fatal combo--arrogance+ignorance. She would be a disaster as pres.--or VP...,JBax52,0,2008-10-19 21:23:15
966568575,Vamoosing back to DC--enjoyed watching the surreal exchange between Palin and the SNL crew last night.,jackiefishman,0,2008-10-19 21:22:57
966568426,@grumpwurst Palin is not ready to step into presidency. So it showed bad judgment by McCain.,TheDisneyBlog,0,2008-10-19 21:22:48
966568254,Palin is a KGB/AIP secessionist mole and so is her shadow VP Todd. Don't allow them near the White House! http://tinyurl.com/3zt2hw,bigskyman,0,2008-10-19 21:22:37
966568063,Wash. Post: Obama Aired Ad Targeting Women During Palin 's SNL Performance: By Ed O'Keefe .. http://tinyurl.com/65pt4g -HuffNewswire,HuffPostPol,0,2008-10-19 21:22:21
966568058,Wash. Post: Obama Aired Ad Targeting Women During Palin 's SNL Performance: By Ed O'Keefe .. http://tinyurl.com/65pt4g,HuffNewswire,0,2008-10-19 21:22:21
966568006,"Palin scares the he*l out of all women. Making rape victims pay for rape kits, for example?",cubetwit,0,2008-10-19 21:22:18
966567977,actually i laughed more at the first skit with the lady freaking out over the surprise wedding proposal than at the palin /fey frolicking,andreagarnier,0,2008-10-19 21:22:16
966567962,A. Sullivan: The Odd Lies Of Sarah Palin XIII: Accessing Wooten's Medical Records: From .. http://tinyurl.com/599h2b -HuffNewswire,HuffPostPol,0,2008-10-19 21:22:16
966567961,A. Sullivan: The Odd Lies Of Sarah Palin XIII: Accessing Wooten's Medical Records: From .. http://tinyurl.com/599h2b,HuffNewswire,0,2008-10-19 21:22:16
966567448,Parenting News: Lara Bricker: Chasing after Todd Palin in Fremont: Just when the me.. http://tinyurl.com/6krc4g,seacoastonline,0,2008-10-19 21:21:43
966567341,"Honestly, of all the things that SNL could have done with Palin --- they didn't make her look for very good. Baldwin wasn't kidding. Obivous",mojosd,0,2008-10-19 21:21:38
966567282,"Returning home from the land of Nascar, the National Pentecostal Convention, and McCain/ Palin stickers on disgustingly large SUVs.",aweyenberg,0,2008-10-19 21:21:31
966567196,Palin SNL moose raps vs Colin Powell on Meet the Press. Today will be talked about post election.,fart4art,0,2008-10-19 21:21:24
966566277,TV: Mark Wahlberg Upstages Sarah Palin Again http://tinyurl.com/5c5be6,JustPressPlay,0,2008-10-19 21:20:21
966565835,"Just added 'Sarah Palin On SNL With Tina Fey, Weekend Update's Alaska Rap, Baldwin And Wahlb...' to Vodpod http://tinyurl.com/69t9gg",MountainSage,0,2008-10-19 21:19:52
966565713,"""Sarah Palin is everything disgusting about a beauty pagent contestant except for the desire for world peace."" I <3 Sarah Silverman.",Minish,0,2008-10-19 21:19:44
966565239,@doshdosh But did Powell ever address real reason behind changing to Obama. McCain's choice of Palin as a running mate.,TheDisneyBlog,0,2008-10-19 21:19:13
966565022,"Just added 'Sarah Palin On SNL With Tina Fey, Weekend Update's Alaska Rap, Baldwin And Wahlb...' to Vodpod http://tinyurl.com/6fffmc",MountainSage,0,2008-10-19 21:18:55
966564609,Obama Aired Ad Targeting Women During Palin 's SNL Performance http://twurl.nl/y1qnj4,WaPo44,0,2008-10-19 21:18:26
966564588,"watching the Palin Rap from last night again. Sarah looked kinda sexy moving to the beat... she'd get a drink from me at the club, lmao!",mista_duval,0,2008-10-19 21:18:26
966563815,"A lot of people are praising Palin 's SNL appearance yesterday; from what I saw, she didn't *do* much of anything at all.",Secularick,0,2008-10-19 21:17:36
966563394,Palin Hometown A Window Into Her Environmentalism: Long before John McCain made Gov. Sarah Palin his runn.. http://tinyurl.com/6gttbq,fox5ny,0,2008-10-19 21:17:07
966563219,Why media don't cover Palin ties to USA-hating secessionist group or Cindy McCain's drug addiction is beyond me--consv. media bias??,JBax52,0,2008-10-19 21:16:57
966563167,Palin is a KGB/AIP secessionist mole. Where does Putin go first when he raised his head? Alaska. http://tinyurl.com/5c5zpw,bigskyman,0,2008-10-19 21:16:52
966562981,Everyone with a brain knew that that Palin NOBODY isn't ready for the whitehouse.....,Bombero100,0,2008-10-19 21:16:42
966562719,Powell Said Palin is a Nice person but NOT READY to BE PRESIDENT!,Bruce4Obama,0,2008-10-19 21:16:24
966562614,@spreadthewealth THE YOUNG WOMEN OF AMERICA HAVE A MESSAGE TO PALIN : http://tinyurl.com/5wo6lt,Dangerangel,0,2008-10-19 21:16:19
966562501,Palin is a KGB/AIP secessionist mole and Todd is a her ethically-challenged Siberian-Eskimo shadow VP. http://tinyurl.com/5c5zpw,bigskyman,0,2008-10-19 21:16:09
966562197,Come to palin baby shower at prosperity.,melliesmel,0,2008-10-19 21:15:52
966562195,@AllanGoesDMB I hate to admit that Sarah Palin looked pretty...but that's about it.,Cherrrylll,0,2008-10-19 21:15:51
966562168,Sarah palin was pretty funny on snl..glad she's got a good sense of humor..,lilsteviek,0,2008-10-19 21:15:50
966562022,Watching football and getting myself psyched to see Gov. Palin tomorrow. www.rantical.blogspot.com,SickEddy,0,2008-10-19 21:15:41
966561672,"Do you think SNL is watched in the Oval Office and the Pentagon, and if so are those viewers laughing at Palin ?",lindawallace18,0,2008-10-19 21:15:21
966561593,"Palin on SNL: She made me laugh, she made me cry...she made me wonder how Tina Fey didn't get the Vp nod instead?",Amandemic,0,2008-10-19 21:15:17
966561553,"Tina Fey does Sarah Palin better than Sarah Palin . Also, she was awesome on Letterman the other night. Youtube it!",elisestawarz,0,2008-10-19 21:15:14
966560975,Fuck Sarah palin and all of her supporters,astrxxxmyy,0,2008-10-19 21:14:40
966560932,Youtube blocked the Sarah Palin rap from last night...I cant find it anywhere on the YT.,MaggKnight,0,2008-10-19 21:14:33
966560791,Palin palling around with Alaska secessionist group who received sponorship from IRAN to address the U.N. McCain good judgement in action.,SuSandStorm,0,2008-10-19 21:14:26
966560765,"snl: tina fey out-palins palin , while sarah shows acting abilities on par with keanu reeves, only less endearing.",misstree,0,2008-10-19 21:14:24
966560695,@GAPoneEnt Palin is a KGB/AIP secessionist mole and Todd is her ethically-challenged shadow VP. http://tinyurl.com/5c5zpw,bigskyman,0,2008-10-19 21:14:20
966560675,"I enjoy a lil rhythm with my politics; the bits were amusing. Palin 's was a good enough sport, she's as amiable as she is unqualified.",pces,0,2008-10-19 21:14:18
966559809,my parents are ridiculous in their virulent support of McCain- Palin . Can't even have a reasonable conversation without fighting with them.,SooBie,0,2008-10-19 21:13:14
966559193,"Actually, the fart-face scene following Palin 's scene was all about hurtful name calling-- a comment on Palin /McCain?",robkall,0,2008-10-19 21:12:34
966558985,@americanswakeup And Palin who can see Russia from her backyard and cant get past Hooked on Phonics to describe why she is an energy expert,Gingerlatte,0,2008-10-19 21:12:21
966558700,this Palin seccionist argument has been dispelled by both snopes.com and factchecks.org,GeorgeAPeterson,0,2008-10-19 21:12:02
966558623,Palin is a cynical neocon centerfold: women want to be her (if only to get rape kits & militia weapons) & men want to be w/her in a copter.,License_Farm,0,2008-10-19 21:11:57
966558414,"I missed SNL, but the real Sarah Palin was on. Wow, funny stuff. http://tinyurl.com/6mrcrn",ianhoar,0,2008-10-19 21:11:38
966558284,"Love how McCain/ Palin & their supports claim their lies are facts, thinking if you repeat it enough it will stick. Keep clicking your heels",SuSandStorm,0,2008-10-19 21:11:31
966558169,My Palin rage has officially escalated to an uncomfortable level. I can't even look at that fucking bitch's face without screaming.,jenhen,0,2008-10-19 21:11:20
966557701,@AllanGoesDMB lol... There was a moose that grooved across the stage last night on SNL..in front of Sarah Palin ...lol!,Cherrrylll,0,2008-10-19 21:10:48
966557572,"Palin is such an atrocity of a human being, to say nothing of her political views. My god.",Fauxred,0,2008-10-19 21:10:38
966557506,@stevietheman Palin only reads scripts written by the RNC. Heh.,JasonFalls,0,2008-10-19 21:10:34
966557208,#debate08 (Washington Post): Obama Aired Ad Targeting Women During Palin,electionday2008,0,2008-10-19 21:10:11
966557138,"@cmpriest When my SNL blurb said ""Sarah Palin "" I thought they meant Tina Fey/ Palin . I've never changed a channel so fast.",caitkitt,0,2008-10-19 21:10:06
966556739,I have a feeling the Lonely Island group wrote the Palin rap in last nights SNL.,sharpfarts,0,2008-10-19 21:09:38
966556714,memorizing the Sarah Palin rap,MattHurst,0,2008-10-19 21:09:40
966556676,Palin Hometown A Window Into Her Environmentalism http://tinyurl.com/5srkod,FOX13Memphis,0,2008-10-19 21:09:36
966556604,- watching Hulu's collection of Palin (the real one) on SNL: http://www.hulu.com/collections/126,sree,0,2008-10-19 21:09:29
966556585,"Let's not forget that immediately after Sarah Palin appeared on SNL, the next bit was a Fart Face theme. Anyone remember the one before her?",robkall,0,2008-10-19 21:09:30
966555850,":: Vikings, Steelers, Sarah Palin , SNL, RAMS, NFL, Halloween, Barack Obama, Cowboys, Chargers, Dallas, ... http://simpl.es/SibxU3",currentfm,0,2008-10-19 21:08:42
966555539,Politics Palin draws big ratings for 'Saturday Night Live' Television ( http://tinyurl.com/5eaxdb ),infodiva,0,2008-10-19 21:08:19
966555527,"Where's the video for last night's ""I'm No Angel"" SNL skit? Screw the Palin stuff... that was the best skit of the night.",tntwhite,0,2008-10-19 21:08:16
966555478,"@blackvoices yeah, I will say Palin got her ""bounce"" on pretty good.",ruthdfw,0,2008-10-19 21:08:15
966555145,Does anyone know where I can buy moose stew in Rhode Island or nearby Massachusetts? I think Palin 's moose is stewed!,TRCATANZARITE,0,2008-10-19 21:07:54
966554857,The Real Sarah Palin : In case you slept through her appearance last night... http://tinyurl.com/6q2568,ThePajamaPundit,0,2008-10-19 21:07:36
966554612,"The video, ""SNL - Real Sarah Palin On SNL - Tina Fey Meets Her Match - SNL - Part 1"", has become popular. (http://gawkk.com/t/1jlhud)",gawkk,0,2008-10-19 21:07:19
966554288,"Can the American people really respect a President that incites anger, hatred, & xenophobia? McCain/ PALIN is the DEVIL",nikkiazz2fat,0,2008-10-19 21:06:59
966554073,wow. powell says palin isn't ready because she doesn't have experience. WOW AND OBAMA HAS EXPERIENCE? NO!,walrus128,0,2008-10-19 21:06:46
966553928,Obama's church spews hatred to America Palin 's church is christian extremist BIG difference,GeorgeAPeterson,0,2008-10-19 21:06:37
966553882,Google News: Palin draws big ratings for 'Saturday Night Live' - The Associated Pr.. http://tinyurl.com/5eaxdb,080808news,0,2008-10-19 21:06:32
966553279,"Sarah Palin On SNL - Well, She's Got Rhythm http://tinyurl.com/62oj7r",blackvoices,0,2008-10-19 21:05:58
966553155,@retvantq PALIN comparison ?,suzyjax,0,2008-10-19 21:05:49
966552915,Video: Sarah Palin (the real one) on Saturday Night Live (The Yahoo! Newsroom) http://www.newstwit.com?p=18129,breakingstories,0,2008-10-19 21:05:34
966552875,"So i just watched Sarah Palin on SNL, it was good but i thought they good have done more with it. ps i love Mark Wahlberg",AlyMae,0,2008-10-19 21:05:32
966552852,Actress Likens Sarah Palin to 'Fargo' Character http://tinyurl.com/6xc98z,DailyMeArts,0,2008-10-19 21:05:29
966552237,Laughing at SNL's skit about Sarah Palin - http://tinyurl.com/5dzrpt,JVCurran,0,2008-10-19 21:04:56
966552174,"Last night, at the end of SNL, who nearly jumped into the arms of Sarah Palin ? The West Coast feed cut off to soon to see. Was it Tina Fey?!",1LanceAnderson,0,2008-10-19 21:04:52
966552013,"Like with Palin , McCain never vetted Joe the phony plumber.",mujaku,0,2008-10-19 21:04:42
966551848,Palin helps SNL score ratings bonanza http://www.tvblogsearch.com/blog?p=3114,tvblogs,0,2008-10-19 21:04:31
966551683,The Orlando Sentinel endorsed Obama. Soon McCain/ Palin will be calling us fake Florida and saying Gov Crist has an anti-American tan.,dreamonkey,0,2008-10-19 21:04:19
966551443,"thinks it's good Sarah Palin can take a joke, because she is one, after all.",rynetate,0,2008-10-19 21:04:05
966550550,"Hourly Trends: hocus pocus, sarah palin saturday night live video, ...http://tinyurl.com/yvm6f7",rss2twitt,0,2008-10-19 21:03:04
966550399,"@Dow Alec Baldwin mistook Palin for Tina Fey, and Mark Walberg was looking for Andy Samberg to kick his ass.",davidjtate,0,2008-10-19 21:02:53
966550020,"A handmade sign seen taped to a car on the way to MLK: "" Palin is not Hillary. Do your research!"" does anyone really think that?",joshuaroever,0,2008-10-19 21:02:25
966549901,"Thanks To Palin Miscellania - October 19, 2008: Cindy McCain’s lawyer fires high,ha.. http://tinyurl.com/5rsnjf",stix1972,0,2008-10-19 21:02:14
966549485,Palin was on snl last night. It truly is hard to tell difference between her and tina fey haha,willmatic,0,2008-10-19 21:01:46
966549281,First McCain/ Palin bumper sticker on a car this campaign,hellerchris,0,2008-10-19 21:01:35
966548730,FACT: Sarah Palin needs to go home and deal with her Troopergate issues,j9lonehill,0,2008-10-19 21:01:02
966548565,"Amazing that every facet of Palin 's SNL appearance, apart from the good-sport showing up & getting leered at stuff, was devasting put-down.",HalSF,0,2008-10-19 21:00:50
966548302,@skipgo Amy did so good with that Sarah Palin Rap!,brucefranklin,0,2008-10-19 21:00:34
966548212,Palin 's hometown a retail hotbed and a window into her brand of environmentalism : http://tinyurl.com/65bsgj,sarahpalinfeed,0,2008-10-19 21:00:30
966547931,"thinks SNL always takes care of the pols who appear, Palin was below average, disengaged as Joe Hagan says. Still, a plus for her in '1 ...",HuffPostPol,0,2008-10-19 21:00:11
966547929,"thinks SNL always takes care of the pols who appear, Palin was below average, disengaged as Joe Hagan says. Still, a plus for her in '12.",mattizcoop,0,2008-10-19 21:00:11
966547907,"www.newestdiscovery.com update: Sarah Palin meets her mimic, live on US comedy show (Republican vice-presidential candidate Sarah Pa...)",newestdiscovery,0,2008-10-19 21:00:13
966547900,Palin helps SNL score ratings bonanza http://tinyurl.com/5bcum5,watch3r,0,2008-10-19 21:00:10
966547869,Sarah Palin On Saturday Night Live ( http://tinyurl.com/5gmwvb ),thisislavie,0,2008-10-19 21:00:10
966547762,@SteveOglesby Obama has been questioned. You can't say the same about Palin . http://tinyurl.com/5c5zpw,bigskyman,0,2008-10-19 21:00:04
966547352,re palin /planned parenthood http://tinyurl.com/3mq48q,c_death,0,2008-10-19 20:59:40
966547159,Inordinately excited that Sarah Palin and Tina Fey have appeared together on SNL.,colinjcampbell,0,2008-10-19 20:59:29
966547153,Palin helps SNL score ratings bonanza http://twurl.nl/vdohoi,TV_News_Update,0,2008-10-19 20:59:28
966546415,Palin and the AIP Connection. Palin Palling around with terrorists. http://www.dailykos.com/story/2008/10/11/164510/90,MedTrakker,0,2008-10-19 20:58:36
966546337,Palin smiles as ‘Saturday Night Live’ mocks: Sarah Palin appeared on NBC's “Saturday Night Live” and play.. http://tinyurl.com/5dg7gs,NBCNews,0,2008-10-19 20:58:30
966545774,I missed Sarah Palin on SNL. What a boob I am!,VanessaEEE,0,2008-10-19 20:57:52
966545013,heard that joke about Sarah Palin 's vagina Friday night. I can't get it out of my head.,arlodesign,0,2008-10-19 20:56:56
966544866,Sam Harris rips Sarah Palin in Newsweek http://www.newsweek.com/id/160080,DrawingYou,0,2008-10-19 20:56:47
966544571,"Why didn't Palin explain to us all of the newpapers she reads? I bet, ""How to Kill a Moose Gazette"" is her number one choice.",sexysassysmart,0,2008-10-19 20:56:28
966544130,Video: Missed Palin at Verizon? Watch our speech highlights http://tinyurl.com/6dbky2,indystar,0,2008-10-19 20:55:53
966543999,"Palin 's handling of SNL was really well done, have to admit. http://tinyurl.com/6dr72u",pacificbrewnews,0,2008-10-19 20:55:47
966543981,SNL Fey and Palin in the same frame - priceless,lghill84,0,2008-10-19 20:55:44
966543135,"FiveThirtyEight.com: Electoral Projections Done Right: ""Real"" America Looks Different to Palin , Obam.. http://tinyurl.com/6zkat2",TwitLinksRSS,0,2008-10-19 20:54:46
966542979,"Quote: ""choosing the inarticulate, insular and ethically challenged Palin disqualifies him for the presidency.""",Jennyjinx,0,2008-10-19 20:54:35
966542472,seriously the most awesome sarah palin impression ever: http://www.ucbcomedy.com/videos/play/2844,daily_crack,0,2008-10-19 20:53:59
966542202,"@ScottWilder But in Palin 's case, with John MC being so old... it just makes me nervous, I would never want her to be pres.",RealtorMichelle,0,2008-10-19 20:53:40
966542138,"Republican Colin Powell tells MSNBC, “I don’t believe [ Palin ] is ready to be president of the United States” [shocker]",billcarroll,0,2008-10-19 20:53:35
966542118,"@oyboy Aye, at this point you have to give anyone who's competent & not ideologically insane a pass.Unlike Bush/Cheney/ Palin Republicanism.",Templesmith,0,2008-10-19 20:53:34
966541942,Pweel Only stated the Obvious truths about McCain Palin,Bruce4Obama,0,2008-10-19 20:53:20
966541540,"@douglaskarr - The Obama/Biden campaign is all about Obama, and the other is really about Palin . Palin /McC! You're spot on though.",devbasu,0,2008-10-19 20:52:54
966541398,@eetomost what time did you go to bed???? did you watch SNL?? sarah palin was funny!,asheakes,0,2008-10-19 20:52:44
966541177,"Politico: Palin 's says attacks on kids bring out her ""mama grizzly bear"": Sarah Palin offer.. http://tinyurl.com/5la8w9 -HuffNewswire",HuffPostPol,0,2008-10-19 20:52:31
966541174,"Politico: Palin 's says attacks on kids bring out her ""mama grizzly bear"": Sarah Palin offer.. http://tinyurl.com/5la8w9",HuffNewswire,0,2008-10-19 20:52:31
966541095,"@Gingerlatte When McCain/ Palin cut excessive gov't spending & begin drilling to keep us independent- jobs, financial stability will come!",americanswakeup,0,2008-10-19 20:52:25
966540621,"So, Palin didn't do a melt-down on SNL. Whadja expect? She's a pro pol--just not ready for Prime Time...which makes SNL perfect for her.",jane_gassner,0,2008-10-19 20:51:51
966540456,"Wow, the Salt Lake Tribune really pounded Palin . Harsh, but true. http://tinyurl.com/58hwbc",Jennyjinx,0,2008-10-19 20:51:41
966540347,I think Sarah Palin is more qualified for SNL than running for Vice President!!!!,46boomer,0,2008-10-19 20:51:33
966540254,"Finally about to watch Palin on SNL, super excited.",jaculberson,0,2008-10-19 20:51:24
966539395,McCain now avoiding reporters even more than Palin .: Gov. Sarah Palin (R-AK) continues to dodge the.. http://tinyurl.com/5mbud4 -thinkpr ...,HuffPostPol,0,2008-10-19 20:50:30
966539392,McCain now avoiding reporters even more than Palin .: Gov. Sarah Palin (R-AK) continues to dodge the.. http://tinyurl.com/5mbud4,thinkprogress_i,0,2008-10-19 20:50:30
966538994,"@Bippy for Halloween? I don't know...all of the scariest costumes are kinda boring (cheney, bush, mccain, palin , bachmann...)",chasekb,0,2008-10-19 20:50:06
966538785,"Ya know, I wouldn't mind having a beer with Palin ... but that doesn't mean I don't think shes a raging lunatic... oh same goes for Huckabee",HeyThereKiller,0,2008-10-19 20:49:52
966538555,Palin -tology (V) - loosing Powell: The United States most succesful African-American male (until Barack) ha.. http://tinyurl.com/5894xr,bosca,0,2008-10-19 20:49:37
966538271,MSNBC - Palin smiles as ‘Saturday Night Live’ mocks: Sarah Palin appeared on NBC's “Saturday.. http://is.gd/4lLp,USABreakingNews,0,2008-10-19 20:49:17
966538173,"In related news, a song being used by Palin , the proceeds for the copyright is going to Planned Parenthood. http://tinyurl.com/6qrbey",c_death,0,2008-10-19 20:49:08
966538011,"I don't care who you're voting for, you have to admit Sarah Palin on SNL is hilarious - http://tinyurl.com/5r87w6",kmadamich,0,2008-10-19 20:48:57
966537588,"@saradod i thought snl was funny...obviously not every bit, but especially the palin stuff",regularsm,0,2008-10-19 20:48:31
966537494,"re: Palin on SNL. there's a big difference between having a sense of humor and letting yourself, family and state be the butt of the joke",bryce,0,2008-10-19 20:48:22
966537347,Palin draws big ratings for 'Saturday Night Live' http://snipr.com/4i8s9,wcnc,0,2008-10-19 20:48:14
966537345,Palin Draws Big Ratings For 'Saturday Night Live' http://tinyurl.com/6p99co,myfox8,0,2008-10-19 20:48:16
966537108,at the swap meet. there's a McCAIN booth and a woman seriously has a PALIN shirt. I want a button. just to be a dick.,javjavjav,0,2008-10-19 20:47:59
966536938,Alaska's minorities feel ignored by Palin (Boston Globe): Alaska's black leaders say they're not su.. http://tinyurl.com/6e668d,ElectionWatch,0,2008-10-19 20:47:50
966536622,"Live From New York, Its Governor Palin http://is.gd/4n3q",sendcardsagain,0,2008-10-19 20:47:29
966536397,Palin Thinking About The Future http://twurl.nl/q166u2,feedack,0,2008-10-19 20:47:15
966536318,who watched Palin last night on Saturday night live? i think it could have been way more funny! her peeps regulated im sure!,casandrakc,0,2008-10-19 20:47:10
966536196,Sarah Palin 's 2012 Presidential Campaign Ads http://tinyurl.com/5lr4l7,diggupdates,0,2008-10-19 20:47:04
966535942,@GAPoneEnt Palin and the AIP Connection. Palin Palling around with terrorists. http://www.dailykos.com/story/2008/10/11/164510/90,MedTrakker,0,2008-10-19 20:46:47
966535645,Sarah Palin 's 2012 Presidential Campaign Ads: One thing you can count on. They'll be folksy as all ge.. http://tinyurl.com/5lr4l7,DiggStories,0,2008-10-19 20:46:29
966535049,Daily Me Ent: Actress Likens Sarah Palin to 'Fargo' Character http://tinyurl.com/6xc98z,RSSFeedBot,0,2008-10-19 20:45:49
966534950,Also crying not laughing at Sarah Palin on SNL (per MOMocrats) http://tinyurl.com/5l72lt,techmama,0,2008-10-19 20:45:43
966534810,Sarah Palin 's 2012 Presidential Campaign Ads: One thing you can count on. They'll be folksy as all get.. http://tinyurl.com/5lr4l7,feedzzz,0,2008-10-19 20:45:36
966534727,Palin violated ethics laws. Does god give her a pass on that?,TheDudeAbides,0,2008-10-19 20:45:30
966534482,"@Dangerangel Sorry, Palin has been a Republican since 1982. http://tinyurl.com/6ayhgc",ehog,0,2008-10-19 20:45:12
966534349,"@DOROMarketing girl, that was powerful what he said and how he said it. McCain's choice of Palin didn't sit well with him either!",PRProPam,0,2008-10-19 20:45:08
966534344,@michaeleast Sarah Palin 's 2012 Presidential Campaign Ads - One thing you can count on. They'll be folksy as a - Digg http://minu.ws/Z1Ss,feednote,0,2008-10-19 20:45:07
966534315,McCain has Pat Buchanan and even the Alaskan grizzly bears think Sarah Palin 's an idiot. I think I see a pattern emerging here...,jzellis,0,2008-10-19 20:45:04
966534085,The thought Of Palin Bobbing her head to chants Obama /Ayers rap on SNL ....Shivver Its Just in time for Halloween. Powell Said NO WAY!,Bruce4Obama,0,2008-10-19 20:44:50
966534036,Palin worships on the lunatic fringe. Religion is the cause of most of our fears. We need less of it not more.,DrawingYou,0,2008-10-19 20:44:49
966533232,Palin hometown a window into her environmentalism (AP) http://www.pressbs.com/news?p=24346,pressblogs,0,2008-10-19 20:43:49
966532925,""" Palin Dudes"" don't realize Governor Palin isn't running for Super Awesome Girlfriend of the USA http://is.gd/4n2Q",jsteig,0,2008-10-19 20:43:26
