id,text,username,retweets,date
966496188,New blog post: My friend did Sarah Palin ! http://lifeonwards.com/blog/?p=1246,John_C,0,2008-10-19 20:00:42
966495881,[En nu even ernstig] Palin vs Palin : Bijzonder ontmoeting in Saturday Night Live gis.. http://tinyurl.com/66gwl4,dsoblogs,0,2008-10-19 20:00:25
966495879,Blogger calls Sarah Palin 's child a 'prop' http://tinyurl.com/6djdmc,pregg3r,0,2008-10-19 20:00:21
966495501,New Google Trend: sarah palin saturday night live video http://snipr.com/4i79x,gtrend,0,2008-10-19 20:00:05
966495392,"Just watched Sarah Palin on SNL. Um, WOW. While hilarious, I wonder how many people will vote for her because of this?",scottarany,0,2008-10-19 19:59:58
966495348,RT @karaswisher ... love the fun vibration of Sat. Nite Live skits ... Sarah Palin herself last night: http://tinyurl.com/6ftdxm,ChristinaMerk,0,2008-10-19 19:59:58
966495125,I just finished watching the SNL spoof with Sara Palin & Tina Fey. It had it's moments of funny but not all of it. What did you think?,kimbeasley,0,2008-10-19 19:59:39
966495064,Hard to imagine that Palin will look back on her SNL appearance with joy. All they did was mock her at every chance. She looked out of place,Akula,0,2008-10-19 19:59:36
966494607,Haha you can get librarian glasses for your character in Rock Band 2....im tempted to create a kick ass rock star Sarah Palin,omgitsemilyward,0,2008-10-19 19:59:00
966494241,"McCain's ""cold political calculation"" in picking Palin : counterpoint to ""liberal feminist agenda"": http://bit.ly/1OnmO3 [h/t @samharrelson ]",ayse,0,2008-10-19 19:58:30
966494233,Heartened this morning to see so many conservatives / republicans realizing that McCain/ Palin are not what our country needs.,LindaEskin,0,2008-10-19 19:58:32
966494035,"@seattlepam Palin Is Qualified...Take an Unbiased look @her executive experiences & compare that to Obama's ""less than 3 yrs"" in Senate.",americanswakeup,0,2008-10-19 19:58:19
966493902,"What do you think, is the Colin Powell endorsement of Barack Obama the final nail in the coffin of the McCain- Palin ticket?",joeburnham,0,2008-10-19 19:58:09
966493523,@ninastone Sarah Palin did great on SNL. Proved she can maintain her sense of humor in enemy territory. Go Sarah! [ »»»»»»is she SERIOUS?!!],wiredbirds,0,2008-10-19 19:57:42
966493417,"""Shucky darn doo dah, guys and gals!"" --Sarah Palin",RadioUranus,0,2008-10-19 19:57:31
966493317,@pyt503 agreed. Fey=Funny. Pohler=Funny. Palin =Unfunny twit,TimBond,0,2008-10-19 19:57:22
966492980,This made my week. Terry Tate vs. Sarah Palin : http://tinyurl.com/5bm8dq,paulmdavis,0,2008-10-19 19:56:57
966492618,Love sweet potato pie--but coconut cream is my favorite.That's settled--now beat the s--t out of McCain/ Palin !,honestm,0,2008-10-19 19:56:31
966492405,Great news! Obama/Biden wins Colin Powell endorsement; McCain/ Palin win KKK endorsement!,robertstinnett,0,2008-10-19 19:56:17
966492387,@americanswakeup Michelle is off on her own speaking for O. Unlike Palin who needs a babysitter.,TheDudeAbides,0,2008-10-19 19:56:16
966492378,Was I the only one that thought Sarah Palin 's appearance on SNL last night was NOT funny? Tina Fey still stole the show?,IAmMarielleT,0,2008-10-19 19:56:16
966492144,Watching SNL's Palin rap again.,FrankGumola,0,2008-10-19 19:55:58
966491315,Umm...so what was the point of Palin going on SNL? I've seen mimes talk more: http://tinyurl.com/6mrcrn,AlexBerger,0,2008-10-19 19:55:01
966491034,@deborah909 The Palin /SNL video is also on HuffPo http://is.gd/4lcD,joebaker,0,2008-10-19 19:54:41
966490619,takin a break to watch the Palin rap from SNL last nite on Hulu. wow. Amy Poehler's a good rapper. awesome. surreal.,hellogerard,0,2008-10-19 19:54:12
966489689,Last night's SNL with Sarah Palin ( and Tina Fey! ) http://is.gd/4mub,pixelbud,0,2008-10-19 19:53:08
966489041,Sarah Palin Drops By SNL : Republican vice presidential candidate Sarah Palin took a trip to New Y.. http://tinyurl.com/6d8ul7,socialitelife,0,2008-10-19 19:52:20
966488710,Obama wins Colin Powell’s vote: WASHINGTON (AFP) – Former secretary of state and military supremo .. http://twurl.nl/7dndo0,mg_palin,0,2008-10-19 19:52:00
966488696,"McCain: ‘I love being the underdog’: (CNN) -- Sen. John McCain said Sunday he’s ""very happy&#3.. http://twurl.nl/f7szmt",mg_palin,0,2008-10-19 19:52:02
966488533,"If Palin 's problem were that she takes herself too seriously, the skits would have worked in her favor. But has that ever been her problem?",jonniker,0,2008-10-19 19:51:52
966488315,Loved Palin on SNL last night! Too funny.,GoToTravelGal,0,2008-10-19 19:51:36
966488169,For those who missed it last night- Palin on SNL: http://xrl.us/oudn8 and http://xrl.us/oudno,henslin,0,2008-10-19 19:51:22
966487904,Colin Powell cuts the power to the McCain/ Palin 24-hour Cartoon Network.,dnsf,0,2008-10-19 19:51:08
966487813,Palin was so funny movin' to the rap! Great!,Cherdara,0,2008-10-19 19:51:02
966487694,"@F1F1 Yeah, the McCain/ Palin energy solution is to burn the books they don't want you to read for heat.",robertstinnett,0,2008-10-19 19:50:56
966487141,Powell's endorsement gives him leadership among reality-based Republicans as they emerge from the wreckage of Bush and react to Sarah Palin .,jayrosen_nyu,0,2008-10-19 19:50:17
966486435,This was better then the intro for SNL - Amy Pohler rapping for Palin .. The moose getting shot was funny http://snurl.com/4i6zg,sgraven,0,2008-10-19 19:49:37
966486356,FORGET SNL! This is the funniest thing Sarah Palin has EVER done! http://tinyurl.com/58q94y,JayHandler,0,2008-10-19 19:49:32
966485963,"McCain/ Palin brought to you by the Dark Ages, destroying reason and logic since the 1300's.",meanjuju,0,2008-10-19 19:49:05
966485911,Sarah Palin on SNL... In case you haven't seen it. http://tinyurl.com/5hwyka Pretty funny,Cruzers,0,2008-10-19 19:49:01
966485793,Don't you feel like Palin is just soaking up her 15 minutes of Fame rather than running for office? Andy Warhol whould have fun with her.,hrendesign,0,2008-10-19 19:48:57
966485738,viendo a sarah palin en SNL,allruiz,0,2008-10-19 19:48:52
966485575,"This is well-done look at Palin in the Oval Office, love the red phone http://palinaspresident.us/",kevin_hunt,0,2008-10-19 19:48:39
966485376,I just compared one of my students to Palin . Oops.,jinnigan,0,2008-10-19 19:48:29
966485067,"palin 's writing a book or something. this whole vp thng is jsta steppn stone. you betcha! she wins either way. of course, we could all lose.",lisarein,0,2008-10-19 19:48:08
966485016,"Couldn't believe it last night. Palin at the SNL Desk while Amy Powler did the "" Palin Alaska Rap"". That was awesome.",hrendesign,0,2008-10-19 19:48:04
966484948,"Republican vice-presidential candidate Sarah Palin meets her mimic on the hit-US comedy show, NBC's Saturday Night Live",ADAFINEWS,0,2008-10-19 19:48:04
966484396,@ehog I wonder why Faux News won't go after Palin 's un-American activities the way they harp on Ayers and Wright http://tinyurl.com/3rdlhk,Dangerangel,0,2008-10-19 19:47:27
966484049,Palin Smiles as 'SNL' Mocks Her Anew http://twurl.nl/rzsl38 -TheRealMcCain,HuffPostPol,0,2008-10-19 19:47:02
966484046,Palin Smiles as 'SNL' Mocks Her Anew http://twurl.nl/rzsl38,TheRealMcCain,0,2008-10-19 19:47:02
966484042,McCain/ Palin endorsed by the very same religious zealotry that brought you the dark ages.,seventenths,0,2008-10-19 19:47:02
966483820,"Wow, cameo-fest in een geweldige opening van SNL. Met de echte Palin naast Tina Fey.",Breuls,0,2008-10-19 19:46:54
966483636,@leolaporte I predict that Sarah Palin gets an offer to pose in Playboy on November 5th.,bryanomalley,0,2008-10-19 19:46:41
966483316,She Did It! Palin on SNL. What did you think? http://tinyurl.com/68oct6,mymodernmet,0,2008-10-19 19:46:19
966482931,@pjrodriguez Palin can't co-opt anything. She is one dimensional. In '76 the SNL cast http://is.gd/4mU3 would have shoved her up McCain's...,bigeasy,0,2008-10-19 19:45:55
966482812,U.S News: Wasilla councilwoman Palin helped derail church-led crackdown on bar hours http://tinyurl.com/55ygce,RSSFeedBot,0,2008-10-19 19:45:46
966482800,"Gotta, at least, give props to Palin for being a good sport.",1071,0,2008-10-19 19:45:45
966482705,Blast from the past. Terry Tate shows Sarah Palin what time it is. Yea! Whoooo! http://bit.ly/2ViMFn,krynsky,0,2008-10-19 19:45:40
966482497,"Palin has gained in popularity, thanks to her appearance on SNL",luv2cruze,0,2008-10-19 19:45:25
966482121,LOLing at SNL's Couric/ Palin interview http://tinyurl.com/4laxrb,khuffman,0,2008-10-19 19:44:59
966482038,New blog post: Palin & Fey & Wahlberg & Baldwin & Michaels http://buffalopundit.wnymedia.net/blogs/archives/7219,buffalopundit,0,2008-10-19 19:44:54
966481982,"@joegreenz Palin is on her way to Roswell, NM. Seriously.",EricHassler,0,2008-10-19 19:44:50
966481374,Gov. Sarah Palin on Saturday Night Live. A mountain. She was just there. http://tinyurl.com/6dr72u,curiousyellow,0,2008-10-19 19:44:04
966481335,Powell for sec of defense! Yes! The Powell doctrine to replace the Bush doctrine and Palin still learning about the Monroe doctrine!,DrAbbes,0,2008-10-19 19:44:01
966481258,Sarah Palin seems to have gone quiet. Probably not a sign of anything. She has nothing useful to add.,joegreenz,0,2008-10-19 19:43:57
966481155,Watching last night's SNL. Palin was very good. Still am happy,LizelGon,0,2008-10-19 19:43:48
966481058,"@glucas I hear Palin is making another swing thru RVA, plans pole dance event for money maker...get your wallet ready.",jeffnugent,0,2008-10-19 19:43:40
966481000,Sarah Palin had the training wheels firmly clamped on for last nights SNL. Really weak performance... bordering on strategic blunder.,JPWP,0,2008-10-19 19:43:34
966480654,Amy Poehler rocks. Palin didn't do jack (big surprise) - http://tinyurl.com/6po8wm,slpierce,0,2008-10-19 19:43:12
966480608,"Okay, the Weekend Update with Sarah Palin was cute. But that was more Amy Poehler than Sarah.",auritech,0,2008-10-19 19:43:09
966480065,"Avoiding homework and thinking about internships. Also, I continue to love Tina Fey and loathe Sarah Palin .",elisestawarz,0,2008-10-19 19:42:25
966479789,Eastern Iowa Conservative: Palin Does SNL: [...] http://tinyurl.com/67bqcn,iowaBNN,0,2008-10-19 19:42:05
966479691,Gov. Sarah Palin on Saturday Night Live: She showed America she can take a joke especially if it&.. http://tinyurl.com/5bd72f,theamericanmind,0,2008-10-19 19:42:01
966479558,An ad guy is behind the Sara Palin site I tweeted yesterday http://www.ohkamp.com/interactive.html,steverubel,0,2008-10-19 19:41:51
966479526,FishBowlNY: Sarah Palin on Saturday Night Live: 'All the Mavericks in the House Put Your Hands Up!': .. http://tinyurl.com/5hjf7m,new_yorkBNN,0,2008-10-19 19:41:49
966479460,"Power Plays: Rightbloggers on Palin 's SNL Gig: Loved Her, Hated Liberal Elite: Sensible people to.. http://tinyurl.com/56wama",new_yorkBNN,0,2008-10-19 19:41:44
966479455,Terry Tate > Sarah Palin http://tinyurl.com/6an8sa,lbdwag,0,2008-10-19 19:41:43
966479397,Just watched Palin clips on SNL. Why were all her sketches about her refusing to participate in sketches?,MelissaRyan,0,2008-10-19 19:41:39
966479235,is very disappointed with the Sarah Palin skit on SNL... Over-hyped and not delivered.,adam____smith,0,2008-10-19 19:41:30
966479025,"FNS: McCain Says Palin Is A Counter To ""Liberal Feminist Agenda"": Oh good lord, is he kidding me? WALLACE: ...(H)asn't Govern..",eviltwins,0,2008-10-19 19:41:11
966478972,"@shoemoney I decided on Obama the day Mccain picked Palin . I knew all about her BS long before he chose her. I was ""shocked and appalled"".",ClintLenard,0,2008-10-19 19:41:07
966478798,Slog: The Horrible: Writes a reader at The Corner: I watched Governor Palin on SNL last night... http://tinyurl.com/6gs4yu,washingtonBNN,0,2008-10-19 19:40:51
966478770,Slog: The Politics of Division: One of Palin 's real Americans attacked one of Obama's fake American.. http://tinyurl.com/595ujh,washingtonBNN,0,2008-10-19 19:40:53
966478692,"Slog: ""Dudes for Sarah"": The New York Times has a front-page piece today about the "" Palin Dude"" phe.. http://tinyurl.com/55l72d",washingtonBNN,0,2008-10-19 19:40:46
966478606,"Up late on Sunday, slight headache. Gonna take it easy today and do a lot of reading. And hopefully catch a vid of Palin on SNL last night.",FullMtlPatriot,0,2008-10-19 19:40:39
966478529,Best SNL rap so far! The mother-humpin' Palin rap http://tinyurl.com/5npc3h,blindie,0,2008-10-19 19:40:34
966478291,The Colorado Index: Sarah Palin In Town Tomorrow: Dear Friends: We are in a critical time and ever.. http://tinyurl.com/5zmjz3,coloradoBNN,0,2008-10-19 19:40:19
966477887,"When McCain loses, some conservatives will say Palin deserves part of the blame. They'll want to blunt her before 2012. But it won't work.",OxbloodRuffin,0,2008-10-19 19:39:55
966477635,Sarah Palin Survives on SNL with Fey Baldwin and Wahlberg: Sarah Palin finally got to see Tina Fey in p.. http://tinyurl.com/5bnqso,ACContent,0,2008-10-19 19:39:38
966477505,"Political Intelligence: Palin on SNL: Shooting the moose: By David Beard, Boston.com editor Sarah Palin m.. http://tinyurl.com/6nqto9",massBNN,0,2008-10-19 19:39:26
966477306,"Baldwin outraged by Palin , but still thought she was hot! Hatemongering Bigots are such a turnon?",OmnivorUS_MV,0,2008-10-19 19:39:15
966477053,Saturday Night Live - Sarah Palin Rap - http://tinyurl.com/5e37k4 - thought this was the best. #SNL - thought this was the best skit.,MeFeedia,0,2008-10-19 19:38:55
966476975,"Loved the SNL Palin Rap: ""When I say Obama, you say Ayers! Obama! Ayers! Obama! Ayers!""",RyanSMiller,0,2008-10-19 19:38:50
966476667,Colin Powell doesn't think Sarah Palin is qualified to be VP - http://tinyurl.com/6qmo34,GR8FL,0,2008-10-19 19:38:29
966476643,"@Scott_Pooler You can have that, I think I rather address issues, challenges and real world stuff, not the the rinky dinky Palin stumps",ColderICE,0,2008-10-19 19:38:28
966476626,"Preemptive Karma: General Powell endorses Obama, questions Palin choice: From Politico via Yahoo, Retir.. http://tinyurl.com/5kptcq",oregonBNN,0,2008-10-19 19:38:27
966476540,Did anyone catch the REAL Sarah Palin on SNL last night? Mark Wahlburg wanted to kick Andy Samberg's ass due to because of an offensive skit,SailorCallie,0,2008-10-19 19:38:19
966476371,Politicker NH: Kenney calls Lynch’s Palin joke ‘inappropriate’: Gubernatorial candidate Joe Kenne.. http://tinyurl.com/587uhz,newhampshireBNN,0,2008-10-19 19:38:07
966476302,Politicker NH: Woods calls Palin ‘serious contender’ for 2012: Gov. Sarah Palin has established h.. http://tinyurl.com/5w3o9c,newhampshireBNN,0,2008-10-19 19:38:04
966475282,oh yeah here's the link to the palin rap. funny as hell: http://tinyurl.com/5dzrpt,lisarein,0,2008-10-19 19:36:52
966475087,"thoroughly confused by sarah palin 's appearance on SNL. she almost seems ""cool"" doublethink closing in on my brain.",lisarein,0,2008-10-19 19:36:38
966474668,SNL and Palin : Caribou Barbie. Brilliant!,ColbertsEagle,0,2008-10-19 19:36:11
966474593,@EricHassler Palin has to get new orders from the alien overlords. My favorite protest sign ever: BUSH IS A REPTILIAN SHAPE SHIFTER *lol*,Dangerangel,0,2008-10-19 19:36:06
966474415,Palin Rap is funny.,chadwright,0,2008-10-19 19:35:56
966473583,Sarah Palin nastupila u ‘Saturday Night Live’ http://tinyurl.com/5b4lwc,Jutarnji,0,2008-10-19 19:35:02
966473181,"i cant believe snl did that bs piece with palin ,im glad i didnt watch that crap",ConqueringLion,0,2008-10-19 19:34:37
966473118,@PhillyMac_Biz - I noticed that Tina Fey was scared of Sarah Palin on Saturday Night Live last night. Then I watched House on Haunted Hill.,vaspersthegrate,0,2008-10-19 19:34:33
966473117,Christopher Buckley in NYT today: “The thought of Sarah Palin as president gives me acid reflux.” http://www.nytimes.com/2008/10/19/fashion,DalydeGagne,0,2008-10-19 19:34:31
966472871,"Palin is in Roswell, NM today. I don't know why that's funny, but it is.",EricHassler,0,2008-10-19 19:34:13
966472616,"mulititasking: 1. creating presidential election year unit, 2. downloading/listening to Palin on SNL at nbc.com, ...",MrsTG,0,2008-10-19 19:33:58
966472612,"SNL: Palin plays it safe, Fey and Poehler shine (again) on SNL: One of the most anticipated TV an.. http://tinyurl.com/5cbpvy",topix_entertain,0,2008-10-19 19:33:59
966472599,can't wait for the tsunami of Sarah Palin gifs,chrisgrav3s,0,2008-10-19 19:33:57
966472418,Amy Poehler's Palin rap from SNL http://tinyurl.com/6m7ukx,Mojos_Newswire,0,2008-10-19 19:33:45
966472416,Palin /Amy Poehler rap lyrics http://tinyurl.com/58defu,Ashlynkat,0,2008-10-19 19:33:42
966472032,Would love to see Powell debate with Palin . He would make her cry and run home to grandpa Mccain whilst being professional and eloquent,TheDudeAbides,0,2008-10-19 19:33:19
966471347,"OK, McCain, it's time to give up: ""Colin Powell endorses Obama"" (http://tinyurl.com/64r6y9, IHT). The best consequence: No Palin .",rintakumpu,0,2008-10-19 19:32:32
966471286,"Palin , Palin : Republican Vice Presidential nominee Sarah Palin ’s guest appearance boosted Saturda.. http://tinyurl.com/66chvd",fitsnews,0,2008-10-19 19:32:26
966471282,Yikes: McCain/ Palin : Hate we can believe in. http://is.gd/4mj0,JulieGomoll,0,2008-10-19 19:32:27
966471170,"""She doesn’t think aloud. She just ... says things"" - Peggy Noonan on Sarah Palin . ROFL. http://tinyurl.com/36d8lg",johnthelutheran,0,2008-10-19 19:32:21
966470973,"Yeah, I watched the Palin skit on SNL last night but I had the sound turned down.",bleifus,0,2008-10-19 19:32:06
966470042,"SNL is still lame, Palin is still cool, and the soup was good.",avri,0,2008-10-19 19:31:06
966469663,"Posted: Sarah Palin meets her mimic, live on US comedy show: Sarah Palin meets her mimic, live on US.. http://tinyurl.com/6nxu5l",rccgd,0,2008-10-19 19:30:37
966469582,I was disappointed with the way SNL utilized Gov. Palin . I didn't think it was bad - it just wasn't worth staying up to watch!,michaelstovall,0,2008-10-19 19:30:34
966469539,"New Camoosta post: Sarah Palin meets her mimic, live on US comedy show: Sarah Palin me.. http://tinyurl.com/6nxu5l",camoosta,0,2008-10-19 19:30:31
966469439,"twaboutMCCAIN> McCain: Palin is a counter to ""Liberal Feminist Agenda"" http://tiny.. http://tinyurl.com/5g7tj9",twaboutMCCAIN,0,2008-10-19 19:30:24
966468749,Sarah Palin is a moron. I don't want another person in the Oval Office that I think I'm smarter than. That's NOT what the POTUS should be.,elgreg,0,2008-10-19 19:29:42
966468349,"You know, I don't like Palin , but I gotta say she got brownie points with me for going on SNL...that was actually kinda cool of her.",shaunduke,0,2008-10-19 19:29:13
966468250,OMG! Last night's Saturday Night Live Sarah Palin rap was hilarious! I love Amy Poller!,Mrs_Dux,0,2008-10-19 19:29:04
966468031,"McCain: Palin is a counter to ""Liberal Feminist Agenda"" http://tinyurl.com/6ouozf",marcsobel,0,2008-10-19 19:28:46
966467820,"Colin Powell's endorsement of Obama could be death knell for McCain? Meanwhile, Palin 's celebrity grows via SNL.",jarofclay73,0,2008-10-19 19:28:33
966467792,"Terry Tate Linebacker, on Governor Palin http://hellotxt.com/l/oWi4",JimCutlerVO,0,2008-10-19 19:28:31
966467639,"I don't watch SNL normally. And while the Palin clip was funny, I'm reminded why I stopped watching SNL.",BrotherD,0,2008-10-19 19:28:17
966467638,"Video & Transcript: Sarah Palin on Saturday Night Live! - ""When I say Obama, you say Ayers!"" http://tinyurl.com/5ftvgl",velvethammer,0,2008-10-19 19:28:17
966467626,From her house Palin can see the end of her political career.,itsreallyrich,0,2008-10-19 19:28:18
966467273,"I wonder if Palin realizes SNL was laughing AT her, not WITH her. Especially Amy's rap.",danielrhorton,0,2008-10-19 19:27:55
966467185,"Wasn't Norm Coleman supposed to be Mr. ""No Negative Ads""? He and Tood Palin , quite the pair. http://www.balloon-juice.com/?p=12569",jeffshaw,0,2008-10-19 19:27:48
966466922,Agora no Blog: Sarah Palin e Tina Fey Juntas no SNL! http://tinyurl.com/5mcazz,ligadoemserie,0,2008-10-19 19:27:31
966466813,"Colin Powell endorses Barack Obama because of lack of belief in Sarah Palin . Almost funny, really.",PandrioAndrotti,0,2008-10-19 19:27:22
966466659,Sarah palin thought that afghanistan bordered the US...wtf how can anyone think that? This is recent during her campaigning for mccain too!,abidiar,0,2008-10-19 19:27:09
966466374,Terry Tate on Sarah Palin : Reading Is Fundamental - http://tinyurl.com/58q94y - ABSOLUTELY HILARIOUS!,Forian,0,2008-10-19 19:26:50
966466118,"Watching a DVRed version of last night's SNL. Man, the opening with Sarah Palin was dullsville. The rest of the episode has been terrible.",auritech,0,2008-10-19 19:26:27
966465654,Palin could have thrown another hail Mary who was up staged by a a very pregnant Amy while she pretends to be hip - OMG how pathetic,JoshuaNard,0,2008-10-19 19:25:57
966464940,"I agree with Leo Laporte. When this election is all done, S. Palin will have a job at Fox news as another talking head. Or other TV show.",Boxelderbob,0,2008-10-19 19:25:09
966464866,Palin is the least popular Govenor according to actual numbers of people,dandubelman,0,2008-10-19 19:25:05
966464855,"Sarah Palin Rap: Sarah Palin appeared on SNL's Weekend Update, too, but Amy Poehler had to take over the mic wh... http://tinyurl.com/6po8wm",BuzzFeed,0,2008-10-19 19:25:04
966464737,New SNL clip at SugarCain: http://SugarCain2008.com/YouTubed.html Gov Palin makes an appearance!,007bond4321,0,2008-10-19 19:24:55
966464486,@littlelazer I actually enjoyed Sarah Palin .,RockDiggie,0,2008-10-19 19:24:38
966464261,twHILLARY> Monica Lewinsky is to President Clinton as Jacques Slade is to Sarah Palin ...I .. http://tinyurl.com/5pgbo4,twHILLARY,0,2008-10-19 19:24:23
966464127,McCain/ Palin Change made the local paper! http://tinyurl.com/6ho3rj/20081019/NEWS/710199982/1001/NEWS,waltermoore,0,2008-10-19 19:24:16
966464075,"retweeting @rachelsklar ""crowd in Penn at a McCain Palin rally booed Tina Fey's name"" my comments: THAT'S what Obama meant by ""bitter"".",someothercraig,0,2008-10-19 19:24:11
966464045,@deborah909 Palin rap on SNL - http://tinyurl.com/5dzrpt,dswinscoe,0,2008-10-19 19:24:07
966463978,Everyone should watch the Palin Rap from SNL http://tinyurl.com/5pvzkz,mattpennington,0,2008-10-19 19:24:06
966463841,Colin Powell to McCain and Palin . The big F you.,TheDudeAbides,0,2008-10-19 19:23:54
966463755,"If you missed Tina Fey and Sarah Palin on SNL, you can see the videos here: http://tinyurl.com/625g7h",WebDesign_Steve,0,2008-10-19 19:23:47
966463670,Andrew Sullivan says that Joe the Plumber has given more press conferences as Sarah Palin .,r0b,0,2008-10-19 19:23:43
966463584,Hulu: Backstage: Gov. Palin Visits (Saturday Night Live) was added to his queue: Backstage: .. http://tinyurl.com/5haf33,frizzlefryfeeds,0,2008-10-19 19:23:33
966463357,"@ShaunPatrick did you know Palin 's gonna force you to eat some moose... true, heard it from a grizzly.",jahsensie,0,2008-10-19 19:23:22
966463036,"Obama responding to Palin with a variation on his 2004 DNC speech. ""There is no real or fake America...patriots were for & against Iraq war",tigerbeat,0,2008-10-19 19:22:57
966462936,"If Sarah Palin ever becomes president, they'd have to come and take me away! Hey, that reminds me>>> ♫ http://blip.fm/~hhff",edovett,0,2008-10-19 19:22:54
966462894,Sarah Palin Calls 'SNL' Appearance a 'Blast' http://tinyurl.com/5r524a,the_insider,0,2008-10-19 19:22:50
966462746,The best Palin interview of them all. http://tinyurl.com/58q94y,radcabbage,0,2008-10-19 19:22:40
966462629,McCain Palin Hate sign made local news! http://tinyurl.com/6ho3rj/20081019/NEWS/710199982/1001/NEWS,waltermoore,0,2008-10-19 19:22:31
966462583,I will say one thing for Sarah Palin . The girl's got rhythm. http://tinyurl.com/5dzrpt,blwarren,0,2008-10-19 19:22:30
966462483,Tina Fey and Sarah Palin together on Saturday Night Live last night: http://news.yahoo.com/s/ynews/ynews_pl98,Jon_Nordmark,0,2008-10-19 19:22:23
966462153,The Palin Rap was incredible. Kudos to SNL...http://tinyurl.com/6otx6k,thedigitaltom,0,2008-10-19 19:22:03
966461894,A different type of Sarah Palin protest: http://tinyurl.com/6xcka5,DaveWaldon1908,0,2008-10-19 19:21:43
966461877,"Joe the plumber has given more press conferences than Sarah Palin in the last few days, what a shame. McCains campaign is a disgrace",jpstephens,0,2008-10-19 19:21:42
966461870,Just watched the weekend update Palin rap. Pretty funny I thought,Matchgrip,0,2008-10-19 19:21:41
966461697,"I can't tell if all these McCain/ Palin yard signs are part of the Halloween decorations or not, but it sure is scary!!!",paul4ta,0,2008-10-19 19:21:27
966461360,"If u saw it, u know she didn't say much. Reasons http://newscriticreport. blogspot. com/2008/10/reasons- palin -didnt-get-many-lines-on. html",Music4VideoNate,0,2008-10-19 19:21:03
966461312,"Live, from New York, it's Sarah Palin !: After watching ""Saturday Night Live"" make fun of her from .. http://tinyurl.com/5qwjjg",StarNewsOnline,0,2008-10-19 19:20:58
966460663,"Taking a break from cleaning to re-watch SNL. I'm almost less afraid to like Sarah Palin now, somehow...",nukillerstar,0,2008-10-19 19:20:16
966460225,Monica Lewinsky is to President Clinton as Jacques Slade is to Sarah Palin ...I mean wouldn't you?,kustoo,0,2008-10-19 19:19:52
966460060,@the jelly belly factory (don't ask) and there are McCain/ Palin signs everywhere - political candy??,banastas,0,2008-10-19 19:19:42
966459933,GOOGLE NEWS - Did Sarah Palin flop or fly on 'Saturday Night Live?' - Los Ange.. http://is.gd/4mRe,USABreakingNews,0,2008-10-19 19:19:32
