id,text,username,retweets,date
950653741,Tom is going to open a can of whoop ass and we might be stuck with Palin or Biden,xmcgraw,0,2008-10-08 03:14:04
950653671,@aswas #debate08 Mah bizness e-mails FTW after McCain mah freenz shots. Sarah Palin .,Wickliffe,0,2008-10-08 03:14:02
950653602,"#debate08 - repeating same old stories over...and over...and over...very interesting....but no president, kind of like Palin ...",j1alex,0,2008-10-08 03:14:00
950653342,"Did y'all notice McCain going ""better be darn sure""? Uhhh that Palin rubbing off on you?",savantemeritus,0,2008-10-08 03:13:54
950653180,McCain what will happen if your health declines? We will have Sara Palin as our president due to your decision tothrow the USA under the bus,mparks,0,2008-10-08 03:13:49
950653152,"I love how Palin told Biden that he dwells on the past too much, while all she and McCain do is talk about Reagan, Roosevelt, and Kissenger.",minxsy,0,2008-10-08 03:13:48
950652964,"Obama is strong, statesman-like, and focused. McCain is scattered, hunched, stuttering. It's over. Palin would do better at this point.",leolaporte,0,2008-10-08 03:13:44
950652952,"A little over an hour in, I'm calling it a draw. Which for McCain- Palin means, an Obama win. #nashdebate",drewmaniac,0,2008-10-08 03:13:44
950652824,Guaranteed: you won't even remember Sarah Palin 's name 9 months from now.,worksology,0,2008-10-08 03:13:41
950652659,what this debate needs is palin /biden half time show - that was a more interesting debate,stardiver,0,2008-10-08 03:13:37
950652614,"@baratunde @TrevorDickerson he pronounces Pakistan CORRECTLY. Unlike Palin , who pronounces Iran, Iraq, nuclear AND Ahmadinejad incorrectly.",jilliancyork,0,2008-10-08 03:13:36
950652478,There appears to be an epidemic of quotation-mangling in the McCain- Palin campaign.,sarking,0,2008-10-08 03:13:34
950652467,"Am I the only one who finds Palin 's ""Joe Six Pack"" generalization really annoying and borderline insulting?",mandi,0,2008-10-08 03:13:34
950652391,really wants to hear the palin doctrine. You betcha!,dorafang,0,2008-10-08 03:13:32
950652315,rt @JessieX Friend Palin is damn good @relationships People love her / hate her. Everybody has relationship with her. Bigger sbjct than ...,leslie,0,2008-10-08 03:13:31
950652190,I can see Pakistan from my house!! #palin,mygalmeg,0,2008-10-08 03:13:27
950652021,@damonpace Unsure about who paid for the hairplugs. Would US govt pay for Palin 's tanning bed?,galenward,0,2008-10-08 03:13:21
950652012,"""Records not Rhetoric"" McCain/ Palin 2008",laurajacob,0,2008-10-08 03:13:21
950651922,thinks the two bald guys behind mccain are either clones or the only same-sex couple that Sarah Palin knows,Phillyberg,0,2008-10-08 03:13:18
950651600,is palin still talking about her energy policy?,JerseyTodd,0,2008-10-08 03:13:05
950651288,"i have to say it. JOHN MCCAIN IS A REAL A-HOLE. i'm pretty sure that Palin announced ""bomb pakistan!"" in a pizza place last week. #debate08",isweatbutter,0,2008-10-08 03:12:54
950651171,#debate08 don't announce it like Palin did you mean? my friend?,OpenIntro,0,2008-10-08 03:12:49
950651006,Palin 's husband was part of Alaskan Independence Party. We know this. Did you know they asked Iran for help seceding? www.tinyurl.com/3qs5of,jmsaye,0,2008-10-08 03:12:42
950650928,"#current OK, so McC came with talking points, just like Palin . Got it. Get to the question when you can, m'kay? Thxbai.",CharJTF,0,2008-10-08 03:12:39
950650862,McCain bashes Obama for saying the thing he defended Palin for saying last week. Maverick-y!,lucas_is,0,2008-10-08 03:12:37
950650641,"I concede this: Obama needs to be more sound bitey. No, that does not always equal substance, but Palin has proved substance matters not.",wendi_c_thomas,0,2008-10-08 03:12:28
950650389,"Nobody but a comedian would vote for McCain because of Palin , she could keep comedians in business for years. #current",Jackabug,0,2008-10-08 03:12:18
950650313,Palin speaks with group of reporters on campaign plane http://tinyurl.com/5dxak2/20081007/NEWS02/710089982,Wenatcheeworld,0,2008-10-08 03:12:15
950650121,#current McThurd forgets that Palin said this last weekend.,mexiwi,0,2008-10-08 03:12:09
950649800,"Palin had the notes tattooed on the inside of her eyelid, which is why she kept winking.",erked,0,2008-10-08 03:11:58
950649725,"Can't even get the Teddy Roosevelt quote correct, and doesn't seem to be aware of Palin 's statements... McCain IS senile...",DruidSmith,0,2008-10-08 03:11:56
950649685,Remember when Palin couldn't remember bin Laden's name?,RockDiggie,0,2008-10-08 03:11:54
950649578,#debate08 Palin announced that she would go into Pakistan.,vjmurphy,0,2008-10-08 03:11:50
950649539,McSame is FAILing really really badly. Palin ALSO said we should attack Pakistan btw - to reporters.,jeneane,0,2008-10-08 03:11:49
950649474,"@giantghost I'm firmly oppsosed to sick kids; also, Palin",josiahq,0,2008-10-08 03:11:47
950649193,"@laura47 Now you've got me mashing up Sarah Palin and John McCain singing ""My Friends""...",Jadasc,0,2008-10-08 03:11:38
950649066,"surprised Obama didn't drop the "" palin and I agree on Pakistan"" card. Would have driven McCain nuts",seat42F,0,2008-10-08 03:11:34
950648740,"#McCain doing the ""condescending wonder"" way of speak like palin now. - Photo: http://bkite.com/01MB8",lxbarth,0,2008-10-08 03:11:24
950648674,McCain and Palin don't agree on Pakistan,kenshane,0,2008-10-08 03:11:22
950648543,I dislike the way Sen O pronounces Pakistan and Taliban as much as I do Palin 's proun of Iraq... does no one know what 60 seconds means?,scottfillmer,0,2008-10-08 03:11:17
950648516,Palin 's husband was part of Alaskan Independence Party. We know this. Did you know they asked Iran for help seceding? tinyurl.com/3qs5of,jmsaye,0,2008-10-08 03:11:17
950648431,Palin 's husband was part of Alaskan Independence Party. We know this. Did you know they asked Iran for help seceding? tinyurl.com/3qs5of,jmsaye,0,2008-10-08 03:11:13
950648186,Obama should be debating Palin ...since she'll be our next president if mccain gets elected. #current,meganlupotter,0,2008-10-08 03:11:04
950647970,"I admire how Obama pronounces words like ""Pakistan"" correctly. It shows a certain level of respect. Unlike nucular Bush and Palin .",atonse,0,2008-10-08 03:10:56
950647952,I hope Palin is listening to McCain's answer to this one since she contradicted his position on this last week.,chuck_hamsher,0,2008-10-08 03:10:56
950647945,#current I got to believe that many of the conservatives wish that Palin was at the top of the ticket.,silnan,0,2008-10-08 03:10:56
950647873,"this is no fun only twittering with democrats. that's it, i'm going to the dark side. mccain palin in 2008! we are the true change!",ChasMcEnerney,0,2008-10-08 03:10:53
950647859,"@jowyang My Tag cloud: time_limit, mccain_breathing, obama, win, Tom, attitude, Palin _who?",ldbaldwin,0,2008-10-08 03:10:52
950647786,"@chumworth I think Palin and Biden are using this opportunity for a little ""Mommy and Daddy"" time.",badbanana,0,2008-10-08 03:10:50
950647674,"McCain's reference to ""never again"" is a stark contrast to palin 's use in reference to mortgages",giri_sreenivas,0,2008-10-08 03:10:46
950647648,is WHERE THE HELL IS MCCAIN'S LAPEL PIN AT?! This is the 2nd debate in a row... Palin can't wear her Lapel-bling to bail him out this time,Cdog923,0,2008-10-08 03:10:46
950647564,Don't worry about Pakistan. Sarah Palin will get General McClellan to fix it. And possibly General Lee. Yee-haw!,PlanetCait,0,2008-10-08 03:10:42
950647324,"When Their Supporters Call Obama a Terrorist and Demand His Assassination, Why Do McCain and Palin Remain Silent?",NYCer,0,2008-10-08 03:10:35
950647257,"i need some humor, bring back Palin , ha ha ha",Republican1b,0,2008-10-08 03:10:32
950647199,"@SistersTalk then Palin will rush in and wink, wink, wink",Mindingmatters,0,2008-10-08 03:10:31
950647192,Palin needs to walk in the room and wink. This debate is lacking charm. #current,Scott_Bromley,0,2008-10-08 03:10:31
950647183,Friend - Palin is damn good at relationships. People love her or hate her. Everybody has a relationship with her. Bigger subject than 140.,JessieX,0,2008-10-08 03:10:30
950646961,"What kind of pinko fag correctly pronounces ""Pakistan?"" A Muslim one. I could write jokes for McCain/ Palin .",Doctor_Andy,0,2008-10-08 03:10:24
950646949,When did McCain win a war? Palin said same thing in veep debate.,wendyhoke,0,2008-10-08 03:10:24
950646563,"McCain and Palin keep talking about ""victory"" in Iraq, but Petraeus says there will be no victory. #current",DerekHarmon,0,2008-10-08 03:10:14
950646510,"@babyluxe Oh but wait... who gets naming rights? Oooh, how about Sarah Palin ? We could name the baby Hacksaw or something. Woo!",twinklingtees,0,2008-10-08 03:10:13
950646439,@Yardboy OMG...that is hilarious! Palin doesn't need help to be confused. I think it comes naturally.,LadyFarnsworth,0,2008-10-08 03:10:11
950646196,#debate08 #current Channeling Sarah Palin,The_Osoto,0,2008-10-08 03:10:05
950645921,"@danamo ""My friends"" is what he practiced in debate camp with Palin .",HarlemWriter,0,2008-10-08 03:09:57
950645911,Is Palin ready to lead the military?,mangeroth,0,2008-10-08 03:09:57
950645675,"McCain ain't gotta explain... he and Palin is failin', won't answer questions in this game",AnyMeans,0,2008-10-08 03:09:51
950645432,Holla to your jews! McCain/ Palin drops the Holocaust in all three debates so far. #current #nashdebate,TracyViselli,0,2008-10-08 03:09:44
950645411,RT @weirdsmobile Oh noes! Now Sarah Palin has TWO MORE DOCTRINES to learn!,atypicalsnowman,0,2008-10-08 03:09:44
950645143,#nashdebate wonder what sarah palin is wearing right now...,chumworth,0,2008-10-08 03:09:36
950645081,@dryller words maverick change Obama friends palin biden mccain,randomslagathor,0,2008-10-08 03:09:34
950645035,"at least they're answering the questions better than sarah palin . then again, that's not too difficult.",ink176,0,2008-10-08 03:09:33
950644992,Poll: Who's more annoying? McSame or Palin ?,Rene_AandR,0,2008-10-08 03:09:32
950644747,"Sarah Palin watching the debate at a restaurant in Greenville, NC",stevebruskCNN,0,2008-10-08 03:09:26
950644659,Can you imagine Sarah Palin answering these kinds of questions?,bkriner,0,2008-10-08 03:09:24
950644532,"#debate #debate08 — Waiting for someone to forgo their real question to ask ""Sarah Palin ? Seriously?""",Vocino,0,2008-10-08 03:09:20
950644413,http://twitter.com/replies PALIN ?,Marthalewallen,0,2008-10-08 03:09:18
950644393,"Sullivan: It would have been a strong moment for McCain when he cited ""no on the job training"" in the White House. And then he picked Palin !",Remy,0,2008-10-08 03:09:17
950644319,Brokaw is asking for definitions of the McCain Doctrine and the Obama Doctrine. Where is Sarah Palin when we need her?,Slate,0,2008-10-08 03:09:15
950644129,McCain getting tired? Send Nurse Palin in with a wheelchair and warm glass of milk.,jimhirshfield,0,2008-10-08 03:09:11
950644099,McCain/ Palin 2008,jhooie,0,2008-10-08 03:09:10
950643881,"#debate08 Isn't this the Palin ""gotcha"" question?",KnockItOff,0,2008-10-08 03:09:05
950643674,"sarah palin said ""never again"" to the bailout. what a clueless moron.",peterhoneyman,0,2008-10-08 03:09:01
950643550,"@gurubanks look, this economy has a very real and direct impact on Sarah Palin 's lipstick and tanning bed fund - we have to respect that.",stuph,0,2008-10-08 03:08:58
950643458,"We need a ""cool hand at the tiller,"" her name is Sarah Palin .",dustyj,0,2008-10-08 03:08:57
950643451,"Oh yes, the hot pursuit question that Palin got.",mvatlarge,0,2008-10-08 03:08:56
950643444,McCain Hothead. Unstable. Old. Palin . Bad Mic Technique.,stevegarfield,0,2008-10-08 03:08:56
950643221,one million dollars that Palin believes the holocaust never happened.,writingroads,0,2008-10-08 03:08:52
950643004,McCain doesn't like on the job training. ... Palin .,marcamos,0,2008-10-08 03:08:47
950642943,I am going to vote for Sarah Palin and that guy with white hair.,castjohn,0,2008-10-08 03:08:46
950642803,"McCain is like Palin .. avoid the question, sprinkle american pride into the mix and leave it be.. ? wtf?",MossyBlog,0,2008-10-08 03:08:43
950642661,McCain is sounding like Palin now. The worm has turned and the tail is wagging the dog.,SkyWriter012,0,2008-10-08 03:08:40
950642442,@amazonmidwife he graduated from the Sarah Palin school of public relations?,MammaD,0,2008-10-08 03:08:36
950642332,"#debate08 If Palin had run for president, would she have even made it as far as the YouTube debates?",glassesgeek,0,2008-10-08 03:08:34
950642299,Palin 's husband was part of Alaskan Independence Party. We know this. Did you know they asked Iran for help seceding? T,jmsaye,0,2008-10-08 03:08:33
950642218,"Y'know, I'd believe McCain's stuff about on the job training if he didn't pick Sarah Palin as his VP.",danpolinsky,0,2008-10-08 03:08:31
950642171,"No ""on the job training"" in the White House, John? Will Palin be going to some sort of training camp over the summer, then?",cabridges,0,2008-10-08 03:08:30
950642066,"#current #debate08 McCain is kinda skinny for a man at his frail age. One bout of the Flu, and Palin is guttin' a moose in the white house.",BigToys,0,2008-10-08 03:08:28
950641970,"ok, new drinking game anytime Palin or McCrazy talk: anytime they bring up Reagan. Let the man rest in peace, MY FRIENDS!",urbanblissmedia,0,2008-10-08 03:08:25
950641851,I'm not sure I can picture Palin having this debate so that means McCain does NOT get my vote!!,Kit1000,0,2008-10-08 03:08:23
950641759,On McCain and Palin 's debate to-do list: Mention Reagan.,Mark_Lowry,0,2008-10-08 03:08:21
950641672,"""withdraw in humiliation"" Who wants to take a crack at a Bristol Palin joke?",monteiro,0,2008-10-08 03:08:19
950641550,"Palin : Damn, another doctrine?!",epilkington,0,2008-10-08 03:08:17
950641266,"Excuse me Sitting down with the enemies? Didn't Sarah Palin meet with Mr Pakastan? Guess they did not sit..,, #current",jmedvm,0,2008-10-08 03:08:12
950641071,I'm tired of the McCain/ Palin campaign talking about how wonderful Reagan was - he sucked...hello Iran Contra anyone? #current,dominickevans,0,2008-10-08 03:08:08
950641036,"#current ""Beneficially Affect the situation"" I think he's been hanging around Palin for a while !",mexiwi,0,2008-10-08 03:08:07
950640993,Palin 's per diem pay under review http://tinyurl.com/4nzhta,MSNBC,0,2008-10-08 03:08:07
950640879,Olbermann's rant on Palin : http://tinyurl.com/4gypsr,claymc,0,2008-10-08 03:08:05
950640485,McCain already has Palin 's 'Maverick' beat with 'My Friends',guidemike,0,2008-10-08 03:07:57
950640113,@lebontempsroule It is hard for Palin to write fast using an Etch-a-Sketch.,paleobiology,0,2008-10-08 03:07:50
950640028,i'm not sure which voice is more irritating Palin 's finger on the chalkboard.....or mccains',lizmoras,0,2008-10-08 03:07:49
950639993,"""my friends"" does for McCain what ""Also"" does for Palin .",Amandemic,0,2008-10-08 03:07:48
950639964,"#debate08 who's the chica in the back, dark suit,green shirt -- rockin' the Palin Pompadour & spex?",kidelo,0,2008-10-08 03:07:48
950639922,"McCain: ""never again."" Palin said it too. Not a coincidence: dogwhistle to Jews. This Jew ain't rolling over.",Fritinancy,0,2008-10-08 03:07:47
950639862,Question: Does Palin know what the McCain Doctrine is?,MichaelBJordan,0,2008-10-08 03:07:46
950639835,"@ryenna Normally I don't, but McCain/ Palin scare me so badly that I have to have my nose in it this time.",wordsofgray,0,2008-10-08 03:07:46
950639623,"This ""My friends"" line is starting to get even creepier than than Palin 's wink.",jkeener,0,2008-10-08 03:07:42
950639578,"is it possible that McCain has said ""my friends"" more than palin said ""maverick?""",joshuawhite,0,2008-10-08 03:07:42
950639489,"#debate08 McCain is looking older and older. If he wins, Palin will probably become president.",ialexi,0,2008-10-08 03:07:40
950639410,"""we don't have time for on the job training"" ok, mccain...so ummm, palin ?!",meigs,0,2008-10-08 03:07:38
950639278,"@ryenna Normally I don't, but McCain/ Palin scare me so badly that I have to have my nose in it this time.",wordsofgray,0,2008-10-08 03:07:36
950639257,"""my friends"" and ""maverick"" and ""also"" used much by McCain- palin",danbradford,0,2008-10-08 03:07:35
950639111,"@artistic_amanda Too bad they couldn't teach Palin those big words, eh? Eh?",x_Dave_Lister_x,0,2008-10-08 03:07:33
950639098,@yatpundit Well Palin maxed out the Man-o-Meter,leendaluu,0,2008-10-08 03:07:32
950639032,#debate08 I heard Palin took her motorcycle to a pizzeria in NC to watch the debate.,Smedette,0,2008-10-08 03:07:31
950638622,I'm not sure how much I can take of Palin 's incessant winking and McCain's delusions about how many friends he has.,dciii,0,2008-10-08 03:07:23
950638523,"words im tired of,maverick, fundamental, difference bailout, sara, palin , senator. Im just tired of hearing these words.",ericcapehart,0,2008-10-08 03:07:21
950638434,"McCain is to 'my friends' as Palin is to 'also, too'",Tami_McBrady,0,2008-10-08 03:07:19
950638395,Palin : Oh no not another doctrine.,marcdirix,0,2008-10-08 03:07:18
950638299,"RT @WPoFD Poor Sara Palin , after tonight she's got to memorize all sorts of new stuff. Her lil head's just gonna bust don'tcha know",felix42,0,2008-10-08 03:07:16
950637954,@joeplanet reminder: palin effectively running for president. she's spanking McCain in polls every time she talks.,chrissandoval,0,2008-10-08 03:07:10
950637745,"@nick RT Oh good, more doctrines to confuse Sarah Palin about.",ahess247,0,2008-10-08 03:07:06
950637611,"Wait, he said no on the job training. (Scratching head over Palin .)",RindaElliott,0,2008-10-08 03:07:03
950637380,#dialtest * Palin 1* Just thinking about her for a moment.,rgalloway,0,2008-10-08 03:06:59
950637351,"The McCain campaign seems to like repeating terms to make a point. ""Maverick"" last with with Palin , ""my friends"" this week with John.",August,0,2008-10-08 03:06:59
950637062,McCain's answer to the Fey/ Palin debate drinking game... my friends,ARBetts,0,2008-10-08 03:06:53
950637019,@leolaporte I kinda think McCain lost it more then Obama one it.. between Palin and his Campaign suspension and such,MattSearles,0,2008-10-08 03:06:52
950636768,Sarah Palin knows what the McCain doctrine is because she read it on a Starbucks cup.,RogerKint,0,2008-10-08 03:06:48
950636747,"Calling it the ""Obama Doctrine"" - is that a jab at Sarah Palin for not knowing the ""Bush Doctrine?"" (if it isn't it should be) #debate08",jaynawallace,0,2008-10-08 03:06:48
950636724,"Look, McCain has a crystal ball of what would have happened. Call Sarah Palin 's witch hunter pastor!",SuSandStorm,0,2008-10-08 03:06:47
950636632,"Previous tweet from John Roger's latest; also calls Palin out as Warren Ellis' ""Smiler"" (Transmetropolitan) -- spot on! http://is.gd/3EuG",morabbin,0,2008-10-08 03:06:46
950636625,Long time no twitter - watching the debate. My ears aren't hurting as badly as they were for the VP debate... I don't like Palin 's voice,SHemmann,0,2008-10-08 03:06:46
950636460,"What Obama would have done, Senator McCain? I thought you and Ms. Palin were looking toward the future. #debate08 #current",omaryak,0,2008-10-08 03:06:43
950636450,RT @weirdsmobile Oh noes! Now Sarah Palin has TWO MORE DOCTRINES to learn!!,haelmai,0,2008-10-08 03:06:43
950636338,@JessieX And what relationships in her own right does Palin have to be effective today?,Jillfoster,0,2008-10-08 03:06:40
950636226,Does palin know what the mccain doctrine is?,WillOstedt,0,2008-10-08 03:06:38
950635610,@bredemske went through newspapers from over weekend. Palin was in Omaha. Someone from campaign must have been looking for locals?,dougkeklak,0,2008-10-08 03:06:26
950635514,Obama sounded like palin on doctrine answer. You can see the gears turn.,KSoltisAnderson,0,2008-10-08 03:06:24
950635460,"RT @bcompton : Pssst... McCain... the Earth doesn't really have ""four corners."" You will confuse Palin if you keep saying that.",Yardboy,0,2008-10-08 03:06:23
950635438,Sarah Palin should answer this one...she's so familiar with the Bush doctrine!,the_mom,0,2008-10-08 03:06:23
950635271,#debate08 The McCain doctrine: Sarah Palin is furiously taking notes.,zinta504,0,2008-10-08 03:06:19
950635177,"I have a hard time believing that Palin will be able to memorize two more doctrines. Not like the McCain one wil be much different, though.",Zoeytrope,0,2008-10-08 03:06:17
950635035,@quinnelk Palin doesn't do doctrines. Unless they involve witch doctors.,WeeLaura,0,2008-10-08 03:06:14
950635015,Hey Palin - There is not time for on the job training...,epilkington,0,2008-10-08 03:06:14
950634999,"In what respect, Tom? Oh, wait, we don't have to ask Palin about the Obama or McCain doctrine.",kdemerly,0,2008-10-08 03:06:14
950634972,"""Obama Doctrine"" on when to send in U.S. troops sounds like it was written by Sarah Palin .",radleybalko,0,2008-10-08 03:06:13
950634542,Live haiku #08: Doctrine in da house/ Palin in comparison?/Cruelty gets a spike.,ellmcgirt,0,2008-10-08 03:06:05
950634509,I'm so sick and tired of hearing these *verifiable* lies of McCain/ Palin that I don't care who agrees with me anymore. #golookitup,christophr,0,2008-10-08 03:06:05
950634506,@strategiclee => Palin doesnt need on the job training? <- when i saw that bit...I had to reach for a stiff drink. I am creeped out,afromusing,0,2008-10-08 03:06:05
950634469,Friend Palin just needs to be herself. She's doing just fine. Words won't get us out of this crisis. Relationships will. Profound. #current,JessieX,0,2008-10-08 03:06:04
950634270,"#debate08 defining doctrines. Sarah palin , take notes.",dangermee,0,2008-10-08 03:06:00
950634170,"Where is Palin tonight? I need someone to say ""betcha""",ellie_lumpesse,0,2008-10-08 03:05:59
950634157,RT @bobbykearan : No on the job training... McCain said so... Therefore no Palin in the whitehouse! #nashdebate,iDeeDee,0,2008-10-08 03:05:58
950633905,Wonder what Sarah Palin is doing right now.,collazoprojects,0,2008-10-08 03:05:54
950633891,"@nick #palin ""what's a doctor in, hehe?""",McAtoms,0,2008-10-08 03:05:53
950633875,Screw that. I want to hear McCain talk about the Palin Doctrine. #current,sam_kolb,0,2008-10-08 03:05:52
950633761,"Sarah Palin needs to be worked into this debate somehow...the lack of hearing ""Maverick"" is really disappointing me.",topekajim,0,2008-10-08 03:05:50
950633726,Costume Kingdom has exclusive sara palin halloween mask. Get yours now before its too late at http://iiicoupons.com,iiicoupons,0,2008-10-08 03:05:49
950633614,"@BlogXilla ""My Friend"" is McCain's line and "" Maverick"" is Palin 's ... lol",arm_candy,0,2008-10-08 03:05:47
950633543,"""Short career"" ""On-the-job training"" These comments coming from someone that wants Palin a heartbeat away from the presidency.",bradleybowen,0,2008-10-08 03:05:46
950633340,The man who gave us Sarah palin says there's no time for on the job training. hahaha.,JonathanMosen,0,2008-10-08 03:05:43
950633332,i wish sarah palin was here. and tina fey. and cindy mccain.,megancarusona,0,2008-10-08 03:05:43
950633258,Palin is inexperienced and he's willing to send her into presidency after she kills him!,livingalmost,0,2008-10-08 03:05:41
950633237,"retweet: @bsktcase Palin is thinking, ""oh noes, two more Doctrines for me not to have heard of!"" #debate08",fairybookmother,0,2008-10-08 03:05:41
950633208,"Whatever the Obama Doctrine is, you can bet Palin doesn't know what it is. #notmygal",quinnelk,0,2008-10-08 03:05:40
950633061,Starting to miss Biden/ Palin debate. Speaking point overload!!,rcrissinger,0,2008-10-08 03:05:37
950633019,Palin crushes everyone when it comes to business management - are the majority of businesses in America - small business. Take that Dems! :),natedlee,0,2008-10-08 03:05:36
950632961,Brokaw just asked what the Obama Doctrine is. So he can have Palin repeat it later.,mlouttit,0,2008-10-08 03:05:34
950632879,No on the job training... McCain said so... Therefore no Palin in the whitehouse! #nashdebate,bobbykearan,0,2008-10-08 03:05:33
950632844,@jillfoster - Friend says Palin just needs to be herself. She's doing just fine. Words won't get us out of this crisis. Relationships will.,JessieX,0,2008-10-08 03:05:32
950632765,"once again, twitter is not posting my comments. Was it eh Palin panty raid thing, twitter?",carynloveless,0,2008-10-08 03:05:30
950632585,"RT @johnhummel : Brokaw: What is the Obama doctrine? What is the McCain doctrine? Don't ask Palin , whatever you do!",LindaLawrey,0,2008-10-08 03:05:27
950632499,"@ShaunaN If Palin can do it, so can McCain",LisaPimental,0,2008-10-08 03:05:24
950632469,"Ok, Palin , pay attention! You could be quizzed on either thie Obama doctrine or the McCain doctrine now.",tesuit,0,2008-10-08 03:05:24
950632417,"rt @gilgul right. we don't have time for job training. Thats exactly why you've picked Palin as your #2, my friend?",rmack,0,2008-10-08 03:05:23
950632332,#current #debate08 I wonder how Brokaw would act if Palin was up there.,BigToys,0,2008-10-08 03:05:21
950632299,Wait. Maybe Sarah Palin is teaching him about geography.,jerrycolonna,0,2008-10-08 03:05:20
950632295,palin not in military = no foreign policy experience (or a clue?),marcfeld,0,2008-10-08 03:05:20
950632262,Still to this day I wonder if Palin knows what a Rwanda is,DJEdNice,0,2008-10-08 03:05:20
950632204,@KathleenLD I thought for sure he'd throw Palin there. It's what I wanted to know.,jlsp30,0,2008-10-08 03:05:18
950632140,"If we don't have ""time for on the job training,"" what does that say for Palin ?",veronicas,0,2008-10-08 03:05:17
