id,text,username,retweets,date
951155708,"RT @viveka Micallef asks the tough questions: If Palin becomes President & has an airport named after her, will it be called the Palindrome?",einspruch,0,2008-10-08 12:51:08
951154110,Palin 's Dear John Letter! http://www.voy.com/99354/14781.html,make_lemons,0,2008-10-08 12:49:21
951153953,"Brigitte Bardot slams Palin as a ""disgrace to women"": Brigitte Bardot weighs into Sarah Barracuda and J.. http://tinyurl.com/43dlhb",NowPublic,0,2008-10-08 12:49:11
951152716,@lovehasnologic I love that Palin is related to Princess Di. It somehow only adds to her charm.,jpsmythe,0,2008-10-08 12:47:44
951152111,Just posted 'Biden calls Palin 's criticism 'mildly dangerous'' - http://tinyurl.com/4xysjh,ConnPolitics,0,2008-10-08 12:47:03
951151538,"Micallef asks the tough questions: If Palin becomes President and has an airport named after her, will it be called the Palindrome?",viveka,0,2008-10-08 12:46:25
951151336,"Just heard....""My friends, if something should happen to me, don't you feel secure with 'my friend' Sarah Palin running things for awhile""!",charlesoliver,0,2008-10-08 12:46:11
951150892,(Media Biz) Covering civil rights vs. dealing with Palin fans http://tinyurl.com/4urkrp,B2BTechnologyPR,0,2008-10-08 12:45:42
951150831,"@blackfonzie it w/ be great if politics was like the wrestling... "" in the left corner we have Punisher Palin watch out for her killer wink""",Solshadow,0,2008-10-08 12:45:36
951150397,Video: Nader running mate Gonzalez on the Sarah Palin /Biden Debate http://tweetopolis.com/politics/#118,twop,0,2008-10-08 12:45:09
951149943,WTF? Methinks someone has too much time on his(?) hands: www.sarahpalin.co.za #palin,mandyjwatson,0,2008-10-08 12:44:30
951149594,Anyone else notice its like obama against palin now?,wolff,0,2008-10-08 12:43:58
951147959,"RT @NBC2 : Sheriff Scott says he's done. http://tinyurl.com/4r3p73 4 those of u not here, the sheriff spoke b4 Palin & used Obama's full name",kbarry,0,2008-10-08 12:41:34
951147533,Just saw a campaign ad against McCain/ Palin . You could tell that things were taken out of context.,allenbower,0,2008-10-08 12:40:59
951147427,"I get the feeling that Palin heard this and didn't realise it was ironic; ""my policies! in a song!"" - ♫ http://blip.fm/~dmd6",solobasssteve,0,2008-10-08 12:40:48
951145188,The Political Environment: Here's Another Group of Real Mavericks Angry At McCain- Palin : The genuine.. http://tinyurl.com/4b85y8,wisconsinBNN,0,2008-10-08 12:37:52
951144990,Don Surber: Not McCain: I’m voting only because of Republican Sarah Palin . (more…) .. http://tinyurl.com/4b7ffh,westvirginiaBNN,0,2008-10-08 12:37:36
951144203,"THE CITIZENS JOURNAL: L.A. Times calls Palin a ""Monkey"": Via - NRO.Another media cheap shot at Americ.. http://tinyurl.com/3oltow",arkansasBNN,0,2008-10-08 12:36:38
951143701,¿Alguien puede decirme dónde encontrar el video de Sarah Palin (Tina Frey) subtitulado?,sunne,0,2008-10-08 12:36:00
951143091,Sarah Palin en 30 segundos http://tinyurl.com/4f4v87,Hipertextual,0,2008-10-08 12:35:13
951142795,"US-Vizepräsidentkandidatin:Brigitte Bardot beschimpft Palin als ""Schande"" : US-Vizepräsidentkandidatin:.. http://tinyurl.com/4brhes",Infopirat,0,2008-10-08 12:34:51
951142225,Rewatched SNL Palin /Biden spoof for grins & feeding inner geek by checking latest offerings at ThinkGeek before Benadryl sets in (me),ageekmom,0,2008-10-08 12:34:12
951141445,Roy Greenslade: why Sarah Palin refuses to hold a press conference http://tinyurl.com/4j9z3g,radiotodayextra,0,2008-10-08 12:33:15
951141173,"Gwen Ifill on Sarah Palin 's performance: ""the understanding was that we were going to have a debate"": http://snipurl.com/46cje",jrheling,0,2008-10-08 12:32:55
951141001,"Sarah Palin has ruined winking. It will take decades to recover, and even then, only through a period of self-aware kitsch/irony abuse.",jdub,0,2008-10-08 12:32:43
951140023,"oh i get it now. michael palin as gumby and ""my brain hurts"" = sarah palin DUH",pianica,0,2008-10-08 12:31:26
951139331,twaboutMCCAIN> The Governor Palin (McCain/ Palin ) Rally in Jacksonville - 10pm east.. http://tinyurl.com/3lazsl,twaboutMCCAIN,0,2008-10-08 12:30:33
951139048,The Governor Palin (McCain/ Palin ) Rally in Jacksonville - 10pm eastern TONIGHT ON THE RECORD: Yesterday we went to... http://tinyurl.com ...,greta,0,2008-10-08 12:30:14
951138964,Video: Nader running mate Gonzalez on the Sarah Palin /Biden Debate http://tweetopolis.com/politics/#118,twop,0,2008-10-08 12:30:09
951138319,Mayor In Russia Says He Can See Sarah Palin Showering From His House,mykpruitt,0,2008-10-08 12:29:11
951137596,"Palin Family Tree Extends to Princess Di, FDR: Republican vice presidential... http://tinyurl.com/45va9a",foxnewspolitics,0,2008-10-08 12:28:07
951137441,rt @tariqkrim tyler from monocle talks about interview of sarah palin a Year Ago,christopheradam,0,2008-10-08 12:27:51
951137019,"ELECTIONS: Palin Family Tree Extends to Princess Di, FDR http://tinyurl.com/45va9a",FoxNews,0,2008-10-08 12:27:06
951136638,Sarah Palin 's debate performance lowered the standards for both female candidates and US political discourse: http://tinyurl.com/4d7lok,wu,0,2008-10-08 12:26:33
951135937,"@EmilioPujol It's very interesting, since the VP debate she has been very quiet about politics and LIKES Sarah Palin .",truckertom,0,2008-10-08 12:25:25
951135507,http://is.gd/2W46 PBS has an online poll posted asking if Sarah Palin is qualified,janstewart,0,2008-10-08 12:24:49
951135242,"Just heard from a Danish friend I met last week in Norway: ""that Palin woman is kind of a disgrace to every living intellectual person.""",ptpower,0,2008-10-08 12:24:20
951133795,A. Sullivan: Trying To Find Out About Palin : It's a very difficult task when the Palin-M.. http://tinyurl.com/3lvwwe -HuffNewswire,HuffPostPol,0,2008-10-08 12:22:23
951133794,A. Sullivan: Trying To Find Out About Palin : It's a very difficult task when the Palin-M.. http://tinyurl.com/3lvwwe,HuffNewswire,0,2008-10-08 12:22:22
951132663,Friedman on Palin and Patriotism is a must read this morning: http://tinyurl.com/4b6f6r,PMM_,0,2008-10-08 12:20:57
951132135,tyler from monocle talks about interview of sarah palin a Year Ago,tariqkrim,0,2008-10-08 12:20:17
951132033,Roy Greenslade: why Sarah Palin refuses to hold a press conference: http://www.mediauk.com/tv/news/go/51671,minfoUKtv,0,2008-10-08 12:20:10
951130097,I like that the networks are making note that 'Sarah Palin was invited to appear but declined our invitation',ptpower,0,2008-10-08 12:17:50
951129868,Enjoys watching Joe Biden on the Today show. Especially when they're showing footage from SNL. Palin declined to appear--big surprise.,stevenseighman,0,2008-10-08 12:17:31
951128984,"I cannot argue with the basic thesis of this article http://tinyurl.com/4qpl3a However, I would loathe Palin just as much if she were a man.",violetxoxox,0,2008-10-08 12:16:25
951128977,"Is it true? Cat tells me that October 21 will be ""International Talk Like Sarah Palin Day on Facebook. Say it's true, please say it's true.",NYMeng,0,2008-10-08 12:16:23
951128896,Biden: called Palin on not condemning violent remarks.,data4all,0,2008-10-08 12:16:15
951127944,Video: Nader running mate Gonzalez on the Sarah Palin /Biden Debate http://tweetopolis.com/politics/#118,twop,0,2008-10-08 12:15:07
951126850,"Palin 's visit draws big crowds, funding...http://tinyurl.com/48a3by",SayfieReview,0,2008-10-08 12:13:24
951125729,"I was glad to hear that McCain and Obama call the Bail-Out a ""Rescue."" I hear Palin uses helicopters to rescue wolves.",BlaveFlopata,0,2008-10-08 12:11:44
951123450,Sheriff's 'final comment' on Palin rally - WZVN-TV http://tinyurl.com/3gjxq5,CrazyJoesCoffee,0,2008-10-08 12:08:13
951123375,[Brandi40] #1 unless Palin get's into office *running from people who don't agree* lol,Robs_Place,0,2008-10-08 12:08:05
951122833,"Sarah Palin es pariente lejana de Lady Di y del ex presidente Roosevelt: NUEVA YORK, 8 (Reuters/EP) L.. http://tinyurl.com/43j5v7",msnnoticias,0,2008-10-08 12:07:24
951120515,"Sing it: ""Hey Sarah Palin , do you tell them in Wasilla That 4,000 years ago we roamed the planet with Godzilla"" http://snurl.com/46bxg",spiver,0,2008-10-08 12:04:16
951119889,@nokson yeah palin milf xD,proyecto,0,2008-10-08 12:03:28
951119803,Sarah Palin Works To Close Gap In Florida http://tinyurl.com/4rbqcl -nprpolitics,HuffPostPol,0,2008-10-08 12:03:20
951119801,Sarah Palin Works To Close Gap In Florida http://tinyurl.com/4rbqcl,nprpolitics,0,2008-10-08 12:03:20
951119020,Palin mag niet naar concert Madonna http://rss.feedsportal.com/c/585/f/9435/s/211d344/l/0L0Stelegraaf0Bnl0Cprive0C2140A380A0C0I0IPalin0I ...,telegraaf,0,2008-10-08 12:02:16
951118814,Yahoo headlines- Palin may be related to Princess Di Jade Goody starts planning funeral Lopez: 'I will send twins to scientology school'HELP!,methel,0,2008-10-08 12:01:57
951118271,New blog post: Friedman on Palin : Shooting Patriotic Fish In A Barrel http://tinyurl.com/3j9rlm,markwillismedia,0,2008-10-08 12:01:16
951117907,why some women hate Sarah Palin ? http://tinyurl.com/4qpl3a,yoshife,0,2008-10-08 12:00:48
951117403,Video: Nader running mate Gonzalez on the Sarah Palin /Biden Debate http://tweetopolis.com/politics/#118,twop,0,2008-10-08 12:00:12
951117034,@Nokson Palin MILF,Wikichipi,0,2008-10-08 11:59:53
951116870,"Palin says ""Golly Gee, The old guy sucked!""",airavata,0,2008-10-08 11:59:39
951115952,"If you are not a Palin fan, this will totally make your day. Some language, but funny: http://tinyurl.com/4dkdzl",laurasolomon,0,2008-10-08 11:58:10
951114700,you know what i enjoy even more than the debates? the SNL skits. tina fey = sarah palin to a T. it makes me giggle.,illumined,0,2008-10-08 11:56:06
951113740,"[WELT] US-Vizepräsidentkandidatin : Brigitte Bardot beschimpft Palin als ""Schande"": Die französ.. http://tinyurl.com/4jld93",politikfeed,0,2008-10-08 11:54:33
951112192,Palin es pariente lejana de Lady Di y Roosevelt: La candidata republicana a la Vicepresidencia de.. http://tinyurl.com/3hjhjq,elcomerciodigit,0,2008-10-08 11:52:07
951111697,Bigots love McCain/ Palin . Everyone else...not so much...,airavata,0,2008-10-08 11:51:25
951111537,"Ack, Palin was in town last night and the local news is full of her ... apparently I'm blue in a red state.",Prosemonkey,0,2008-10-08 11:51:11
951110914,"@agape_eternal creepy, and i know what you mean about the ""boy"" thing. Palin seems to think ""not like us"" will do the trick...",dug,0,2008-10-08 11:50:14
951109990,"Brigitte Bardot à Sarah Palin : ""Vous faites honte aux femmes"": L'actrice a adressé une lettre à Sarah Pali.. http://tinyurl.com/4jmhta",LePost,0,2008-10-08 11:49:01
951109987,reviewing the debate - it is confirmed: I'm voting @geoffsurratt for press secretary in a Palin -McCain ticket.,danohlerking,0,2008-10-08 11:49:00
951109078,Lieberman and McCain eloping to Vegas. Palin to run with Buchanan!,airavata,0,2008-10-08 11:47:43
951107697,(Political Spin) Palin Attempts To ‘Turn The Page’ From The Economy Back To ‘Drill Baby Drill’ http://tinyurl.com/3w6t6p,B2BTechnologyPR,0,2008-10-08 11:45:47
951107282,ABC: Palin es pariente lejana de Lady Di y el ex presidente Roosevelt http://tinyurl.com/4mhf56,AlMinuto,0,2008-10-08 11:45:11
951107257,Video: Nader running mate Gonzalez on the Sarah Palin /Biden Debate http://tweetopolis.com/politics/#118,twop,0,2008-10-08 11:45:08
951106540,New blog post: Dowd on Palin : More Cheney Than Cheney http://tinyurl.com/4stktn,markwillismedia,0,2008-10-08 11:43:53
951102867,Sarah Palin 's doodles from pre-mayoral days - I'm sure graphologists will have a field day with this: http://url.ie/rjj,cathbrodigan,0,2008-10-08 11:37:52
951102665,"Palin related to FDR, Princess Diana http://tinyurl.com/3m6bj8",NECN,0,2008-10-08 11:37:32
951100657,lu sur staragora: Madonna ne veut pas voir Sarah Palin à ses concerts: C'est offi.. http://tinyurl.com/444hgo,PamelaKaulitz,0,2008-10-08 11:34:55
951100626,"people : Madonna ne veut pas voir Sarah Palin à ses concerts: C'est officiel, clair, net .. http://tinyurl.com/444hgo",AngelinaSpears,0,2008-10-08 11:34:52
951100560,"staragora : Madonna ne veut pas voir Sarah Palin à ses concerts: C'est officiel, clair.. http://tinyurl.com/444hgo",JeromineSharon,0,2008-10-08 11:34:46
951099815,"Bardot à Palin :""vous faites honte aux femmes et représentez, à vous seule, une terrible menace, une véritable catastrophe écologique""",Paaquito,0,2008-10-08 11:33:48
951099291,The Extremely Dangerous Religion Of Sarah Palin :,mcpierce,0,2008-10-08 11:33:02
951098658,Rambling Palin Opens Up to Press Pack: Sarah Palin surprised reporters yesterday by coming to the back of .. http://tinyurl.com/54jgvq,Newser,0,2008-10-08 11:32:03
951097505,twaboutMCCAIN> Sarah Palin .what was McCain thinking? or was he? I was borderline m.. http://tinyurl.com/3l3eq2,twaboutMCCAIN,0,2008-10-08 11:30:22
951097361,Video: Nader running mate Gonzalez on the Sarah Palin /Biden Debate http://tweetopolis.com/politics/#118,twop,0,2008-10-08 11:30:11
951094527,Mary Mitchell Chicago Sun Times - Palin should apologize to Obama for remarks made by supporters! http://tinyurl.com/5gsz4q,tinarfh,0,2008-10-08 11:25:21
951091516,he he ... facebook group called 'i have more foreign policy experience than sarah palin ',genrobey,0,2008-10-08 11:20:30
951090418,The Morning Line: Obama! Palin ! Who's Got the Best Line?...: As pundits and the press provide instant .. http://tinyurl.com/4ptbs4,comicriffs,0,2008-10-08 11:19:00
951088268,"Digg: Palin 's Governor Expenses, Including Billed Nights At Home http://tinyurl.com/4tl2b2",DerdersHyeNews,0,2008-10-08 11:15:47
951087892,"Some Yank shouted ""Kill him"" in response to Palin criticizing Obama... is there any hope left in that country? Or the world at large...?",jessedyck,0,2008-10-08 11:15:12
951087879,"What an electrifying evening... Sen. Elizabeth Dole, Mayor Pat McRory, Sen. Richard Burr, and GOV. SARAH PALIN ! Wow!!!!! All that, an ...",NazPastorCJ,0,2008-10-08 11:15:11
951087834,Video: Nader running mate Gonzalez on the Sarah Palin /Biden Debate http://tweetopolis.com/politics/#118,twop,0,2008-10-08 11:15:08
951087451,"Joe Biden est un ""nobod"" sur le Net par rapport à Palin ces 18 derniers jours ! http://presidentialwatch08.com/index.php/trends/",mademoisellep,0,2008-10-08 11:14:25
951086959,"@casteleiro Vamos, que le falto decir ""that nigger"" (""ese negrata"")... Madre mía la que se nos viene encima con el dúo McCain- Palin ...",lmmartin,0,2008-10-08 11:13:30
951085611,Best of Sarah Palin music CD! :-) http://bit.ly/QnFGA,enargins,0,2008-10-08 11:11:02
951084962,"Watching: ""YouTube - Palin struggles with geography Keith Olberman Countdown"" ( http://tinyurl.com/4lx6eo )",applemacbookpro,0,2008-10-08 11:10:01
951083551,"@idlefritz I was pretty solid on McCain, until Palin was picked... not sure she is a strong leader... but Biden seems to like to lie...sooo",iggyoutWest,0,2008-10-08 11:07:44
951082588,Sarah Palin Sex Tape http://tinyurl.com/4qcwwr,BPTweeted,0,2008-10-08 11:06:11
951081450,Madonna ne veut pas voir Sarah Palin à ses concerts http://tinyurl.com/444hgo,staragora,0,2008-10-08 11:04:39
951081036,note: Sarah Palin : Palling Around With Secessionists has been added to dailysourcecode @http://tinyurl.com/424txu,OregonCoastDave,0,2008-10-08 11:04:00
951081025,note: Sarah Palin : Palling Around With Secessionists has been added to dailysourcecode @http://tinyurl.com/424txu,haversman,0,2008-10-08 11:03:59
951079670,"[FreeRepublic] Palin 's family ties include FDR, Princess Diana: Barack Obama and.. http://tinyurl.com/43l3t9",conservatweet,0,2008-10-08 11:01:55
951079451,Palin : anti-American? http://bit.ly/4q9wXX,metacosm,0,2008-10-08 11:01:37
951079380,"@warrenellis So then Palin steps in and stands on the white house roof with her rifle telling everyone it was ""gods will""",seanmason,0,2008-10-08 11:01:30
951078398,Video: Nader running mate Gonzalez on the Sarah Palin /Biden Debate http://tweetopolis.com/politics/#118,twop,0,2008-10-08 11:00:09
951072970,"Front Page: Palin 's Governor Expenses, Including Billed Nights At Home: Alaska's top fin.. http://tinyurl.com/4tl2b2",diggfrontpage,0,2008-10-08 10:51:12
951072363,Twello Foodie Tweets wonders can Palin spell potato? http://tinyurl.com/5ywzkp,foodbloggernews,0,2008-10-08 10:50:18
951071605,"Digg: Palin 's Governor Expenses, Including Billed Nights At Home: huffingtonpost.com — (Dig.. http://tinyurl.com/42tc3j",top_dedist,0,2008-10-08 10:49:13
951070907,"Digg: Palin 's Governor Expenses, Including Billed Nights At Home: huffingtonpost.com — (Digg a.. http://tinyurl.com/42tc3j",top_web,0,2008-10-08 10:48:06
951070138,"Palin 's Governor Expenses, Including Billed Nights At Home http://tinyurl.com/4tl2b2",diggupdates,0,2008-10-08 10:46:57
951070118,"Palin 's Governor Expenses, Including Billed Nights At Home http://twurl.nl/2jptih -TheRealMcCain",HuffPostPol,0,2008-10-08 10:46:56
951070115,"Palin 's Governor Expenses, Including Billed Nights At Home http://twurl.nl/2jptih",TheRealMcCain,0,2008-10-08 10:46:56
951069531,"Palin 's Governor Expenses, Including Billed Nights At Home: Alaska's top finance officer will review .. http://tinyurl.com/4tl2b2",DiggStories,0,2008-10-08 10:46:02
951068969,"Palin 's Governor Expenses, Including Billed Nights At Home: Alaska's top finance officer will review p.. http://tinyurl.com/4tl2b2",feedzzz,0,2008-10-08 10:45:20
951068939,"ABC: Sarah Palin , pariente lejana de Lady Di http://tinyurl.com/3ml8vg",AlMinuto,0,2008-10-08 10:45:18
951068862,Video: Nader running mate Gonzalez on the Sarah Palin /Biden Debate http://tweetopolis.com/politics/#118,twop,0,2008-10-08 10:45:11
951068552,Palin est une grosse catin puritaine...,fchazal,0,2008-10-08 10:44:42
951065349,Sarah Palin look alike being sought for adult film - priceless - www.shrinklink.co.uk/4l9gng,Spacefrog29,0,2008-10-08 10:38:38
951064213,"Palin 's Governor Expenses, Including Billed Nights At Home http://tinyurl.com/4tl2b2",mattrowe_test,0,2008-10-08 10:36:49
951064099,"Palin 's Governor Expenses, Including Billed Nights At Home http://tinyurl.com/4tl2b2",mattrowe_test,0,2008-10-08 10:36:41
951063472,"RT @JonathanDeamer : ""Sarah Palin : finally, a beauty queen who doesn't want world peace ;-)"" ... ha ha ha ha ha. ahem.",jdub,0,2008-10-08 10:35:40
951062633,"Sarah Palin : finally, a beauty queen who doesn't want world peace ;-)",JonathanDeamer,0,2008-10-08 10:34:31
951061504,Texans explains how Sarah Palin is a post-turtle. http://tinyurl.com/4aujpd,peallmaivia,0,2008-10-08 10:32:45
951060573,Tuesdays debates were not as exciting as Joe and Palin but I think Obama appeared more like a president to me.,scottrn,0,2008-10-08 10:31:24
951059766,Video: Nader running mate Gonzalez on the Sarah Palin /Biden Debate http://tweetopolis.com/politics/#118,twop,0,2008-10-08 10:30:10
951057978,A debate between Barack Obama and Sarah Palin would actually be far more interesting or possibly a mud wrestling and slinging match.,ZenDoc,0,2008-10-08 10:27:02
951056623,Sarah Palin to Visit Saturday Night Live? - Sarah Palin - Zimbio: http://sbrwse.com/dcN,ja1000,0,2008-10-08 10:24:41
951054856,Lustig: Vice-President-Debate hat in Bittorrent VIEL mehr DLs als President-Debate. Wollen alle nur die Palin kucken. ;/ #politik #funfactor,st0rz,0,2008-10-08 10:21:50
951053979,"NY Times: Palin 's Inflammatory Rhetoric Causes One Supporter to Yell: ""Kill Him."" http://tinyurl.com/3o499k",newsladder,0,2008-10-08 10:20:25
951053894,"NY Times: Palin 's Inflammatory Rhetoric Causes One Supporter to Yell: ""Kill Him."" http://twurl.nl/ec15sy",McCainNewsLadr,0,2008-10-08 10:20:15
951052383,@obie drink on 'maverick' while palin is speaking and you will be out cold.,matthewcarriere,0,2008-10-08 10:18:02
951051814,"@MichaelDWalker - I agree that an Obama- Palin debate would be far more interesting - or a cage match or mud wrestling, etc. McCain is Dead.",ZenDoc,0,2008-10-08 10:17:12
951050305,Video: Nader running mate Gonzalez on the Sarah Palin /Biden Debate http://tweetopolis.com/politics/#118,twop,0,2008-10-08 10:15:05
951048057,I put more time and effort into this blog post than usual.http://tinyurl.com/4s3sgm #Obama #McCain #Palin #Biden Obama McCain Palin Biden,DeaconSchroeder,0,2008-10-08 10:11:04
951046905,"thinks McCain did a respectable job at #debate08 , but he still carries lots of Bush Cheney Palin baggage into #election08",DailyMeEditor,0,2008-10-08 10:08:59
951046478,RT @davewiner : [Who let the dogs out?] US Scrt Svc invstgting threats made at Palin rally. http://bit.ly/HHNuV,ZachTumin,0,2008-10-08 10:08:16
951045717,@JPMicek Glad to know I helped save you 1 hour and 40 minutes of time. :) I would rather see a cage match of Palin vs Obama. :),MichaelDWalker,0,2008-10-08 10:06:57
951045559,"SIASA DUNI EXPLOSIVE: Country First? Sarah and Todd Palin ’s troubled ties to AIP (""Alaska First""), - http://afrigator.com/r/t/6903/476579",Afrigator,0,2008-10-08 10:06:43
951044732,"B. Bardot'tan Palin 'e: İnşallah kaybedersin!: Brigitte Bardot, Palin 'e hitaben kaleme aldığı açık mektup.. http://tinyurl.com/49m7ed",ntv,0,2008-10-08 10:05:31
951042319,"If John McCain wins, it'll be because of Sarah Palin . If John McCain loses, it'll be because of Sarah Palin . Good choice of running mate.",jearle,0,2008-10-08 10:01:45
951041893,"Palin not only pallin' around with crazy religious fundamentalists, she's the head pal of the entire paldom.",mccannt,0,2008-10-08 10:01:07
951041837,New blog post: Sarah Palin y los Videojuegos http://tinyurl.com/3o9sjz,gamell,0,2008-10-08 10:01:01
951041196,Video: Nader running mate Gonzalez on the Sarah Palin /Biden Debate http://tweetopolis.com/politics/#118,twop,0,2008-10-08 10:00:12
951036827,"This morning, the lead editorial in the NYT scolds the McCain / Palin campaign. http://is.gd/3HyU Thank you NYT!",KayBallard,0,2008-10-08 09:52:31
951036722,"CNN: ON THE TRAIL: Wednesday, Oct. 8th, 2008: * Sen. John McCain and Gov. Sarah Palin campaign i.. http://tinyurl.com/3zw3ol -HuffNewswire",HuffPostPol,0,2008-10-08 09:52:21
951036721,"CNN: ON THE TRAIL: Wednesday, Oct. 8th, 2008: * Sen. John McCain and Gov. Sarah Palin campaign i.. http://tinyurl.com/3zw3ol",HuffNewswire,0,2008-10-08 09:52:21
951035895,in case debate No. 2 doesn't kill this discussion.... Palin 's pallin' around with their own anti-Americans. http://tinyurl.com/3rdlhk,RobinJP,0,2008-10-08 09:51:00
951033271,Palin rejoining McCain on the trail - so will she be in MN on friday? *swoon* http://tinyurl.com/palinplease,Chuckumentary,0,2008-10-08 09:47:02
951031958,Video: Nader running mate Gonzalez on the Sarah Palin /Biden Debate http://tweetopolis.com/politics/#118,twop,0,2008-10-08 09:45:09
951029974,Ni un comentarista consultado por la Fox (el medio conservador por excelencia y en el que Palin lo vio) opina que McCain ganó el debate.,llorach,0,2008-10-08 09:41:32
951028987,Cindy mccain and sarah palin to do a porn. Cokie and joe sixpack scissor.,TheDudeAbides,0,2008-10-08 09:39:47
951028948,"THE SAME ROWDY CROWD: Sarah Unplugged: ‘Lo and behold, Governor Palin apparently discovered on.. http://tinyurl.com/44omtz",minnesotaBNN,0,2008-10-08 09:39:42
951028633,"So if McCain goes down (he's old ya know), Palin to run the nation via her Yahoo account? Good luck with that.",Gregz0r,0,2008-10-08 09:39:11
951026532,Your Right Hand Thief: Since Gov. Palin reads The Economist...: I hope she enjoyed this article.A nu.. http://tinyurl.com/4ju99u,louisianaBNN,0,2008-10-08 09:35:53
951026034,McCain's doing Palin 's loud whisper.,JayGogh,0,2008-10-08 09:35:13
951025730,McCain ni mencionó el eje de la campaña de Palin : la amistad de Obama con un terrorista. Algún día se sabrá si se arrugó ya en el debate.,llorach,0,2008-10-08 09:34:51
951025453,Kevin Spacey's stance on the election: we might be in a situation where Sarah Palin is a 72-year-old's heart beat away from being President.,nrgza,0,2008-10-08 09:34:28
951025085,Palin is secessionist. Why would you vote for a traitor?,TheDudeAbides,0,2008-10-08 09:33:58
951024242,"With all this money coming from governments to rescue whatever, I always roll my eyes when Sarah Palin still eludes to lower taxes.",dspiers,0,2008-10-08 09:32:41
951023894,"We don’t play the race card Palin supporters obviously do thou ""That one"" May not be completely racist but It carries Heavy undertone",Bruce4Obama,0,2008-10-08 09:32:10
951023517,Sarah Palin was reading the NYT upside down. It really said. Palin and mccain are Rove flunky lap monkey douche bags.,TheDudeAbides,0,2008-10-08 09:31:39
951022963,"It's colder in edinburgh than livingston. If that's because it's nearer to hell, at least palin wont be vp any time soon.",marksutherland,0,2008-10-08 09:30:59
951022644,twaboutMCCAIN> McCain and Palin are truly a bridge to nowhere but hell... http://tinyurl.com/3nqyqm,twaboutMCCAIN,0,2008-10-08 09:30:30
951022591,twaboutMCCAIN> McCain/ Palin rallies are about to turn in to a sess pool of racist .. http://tinyurl.com/4had6j,twaboutMCCAIN,0,2008-10-08 09:30:25
951022361,Video: Nader running mate Gonzalez on the Sarah Palin /Biden Debate http://tweetopolis.com/politics/#118,twop,0,2008-10-08 09:30:07
951021415,McCain/ Palin rallies are about to turn in to a sess pool of racist remarks and fear mongering.,Bruce4Obama,0,2008-10-08 09:28:32
951021244,people for mccain. he is going to pay the mortgage on your trailer that is worth nothing so you can buy some more Pabts and hang w palin,TheDudeAbides,0,2008-10-08 09:28:14
951021151,Someone should go as a Maverick Mashup of Tom Cruise and Sarah Palin for halloween!,momopeche,0,2008-10-08 09:28:03
