id,text,username,retweets,date
951649965,"I do a Bush on Palin /McCain and change the channel, whenever any of them are on.",Veronica19,0,2008-10-08 19:29:32
951649867,"Palin supports a party (AIP) who's founder said, ""I'm an Alaskan, not an American. I've got no use for America or her damned institutions.""",bigskyman,0,2008-10-08 19:29:29
951649766,"""[ Palin ] is an energy expert exactly the same way the king of Saudi Arabia is an energy expert — by accident of residence."" THOMAS FRIEDMAN",traciAWESOME,0,2008-10-08 19:29:24
951649155,"@yvonnics I hadn't had time to catch ""Face The Nation"" 'til now. I was commenting on a Palin mouthwork event.",toddcamack,0,2008-10-08 19:28:52
951649023,"If I have to listen to McCain and Palin 's voices, and hokey catchphrases for 4-8 years, I will go fucking postal and kill you all. :-)",dessdot,0,2008-10-08 19:28:46
951648918,Sarah Palin rocks,StacyHarp,0,2008-10-08 19:28:41
951648776,"La frase del día: ""Sarah Palin es una vergüenza para las mujeres de todo el mundo"" (ex diosa Brigitte Bardot)",niklasgv,0,2008-10-08 19:28:32
951648530,Sarah Palin 's Top 5 Favorite Movies: http://tinyurl.com/4zjdap,WeeLaura,0,2008-10-08 19:28:20
951648414,"Sounds like Sarah ""Mad Dog"" Palin is now raising McCain.",gbibliophile,0,2008-10-08 19:28:14
951648387,"It astonishes me to still be hearing Palin offer nothing in her speeches,anyone can read from a script written by someone else,No Substance",jason1212,0,2008-10-08 19:28:14
951648052,Palin didn't use her Ayers smear during the rally. Just a bunch of lies. I guess they decided it was wise not to incite hatred.,KnowYourObama,0,2008-10-08 19:27:55
951647730,Gov. Palin Not Giving up on Michigan campaign: http://tinyurl.com/3tpp9a,PoliticalCowboy,0,2008-10-08 19:27:39
951647366,RT @malisams : Palin get's high-tech heckled at CA rally: http://www.dailykos.com/storyonly/2008/10/8/104337/492/582/623858,mcasburn,0,2008-10-08 19:27:18
951647344,http://ping.fm/IIS1C (Indictment in Palin Email Hacking Case),dangrsmind,0,2008-10-08 19:27:16
951647265,You would think McCain/ Palin would see that their material (maverick) is old and stale and not working. Hint: Hateful doesn' work either.,SuSandStorm,0,2008-10-08 19:27:11
951646983,Saw a lady with a Palin hairstyle but all the tweets I could think of were sexist. #drillbabydrill,mhglover,0,2008-10-08 19:26:57
951646759,"The chanting at these republican rallys is fucking creepy. Also, as predicted: McCain is rarely without Palin on the trail.",philnelson,0,2008-10-08 19:26:46
951646637,Palin & McCain just have to stop talking. I can't keep up with the drinking games. ;),JLCBamberger,0,2008-10-08 19:26:39
951646555,"Did Palin say McCain won't say he fought for you? Sorry Sarah, but he has repeatedly reminded us of that! Endlessly! It's all he has!",airavata,0,2008-10-08 19:26:35
951645953,"Palin : ""We believe in a culture of life"". Oh, except those wars where people are dying for no reason. You betcha!",chadcrowell,0,2008-10-08 19:26:03
951645906,"Doesn't matter much to me how Palin wears her hair, I still don't feel she's fully left 1995 behind her.",lucylovegood,0,2008-10-08 19:26:01
951645586,if you didnt know Palin is a female robot ..better yet a pawn in a extremely serious game of Chess..the stakes are way too high..Obama 08,BatmanVaPromotr,0,2008-10-08 19:25:42
951645470,sidekick palin needs a tmobile endorsement like yesterday,ConqueringLion,0,2008-10-08 19:25:37
951645289,didn't Sarah Palin already wear that suit at least twice?,jenntopper,0,2008-10-08 19:25:28
951645177,"Prediction: 2 weeks before the election, Palin will have a new hairstyle. Hillary did, Marcia Clark did it, and many others. Free press.",AaronLea,0,2008-10-08 19:25:22
951645157,I'm glad Palin mentioned McCain being a POW. I had no idea. This changes EVERYTHING! I wonder why they never brought that up?,dessdot,0,2008-10-08 19:25:19
951645027,"3 mavericks, 1 POW, 1 Reagan, 1 culture of life, 1 shining city on a hill...predictable Palin strikes again",airavata,0,2008-10-08 19:25:13
951644911,is thinking his throat is feeling even worse now that he happened to watch some of the McCain/ Palin rally while trying to rest on the couch.,zacharyparadis,0,2008-10-08 19:25:10
951644879,"i think someone just screamed that palin is ""HOT"". wonder if mccain rallies will turn into heckle-fests",hbeeinc,0,2008-10-08 19:25:08
951644659,Palin on CNN speaking sans Updo. http://flickr.com/photos/foodmuse1/2913240712/,GracePiper,0,2008-10-08 19:24:58
951644509,anybody know why palin 's ties to the secessionist alaska independence party aren't being mentioned in the mainstream media?,joe_kennedy,0,2008-10-08 19:24:49
951644479,Palin speaking and shrieking--no inspiration from this wicked witch of the north,j9lonehill,0,2008-10-08 19:24:47
951644474,"Watching McCain- Palin rally in PA. Fella in crowd behind stage is chewing gum with an open mouth. Reinforces old guy ""get off my lawn"" i ...",HuffPostPol,1,2008-10-08 19:24:46
951644473,"Watching McCain- Palin rally in PA. Fella in crowd behind stage is chewing gum with an open mouth. Reinforces old guy ""get off my lawn"" image",WendyNorris,0,2008-10-08 19:24:46
951644345,"watch http://snfd.tv/mex Bush in 2000, Palin in 2008-Bush in the debates of 2000 saying almost the exact same talking points Sarah Palin ...",snackfeedbuzz,0,2008-10-08 19:24:41
951644318,"Episode 29 is live! Covering more economic crisis, CCMRF, Palin , Bush at the UN, your humanity on patriotism, 08 debates, & Ask Science Dude",whatsabudget,0,2008-10-08 19:24:38
951644218,Trying to sell a feature on the pornification of Palin and its surprising implications for feminism. Nobody's biting :(. Any suggestions?,MyOwnVelouria,0,2008-10-08 19:24:34
951644151,"Palin playing the War Monger game. How come she didn't enlist? Why didn't her husband the ""first dud"" inlist?",bln111257,0,2008-10-08 19:24:30
951644102,Palin 's working the crowd honoring the men and women of service... she's got skills I have to admit. We should all do more.,mmoney,0,2008-10-08 19:24:28
951644100,twHILLARY> clinton female voters are turned off by palin . read the wall st journal for pro.. http://tinyurl.com/3fslw2,twHILLARY,0,2008-10-08 19:24:26
951644032,twHILLARY> Palin using hand gestures like flight attendant mixed with the Clinton thumbles.. http://tinyurl.com/5x8r3q,twHILLARY,0,2008-10-08 19:24:23
951643813,is kind of tired of hearing Palin talk...it was cool at first but now its kind of boring and annoying,aye_blinkin,0,2008-10-08 19:24:15
951643765,New From AAB: Indictment In Palin Email Scandal: A federal grand jury has handed down an indi.. http://tinyurl.com/3tzuky,ThatDuaneLester,0,2008-10-08 19:24:14
951643626,Sarah Palin live on CNN. The scariest comedy I've seen since American Werewolf in London.,iconjohn,0,2008-10-08 19:24:06
951643491,"Man, Palin on live right now. Reeling off all the same scripted one-liners. How can that possibly help them?",hyperg,0,2008-10-08 19:24:00
951643450,"Watching Palin 's speech in PA. As a US Sailor, I wish she'd fucking cut the shit and stop using the military for heartstring points. STFU.",dessdot,0,2008-10-08 19:23:56
951643339,"McCain only picked Palin to exploit her as a female. Didn't work with women! Only men. As the saying goes, Men think with their bottom head.",MedTrakker,0,2008-10-08 19:23:49
951643279,"Palin supports a party (AIP) who's founder said, ""I'm an Alaskan, not an American. I've got no use for America or her damned institutions.""",bigskyman,0,2008-10-08 19:23:48
951643263,This could get ugly. Palin should remember her son was accused of joining the army only because he vandalized school bus brakes in Alaska.,SuSandStorm,0,2008-10-08 19:23:44
951643147,"Watching the Palin rally, at first, I didn't even realize that Palin 's sidekick, John McCain, was standing by her and looking uncomfortable.",sckao,0,2008-10-08 19:23:42
951642833,Palin as the bad guy smacks of desperation. She's talking out of both sides of her fake shiny veneered mouth.,jenfraiz,0,2008-10-08 19:23:26
951642720,"CNN covering speech by Palin . She's leading the audience in a ""USA. USA"" chant. :-). BTW she wants us to know McCain was a soldier too.",PaulShoe,0,2008-10-08 19:23:20
951642576,McCain: Trott off into the Sunset. Palin : Put your highheals on and head back to Alaska so you can keep and eye on Russia,bln111257,0,2008-10-08 19:23:11
951642525,May I remind Governor Palin that veterans rank Obama far above McCain for them. Current donations from troops 6:1 FOR OBAMA.,indiegoddess,0,2008-10-08 19:23:07
951642419,Am I wrong for wanting to bang Palin ?!,productthespic,0,2008-10-08 19:23:02
951642412,who's the blond girl behind palin ?...thats not mrs. mccain...,mindlessbabble,0,2008-10-08 19:23:04
951642403,"[Hot Air]: Video: Has-been bores audience, screams about Palin : ""Now get that bitch out o.. http://tinyurl.com/4hkyk7",conservatweet,0,2008-10-08 19:23:04
951642402,"AIP chairwoman Lynette Clark told called Sarah Palin is her kind of gal. ""She's Alaskan to the bone ... she sounds just like Joe Vogler.""",bigskyman,0,2008-10-08 19:23:05
951642137,"A. Sullivan: Barack ""Hussein"" Obama Again: At a McCain- Palin event with both present. An.. http://tinyurl.com/4pc8tn -HuffNewswire",HuffPostPol,0,2008-10-08 19:22:52
951642131,"A. Sullivan: Barack ""Hussein"" Obama Again: At a McCain- Palin event with both present. An.. http://tinyurl.com/4pc8tn",HuffNewswire,0,2008-10-08 19:22:52
951641837,Watching palin speech. There's something unnerving about the USA chanters i can't put my finger on,addicuss,0,2008-10-08 19:22:38
951641705,Watching McCain/ Palin rally on MSNBC.,MarkCzerniec,0,2008-10-08 19:22:32
951641622,Someone has to be holding up cue cards at the McCain/ Palin rally in Pennsylvania because there is no way Palin is that witty on her own.,ispeaktroll,0,2008-10-08 19:22:27
951641548,NYT: Student Indicted in Case Involving Hacking Palin 's E-Mail: Th son of a Tennessee state lawm.. http://tinyurl.com/4pbq4v -HuffNewswire,HuffPostPol,0,2008-10-08 19:22:25
951641546,NYT: Student Indicted in Case Involving Hacking Palin 's E-Mail: Th son of a Tennessee state lawm.. http://tinyurl.com/4pbq4v,HuffNewswire,0,2008-10-08 19:22:25
951641486,Palin dropped from ticket; Fields in! http://www.electmccain2008.us/index.html -mbrownerhamlin,HuffPostPol,0,2008-10-08 19:22:22
951641485,When will FOX talk about Palin paling around with domestic terrorist Joe Vogler?,bigskyman,0,2008-10-08 19:22:22
951641484,Palin dropped from ticket; Fields in! http://www.electmccain2008.us/index.html,mattkbh,0,2008-10-08 19:22:21
951641363,What would be so great for lunch? Sarah Palin 's Moose Stew with a side of wolf and cathead biscuits.,brucefranklin,0,2008-10-08 19:22:17
951641220,CNN: HAPPENING NOW: McCain- Palin stump in Pennsylvania: Watch the event on CNN.com/live. .. http://tinyurl.com/4ahdyo -HuffNewswire,HuffPostPol,0,2008-10-08 19:22:10
951641219,CNN: HAPPENING NOW: McCain- Palin stump in Pennsylvania: Watch the event on CNN.com/live. .. http://tinyurl.com/4ahdyo,HuffNewswire,0,2008-10-08 19:22:10
951641183,Is Sarah Palin a Republican Party Infiltrator? http://tinyurl.com/4b22cq,bigskyman,0,2008-10-08 19:22:08
951641102,Diagramming Sarah Palin 's sentences: http://www.slate.com/id/2201158/,bozoskeleton,0,2008-10-08 19:22:04
951640973,"palin - ""he isn't afraid to use the word victory""...despite the fact patreus doesn't want it used.",hbeeinc,0,2008-10-08 19:21:58
951640960,Are you Pullin for Palin ? http://pullinforpalin.com/,stiiina,0,2008-10-08 19:21:55
951640825,McCain looks very uncomfortable standing beside Palin . The internal cringing is almost audible.,tundrababe,0,2008-10-08 19:21:50
951640807,Olbermann DESTROYS Palin with her own terrorist pals! http://tinyurl.com/3t6bau,bigskyman,0,2008-10-08 19:21:50
951640667,Palin on CNN--shrieking,j9lonehill,0,2008-10-08 19:21:43
951640333,"Turned on CNN just in time to see Sarah Palin say ""maverick"". Wasn't prepared for the drinking game to start again during the workday!",SpamSpam,0,2008-10-08 19:21:27
951640275,McCain on stage w/ Palin at speech in Pa. He looks like he's in pain.,JLCBamberger,0,2008-10-08 19:21:24
951640162,"Palin : ""Obama not willing to drill for energy, but he is sure willing to drill for votes"" Drill baby, Drill!"" LOVE HER!!!!!!!!!!!!!!!!!!",MicheleTivey,0,2008-10-08 19:21:17
951640125,PULLIN FOR PALIN LOL http://www.pullinforpalin.com/,gurj,0,2008-10-08 19:21:14
951640120,americans thought they knew Mcc.. that guy is long gone.. McCain picked Palin ..duhhhhhhh,TerryFlutemaker,0,2008-10-08 19:21:18
951640002,i called it...they gave Palin a makeover -- check her out at today's rally in Bethlehem,amanbattish,0,2008-10-08 19:21:10
951639830,"If Obama attracts more educated voters, who does Palin attract? http://tinyurl.com/3ncm2r",bigskyman,0,2008-10-08 19:21:00
951639654,@FOX29 I would rather not watch Palin push more ignorance on American people...you betcha,USNITROUS,0,2008-10-08 19:20:51
951639597,"McCain/ Palin speeches are just mudslinging, shallow affairs.",dannomatic,0,2008-10-08 19:20:50
951639520,Friedman lambasts Palin http://tinyurl.com/4w8bvf,pluckow,0,2008-10-08 19:20:44
951639502,Palin wants women to carry rapists babies. http://tinyurl.com/43j77h,bigskyman,0,2008-10-08 19:20:46
951639427,This is WKYC.com Web reporter Kim Wendel at the McCain- Palin rally. The Secret Service has just allowed the media inside. Game on!,wkyc,0,2008-10-08 19:20:39
951639267,ABC NEWS - Indictment in Palin Yahoo! E-Mail Hacking Case: Son of Tennessee state legisla.. http://is.gd/3J9R,USABreakingNews,0,2008-10-08 19:20:35
951639238,"Palin ""Maverick"" count. 3 in 4 minutes.",JNathan,0,2008-10-08 19:20:32
951639217,"Palin needs to go back to her country, the one where her husband is on the board to make alaska separate. Talk about domestic terrorism!",MedTrakker,0,2008-10-08 19:20:32
951639209,Palin on Rape Kits. http://tinyurl.com/43j77h,bigskyman,0,2008-10-08 19:20:30
951639132,Palin says maverick again...someone get her a thesaurus!,airavata,0,2008-10-08 19:20:28
951639121,Vote now to say if you think Palin is qualified or not for VP. Also tell your friends: http://tinyurl.com/67kocc,mabelgirl,0,2008-10-08 19:20:28
951639058,clinton female voters are turned off by palin . read the wall st journal for proof. http://online.wsj.com/article/SB122341711146712845.html,ubermensche,0,2008-10-08 19:20:23
951639024,palin is mccain the organ grinder's monkey,smelllaroses,0,2008-10-08 19:20:20
951638914,"""Obama not willing to drill for energy but is willing to drill for votes.""..well said, Palin . Obama will say anything to acquire votes.",luv2cruze,0,2008-10-08 19:20:17
951638905,"I've realized, Palin is just a mean, sarcastic, little bitch! Not cute and clever like she thinks.",flavorite,0,2008-10-08 19:20:18
951638741,Watching Palin speak at the PA rally. It's ... uncomfortable.,sixuntilme,0,2008-10-08 19:20:10
951638732,sarah palin is a snarky bitch,nofireworks,0,2008-10-08 19:20:10
951638594,Palin makes me want to vomit.,Interabang,0,2008-10-08 19:20:03
951638580,"Palin supports a party (AIP) who's founder said, ""I'm an Alaskan, not an American. I've got no use for America or her damned institutions.""",bigskyman,0,2008-10-08 19:20:05
951638486,Palin went to college in HI for a semester? How very random.,wildsheep_,0,2008-10-08 19:20:01
951638475,"WATCH LIVE: McCain- Palin Rally In Bethlehem, Pa.. http://tinyurl.com/4fla7c",FOX29philly,0,2008-10-08 19:20:00
951638463,"Palin has her hair down, a sexier look, at today's rallies. They must really be trying to sex it up desperately after last night's mauling.",xeni,0,2008-10-08 19:20:00
951638315,"This might be old but I just saw it today. NYT's ""Why Some Women Hate Sarah Palin "". http://is.gd/3J9B. The first two reasons are stupid.",digitalfemme,0,2008-10-08 19:19:53
951638114,"listening to the McCain- Palin speeches from Pennsylvania, listening to the opposition is better than listening to the financial news.",hngryO,0,2008-10-08 19:19:43
951638048,is watching the McCain/ Palin rally in PA. Hmmm.,GKeast,0,2008-10-08 19:19:37
951638004,woah. palin 's speaking at a rally. its like some crazy cult convention. scary stuff.,jewdy7,0,2008-10-08 19:19:38
951637907,"The world in nine minutes: Christopher Hitchens, Pat Buchanan and Joe Scarborough discuss Sarah Palin , Afgh.. http://tinyurl.com/4mno8k",bosca,0,2008-10-08 19:19:31
951637903,Palin 's Kind of Patriotism. http://tinyurl.com/3ubhnh,bigskyman,0,2008-10-08 19:19:31
951637901,"Palin whips crowd into ""Drill Baby Drill"" chants again....ho hum",marshallexec,0,2008-10-08 19:19:32
951637829,"@airavata - you are infatuated with Palin ... you secretly LOVE her don't you? Come on out of the closet, that's way to much effort",ScubaChicken,0,2008-10-08 19:19:30
951637712,Ugh same ole not quit lies from Sarah Palin,avalonai2,0,2008-10-08 19:19:24
951637694,I don't get why people clap when Palin says to build new nuke plants. HELLO?? There is no safe storage option! Talk about short-sighted!,summersumz,0,2008-10-08 19:19:23
951637665,sarah palin has no soul,mrnorth,0,2008-10-08 19:19:22
951637576,Sheik Sarah Bin Palin is touting her skills as the next energy czar! While know little about the real forces behind energy issue!,realmatrix,0,2008-10-08 19:19:18
951637532,I think Palin is the last person who should be making DRILL jokes! lmao,airavata,0,2008-10-08 19:19:16
951637507,Palin is a distant cousin to Princess Di and FDR? How cool is THAT? http://www.reuters.com/article/lifestyleMolt/idUSTRE4971HJ20081008,jenshow,0,2008-10-08 19:19:14
951637373,"From Pennsylvania, Gov. Sarah Palin heads to Strongsville, a suburb of Cleveland, Ohio, with Sen. John McCain http://tinyurl.com/Cuyahoga",zgirlie,0,2008-10-08 19:19:08
951637022,@ObamaMOMMA good one! McCain for assistant principle and Palin for kindergarten teacher of the year! love it! :-D,soulfulpup,0,2008-10-08 19:18:54
951637011,no wonder palin doesn't consider taxes patriotic. she cheats on them. http://online.wsj.com/article/SB122334021713509963.html,ubermensche,0,2008-10-08 19:18:54
951637002,@aarontait although it's easy to be negative about palin for obvious reasons...,fonziewonzie,0,2008-10-08 19:18:54
951636916,Palin Spews more lies LIVE,Bruce4Obama,0,2008-10-08 19:18:49
951636720,"@ninjapoodles This year, due to the questionable nature of Palin 's ability; I seriously question McCain's supporters own intelligence.",robdb,0,2008-10-08 19:18:43
951636593,Retweet @Sarah_ Palin : 100 U.S. Ambassadors Endorse Sen. John McCain and Gov. Sarah Palin http://tinyurl.com/Thats100,zgirlie,0,2008-10-08 19:18:35
951636505,Palin and McCain remind me a lot of the Iraqi Information Minister. http://snurl.com/46ot5,Pixelnated,0,2008-10-08 19:18:33
951636208,Palin says NUCULAR again. Sheesh! Can no Republicans pronounce the word correctly?,airavata,0,2008-10-08 19:18:16
951636186,delicious: The Poetry of Sarah Palin . - By Hart Seely - Slate Magazine http://tinyurl.com/3hmahk,top_web,0,2008-10-08 19:18:17
951636100,d: The Poetry of Sarah Palin . - By Hart Seely - Slate Magazine http://tinyurl.com/3hmahk,top_dedist,0,2008-10-08 19:18:15
951636005,“Tasergate?” Palin borrows silly phrases from right wing blogs http://tinyurl.com/4l2xse,MnIndy,0,2008-10-08 19:18:11
951635993,Palin is saying that PA vote is so close. Just like troopergate she is filled with lies and delusions.,bln111257,0,2008-10-08 19:18:09
951635806,watching McCain Palin rally in PA right now. GOvernor Palin is getting sooooo good! She brings such energy and pizzaz to the place.,MicheleTivey,0,2008-10-08 19:18:02
951635660,"Watching Palin on tv right now, I'm struck by the lack of diversity in the crowd behind her. Emblematic of the Republican party?",sckao,0,2008-10-08 19:17:53
951635632,"once again, palin says ""energy independence"" and the crowd responds with ""drill baby drill"" - morons",hbeeinc,0,2008-10-08 19:17:55
951635565,"Gov. Palin says ""Man"" a lot in her speeches http://is.gd/3J9e",nerdette,0,2008-10-08 19:17:50
951635386,@CityMama Palin makes me want to vomit. Someone get that woman some new material. Referably something with a little truth in it,LizPW,0,2008-10-08 19:17:43
951635368,Is it just me or does Palin steal the show at rallies? Are we sure we know who the republican nominee is?,jspin,0,2008-10-08 19:17:44
951635234,"Palin is speaking now, Voice extremely shaky, Nervous about saying all those lies spewing out of her mouth",MedTrakker,0,2008-10-08 19:17:38
951635139,Tennessee Student Indicted for Hacking Palin E-Mail: http://tinyurl.com/4qsgp2,bestTechNews,0,2008-10-08 19:17:33
951635004,Is it just me or does Sarah Palin sound like a cheerleader on speed? She is So. Freaking. Annoying. Chalk on a blackboard. Ugh!!!,jonimueller,0,2008-10-08 19:17:25
951634981,palin was just talking about bringing back civility and shes screaming Obama is a black communist terrorist muslim,conservativeguy,0,2008-10-08 19:17:25
951634735,"Palin still reading a script, since she still doesn't know what she's talking about.",airavata,0,2008-10-08 19:17:15
951634692,Palin is trying every thing she can. If the McCain voters are uneducated and have not TVs they might believe her lies. She is a racist.,bln111257,0,2008-10-08 19:17:13
951634501,"Palin : McCain's the only candidate offering an ""optimistic"" solution. What kind of glasses is she wearing?",KnowYourObama,0,2008-10-08 19:17:04
951634424,"Palin : ""Our opponent keeps talking about the past"". I seem to remember McCain saying ""Look at my record"" like 3000 times last night.",chadcrowell,0,2008-10-08 19:16:59
951634328,usa: Op-Ed Columnist - Palin 's Kind of Patriotism - NYTimes.com http://tinyurl.com/4b6f6r,top_regional,0,2008-10-08 19:16:56
951634264,"Just received the latest Newsweek, which features a close-up of Sarah Palin . She has a nice little catfish mustache going on.",calanan,0,2008-10-08 19:16:55
951634205,HAPPENING NOW: McCain- Palin stump in Pennsylvania http://twurl.nl/4ssmoz,TheRealMcCain,0,2008-10-08 19:16:52
951634022,Palin using hand gestures like flight attendant mixed with the Clinton thumbless fist.,airavata,0,2008-10-08 19:16:43
951633949,"@TKPope with cell phones everywhere, he will get caught uttering something soon, same with Palin .",ophelia,0,2008-10-08 19:16:40
951633897,http://tinyurl.com/4klk6u Palin should be indicted for using a Yahoo acct to have govt convos. Don't think hacking is the right word here.,jromi,0,2008-10-08 19:16:39
951633892,Fresh Loaf: Time and Place: Palin close-up: This weeks Time and Place photograph was take.. http://tinyurl.com/4yz9ar,cl_atlanta,0,2008-10-08 19:16:35
951633846,Palin doesn't believe in evolution,conservativeguy,0,2008-10-08 19:16:36
951633779,"RSS - Political picture for your blog - John McCain - Ya see, Governor Palin , she's ... she , .. http://tinyurl.com/3nyvte",PunditKitchen,0,2008-10-08 19:16:33
951633132,palin is spinning massive lies about mccain winning the debate and trying to claim obama's a coward for not doing other town hall debates,hbeeinc,0,2008-10-08 19:16:01
951632960,There must be some really bad water on the Straight Talk Express. McCain and Palin seem to be showing signs of brain damage.,SuSandStorm,0,2008-10-08 19:15:57
951632483,"Biden Calls ""Veiled"" McCain Attacks ""Outrageous"", Mocks Palin http://www.pressbs.com/news?p=18366",pressblogs,0,2008-10-08 19:15:34
951632450,"Sarah Palin : The Roofer for the Glass Ceiling. She's just about nailed the final shingle for the rest of us. Thanks a lot, Moose Lady.",Glennia,0,2008-10-08 19:15:35
951632445,@jeffliwag --thanks for the Palin updates. I expect the Rep's to slam Obama with something unexpected anyday...O. better watch his back,auramouth,0,2008-10-08 19:15:33
951632314,Palin says McCain won. All the voter polls say Obama won.,KnowYourObama,0,2008-10-08 19:15:30
951632128,"Palin saco un DVD de Judo siendo el maestro... se opina que Calderon haga uno llamando ""como transear a México en 10 sencillos pasos""",Zeraal,0,2008-10-08 19:15:21
951631923,Video: Nader running mate Gonzalez on the Sarah Palin /Biden Debate http://tweetopolis.com/politics/#118,twop,0,2008-10-08 19:15:15
951631857,"McCain asks Palin to step down, replaced by Debbi Fields! http://electmccain2008.us/",j_ro,0,2008-10-08 19:15:14
951631816,Palin talking now. She's such a dope.,Linda_Kay,0,2008-10-08 19:15:13
951631378,palin is living on the moon?,conservativeguy,0,2008-10-08 19:14:52
951631055,100 U.S. Ambassadors Endorse McCain- Palin http://tinyurl.com/4joedr #current #debate08 #nashdebate,ConservativeRep,0,2008-10-08 19:14:35
951630899,It's soooooo painful warching Palin speak these days. Her voice alone makes me cringe!,BrandManBart,0,2008-10-08 19:14:27
951630789,Headed back to CLE after lunch...just got a little nervous at an obvious reaction I just got to my pretty pink McCain/ Palin bumper sticker,raciestene,0,2008-10-08 19:14:21
951630772,I'd take my kid to a better school if a teacher told him that dinosaurs lived 4000 years ago. Palin is not qualified. Period.,hedeal,0,2008-10-08 19:14:19
951630505,palin is going to be pallin around w/snl? MAD TV viewers unite,smelllaroses,0,2008-10-08 19:14:05
951630346,"@nicopitney they might want to address ""that one"" you betcha...smh Booo McCain/ Palin =Unstable/Unable",USNITROUS,0,2008-10-08 19:13:56
951630343,Sarah Palin is live on MSNBC - and she let her hair down for once! How Maverick-alicious.,tundrababe,0,2008-10-08 19:13:58
951630311,ok. seriously. palin needs to remove the word *maverick* from her vocabulary.,blondegeek16,0,2008-10-08 19:13:54
951630224,"In first 2 minutes Palin says Maverick twice! Limited vocabulary, Sarah??",airavata,0,2008-10-08 19:13:52
