id,text,username,retweets,date
952028805,RT @macnewsweekly Rumor: The real Sarah Palin will show up on the SNL Weekend Update Special tomorrow night.,daynah,0,2008-10-09 00:59:54
952028762,Found out Palin is dropping the puck at Sat's Flyers game. Hope the home crowd gives her the typical Philly away team reception.,rmiriam,0,2008-10-09 00:59:51
952028717,"@dote LMAO!! You're too funny! But, dude, YOU'RE the Presidential candidate...I'm just supposed to be your less attractive ""Sarah Palin ""!",WatariGoro,0,2008-10-09 00:59:47
952028136,Should I be scared that @Sarah_ Palin is following me?,kyleroth,0,2008-10-09 00:59:16
952028082,"Sarah Palin means ANOTHER oil person in the administration. (Her husbad works ""every other week"" for BP) Will it ever end?",Faramir_meow,0,2008-10-09 00:59:12
952028021,"Palin e-mail hacker indicted, pleads not guilty. Is justice being served? - http://tinyurl.com/4na6xq",ZDNet,0,2008-10-09 00:59:05
952027527,Considering planning a Sarah Palin costume photo scavenger hunt for Halloween Night. I saw 12 Borats in '06!,lindsayism,0,2008-10-09 00:58:34
952027338,"Palin 's going to drop the puck at the Flyers game. Stay awaaaaaaay, hockey mom!",matticus,0,2008-10-09 00:58:22
952027107,How did Sarah Palin come to have a net worth of $1.2 million...hmmmm;her husband does work for BP... http://tinyurl.com/4fume4,Faramir_meow,0,2008-10-09 00:58:08
952026556,"How funny, Palin in her F#@K me boots says we need to know the real Obama, yet we've known her less and she doesn't do many interviews.",carterartist,0,2008-10-09 00:57:33
952026353,"Ha! to @awoods link to Palin -bash vid ( Palin in 4 min). A little overdone, but still a har. http://www.funnyordie.com/videos/6bda020b0f",amymstewart,0,2008-10-09 00:57:18
952026349,Best of Palin http://tinyurl.com/3tzuav,politicophil,0,2008-10-09 00:57:19
952026203,best response to palin 's statements: http://tinyurl.com/4z9xbr,NicolePerez,0,2008-10-09 00:57:11
952026079,Do we want our daughters to be as stupid as Palin ?,tarheelguy124,0,2008-10-09 00:57:02
952025499,"my fellow prisoners-- sara palin is hot, but not ready for prime time--vp",jmcfarm,0,2008-10-09 00:56:22
952025196,"I wonder how many girls will be dressed as palin acting stupid this halloween, scary",tarheelguy124,0,2008-10-09 00:56:02
952024926,Palin plans (if they win) to have McCain decleard mentally unstable and take over. She hates him,bln111257,0,2008-10-09 00:55:45
952024354,Tennessee man indicted for hacking Palin e-mail: A Tennessee man has been indicted for hacking into .. http://tinyurl.com/4cpams,channelone,0,2008-10-09 00:55:08
952024193,"Raw Story Olbermann: McCain, Palin have suspect ties: Olbermann: McCain, Palin have suspect ties http://tinyurl.com/3svuw9",RawStory,0,2008-10-09 00:54:55
952023811,@jerseymomma I think we need to take baby steps with Palin . Like getting her to pronounce her g's or fixing that wink thing she has going on,debng,0,2008-10-09 00:54:35
952023790,Sarah Palin Halloween Costume! http://tinyurl.com/3ecgf9,techie_girl,0,2008-10-09 00:54:33
952023643,Palin would be that one annoying ass-kissing yes-man at work should McCain win the election.,rustedmatrix,0,2008-10-09 00:54:24
952023114,"yeah, Palin with a giant assault rifle...THAT totallty makes me want to vote for her.",lesliebot,0,2008-10-09 00:53:51
952023018,The thought of power has gone to Palin 's head. Scary.,brande87,0,2008-10-09 00:53:47
952023002,twHILLARY> McCain/ Palin forgot that Obama/Ayers came out when Obama was competing with H. .. http://tinyurl.com/4pnyqm,twHILLARY,0,2008-10-09 00:53:45
952022989,"twHILLARY> Sarah Palin = Star Wars, Hillary Clinton = Star Trek: This is hilarious. Taken .. http://tinyurl.com/5yhrjw",twHILLARY,0,2008-10-09 00:53:45
952022421,20yo turns himself in over Palin email hack: A Tennessee man has been indicted for hacking into US Republ.. http://tinyurl.com/42hand,abcnews,0,2008-10-09 00:53:08
952021378,@JustKurt With exception of the LA woman. mendell? forgot name anyway she sounds pretty supportive of Palin /Bush ticket. smiles,Alrady40,0,2008-10-09 00:51:58
952021165,is glad his vision of America isn't the same as Sarah Palin 's. http://tinyurl.com/4a9g3r,inuyaki,0,2008-10-09 00:51:45
952019914,I WOULD MAKE PALIN SELL IT FOR ME...,TALKALOT,0,2008-10-09 00:50:28
952019843,"@Alrady40 ...but instead of feminist NOW types raising up #Palin as a model, they denegrate her and encourage #Spitter #McCaskill",JustKurt,0,2008-10-09 00:50:26
952019365,You're not going to believe this but Sarah Palin is following me on Twitter now. I'm sure it's the real Sarah Palin . Don't you think? :),TreyMorgan,0,2008-10-09 00:50:00
952019318,@elysee1013 Palin 's still governor there though... couldn't we do canada or something?,manosdvd,0,2008-10-09 00:49:58
952018970,"Hey Sarah Palin , if you become VP, its Canada for me http://tinyurl.com/4dkdzl",nthelitz,0,2008-10-09 00:49:38
952018915,PALIN IS A HOE,TALKALOT,0,2008-10-09 00:49:34
952018115,"Fox blathering about non-retouched Newsweek photo of Palin . I thought McPalin all about straight talk, honesty. Now they want retouching?",2terriervineyrd,0,2008-10-09 00:48:44
952017979,@DanKennedy_NYC What about if you're a teenager using drugs with your mother who is Sarah Palin and you like it? WHAT THEN?,johnmoe,0,2008-10-09 00:48:40
952017905,Conservative columnist david brooks said Palin is a 'fatal cancer on the republican party',jimfinn,0,2008-10-09 00:48:33
952017890,"everyone's seen Tina Fey's freakin hilaaaaarious spoof on Sarah Palin , right right!?",HannnahRae,0,2008-10-09 00:48:34
952017654,"@joegerstandt PALIN , FTW!",lizwebpage,0,2008-10-09 00:48:20
952016966,"Capitol Steps: Cheney & Palin : Mine Every Mountain, God Bless My SUV, W: ""Uncertain times call for uncertain leadership.""",Benabik,0,2008-10-09 00:47:36
952016777,Palin email hacker in court: The man accused of hacking into the email account of US vice-presidentia.. http://tinyurl.com/43rqkl,NZStuffTech,0,2008-10-09 00:47:29
952016749,It is the Palin / Pensacola curse.,KimberlyBrill,0,2008-10-09 00:47:24
952016718,Palin set to drop puck at Flyers' season opener http://twurl.nl/bn251j,TheRealMcCain,0,2008-10-09 00:47:26
952015902,"Flap's Del.icio.us: David Brooks: Sarah Palin ""Represents A Fatal Cancer To The Republica.. http://tinyurl.com/4yeh6r",Flap,0,2008-10-09 00:46:39
952015871,Flap's Del.icio.us: Black Congressmen Declare Racism In Palin ’s Rhetoric | The New York O.. http://tinyurl.com/4qxnrl,Flap,0,2008-10-09 00:46:38
952014867,There's palin bashing going on around here.,mac_feisty,0,2008-10-09 00:45:40
952014710,Everyone else calls it Troopergate; Palin calls it Tasergate. http://is.gd/3IQf,Fritinancy,0,2008-10-09 00:45:33
952014622,"That was really bad grammar.. ""but organic pancakes with organic syrup are just so good."" Gosh, maybe I have watched to make Palin .",retrohousewife5,0,2008-10-09 00:45:28
952014439,"Sarah Palin = Star Wars, Hillary Clinton = Star Trek: This is hilarious. Taken from (http://io9.com/50591.. http://tinyurl.com/3jxu3e",GayCork,0,2008-10-09 00:45:18
952014292,Video: Nader running mate Gonzalez on the Sarah Palin /Biden Debate http://tweetopolis.com/politics/#118,twop,0,2008-10-09 00:45:11
952014050,The lady at chic-fil-a was a complete jerk and wore a McCain Palin button. Should have gone to wok-n-roll.,chrismerritt,0,2008-10-09 00:44:57
952013902,"Brooks on Palin ""a fatal cancer to the Republican party"" http://tinyurl.com/4yeh6r",donsbot,0,2008-10-09 00:44:44
952013901,"watch http://snfd.tv/mgL Palin : McCain has a plan for the economy -Oct. 8: Speaking at a Pennsylvania rally, Sarah Palin stresses John Mc...",snackfeedbuzz,0,2008-10-09 00:44:47
952013774,Why is Palin in Kuwait shooting guns? There are no moose in the Middle East.,mwissa,0,2008-10-09 00:44:38
952013609,"McCain=unstable and Palin =unable http://tinyurl.com/3z27x7 McCain: ""My fellow prisoners""",jensimmons,0,2008-10-09 00:44:27
952013396,"Brigitte Bardot: Sarah Palin Is ""A Disgrace For Women"" http://tinyurl.com/4qdvcf",ZETAZEN,0,2008-10-09 00:44:11
952012942,Manhattan mini storage subway ad: what's more limited? Your closet or her experience? (w/ a picture of Palin ),orian,0,2008-10-09 00:43:43
952012393,Don't know why I expect more from The Age these days but their one-eyed McCain/ Palin coverage is getting embarrassing.,snazdoll,0,2008-10-09 00:42:58
952011756,Well there's a problem - I just found myself feeling sorry for Sarah Palin . It may be time to call the men in the white coats.,randomfreak,0,2008-10-09 00:42:19
952011744,@jerseymomma why does BO call himself 'the one'? curious what is your reason for dislilkling Palin so much?,littlebytesnews,0,2008-10-09 00:42:18
952011618,ELECTIONS: 'Hockey Mom' Palin to Drop Flyers' First Puck http://tinyurl.com/4k435y,FoxNews,0,2008-10-09 00:42:10
952011593,you know what I'd love to see - a debate between Michelle Obama and Sarah Palin,knp7,0,2008-10-09 00:42:09
952011311,BlueNC | Sarah Palin Member of Political Party that Hates America - Alaska Independence Party [Vid.. http://tinyurl.com/4roowm,bluenc,0,2008-10-09 00:41:50
952011093,Palin speaking in code - why republicans dig her. http://tinyurl.com/47s86g,KnowYourObama,0,2008-10-09 00:41:36
952010956,Rumor: The real Sarah Palin will show up on the SNL Weekend Update Special tomorrow night.,macnewsweekly,0,2008-10-09 00:41:26
952010451,really wants people to know that Palin 's hate inducing speeches are NOT protected free-speech. Wake up neo-cons! She will be your downfall.,JaBriTo,0,2008-10-09 00:40:55
952010079,Didn't Sarah Palin say Obama was unpatriotic for telling this truth? http://www.msnbc.msn.com/id/27082077/,CatSkoor,0,2008-10-09 00:40:32
952009971,Hey Sarah Palin http://tinyurl.com/4dkdzl quality stuff,asolmssen,0,2008-10-09 00:40:26
952009931,@idblog I too got only a 90% on Palin vs Fey (http://tinyurl.com/3ld2o6 ) - they do look an awful lot alike!,bphuettner,0,2008-10-09 00:40:23
952009809,'Hockey Mom' Palin to Drop Flyers' First Puck: Sarah Palin plans to drop the ceremonial first... http://tinyurl.com/4k435y,foxnewspolitics,0,2008-10-09 00:40:15
952009262,New MTV ST08 vid: Sarah Palin 's Double Standard: http://think.mtv.com/044FDFFFF00989DFD001700993DE9/,AlexParker,0,2008-10-09 00:39:39
952008645,Elephants in the Blue Grass: The Immaterial Girl Pouts Against Palin : Elizabeth Snead of the LA Times.. http://tinyurl.com/4jcfns,kentuckyBNN,0,2008-10-09 00:39:05
952008403,"Michele thinks the new McCain- Palin campaign song is ""Desperado."" I'm not sure McCain even knows who the Eagles are-they aren't BIG BAND.",helenbedd2,0,2008-10-09 00:38:49
952008275,"Badlands Blue: David Brooks: Sarah Palin ""represents a fatal cancer to the Republican party"": [Sa.. http://tinyurl.com/4rx4zg",south_dakotaBNN,0,2008-10-09 00:38:41
952008231,@Sarah_ Palin will be sure to watch!,ginty,0,2008-10-09 00:38:39
952008092,May put my dismay over the Palin puck drop in greater context.,quick13,0,2008-10-09 00:38:31
952007571,"Sweet Stanford dorm theme: ""Serra Palin "" http://tinyurl.com/44mhqw",andrewparker,0,2008-10-09 00:37:53
952007388,Video: Chuck Todd: The Palin strategy may be pivoting http://tinyurl.com/48lmqk,NBCNightlyNews,0,2008-10-09 00:37:46
952006915,Fey vs/ Palin photo quiz http://tinyurl.com/4w4slc,pbarrett,0,2008-10-09 00:37:20
952006515,@robport HA! Newsweek put a picture of Palin on their mag where she looks like herself... How terrible can you get?! Stupid media.,Qwennigan,0,2008-10-09 00:36:56
952005745,"Connecticut Bob: $300 for 3,000 Palin emails: Seems like a pretty good deal to me! Maybe we ca.. http://tinyurl.com/4rrg8j",connecticutBNN,0,2008-10-09 00:36:11
952004822,if Philly boos Sarah Palin on Saturday night at the Flyers game ... I will never say anything bad about the city again,jeffshaw,0,2008-10-09 00:35:16
952004722,Tennessee Man Indicted for Alleged Hack of Governor Sarah Palin,tmfh,0,2008-10-09 00:35:07
952004263,@KatrinHier Sarah Palin ?,LORMO3000,0,2008-10-09 00:34:43
952003697,"New post at WMJP ""She's Still Far More Coherent Than Palin "" http://tinyurl.com/4d6mk4",jetpacks,0,2008-10-09 00:34:07
952003224,"McCain's age: 72. Times he said ""My friends"": 22. Times he mentioned Lieberman: 4. Times he mentioned Palin : ZERO (0)",sckao,0,2008-10-09 00:33:40
952002793,I have a passionate disdain for the idiot tactics of sarah palin & cindy mccain. they are classless & arrogant and they think we're stupid.,huny,0,2008-10-09 00:33:14
952002475,NOW endorses and gives introduction to Palin .....It's about time...,TEEITHIGH,0,2008-10-09 00:32:56
952002145,Why women hate Sarah Palin ? http://tinyurl.com/4wr2gk,cassyfiano,0,2008-10-09 00:32:32
952001805,oh man...According to Ancestry.com Palin is 10th cousin to Princess Diana...,mmoney,0,2008-10-09 00:32:14
952001449,Irish political cartoon of Sarah Palin http://www.cagle.com/working/081006/turner.jpg,buffalosean,0,2008-10-09 00:31:47
952001268,"New blog post: ""Hey Sarah Palin "" Song http://twostorks.com/blog/?p=362",threestorks,0,2008-10-09 00:31:40
952001241,Did Newsweek Try To Make Palin Look Bad On Their Cover? http://tinyurl.com/3lnqsw,robport,0,2008-10-09 00:31:37
952001105,[SayAnything] Did Newsweek Try To Make Palin Look Bad On Their Cover? http://tinyurl.com/3lnqsw,conservatweet,0,2008-10-09 00:31:24
952000502,Tennessee Man Indicted for Alleged Hack of Governor Sarah Palin 's E-Mail Account (US Department of Justice) http://tinyurl.com/52gh7m,TechmemeFH,0,2008-10-09 00:30:53
952000336,"New Channel Surfing: Sarah Palin , plugged http://tinyurl.com/3wfgt6",newspoet41,0,2008-10-09 00:30:40
951999753,Video: Nader running mate Gonzalez on the Sarah Palin /Biden Debate http://tweetopolis.com/politics/#118,twop,0,2008-10-09 00:30:07
951998954,made me lol RT @nominivan loves that a couple named their kid Palin - http://www.2news.tv/news/lo... No wonder people hate Americans.,KristenKouk,0,2008-10-09 00:29:19
951998776,"@aaronmmarks @walt_gilbert Wasn't it Palin that said women would go to hell? ur not a female? hmm..seriously though, sorry u had to get that",onlinewoman,0,2008-10-09 00:29:06
951998583,"Wondering if the ""got moose?"" bumper sticker I just saw is a Sarah Palin sticker.",sarahbellum,0,2008-10-09 00:28:56
951998418,best of sarah palin http://tinyurl.com/3tzuav,politicophil,0,2008-10-09 00:28:44
951998275,@jerseymomma great point. Whats the Obama Hockey Momma population like?? We hear so much about the palin supporters...,CBSPhilly,0,2008-10-09 00:28:34
951998129,"A woman wearing at least 4 McCain/ Palin pins got her bag caught in the doors of my subway train and had a minor, stupid freakout. LOLz",AgentM,0,2008-10-09 00:28:24
951998124,"A woman wearing at least 4 McCain/ Palin pins got her bag caught in the doors of my subway train and had a minor, stupid freakout. LOLz",AgentM,0,2008-10-09 00:28:19
951997566,"@phillyd If two stupid people collided and merged, would that mean we'd have another Palin ?",SirAmicVarze,0,2008-10-09 00:27:48
951997515,watch this video that humorously summarizes Sarah Palin http://www.funnyordie.com/videos/6bda020b0f #palin #video,awoods,0,2008-10-09 00:27:44
951997421,Interesting speech about RNC and Palin @http://tinyurl.com/6nago2,joeboutte,0,2008-10-09 00:27:37
951997405,"From Feministing: Planned Parenthood received over $800, 000 in donations in Sarah Palin ’s honour. Donations came in from all 50 states",shannatrenholm,0,2008-10-09 00:27:36
951997096,Not sure how I feel about the kid from UT getting time for hacking #Palin 's yahoo account. She's the one using yahoo for state business.,rdweatherly,0,2008-10-09 00:27:17
951997074,check out the best of sarah palin http://tinyurl.com/3tzuav,politicophil,0,2008-10-09 00:27:15
951996986,@davidlebovitz eBay. Ask Sarah Palin for tips!,jessicafm,0,2008-10-09 00:27:06
951996833,@SamanthaWilson you've been to alaska? what was it like? is sarah palin the typical alaskan?,pasher,0,2008-10-09 00:26:59
951996424,gleefully watching all the SNL clips of Tina Fey as Sarah Palin on nbc.com. Girl has a steady Saturday engagement till the election.,BryanYWang,0,2008-10-09 00:26:28
951996405,Check out this. The Best of Palin http://tinyurl.com/3tzuav,politicophil,0,2008-10-09 00:26:27
951996251,"at Starbucks working, and trying to see if Sarah Palin has recently lifted any quotes to distort (okay, not really trying all that hard).",larisa_a,0,2008-10-09 00:26:19
951995833,Create your own Sarah Palin speech with real sound bytes: http://pa.lindro.me/,Skyliting,0,2008-10-09 00:25:51
951995466,palin is dropping the pick at the flyers home opener Saturday that im going to yea,firedancer41,0,2008-10-09 00:25:24
951995448,@kristinaeichorn 9 out of 10 on the Palin / Fey quiz. How did you do?,cjgraphix,0,2008-10-09 00:25:27
951994609,Best Of Palin http://tinyurl.com/3tzuav,politicophil,0,2008-10-09 00:24:36
951994476,"@mutantreptile :D Las voy a imprimir! Ya tengo dos juegos! Palin Bingo, y ahora esto! :D Yay!",dianadhevi,0,2008-10-09 00:24:26
951993555,best of Palin http://tinyurl.com/3tzuav,politicophil,0,2008-10-09 00:23:29
951993444,"Palin to drop puck at Flyers' opener (AP): Sarah Palin 's next faceoff will come at center ice at an NHL arena, not at a debate. T..",sportfan,0,2008-10-09 00:23:22
951993329,Palin and Biden: a study in contrasts: http://tinyurl.com/3f8odq,cinerina,0,2008-10-09 00:23:14
951993203,"Choosing Palin was a monumental blunder by McCain, highlighting his impulsive nature at its worst.",esacto,0,2008-10-09 00:23:08
951992944,"Hopefully Palin is brought down with Troopergate - the ""first dud"" also. They are Trailer Park Trash",bln111257,0,2008-10-09 00:22:51
951992645,Valley Wag Sarah Palin + Facebook + boredom = creativity [Satire] : Someone has created .. http://tinyurl.com/48t8um,knightowlcasts,0,2008-10-09 00:22:32
951992568,[GoogleNews] UPDATE 1-Tennessee man indicted for hacking Palin e-mail - Reuters http://tinyurl.com/4fcz2z,techupdates,0,2008-10-09 00:22:27
951992451,"Michigan, welcome to Maryland. And hi to Idaho too!: Governor Sarah Palin wasn't all that pleased abo.. http://tinyurl.com/539b54",rc_wicomico,0,2008-10-09 00:22:22
951992156,Democrat's son charged over Palin hack: THE son of a prominent Democratic state politician has been .. http://is.gd/3K1U,starsnsnipes,0,2008-10-09 00:22:02
951992061,"NYT: Drop That Puck: Sarah Palin , the Republican vice-presidential nominee and hockey mom, will .. http://tinyurl.com/4ygbs9 -HuffNewswire",HuffPostPol,0,2008-10-09 00:21:54
951992059,"NYT: Drop That Puck: Sarah Palin , the Republican vice-presidential nominee and hockey mom, will .. http://tinyurl.com/4ygbs9",HuffNewswire,0,2008-10-09 00:21:54
951992041,Little known fact: the character of small town mayor turned horrible demon Richard Wilkins on Buffy was based on Sarah Palin .,jeffkirvin,0,2008-10-09 00:21:56
951991898,"David Brooks: Sarah Palin ""Represents A Fatal Cancer To The Republican Party"": David Brooks spoke frankl.. http://twurl.nl/ihocn4",mg_palin,0,2008-10-09 00:21:48
951991880,Son of Tenn. Democrat indicted in Palin hacking: AP - The son of a Democratic Tennessee state lawmaker p.. http://twurl.nl/uvxxwz,mg_palin,0,2008-10-09 00:21:45
951991813,"scored 90% on Palin vs Fey, but should have been 100: http://tinyurl.com/3ld2o6",BethMazur,0,2008-10-09 00:21:42
951991801,"David Brooks: Sarah Palin ""Represents A Fatal Cancer To The Republican Party"": David Brooks spoke frank.. http://twurl.nl/7uv232",mg_mccain,0,2008-10-09 00:21:42
951991750,"David Brooks: Sarah Palin ""Represents A Fatal Cancer To The Republican Party"": David Brooks spoke frankl.. http://twurl.nl/43x7s2",mg_obama,0,2008-10-09 00:21:35
951991699,"David Brooks: Sarah Palin ""Represents A Fatal Cancer To The Republican Party"": David Brooks spoke frankl.. http://tinyurl.com/4d987s",mg_biden,0,2008-10-09 00:21:35
951991643,"David Brooks: Sarah Palin ""Represents A Fatal Cancer To The Republican Party"": David Brooks spoke frankly.. http://tinyurl.com/4d987s",mashget,0,2008-10-09 00:21:30
951991588,Son of Tenn. Democrat indicted in Palin hacking: AP - The son of a Democratic Tennessee state lawmaker pl.. http://tinyurl.com/42x7h7,mashget,0,2008-10-09 00:21:28
951991137,Is SNL fueling Palin mania in the media? http://tinyurl.com/4zcxq9,trashwire,0,2008-10-09 00:20:58
951990870,TRASHWIRE.COM » Is SNL fueling Palin mania in the media? http://tinyurl.com/4hd3lb,trashwire,0,2008-10-09 00:20:45
951990759,"David Brooks: Sarah Palin ""Represents A Fatal Cancer To The Republican Party"" [huffpo] http://is.gd/3K1I",bklyndad,0,2008-10-09 00:20:39
951990707,McCain/ Palin Circling the Drain: http://tinyurl.com/4wsoyc,Jennyjinx,0,2008-10-09 00:20:37
951990320,"Billboard across from Palin HQ, people could text it questions: http://www.ustream.tv/recorded/762520",Skyliting,0,2008-10-09 00:20:15
951990141,tennessee democrat's son indicted for hacking palin 's email. http://tinyurl.com/4sfo8m,JessicaGottlieb,0,2008-10-09 00:20:07
951989855,( VCsAndAngels.com ) Sarah Palin + Facebook + boredom = creativity [Satire] http://tinyurl.com/48t8um,vcsangels,0,2008-10-09 00:19:51
951989626,Are there any other Philadelphia Hockey Mommas for Obama on here? Anyone going to the game on Sat. to see Palin drop our puck ;( ?,jerseymomma,0,2008-10-09 00:19:36
951989520,Democrat's son charged over Palin hack http://tinyurl.com/49peqn,dailytelegraph,0,2008-10-09 00:19:31
951989360,Democrat's son charged over Palin hack http://tinyurl.com/487cpd,theTiser,0,2008-10-09 00:19:21
951988527,I love saturday night live... they did an awesome job at the biden/ palin debate!! LMAO,iAmMissKarma,0,2008-10-09 00:18:32
951987427,90% Not bad... RT @rockstarjen : re: palin /fey test. http://tinyurl.com/3ld2o6,DowntownRob,0,2008-10-09 00:17:32
951987390,"Oh yeah, Palin , this is PHILLY, they booed Santa Claus. Remember that.",ronaldhennessy,0,2008-10-09 00:17:27
951987368,"Donklephant: David Brooks Slams Palin , Bush; Praises Obama http://tinyurl.com/4a5729",jpgardner,0,2008-10-09 00:17:26
951987039,"RT @Sarah_ Palin : Gov. Sarah Palin interview with “Hannity & Colmes” tonight on Fox News Channel, 9 pm ET",SwitchingGranny,0,2008-10-09 00:17:06
951987019,"FOX EMBEDS: Palin : Obama Won’t Drill for Oil, But Will Drill for Votes http://tinyurl.com/4ywae8",FoxNews,0,2008-10-09 00:17:08
951986949,"David Brooks: Sarah Palin ""Represents A Fatal Cancer To The Republican Party"" http://tinyurl.com/4yeh6r",Faramir_meow,0,2008-10-09 00:17:05
951986571,"@johnmoe IKristen Wiig is a much better Palin choice than Fey. No disrespect to Tina, but Wiig has bizarro American idiots on lock.",JesseThorn,0,2008-10-09 00:16:40
951986359,New FlapsBlog post: Sarah Palin Watch: E-mail Hacked and Family Photos/Voicemail Stolen .. http://tinyurl.com/48zpth,Flap,0,2008-10-09 00:16:32
951986049,Secret Service investigating threat made at Palin rally? http://tinyurl.com/4wphnw,JakeWagman,0,2008-10-09 00:16:17
951985865,"Palin : Obama Won’t Drill for Oil, But Will Drill for Votes: BETHLEHEM, PA – Continuing to... http://tinyurl.com/3lm93b",foxnewspolitics,0,2008-10-09 00:16:07
951984944,Politico: Secret Service investigating Palin scene: The Secret Service is checking a quote f.. http://tinyurl.com/4wphnw,politico,0,2008-10-09 00:15:14
951984919,:: just watched the SNL Tina Fey/ Palin -Biden debate video...so funny...,jimoleary,0,2008-10-09 00:15:13
951984853,Video: Nader running mate Gonzalez on the Sarah Palin /Biden Debate http://tweetopolis.com/politics/#118,twop,0,2008-10-09 00:15:09
951984364,Beth! Sarah Palin ? Say it ain't so!,DarylPlummer,0,2008-10-09 00:14:38
951983396,Brilliant use of tech by CA Dems. Built a billboard across from Palin rally site asking ?s. You can send your own via SMS. http://is.gd/3K0j,GothamNurse,0,2008-10-09 00:13:31
951983209,This won't end well. Palin to drop the puck at the Flyers game Saturday. Get your DVR ready. NHL Center Ice has a free preview this week,OreoDCW,0,2008-10-09 00:13:19
951982955,Friedman on Palin and Taxes: http://tinyurl.com/4w8bvf,meredithanne42,0,2008-10-09 00:13:01
951982954,punchback to the head for anyone wearing palin glasses,smelllaroses,0,2008-10-09 00:13:02
951982916,I think people using Obama's middle name at these McCain/ Palin hate rallies have anger issues.,robknight,0,2008-10-09 00:13:00
951982729,@MarketingProfs ran through Palin /Fey look alike test very fast...but faired a 90. http://plurl.me/1em,LisaMLoeffler,0,2008-10-09 00:12:49
951982506,"Sarah Palin Anchorage Alaska 1st USAcanidate , to join my GROUP , How my Blog just turned into the HOTTEST THING YOU EVER DID READ , 4 SURE",ArtByLetters,0,2008-10-09 00:12:35
951982123,Is rockin the Sarah Palin glasses.,jruscello,0,2008-10-09 00:12:11
951981973,"mccain only tells palin to ""have fun""??? http://tinyurl.com/52stqb",dutch163,0,2008-10-09 00:11:59
951981832,See Sarah Palin go to her reward in this video: http://tinyurl.com/3fmjaw,PresidentBarama,0,2008-10-09 00:11:52
951980339,Bear with this - it totally makes sense: How Sarah Palin = 50 Cent! http://tinyurl.com/4swzwj,OMGLOLWTF,0,2008-10-09 00:10:09
951979799,@SBEG just make sure he don't get bristol palin pregnant lol,anthonytaurus,0,2008-10-09 00:09:37
951979798,check out www.chrismenning.com to see why @sarah_ palin is a terrorist,cjmenning,0,2008-10-09 00:09:38
951979775,"Ooh yay!! Another Palin interview tonight (on Fox News, no less). C'mere puh-pee!!",Stacina,0,2008-10-09 00:09:32
951979349,Going to see the Capitol Steps. I am sure they will have plenty to say about Palin .,mjr3715,0,2008-10-09 00:09:09
951979323,Palin leads the GOP witchhunt - thank goodness she's been protected from witches: http://tinyurl.com/3wbudc,PalinPatrol,0,2008-10-09 00:09:07
