id,text,username,retweets,date
952939083,Sarah Palin spewing hatred is the last thing this country needs now. Someone should put a stop to this NOW!!!,gavintiegirl,0,2008-10-09 17:33:14
952938883,Sarah Palin spewing hatred is the last thing this country needs now. Someone should put a stop to this NOW!!!,gavintiegirl,0,2008-10-09 17:33:05
952938823,Sarah Palin spewing hatred is the last thing this country needs now. Someone should put a stop to this NOW!!!,gavintiegirl,0,2008-10-09 17:33:01
952938771,Sarah Palin spewing hatred is the last thing this country needs now. Someone should put a stop to this NOW!!!,gavintiegirl,0,2008-10-09 17:32:58
952938705,Sarah Palin spewing hatred is the last thing this country needs now. Someone should put a stop to this NOW!!!,gavintiegirl,0,2008-10-09 17:32:57
952938647,Sarah Palin spewing hatred is the last thing this country needs now. Someone should put a stop to this NOW!!!,gavintiegirl,0,2008-10-09 17:32:54
952938349,"Watch Madonna go crazy in concert on Sarah Palin : Either she took too many vitamins that morning, or .. http://tinyurl.com/52fb4w",b5Celebrity,0,2008-10-09 17:32:41
952938294,"Tizzy over Palin 's Newsweek cover (I had it Mon): http://tinyurl.com/3l827g. For the rec, noticed the 'stache only on huge hi-rez versio ...",HuffPostPol,0,2008-10-09 17:32:38
952938292,"Tizzy over Palin 's Newsweek cover (I had it Mon): http://tinyurl.com/3l827g. For the rec, noticed the 'stache only on huge hi-rez version.",rachelsklar,0,2008-10-09 17:32:38
952938248,@politicoman Indeed - Palin is... HOW SAD IS THAT!,wiredbirds,0,2008-10-09 17:32:37
952937987,"Palin 's Rise Proves GOP Just Doesn't Care: If the polls are right, Republicans are about to lose the elect.. http://tinyurl.com/3r48ha",Newser,0,2008-10-09 17:32:25
952937939,un chirurgo plastico per 007 – “il nuovo mondo” di ridley scott – bardot: palin … http://snipr.com/47qsh,spettegolando,0,2008-10-09 17:32:22
952937446,You want a war over Palin ? I’ll give you a war.: It appears as if we have begun the 2012 GOP Pres.. http://tinyurl.com/4yaaue,Racefour,0,2008-10-09 17:32:02
952937441,"GOP conservative on bush/ palin : ""not only to scorn liberal ideas, but to scorn ideas entirely"" ouch. http://twurl.nl/fb44p0",coldfusionPaul,0,2008-10-09 17:32:02
952936854,RE Newsweek photo: So it's an Obama plot that Sarah Palin didn't get a lip wax in time for the cover shoot?,2terriervineyrd,0,2008-10-09 17:31:34
952936404,M&C World News Princess Diana was distant cousin of Palin : Report : London - Prince.. http://tinyurl.com/444q4r,monstersandcrit,0,2008-10-09 17:31:17
952935982,RT- @TDefren Interviewing McCain / Palin supporters. http://tinyurl.com/48p9nx,BizGirl,0,2008-10-09 17:31:01
952935780,Breathtaking ignorance of McCain/ Palin supporters: http://twurl.nl/8x2ykc,thegoodhuman,0,2008-10-09 17:30:53
952935210,"Sarah Palin Parking Lot, Part II: Here is more of Tim Russo’s scary movie about the GOP’s s.. http://tinyurl.com/3npfjg",Wonkette,0,2008-10-09 17:30:27
952934944,"RE Newsweek pic. I thought Palin was all ""honesty, straight talk & experience"" now she wants to be airbrushed like a beauty queen?",2terriervineyrd,0,2008-10-09 17:30:19
952934897,Live Stream: McCain / Palin in Waukesha: http://www.todaystmj4.com/news/livestream,katie91684,0,2008-10-09 17:30:17
952934672,Video: Nader running mate Gonzalez on the Sarah Palin /Biden Debate http://tweetopolis.com/searchtag/118,twop,0,2008-10-09 17:30:06
952934091,@matthewbaldwin Maybe if it was titled 'How Sarah Palin Won the Election[1]... and Saved America. [1] for Obama',jaydeflix,0,2008-10-09 17:29:44
952933473,really rooting for someone to get some evidence of one of the Lil Palin 's drug use. That would be fun.,davehuge,0,2008-10-09 17:29:14
952933338,"palin = ""fatal cancer"" to GOP http://tinyurl.com/3kvfdj",tjkelly,0,2008-10-09 17:29:06
952931759,Just realised why McCain picked Palin http://tinyurl.com/3vferb - he needed sex appeal...!,pokerknave,0,2008-10-09 17:27:55
952930784,"Hugh Hewitt can't find a publisher for his book ""How Sarah Palin Won the Election...and Saved America"". Not a joke: http://hsps.notlong.com",matthewbaldwin,0,2008-10-09 17:27:09
952930682,"@iconjohn Man, Palin spends more time in Center City than I do. What's up with that?",holaolah,0,2008-10-09 17:27:04
952930648,"retweet @philebrity : PSA: Come One, Come All Saturday’s Big Sarah Palin Protest: If you enjoy a good protest .. http://tinyurl.com/5y2h48",Sistory,0,2008-10-09 17:27:01
952930641,"@RossCode I would have to say ditto to that. @mjeaton what a joke. Palin , election. :D",DeanWeber,0,2008-10-09 17:27:02
952930433,"Palin , while telling audience obama associates w terrorists, incites crowd to chant ""terrorist"" ""treason"" ""off with his head"" ... Wow!",thomassanchez,0,2008-10-09 17:26:50
952930373,"@overheard @joelevi ""Sarah Palin 's daughter is pushing out everyone else s kids why not tina fey's?"" wow joe really? nothing is sacred eh?",mikedopp,0,2008-10-09 17:26:49
952930349,Palin : The Leader of the Evil Idiot Brigade (EIB). http://tinyurl.com/4s7smc,bigskyman,0,2008-10-09 17:26:45
952930236,"George Will just called Palin a ""female Sancho Panza."" Hahahahahaha!",vmontes,0,2008-10-09 17:26:44
952930139,"@HarlemWriter The same crazies who shouted ""Kill Him"" at the Palin ralley!?",KathrinOutLoud,0,2008-10-09 17:26:40
952929422,Ignorance on Display at McCain/ Palin Rally: Watch this for some pretty extreme examples of ignoran.. http://tinyurl.com/4mzw5k,barackoblogger,0,2008-10-09 17:26:07
952929344,"@jmp5329 ... and fox news and the GOP are upset at an ""unretrouched"" photo of Palin on Newsweek... give me a break!",timsed,0,2008-10-09 17:26:03
952929167,Nnaarrgh.I feel so sleepy & unaware. Unintelligable & in a dream-like state. Yes. I could make a better VP nomination than Palin .,Templesmith,0,2008-10-09 17:25:53
952929003,Sarah Palin spewing hatred is the last thing this country needs now. Someone should put a stop to this NOW!!!,gavintiegirl,0,2008-10-09 17:25:48
952928436,Up to the minute: Campaign officials working on N.H. Palin visit: CONCORD  John .. http://tinyurl.com/3e8edh,seacoastonline,0,2008-10-09 17:25:22
952927785,"The Rep. ticket is losing to Obama all gains made by picking Palin , as women shift from voting with their vaginas to voting with their clits",smartasshat,0,2008-10-09 17:24:56
952927590,PALIN CHIDES BIDEN FOR HECKLING McCAIN SUPPORTERS AT OBAMA RALLY http://tinyurl.com/4vu5jc,ptd,0,2008-10-09 17:24:44
952927476,They found the person who hacked Palin 's Yahoo! account: http://tinyurl.com/4wqbfd,anna_mcg,0,2008-10-09 17:24:41
952927118,@jwright You're right. @mjeaton is sort of a loser. Palin :-),RossCode,0,2008-10-09 17:24:24
952927116,Just saw my first palin McCain bumper sticker...there had to be at least one.,raydawg88,0,2008-10-09 17:24:26
952927043,* meant palin supporters on last tweet .. sorry!,JoleneAL_,0,2008-10-09 17:24:22
952926818,RT @katia511 : - PBS Poll re: Palin Preparedness Link http://tinyurl.com/67kocc . Cast your vote now.,HarlemWriter,0,2008-10-09 17:24:10
952926209,"wiredbirds: RE: Tuning out the press. Ah, but Michelle Obama isn't running for office. Palin is.",politicoman,0,2008-10-09 17:23:45
952925888,@holaolah Palin is in Philly Saturday night.,iconjohn,0,2008-10-09 17:23:28
952925555,One more reason to hate the Flyers: Sarah Palin will drop the puck at their opener.,rockonfred,0,2008-10-09 17:23:14
952924866,@Gingerlatte yeah that's what palin wants to do. I don't like that kind of stuff either. Hey but that's a great come back. U sound likeobama,swopesean,0,2008-10-09 17:22:48
952924791,A. Sullivan: Palin 's First Campaign Manager: Not a fan: “She’s nothing like us!” she sta.. http://tinyurl.com/3sv6v2 -HuffNewswire,HuffPostPol,0,2008-10-09 17:22:45
952924784,A. Sullivan: Palin 's First Campaign Manager: Not a fan: “She’s nothing like us!” she sta.. http://tinyurl.com/3sv6v2,HuffNewswire,0,2008-10-09 17:22:45
952924756,"A. Sullivan: ""He's Got The Bloodlines"": McCain- Palin supporters at a Palin rally tell us.. http://tinyurl.com/48p9nx -HuffNewswire",HuffPostPol,0,2008-10-09 17:22:43
952924752,"A. Sullivan: ""He's Got The Bloodlines"": McCain- Palin supporters at a Palin rally tell us.. http://tinyurl.com/48p9nx",HuffNewswire,0,2008-10-09 17:22:43
952924360,"Michelle Obama says that she's tuned out..the media.., ""I've stopped reading and watching a lot of stuff."" JS: ""So you're a lot like Palin ""!",wiredbirds,0,2008-10-09 17:22:27
952924190,Obama and Biden divide up locations; McCain sticks with Palin so she doesn't go off script. Now that sad.,politicoman,0,2008-10-09 17:22:20
952923513,"Sarah Palin , Lip Hairs and All: The Oct. 13 issue of Newsweek features an up-close-and-personal pho.. http://tinyurl.com/3t2pcu",amandahess,0,2008-10-09 17:21:51
952923484,Best Sarah Palin ever: http://overcompensating.com/posts/20081007.html,ben_applegate,0,2008-10-09 17:21:50
952923479,Interviewing McCain/ Palin supporters. http://tinyurl.com/48p9nx,TDefren,0,2008-10-09 17:21:47
952923402,repost - PBS Poll re: Palin Preparedness Link http://tinyurl.com/67kocc,KathrinOutLoud,0,2008-10-09 17:21:45
952922985,The Fox news freak out over unretouched photo of Palin is ridiculous: http://tinyurl.com/4f22we,ericos,0,2008-10-09 17:21:28
952921586,over at my blog: I miss my garbage pail kids!: Please to look at Garbage Palin ! http://tinyurl.com/4voxfr,superphoebe,0,2008-10-09 17:20:29
952921352,"its funny, i never really wink in real life, but on IM i'm like sarah palin",mathiasreese,0,2008-10-09 17:20:21
952921172,NC Tweeps: We're about to have some company--McCain and Palin are coming to North Carolina http://is.gd/3Md6,natthedem,0,2008-10-09 17:20:11
952921009,Todd Palin had unusual access to wife’s staff http://tinyurl.com/472m6s,TucsonStar,0,2008-10-09 17:20:08
952920989,Palin is in Philly Friday... she could easily make it to NYC early Saturday to practice for that night's SNL http://tinyurl.com/3md3k8,holaolah,0,2008-10-09 17:20:07
952920436,"CNN - Palin on SNL? 'All in good time,' producer says: Read full story for latest details. http://is.gd/3Md0",USABreakingNews,0,2008-10-09 17:19:45
952920300,Rush is on a roll. Evidently the media is upset that Palin supports are calling Barry Obama names (cry me a river),JoleneAL_,0,2008-10-09 17:19:39
952918776,"PSA: Come One, Come All To Saturday’s Big Sarah Palin Protest: If you enjoy a good protest now .. http://tinyurl.com/5y2h48",philebrity,0,2008-10-09 17:18:32
952917831,"the Change First - a Rock Band custom band http://tinyurl.com/3wqshr (McCain, Obama, Palin , & Biden)",auilix,0,2008-10-09 17:17:52
952917791,Class b4 trash McCain/ Palin =Trash King w/Michelle http://www.cnn.com/video/#/video/politics/2008/10/09/sot.lkl.michelle.obama.energy.cnn,chickylala,0,2008-10-09 17:17:51
952917684,"Oh goody, it's Yom Kippur and I'm losing weight and not having to experience McCain- Palin !",jccosta32,0,2008-10-09 17:17:46
952917341,"Misread a sign @a rally; thot it said ""Hokey fan for Palin ."" Does that still make sense? You betcha. -anamariecox",HuffPostPol,0,2008-10-09 17:17:31
952917337,"Misread a sign @a rally; thot it said ""Hokey fan for Palin ."" Does that still make sense? You betcha.",anamariecox,0,2008-10-09 17:17:31
952917107,@DavilaDraws But they fail to point out that Palin is useless legislatively while Obama HAS to be a relative newcomer to affect any change.,LeeCherolis,0,2008-10-09 17:17:24
952916949,New blog post: Tennessee man indicted for hacking Palin e-mail http://tinyurl.com/42h7bs,AxelBuhrmann,0,2008-10-09 17:17:14
952916875,Sarah Palin is Pucking Her Way into Pennsylvanians' Hearts http://tinyurl.com/3mqpvq,indecision,0,2008-10-09 17:17:10
952916061,Posted 'Debate: Sarah Palin X Joe Binden - Português - 5ª Parte - Eleições Americanas' to blip.tv: http://blip.tv/file/1340789,gregoripavan,0,2008-10-09 17:16:38
952915658,Palin to drop puck at a Flyers game...Philly dont let me down! http://tinyurl.com/4skebo,chaunceymccall,0,2008-10-09 17:16:19
952915580,Son of Tenn. Democrat Indicted in Palin Hacking : The son of a Democratic Tennessee state lawmaker pl.. http://tinyurl.com/4yyehw,11AliveNews,0,2008-10-09 17:16:17
952915516,"FOX: ""This [Newsweek] cover is a slap in the face to Sarah Palin . Why? Because it's UNRETOUCHED."" http://is.gd/3KSq",marlaerwin,0,2008-10-09 17:16:14
952914087,Video: Nader running mate Gonzalez on the Sarah Palin /Biden Debate http://tweetopolis.com/searchtag/118,twop,0,2008-10-09 17:15:10
952913988,McCain- Palin 2008 Launches New Web Ad:,McCainNews,0,2008-10-09 17:15:09
952913592,"is laughing at ""Hey, Sarah Palin "" http://bit.ly/3tnGZp",danweinand,0,2008-10-09 17:14:52
952913067,The Palin Gamble: http://tinyurl.com/4rgvov A buddy of mine made this - be sure to spread around!,DJFrancis,0,2008-10-09 17:14:26
952912858,Sarah Palin : Palling Around With Secessionists 2008 http://tinyurl.com/4s2cbw,chickylala,0,2008-10-09 17:14:15
952912791,Obama crowds shrinking while McCain/ Palin crowds grow,donbonaddio,0,2008-10-09 17:14:10
952912391,"using palins logic i can link anyone to a 60's antiwar organization.also palin herself,im sure i can link her to an abortion clinic bomber",ConqueringLion,0,2008-10-09 17:13:52
952912148,Perk up McCain and Palin supporters. Watch Mr. Blue Sky by ELO and feel better! Nothing is over yet. http://www.thoughtbeast.com/,thoughtbeast,0,2008-10-09 17:13:41
952911790,Scary Idiots star in The McCain- Palin Mob: http://tinyurl.com/45xucz,_AKA_,0,2008-10-09 17:13:22
952911234,JOHN McCAIN SARAH PALIN WATCH Cool Custom Wristwatch http://tinyurl.com/3watvs,watchguy,0,2008-10-09 17:12:55
952911224,overheard: Palin is the Flavor Flav of the McCain Campain (embarrassingly famous),curtis_mitchell,0,2008-10-09 17:12:54
952910974,Sara Palin looks like my graphic of the naughty librarian...that's about as far as her educational position should go...a stock graphic,britt_loar,0,2008-10-09 17:12:41
952908144,um so madonna really doesn't like sarah palin . http://tinyurl.com/4xypx7,stephaniejane,0,2008-10-09 17:10:30
952907770,@wbboyd You're kidding right? Why wouldn't NRA support McCain/ Palin ?,luv2cruze,0,2008-10-09 17:10:14
952907264,Ok so this is random but anyone else think Sarah palin is one of the most annoying ppl,FallenAngel08,0,2008-10-09 17:09:51
952906441,@mikehillwig Palin represents a 'dumbing down' for sure.,LizPW,0,2008-10-09 17:09:14
952906266,Read what Sarah Palin did in random one sentences - http://palin.appspot.com,bluemonday,0,2008-10-09 17:09:06
952905681,@ricksanchezcnn I'm assuming you're going to talk about Todd Palin 's admitting his guilt in Troopergate. http://tinyurl.com/4kuzdg,OreoDCW,0,2008-10-09 17:08:40
952905623,@tgbdad do you think Biden supporter meant that Sarah Palin was gonna be elected the next PRES?!,SinginMomma,0,2008-10-09 17:08:35
952905353,PBS Poll re: Palin Preparedness - PLEASE VOTE! http://tinyurl.com/4lzam6,KathrinOutLoud,0,2008-10-09 17:08:25
952905251,"An example: Sarah Palin has done an impressive job as governor of Alaska, with an 80% approval rating.",Ipomoea,0,2008-10-09 17:08:20
952905045,The Tech Herald - Kernell pleads innocent after indictment in Palin email case http://tinyurl.com/4qmopx,GeekGurl1213,0,2008-10-09 17:08:14
952905020,Public believes the press has been too hard on Palin . http://is.gd/3Mah,johnrobinson,0,2008-10-09 17:08:12
952904936,New blog post: Are Michelle Obama and Sarah Palin Alike? http://www.misstheda.com/?p=1660,bondgyrl,0,2008-10-09 17:08:09
952904674,@LizPW I don't think that Palin makes all women look dumb. But she does have a good point that winking at the camera was a really bad idea.,mikehillwig,0,2008-10-09 17:07:55
952904590,Life with Down syndrome - share your experience: GOP vice presidential candidate Sarah Palin has.. http://tinyurl.com/53739a,BarbaraCurtis,0,2008-10-09 17:07:54
952904424,I am hoping the shit is going to hit the fan with Palin 's husband influence as advisor and the trooper firing.,Vegasseven,0,2008-10-09 17:07:47
952903617,please how can you say Sarah Palin and impressive in one sentence?,j9lonehill,0,2008-10-09 17:07:15
952903083,"@michaelGregoire That's terrible! Racism is still alive in America. Sad, McCain & Palin aren't doing anything to quell the racial hatred.",randomguru,0,2008-10-09 17:06:51
952902653,"Hugh Hewitt's ""How Sarah Palin Won the Election...and Saved America"" does not yet have a publisher. http://tinyurl.com/3nelau",stouthazard,0,2008-10-09 17:06:34
952902588,@chickylala Yep... Off with Todd Palin 's head... Bitch Slap Palin ... She's guilty by association!!! She palls around with Anti-America nuts!,lawgurl,0,2008-10-09 17:06:29
952902418,Palin was impressive during her interview with Hannity last night. She might just surprise all the nay sayers.,luv2cruze,0,2008-10-09 17:06:24
952902130,Talk like sarah palin day = genius!,dancuster,0,2008-10-09 17:06:12
952901144,McCain/ Palin handing out GOP to America... dont drink the pollution,Ricc,0,2008-10-09 17:05:31
952900740,Sarah Palin : Palling Around With Secessionists 2008 http://tinyurl.com/4s2cbw,chickylala,0,2008-10-09 17:05:13
952900189,"Paris Hilton Sarah Palin has a hot bod : Sarah Palin has a ""hot bod"" and should wear more revealing o.. http://tinyurl.com/3zf2vw",Telegraph,0,2008-10-09 17:04:50
952899876,retweet @mars0701 *funny* Sara Palin debate flowchart: http://tinyurl.com/3ohxtg),MichaelDag,0,2008-10-09 17:04:37
952899865,Video of McCain/ Palin rally in Ohio. People claiming Obama is a terrorist. What are they thinking?? http://snipurl.com/47pq0,billpollock,0,2008-10-09 17:04:38
952899756,"@NunoXEI I blame Palin . Not sure what for yet, but I'll think of something.",TimBrownson,0,2008-10-09 17:04:33
952899698,":: iPhone, Yom Kippur, Iceland, FOWA, Andy Stanley, #fowa , #citrt , #Catalyst08 , Tweetdeck, Sarah Palin ,... http://simpl.es/SibxU3",currentfm,0,2008-10-09 17:04:30
952899538,Palin in Wilmington tonight http://fiturl.com/0ym,daytondailynews,0,2008-10-09 17:04:22
952899417,I have become increasingly convinced Barely Political is genius. I'm loving the Palin spoofs http://tinyurl.com/4pavwj,DaisyWhitney,0,2008-10-09 17:04:17
952898176,Feeling stunned that McCain- Palin have stooped to employing fear and loathing politics (i.e. 'that one'). We must breed these people out.,jromi,0,2008-10-09 17:03:24
952897799,VERY funny videos of my friend Bev Reese as Palin being interviewed by Couric - http://tinyurl.com/4op4wc AND http://tinyurl.com/3oyo6b,mceasley,0,2008-10-09 17:03:06
952897644,My mom just made my eyes bleed. She thinks Palin 's terrific.,kisaA3A3A3,0,2008-10-09 17:02:58
952897406,Its good to see Sarah Palin on Newsweek cover page -see- http://tinyurl.com/49dnso,sphurthy,0,2008-10-09 17:02:50
952896747,Palin might be on SNL this week. Biden should beat her to the punch and show-up in full Palin -drag,Keebler,0,2008-10-09 17:02:19
952896586,"Apparently, Sarah Palin 's moustache on Newsweek is a tactic from Obama's campaign...I had no idea Obama had the power to make people not ...",RebecaHernandez,0,2008-10-09 17:02:12
952896421,"Yesterday it was the fake Cubs Facebook page w/the Billy Goat, today Sarah Palin http://twurl.nl/61ykw8. Thanks @pkitano for the link.",CSMcMahon,0,2008-10-09 17:02:06
952896276,@WatariGoro You must get your talking points from Palin ... cause that sounds really stupid...,lawgurl,0,2008-10-09 17:02:00
952895821,Is Palin seriously blaming Couric for Palin 's being an idiot problem?,carterartist,0,2008-10-09 17:01:39
952895217,"Trainwreck watch: McCain flak Nicolle Wallace on Today trying to sound credible flogging the Ayres story, and ducking a request for Palin .",8oooD,0,2008-10-09 17:01:16
952895067,moment: Palin tried to hire Terrorist Gordon Liddy as spokesperson. http://wkurl.com/wk.php?u=fbc1 - link by DIGG,WaterKula,0,2008-10-09 17:01:08
952895036,Sarah Palin : Palling Around With Secessionists 2008 http://tinyurl.com/4s2cbw,chickylala,0,2008-10-09 17:01:08
952894654,The Palin ’s Un-American Activities http://tinyurl.com/3rdlhk,chickylala,0,2008-10-09 17:00:49
952894577,"""...I still can't answer that question until somebody answers for me what is it exactly that the VP does every day?"" --Sarah Palin",randomguru,0,2008-10-09 17:00:47
952894507,twaboutMCCAIN> McCain and Palin talk ANWR with Sean Hannity: http://gristmill.gris.. http://tinyurl.com/3j68bm,twaboutMCCAIN,0,2008-10-09 17:00:42
952894410,"PALIN : ""Oil and coal? Of course, it's a fungible commodity and they don't flag, you know, the molecules, where it's going and where it's not",tjkelly,0,2008-10-09 17:00:39
952894349,Sarah Palin =Pretty Hate Machine....hat tip to Nine Inch Nails.,CarltonYates,0,2008-10-09 17:00:36
952894250,Palin is a disgrace to woman.,gardenofevils,0,2008-10-09 17:00:32
952894125,"Gov. Sarah Palin ‘On the Record’ Last Night: If you missed our interview last night with Gov. Sarah Palin , then... http://tinyurl.com/47s3tu",greta,0,2008-10-09 17:00:26
952893891,"Sarah Palin : Old hunting photo, new role hunting votes - http://tinyurl.com/48dbna",AHMalcolm,0,2008-10-09 17:00:17
952893813,Video: Nader running mate Gonzalez on the Sarah Palin /Biden Debate http://tweetopolis.com/searchtag/118,twop,0,2008-10-09 17:00:17
952893711,"@QueenofSpain Technically, Palin is married to a former domestic terrorist. Alaska Separatists and what not.",Knownhuman,0,2008-10-09 17:00:12
952893675,McCain and Palin talk ANWR with Sean Hannity: http://gristmill.grist.org/story/2008/10/9/74317/9123,grist,0,2008-10-09 17:00:13
952893673,"Todd Palin Had Unusual Access To Wife's Staff, Investigation Shows http://tinyurl.com/4hmnv4",sland3r,0,2008-10-09 17:00:11
952893579,Intellectualism & Sarah Palin : Or How The Smarty Pants Set Are Threatened By Someone Who Knows Sense - http://is.gd/3M8z - Right Wing Ne ...,PoliticsFix,0,2008-10-09 17:00:10
952893384,Sarah Palin Will Deliver the Vote - http://www.prx.org/pieces/29739,prx,0,2008-10-09 17:00:02
952893042,"Nanners, pregnant with Sarah Palin ’s baby, to pose nude for posh magazine -- http://yourdailynanners.wordpress.com/",dailynanners,0,2008-10-09 16:59:52
952892878,Palin 's brand of patriotism - http://tinyurl.com/4z9xbr,russelltripp,0,2008-10-09 16:59:44
952892337,"PALIN : ""I may not answer the questions that either the moderator or you want to hear...""",tjkelly,0,2008-10-09 16:59:19
952892062,"I just realized that when someone yells ""Kill Him"" at a Sarah Palin rally the ""him"" they refer to is McCain. People love her just that much.",CanadaGood,0,2008-10-09 16:59:05
952891615,@ricksanchezcnn Are people seriously upset that Newsweek didn't airbrush Palin 's face??? WTH? She doesn't need it!,One4Eddy,0,2008-10-09 16:58:47
952891494,This is hard to watch: it makes me very sad for americans... this is ugly: mcain- palin supporters http://tinyurl.com/52wyn6,queerwitch,0,2008-10-09 16:58:42
952891436,"PALIN : ""There's a place in Hell reserved for women who don't support other women.""",tjkelly,0,2008-10-09 16:58:38
952891398,"Even though I don't share the broad Twitterland disdain for Sarah Palin , I find this site very amusing & well done: http://pa.lindro.me/",davidswinney,0,2008-10-09 16:58:37
952891265,"Omg, thank you Jezebel for calling Palin Bible Spice. She'd wear Ginger Spice's minidress but American flag pattern instead of Union Jack.",helper_sloth,0,2008-10-09 16:58:29
952891190,"if you're not sick of these kinds of things already, here's a funny collection of Top 10 Dumbest Sarah Palin Quotes: http://twurl.nl/3x4ta1",petebeck,0,2008-10-09 16:58:27
952890996,Funny how it's clear that Obama can hear the shouts of supporters in the audience. He must have better hearing than McCain- Palin .,natthedem,0,2008-10-09 16:58:18
952890823,"PALIN : ""I'm the mayor, I can do whatever I want until the courts tell me I can't.'""",tjkelly,0,2008-10-09 16:58:10
952890619,"Oh, it looks like McCain- Palin 's Mr Murtagh supports terrorism too: http://tinyurl.com/52np86",vinayd,0,2008-10-09 16:58:01
952890129,"@deniseneil There have been so many great ones, but nothing like the new champ. Tina Fey = Palin FTW!",bryanmasters,0,2008-10-09 16:57:40
952889272,"Sarah Palin : Palling Around With Secessionists, 2008 http://tinyurl.com/4s2cbw",chickylala,0,2008-10-09 16:57:00
952888654,So geneology experts say obama is distant cousins with brad pitt and palin is distant cousins with franklin rosevelt and princess diana ...,abiq,0,2008-10-09 16:56:34
952888604,Posted 'Debate: Sarah Palin X Joe Binden - Português - 4ª Parte - Eleições Americanas' to blip.tv: http://blip.tv/file/1340731,gregoripavan,0,2008-10-09 16:56:32
952888248,"Dear California Democratic Party, Sarah Palin doesn't live here, and she has no power here. Stop scapegoating her.",Taquelli,0,2008-10-09 16:56:16
952888246,"PALIN : ""Well, let's see. There's -- of course -- in the great history of America rulings there have been rulings.""",tjkelly,0,2008-10-09 16:56:13
952887846,"PALIN : ""As Putin rears his head and comes into the air space of the United States of America, where– where do they go?...""",tjkelly,0,2008-10-09 16:55:56
952887599,The McCain- Palin Mob: http://tinyurl.com/4q8gjs - The paranoid style of American politics on bold display.,constantine_jn,0,2008-10-09 16:55:44
952887505,Sarah Palin : Palling Around With Secessionists http://tinyurl.com/4s2cbw,chickylala,0,2008-10-09 16:55:40
952887279,@ricksanchezcnn The crowds at McCain/ Palin rallies are starting to get ugly: http://tinyurl.com/52wyn6,RHercik,0,2008-10-09 16:55:29
952886998,"PALIN : ""As for that VP talk all the time, I'll tell you, I still can't answer that question until somebody answers for me...""",tjkelly,0,2008-10-09 16:55:17
