id,text,username,retweets,date
953475573,Can we start the when will Palin be assainated game?,brande87,0,2008-10-10 00:59:55
953475177,"LOL - someone's losing it... shades of ""Leave Britney alone!"" Too funny... now they're screaming for others to leave Sarah Palin alone.",Fortunalee,0,2008-10-10 00:59:28
953474471,Sending Palin out to lie is like semding a 5 yo girl to repeat your lies,tarheelguy124,0,2008-10-10 00:58:43
953474127,If Palin really cared about the country she would not be going on SNL. McCain Palin first...Country...not so much.,brande87,0,2008-10-10 00:58:21
953473835,"Palin repeated a false claim that Obama once voted in favor of higher taxes on “families” making as little as $42,000 a year. He did not.",HellionBOI,0,2008-10-10 00:58:05
953473786,"New on WA Mash: ""Sarah Palin and SNL: The Fey Factor"" http://tinyurl.com/3mumm2",WAMash,0,2008-10-10 00:58:00
953473781,"sARA PALIN READS mCCAIN'S NOTE CARDS WELL, SHE DOESN'T KNOW WHAT IT MEANS THOUGH",tarheelguy124,0,2008-10-10 00:58:02
953473608,@Spiffster @Doomguy13 it was during the v.a. when they were talking about Sarah Palin 's email,liesforliars,0,2008-10-10 00:57:47
953473584,"OK, not nice to make fun of Palin - I don't want to be labeled as sexist!",MFernandezJSC,0,2008-10-10 00:57:49
953473535,"PALIN MAKES MICHELLE OBAMA LOOK LIKE THE ""ELEPHANT MAN""",MonkPDX,0,2008-10-10 00:57:46
953473380,"Matt wants a ""Retarded Fascists for Sarah Palin "" bumper sticker. LOL LOL",SuziFoo,0,2008-10-10 00:57:32
953473138,"dear snl - palin is not funny, she is dangerous. why are you kissing her ass. MAD TV is not a sell-out",smelllaroses,0,2008-10-10 00:57:21
953472953,This McCain/ Palin thing can't go on much longer.,jermbigdog,0,2008-10-10 00:57:10
953472839,@walrus128 Palin 's to stupid to be racist,cARTHAN,0,2008-10-10 00:56:59
953472817,Palin isn't a racist. Just a fear monger and race hater.,brande87,0,2008-10-10 00:57:02
953472623,"Well, here's more on that Palin poll http://www.pbs.org/now/palin-poll.html",CSMcMahon,0,2008-10-10 00:56:48
953472180,SERIOUSLY if you don't agree with palin FINE but STOP making ridiculous accusations its getting out of hand,walrus128,0,2008-10-10 00:56:18
953471888,"I'm tired of all the Hussein, Muslim, and Terrorist ignorance that is being used by the McCain / Palin campaign!",_nctrnl,0,2008-10-10 00:55:58
953471746,@Schwinn SHUT UP I HATE YOU PEOPLE WHO CAN'T FIND ANYTHING AGAINST PALIN SO U CALL HER A RACIST! SHE HASN'T DONE ANYTHING RACIST AT ALL,walrus128,0,2008-10-10 00:55:51
953471597,politicalticker Alaska Supreme Court won't halt Palin probe http://tinyurl.com/455cay,DRBCH,0,2008-10-10 00:55:42
953471447,"If you google my name in Google's 10th anniversary search from 2001, I'm on page 6. If you google ""Sarah Palin "" there are NO hits.",robinelaine,0,2008-10-10 00:55:28
953471282,@joshbuckner Palin with inner conflict? I did not believe that is possible.,brande87,0,2008-10-10 00:55:23
953470948,"I just re-watched the Couric- Palin interviews.How can it be that she is a VP candidate? I don't think I'm in intellecutal snob, but come on!",MFernandezJSC,0,2008-10-10 00:55:01
953469643,"Beware in that last vid- ""Also"" runs amok. Palin , when you say ""and"", ""also"" is implied- also.",Jennyjinx,0,2008-10-10 00:53:40
953469446,Great more mud over the next 25 days. Gotta love McCain- Palin . Everyday is an adventure.,brande87,0,2008-10-10 00:53:29
953469314,"RT @BrooklynHilary : I get the heebeegeebees every time I hear "" palin probe"".",Tojosan,0,2008-10-10 00:53:21
953469079,RT jensimmons More frightening McCain/ Palin rally footage: http://tinyurl.com/4npecn Their crowds have become so small / monolithic.,Jennyjinx,0,2008-10-10 00:53:09
953468766,"@PeginMobile ""Just love all these wierd ppl telling fairy tale"" yeah, Gov Palin just doesn't fit their model of feminist,and she's qualified",donbonaddio,0,2008-10-10 00:52:48
953468765,is a palin probe covered under medical or dental insurance?,snackwellCuss,0,2008-10-10 00:52:48
953468609,"ponders that the only thing separating ""Pain"" and "" Palin "" is one measly letter. What the 'L'?? (har... get it? L??? ah phooey, I'm tired.)",Wenday71,0,2008-10-10 00:52:40
953468482,"Bewildered, wondering how Sarah Palin 's stunted neural network manages to command her heart and lungs Etc such that her body sustains life.",9600,0,2008-10-10 00:52:33
953468183,oh and I have also heard that Sarah Palin is going on SNL to spoof Tina Fey as Sarah Palin .,KateMarie93,0,2008-10-10 00:52:12
953467959,Blog Post: Palin 's Pallin http://s3nt.com/vej,jleberle,0,2008-10-10 00:52:01
953467635,"Palin investigation can proceed, Alaska high court rules: ANCHORAGE, Alaska (CNN) -- An investigation int.. http://tinyurl.com/3oqx79",mashget,0,2008-10-10 00:51:45
953467606,"I get the heebeegeebees every time I hear "" palin probe"".",BrooklynHilary,0,2008-10-10 00:51:45
953467271,Tina Fey is a better Sarah Palin then Sarah Palin .,KateMarie93,0,2008-10-10 00:51:23
953467203,"Thanks @jcure for this NYT article on the etymology of ""maverick."" Someone send it to Gov Palin 's people, STAT! http://tinyurl.com/4d4zm8",Famini,0,2008-10-10 00:51:14
953466372,"prof just said ""with all due respect to Sarah Palin let's just get rid of Alaska...""",scandalizi,0,2008-10-10 00:50:24
953465899,@tresson yea right where have you heard of palin killing any doctors?,walrus128,0,2008-10-10 00:50:01
953465489,"New from AP, PA: Palin Will Drop First Puck At Flyers Opener http://tinyurl.com/4s9okg",notkyleconner,0,2008-10-10 00:49:35
953465327,I don't know if I can stand another 26 days of Palin . Bring on election day!,sonia_am,0,2008-10-10 00:49:26
953465218,CNN - Alaska high court: Palin probe can continue: An investigation into Alaska Gov. Sarah Pal.. http://is.gd/3NvQ,USABreakingNews,0,2008-10-10 00:49:17
953464949,Madonna proíbe Sarah Palin de ir a seus shows hahahahaha: http://tinyurl.com/4ma9rt,desconjunturas,0,2008-10-10 00:49:05
953464499,palin has folks that will blow up abortion clinics kill a doc save a baby.,ConqueringLion,0,2008-10-10 00:48:40
953464465,Religion: Does Sarah Palin Have a Pentecostal Problem? http://tinyurl.com/3uyfrp,top_religion,0,2008-10-10 00:48:37
953464440,Alaska high court: Palin probe can continue http://tinyurl.com/4pm42c,CNN,0,2008-10-10 00:48:36
953464234,Palin 's Alaskan Independence Party was sponsored by...Pepsi? Nope. Target? Nope. Iran? Yep.: submitte.. http://is.gd/3NvM,reddit_feed,0,2008-10-10 00:48:26
953463918,@CSMcMahon Re: the PBS Palin Poll: http://www.pbs.org/now/palin-poll.html,amycurl,0,2008-10-10 00:48:06
953463900,Palin 's First Campaign Manager doesn't really care for her. http://tinyurl.com/3sv6v2,knitmeapony,0,2008-10-10 00:48:04
953463886,Biden knew less about the role of a VP (and he's served under eight) than Palin ; the political outsider.,Zhumi77,0,2008-10-10 00:48:03
953463884,Please tell me this Palin Mob is a SNL skit. http://tinyurl.com/52wyn6 (thanks @blizzzz ),pbrush,0,2008-10-10 00:48:04
953463875,"holy crap, who gave the ok on the sarah palin newsweek cover? kinda feel sorry for her. yeesh",lo77y,0,2008-10-10 00:48:03
953463004,Skilled immigration can resolve housing crisis: http://tiny.cc/u2YoW Please let me in. please. Even if McCain- Palin win the election.,kesava,0,2008-10-10 00:47:12
953462777,cnn: Alaska high court: Palin probe can continue: An investigation into Alaska Gov. Sarah Palin 's fi.. http://tinyurl.com/4pm42c,top_news,0,2008-10-10 00:47:06
953462477,Retweeting @jollybengali : FOX Freakout Over Unretouched Palin Photo On Newsweek Cover. http://tinyurl.com/4f22we,SpamSpam,0,2008-10-10 00:46:46
953462072,@Saya25 what no Palin and Binladen have common. they both belong ti radical anti-american groups that hate me and YOU.,sblackdiamond,0,2008-10-10 00:46:29
953461433,Good article in SunTimes re: MacCain- Palin extremism and negative campaign - Google: Mary mitchell bigots Palin Mccain,gregsanders,0,2008-10-10 00:45:52
953460681,Video: Nader running mate Gonzalez on the Sarah Palin /Biden Debate http://tweetopolis.com/searchtag/118,twop,0,2008-10-10 00:45:10
953460034,"@c3ane ""Most tweets from O supporters r +ive."" huh? show me one positive tweet for Gov Palin from an Obama supporter? All hate. FAIL",donbonaddio,0,2008-10-10 00:44:31
953459914,@jo3design as long as Palin doesn't join.,kioken,0,2008-10-10 00:44:24
953459505,"@Coyote a song for Sarah Palin , with subtitles so you don't miss any words... http://tinyurl.com/4dkdzl",nanwill,0,2008-10-10 00:43:56
953459164,"Sarah Palin 's grammar is starting to really REALLY irk me. More than the accent, which already irks me so much I slap myself when I hear it.",sherah,0,2008-10-10 00:43:35
953458361,"hey, I got a page 1 ranking in Google for ""Sarah Palin disaster""!",jwesley,0,2008-10-10 00:42:40
953457506,Fox News complains about unretouched Palin photo in Newsweek. http://tinyurl.com/3wd7xe,diabola,0,2008-10-10 00:41:47
953457317,Seguirá investigación contra Palin : Corte de Alaska: La investigación se refiere a la denuncia de u.. http://tinyurl.com/3enldr,eleconomista,0,2008-10-10 00:41:34
953456579,Just saw a pic of Palin with hair down. Forget Tina Fey - she was the spitting image of Jennifer Garner.,districtkris,0,2008-10-10 00:40:44
953456309,McCain/ Palin town hall today with people in the crowd shouting out was staged sad McCain's campaign is going down the toilet,astepabove,0,2008-10-10 00:40:30
953456292,Crazy Corn Mazes - From Sarah Palin to Arkansas Razorbacks (GALLERY) http://tinyurl.com/4wrgtp,trendhunter,0,2008-10-10 00:40:26
953456084,"Acabo de postear sobre: ""Newsweek y el bigote de Sarah Palin "" http://tinyurl.com/4jq4e2",TheDailyDG,0,2008-10-10 00:40:13
953455851,"""Newsweek y el bigote de Sarah Palin "" http://tinyurl.com/3epfjp",TheDailyDG,0,2008-10-10 00:40:01
953455722,sarah palin missed her calling... i think she was supposed to be in porn. maybe thats why McCain hired her...,CaB_MaN,0,2008-10-10 00:39:56
953455610,The desperation of McCain/ Palin is so obvious. How about sticking with the issues -- that would be a nice change.,debgleit,0,2008-10-10 00:39:49
953455482,More frightening McCain/ Palin rally footage: http://tinyurl.com/4npecn Their crowds have become so small / monolithic.,jensimmons,0,2008-10-10 00:39:40
953455298,"Palin hacker indicted /Gadgetell/ - Section: Communications, Email / IM, Computers, Security A federal ... http://tinyurl.com/53n5gh",JenniferEGuerra,0,2008-10-10 00:39:30
953454530,This describes how I feel about McCain/ Palin : http://tinyurl.com/5lxcq4,Akelaa,0,2008-10-10 00:38:43
953453758,"wonders why @glbltrader and @Sarah_ Palin added her when she's not interested in Sarah Palin nor ""bashing"" Obama, kthanksbai.",day200,0,2008-10-10 00:37:59
953453096,"News 11 - McCain, Palin rally in Cleveland area http://tinyurl.com/3pa9d9",WTOL11Toledo,0,2008-10-10 00:37:19
953452839,Wasilla Band Proud to be Anti- Palin http://tinyurl.com/4bb9hh,mattrowe_test,0,2008-10-10 00:37:05
953452638,@SarahPalin I really respect you Governor Palin . I'm in full support of your future Vice Presidency.,DanieljGross,0,2008-10-10 00:36:55
953452551,I really love Ellen...and Sarah Palin really totally tolerates her too.,frostinglickr,0,2008-10-10 00:36:49
953451490,Blue Hampshire: Is John McCain a Coward or a Liar?: The McCain- Palin campaign has resumed its dar.. http://tinyurl.com/4w3h58,newhampshireBNN,0,2008-10-10 00:35:48
953451361,Susan the Bruce: villagers with torches and pitchforks: This footage comes from a Palin rally in .. http://tinyurl.com/3p4dbd,newhampshireBNN,0,2008-10-10 00:35:38
953450566,"is it me, or is S. Palin 's daughter starting to look eerily like Cindy McCain? Veeeery creepy.",jwgiberson,0,2008-10-10 00:34:58
953450490,"Sarah Palin , please don't let anyone else write your script again. I disagree with you wholeheartedly but when you are YOU, you sound better",sine922,0,2008-10-10 00:34:54
953450238,Social Networking with Sarah Palin and dangerously active CMS content magnification,eviltwins,0,2008-10-10 00:34:39
953449621,"My contacts are out ... I'm resting my corneas .. so wearing glasses today. Palin Style. ... wait, that makes no sense.",rocksandshoals,0,2008-10-10 00:34:07
953449388,"PLEASE let it not be true that Palin got under 900 on her SAT's. If that's a real document...hell, handbasket. http://tinyurl.com/49922b",afrobella,0,2008-10-10 00:33:51
953449304,Palin haters. Would your savior want you to behave that way? You brag how he will bring the country together - nice start!,donbonaddio,0,2008-10-10 00:33:49
953448844,Looking at what some are claiming to be Sarah Palin 's academic records. A 900 0n the SATs? Seriously? Jesus. Airhead. http://is.gd/3NtZ,Iron_Spike,0,2008-10-10 00:33:20
953448258,Keith Olbermann rips Sarah Palin 's bigotry and hypocrisy http://tinyurl.com/5x35ow,HamishMacEwan,0,2008-10-10 00:32:49
953448032,The son of a Democratic politician pleads not guilty as he is indicted over the hacking of Sarah Palin 's private e-mail account.,ADAFINEWS,0,2008-10-10 00:32:31
953447975,Palin on Obama. He would diminish “the prestige of the United States presidency.” Don't know what else to say about that one!!!!,jsteig,0,2008-10-10 00:32:29
953447945,If It Walks Like A Duck and Talks Like a Duck Dept: The McCain- Palin Mob http://tinyurl.com/4gg5m6,BoingBoing,0,2008-10-10 00:32:28
953447734,Palin 's first campaign manager is not a fan. http://tinyurl.com/3sv6v2,diabola,0,2008-10-10 00:32:13
953447711,today's viral video of scary mccain/ palin supporters makes me wish it were 11/5 already.,mmmaiko,0,2008-10-10 00:32:13
953447700,"Interesting how Palin disses Obama for pointing to the past, but 15 min. later she starts pointing at Obama's past... hmmmm",NowellVanHoesen,0,2008-10-10 00:32:16
953447649,Alaska Court Refuses to Halt Palin Troop Inquiry: The Alaska Supreme Court clears the way for... http://tinyurl.com/4jgzft,foxnewspolitics,0,2008-10-10 00:32:12
953447596,ELECTIONS: Alaska Court Refuses to Halt Palin Troop Inquiry http://tinyurl.com/4jgzft,FoxNews,0,2008-10-10 00:32:06
953447488,Palin just had the balls to say how refreshing it is that McCain answers questions directly. Does she remember her own debate performance?,GreenMommy,0,2008-10-10 00:32:00
953447396,can we get back to focusing on the issues facing the US instead of Palin 's pimples & facial hair on Newsweek's cover? thanks. appreciate it.,tyme,0,2008-10-10 00:31:55
953447171,"Oh man, Sarah Palin is getting heckled at her Cincinnati ralley. The crowd is chanting ""Obama"" and she's all flustered. Ha, hilarious.",AlexShebar,0,2008-10-10 00:31:41
953446930,Yeah we all know McCain never lie and oh yes and his team vetted Palin . What a joke to believe anything that comes out of McCain Mouth,Nubian_Queen,0,2008-10-10 00:31:30
953446697,"Damn. I'm driving and palin said ""maverick"". I can't drink and drive, but I want to.",davidcohen,0,2008-10-10 00:31:18
953446325,Hmmm... PBS is doing a poll to see if Palin is qualified to be VP. http://tinyurl.com/67kocc Its currently running even.,CSMcMahon,0,2008-10-10 00:30:54
953446182,Leona Helmsley: Only the little people pay taxes. Republican values. RNC mccain palin lott delay rove bush lay cheney,rongillmore,0,2008-10-10 00:30:45
953446098,"Palin said that Obama would ""...diminish the presidency."" Now, what, pray tell, do you think she meant by that? This is so damn ugly now.",lisahubbert,0,2008-10-10 00:30:42
953446054,"just looked up the palin newsweek cover....I don't think its that bad, right wing whiners.",deibster,0,2008-10-10 00:30:39
953445594,Video: Nader running mate Gonzalez on the Sarah Palin /Biden Debate http://tweetopolis.com/searchtag/118,twop,0,2008-10-10 00:30:12
953445356,Of Course Theres a Sarah Palin Sex Doll - http://is.gd/3NtC - Indecision 2008,PoliticsFix,0,2008-10-10 00:30:00
953445081,Alaska Supreme Court Refuses to Halt Palin Probe. http://tinyurl.com/4ypm98,dmetzcher,0,2008-10-10 00:29:49
953444645,"going home, but have homework. boo! will be watching office followed by TNL :) will palin be there? secretly hoping no. like fey better",katefhill,0,2008-10-10 00:29:19
953443840,McCain and Palin were local today and completely off the wall. No one is surprised.,benetwits,0,2008-10-10 00:28:24
953443151,Is so sick of hearing McCain and Palin slander Obama in a desperate attempt to gain leverage with the voters. SICK OF IT!,sfarah19,0,2008-10-10 00:27:43
953443017,Sarah Palin is a terrorist to the American people!,Michelle415,0,2008-10-10 00:27:35
953442995,Hugh Hewitt's prospective book on how Sarah Palin saved America does not yet have a publisher. http://tinyurl.com/3nelau,diabola,0,2008-10-10 00:27:30
953442237,"@bloodyp Sarah Palin says ""also"" almost as much as Shia LeBeouf says ""Nonononono!""",philomela,0,2008-10-10 00:26:40
953441942,Palin is a maverick; takes law into own hands - Retweeting @USATODAY : High court allows Palin ethics probe http://tinyurl.com/45y98a,chrispitre,0,2008-10-10 00:26:15
953441815,"A few days ago I didn't think McCain- Palin were inciting their crowds, that was until I listened to their townhall today. Whack jobs.",brande87,0,2008-10-10 00:26:11
953441627,Palin is related to Princess Diana! http://tinyurl.com/4npte6,SocialRosy,0,2008-10-10 00:25:59
953441437,"How many times do you think Sarah Palin says ""Also"" when she's let into public? 50 times in a minute? 100 times?",HeavyCritters,0,2008-10-10 00:25:47
953441393,Is ready to vomit- Palin is spewing blah blah blah on my television. =(~,a2phc,0,2008-10-10 00:25:43
953441137,"Best nickname for Sarah Palin : Caribou Barbie or Bible Spice? I'm torn, honestly.",melondrama,0,2008-10-10 00:25:26
953440803,palin is a bad joke and mccain a granny.,yokomono,0,2008-10-10 00:25:02
953440743,Still totally freaked out by the McCain/ Palin rallies: http://tinyurl.com/3ruvfr,stumptownmag,0,2008-10-10 00:25:01
953440549,Just added 'Hey Sarah Palin Song' to Vodpod http://tinyurl.com/4x8xpx,dimaks,0,2008-10-10 00:24:51
953440456,link to that quote by Palin http://tinyurl.com/43kq88,ophelia,0,2008-10-10 00:24:43
953440302,@thatboyonline I LOVE YOU FOR LOVING SARAH PALIN !,gmkirkland,0,2008-10-10 00:24:35
953440286,"Palin :find Obama “out of the mainstream,” adding that the Illinois senator would diminish “the prestige of the United States presidency.”",ophelia,0,2008-10-10 00:24:33
953440177,Court Removes Last Hurdle In Palin Inquiry: Alaska's Supreme Court refuses to shut down an ethics i.. http://tinyurl.com/4vkrwj,DenverChannel,0,2008-10-10 00:24:28
953439681,"RT @Digg : Hey Palin , guess what I can see from MY house?? http://tinyurl.com/4xv3dz",dorrine,0,2008-10-10 00:23:57
953439671,What the heck is Todd Palin campaigning for?,brande87,0,2008-10-10 00:23:56
953439597,derisively laughing at the clusterfuck that is McCain/ Palin,jbenmoss,0,2008-10-10 00:23:53
953439520,Palin 's shoes match her carpet bag,SmartParty,0,2008-10-10 00:23:49
953439134,Was one of the six colleges Palin went to in Minnesota?,brande87,0,2008-10-10 00:23:18
953439018,"Up to the minute: Todd Palin to campaign in Maine: PORTLAND, Maine  Todd Palin , .. http://tinyurl.com/4n6ma4",seacoastonline,0,2008-10-10 00:23:14
953437885,"Economic worries tipping Wisconsin toward Obama: APPLETON, Wisconsin (CNN) -- In the last two presidenti.. http://twurl.nl/uy6adj",mg_palin,0,2008-10-10 00:22:05
953437839,A. Sullivan: Troopergate Is On: The legislative report into Palin 's alleged abuse of pow.. http://tinyurl.com/3fystp -HuffNewswire,HuffPostPol,0,2008-10-10 00:21:59
953437837,A. Sullivan: Troopergate Is On: The legislative report into Palin 's alleged abuse of pow.. http://tinyurl.com/3fystp,HuffNewswire,0,2008-10-10 00:21:59
953437761,New World PR Blog: Where Did You See the Palin Skits? http://tinyurl.com/49fzqt,stepahead,0,2008-10-10 00:21:57
953437700,"Palin investigation can proceed, Alaska high court rules: ANCHORAGE, Alaska (CNN) -- An investigation i.. http://twurl.nl/e1nrbi",mg_mccain,0,2008-10-10 00:21:54
953436848,Court rejects bid to halt Palin abuse-of-power probe: Alaska's Supreme Court has dismissed a bid by Repub.. http://is.gd/3NsG,abcnews,0,2008-10-10 00:21:06
953436629,"Headline: ""John McCain Declares 'Underdog' Status"" Afterward, Palin asked if that meant she had to declare ""Sweet Polly Purebred"" status.",joshacagan,0,2008-10-10 00:20:51
953436322,anna: Leave Sarah Palin Alone! http://tinyurl.com/3tovpl,ffholic,0,2008-10-10 00:20:35
953436214,you know palin did do a solid for brunettes though,smelllaroses,0,2008-10-10 00:20:29
953436056,anna: Leave Sarah Palin Alone! http://tinyurl.com/3tovpl,ffholic,0,2008-10-10 00:20:21
953436017,"Sarah Palin is speaking ""down the road"" from me right now...and doing a tremendous job! Palin in '12!!!",gregular,0,2008-10-10 00:20:18
953436000,Keith Olbermann offers the definitive smackdown on Palin 's hypocrisy when it comes to guilt by association. http://tinyurl.com/3kejol,CollinKelley,0,2008-10-10 00:20:16
953435963,Great Palin Video on @stevegarfield blog ! http://tinyurl.com/3md9nv Very funny. Worth 3:53 of your life !,Bsimi,0,2008-10-10 00:20:13
953435917,National electoral map: Obama solidifies lead; time slipping for McCain- Palin - http://tinyurl.com/3enur4,AHMalcolm,0,2008-10-10 00:20:14
953435699,@phillyd have you seen the sara palin sex tape?,baitshopboy,0,2008-10-10 00:20:04
953435627,...for a fuller effect...the intelligent commentary of McCain Palin ticket voters. Scary people here. http://tinyurl.com/3kbec9,foliadesign,0,2008-10-10 00:20:02
953435466,Wondering why @sarah_ palin is following me on twittah.,ambrabenjamin,0,2008-10-10 00:19:53
953435424,$3.15 gas was too enticing on the way back from C-bus. Unfortunately it was at the same exit where Sarah Palin was speaking tonight. D'oh!,prauchenstein,0,2008-10-10 00:19:50
953435373,"Why is the news discussing Newsweek not retouching a Palin photo? Seriously, NOTHING else is newsworthy? Not the Dow?! Not ANYTHING else?",erdoland,0,2008-10-10 00:19:46
953435097,RT @rickaster Alaska Supreme Court agrees the governor is not above the law. Is Palin in big trouble? You betcha,Alheri,0,2008-10-10 00:19:30
953434974,Now in support of genetics testing to make sure inbreds arent able to vote. After seeing the new Palin mob video on You Tube,Bruce4Obama,0,2008-10-10 00:19:23
953434302,Digg: Wasilla Band Proud to be Anti- Palin : losangeles.metromix.com — (Digg and comment this) http://tinyurl.com/3nrlwr,top_dedist,0,2008-10-10 00:18:43
953433975,"Amazing what you can find on cafepress, for example, many varieties of pro-McCain- Palin dog T-shirt.",LizMair,0,2008-10-10 00:18:27
953433861,@winemedineme Obama rally in Ault Park has a lot of that area snarlled. Plus Palin 's plane is at Lunken.,MrGuilt,0,2008-10-10 00:18:20
953433832,@Stephann78 SO why are they showing up to all of the Palin rallies....?,lawgurl,0,2008-10-10 00:18:15
953433483,"Video -- Biden: Palin , A Backwards Step For Women http://tinyurl.com/434jzl",stevenfoley,0,2008-10-10 00:17:58
953433471,"Some straight talk, my friends: Tina Fey has to seriously de-hottify and trash herself up to play Sarah Palin . They are NOT dead ringers.",Mike_El,0,2008-10-10 00:17:55
953433205,Digg: Wasilla Band Proud to be Anti- Palin : losangeles.metromix.com — (Digg and comment this) http://tinyurl.com/3nrlwr,top_web,0,2008-10-10 00:17:47
953433124,Portugal the man VS Sarah Palin http://tinyurl.com/3nrlwr,securingsincity,0,2008-10-10 00:17:40
953432370,"The ""McCain- Palin mob"" video has 320k YouTube views. That's 45,000 more than the McCain ""Ayers"" video. Backlash.",daveweigel,0,2008-10-10 00:16:59
953432257,@fdwlovebug We already know that... their the same nuts scream all that non-sense at Palin rallies..,lawgurl,0,2008-10-10 00:16:51
953431526,"Watching John McCain on ABC News, why is it ok to look into Obama's past but not Palin 's?",Lots_Of_Static,0,2008-10-10 00:16:07
953431155,"If I was McCain, I'd be making-up stories too. This week, it's been McCain, Palin , & Cindy against Obama. And they're still losing.",politicoman,0,2008-10-10 00:15:44
953430992,What event could THIS market possibly be discounting? A meteorite impact? A Palin Presidency?,roberams,0,2008-10-10 00:15:35
953430932,Palin 's Facebook page. Awesome. http://ping.fm/sPYMe,bryanbartow,0,2008-10-10 00:15:30
953430675,"Just love all these wierd ppl telling fairy tales re: S. Palin : Killing kitties, etc. Grow up people. Stick to facts or shut up",PeginMobile,0,2008-10-10 00:15:17
953430541,Video: Nader running mate Gonzalez on the Sarah Palin /Biden Debate http://tweetopolis.com/searchtag/118,twop,0,2008-10-10 00:15:10
953430138,Has the KKK endorsed McCain- Palin yet?,brande87,0,2008-10-10 00:14:40
953429771,"Members of psych-rock band from Wasilla, AK are not fans of Governor Palin . Find out why: http://is.gd/3Nr7 Also, very cool Star Trek tattoo",ReedLyon,0,2008-10-10 00:14:19
953429443,"From where I am...walk five miles in one direction and run into Obama. The other direction, Palin . Hello Ohio swing voters.",toddhenry,0,2008-10-10 00:13:52
953427709,"Hey Palin , who you callin' a terrorist http://tinyurl.com/3rwzlk",JacqBesse,0,2008-10-10 00:12:03
953427675,Sarah Palin looks busted in the unretouched photo on the cover of NEWSWEEK. She ain't that pretty. She should get Mariah Carey's retoucher.,elmayimbe,0,2008-10-10 00:12:01
953427455,"LMAO at Palin 's nickname ""Mooselini""",blkdykegoddess,0,2008-10-10 00:11:46
953427235,"""McCain is the only one in ths campaign offering optimistic solutions""-Sarah Palin (just now in Cinci)----wha? Does she know him?",GreenMommy,0,2008-10-10 00:11:32
953426216,"perils of meeting at your desk: ""albert, why are you searching for ' palin moustache' in google?""",smoovebert,0,2008-10-10 00:10:31
