id,text,username,retweets,date
952373119,Video: Nader running mate Gonzalez on the Sarah Palin /Biden Debate http://tweetopolis.com/searchtag/118,twop,0,2008-10-09 07:15:17
952372096,Palin would make Dan Quayle look presidential.,kfreyla,0,2008-10-09 07:13:35
952372051,tina fey you are so hot. *sigh* you do sarah palin so well...LMFAO,brandylina,0,2008-10-09 07:13:32
952371679,I took a quiz today where I had to pick the real Sarah Palin out of photos with her or Tina Fey. Got 9/10.,russnem,0,2008-10-09 07:12:55
952370941,Has everyone read the David Brooks statements on McCain- Palin ? Remarkable from a staunch conservative! http://tinyurl.com/4yeh6r,dbajpai,0,2008-10-09 07:11:44
952370812,"There's only one competent Palin , and he can't even return a dead parrot to a pet store.",ericfell,0,2008-10-09 07:11:33
952370455,@dangrabbit now thats real ugly when long island republicans are turning from mccain.blame palin mccain .u shudnt have picked her,ConqueringLion,0,2008-10-09 07:10:57
952369640,"Unconfirmed Sources Hockey Moms Put Sarah Palin in the Penalty Box: (Chillicothe, Ohio) Uc.. http://tinyurl.com/53k5lf",ucs,0,2008-10-09 07:09:48
952369503,What I learned today: That even Long Island Republicans are swaying away from McCain/ Palin .,DangRabbit,0,2008-10-09 07:09:35
952368916,"& mo that i analyze debate, obama & mccain has mo chemistry 2gether than obama/biden & mccain/ palin but not mo than obama/hillary.",jellynoose,0,2008-10-09 07:08:40
952367926,mccain was doing fine till he picked palin .that was the beginning of the end of his credibility,ConqueringLion,0,2008-10-09 07:07:06
952367049,My second article published on Al-Jazzera English http://cli.gs/vZ25hm discussing the Vice-Presidential debate Biden vs Palin,DrAwab,0,2008-10-09 07:05:57
952365985,":: iPhone, South Park, Project Runway, Palin , Michelle Obama, Halo 3 Recon, AIG, #ulearn08 , Yom Kippur,... http://simpl.es/SibxU3",currentfm,0,2008-10-09 07:04:28
952365609,So far @rockstarjen is the only person I know fo to score 100% on the palin /fey test. She IS a rock star! http://tinyurl.com/3ld2o6,JenMitch,0,2008-10-09 07:03:57
952364950,"New Post: Obama, McCain & Palin - Who Got the Most Ink?: Follow the trend of news and blogs cover.. http://is.gd/3KPl",cyhung,0,2008-10-09 07:02:55
952364741,New blog post: Keith Olbermann on Palin and Terrorists http://tinyurl.com/3olspx,qmuser,0,2008-10-09 07:02:37
952364568,"Politics ""Topco Sales :: This Is not Sarah Palin Inflatable Love Doll"" ( http://tinyurl.com/4tkv7a )",infodiva,0,2008-10-09 07:02:21
952364555,"The conversation around Palin is heating up, 'spy' on Twitter, FriendFeed, Flickr and more at http://spy.appspot.com/find/Palin",spyapp,0,2008-10-09 07:02:19
952363705,moment: Video - Biden: Palin Must Condemn Hateful Obama Attacks http://wkurl.com/wk.php?u=f544 - link by DIGG,WaterKula,0,2008-10-09 07:01:07
952363396,"Alleged Palin e-mail hacker indicted, faces jail time[Ars Technica] http://tinyurl.com/4fmkv9",techfantastic,0,2008-10-09 07:00:40
952363176,Video: Nader running mate Gonzalez on the Sarah Palin /Biden Debate http://tweetopolis.com/searchtag/118,twop,0,2008-10-09 07:00:22
952363149,Sirius 108 - Manertainment- 300 Beat Down and Sarah Palin ...Moose Killer!: Happy Thu.. http://tinyurl.com/4otqxz,manertainment,0,2008-10-09 07:00:20
952362942,Catchy and political too! A Sarah Palin musical interlude: http://tinyurl.com/4pmahn,Marj,0,2008-10-09 07:00:07
952360535,"Take the L out of Palin , and you'll be left with Pain. http://tinyurl.com/4u4aky",ronnierayjenkin,0,2008-10-09 06:56:23
952360230,palin wrote a pop up book,phoenix03,0,2008-10-09 06:55:53
952357245,New blog post: Conversations With Palin Supporters http://tinyurl.com/3knuur,trojan1500,0,2008-10-09 06:51:20
952356629,ペイリン氏狙ったハッカーを起訴: 【10月9日 AFP】米連邦大陪審は、米大統領選の共和党副大統領候補サラ・ペイリン（Sarah Palin ）アラスカ（Alaska）州知事の電子メールアカウントに許可無くア.. http://tinyurl.com/4d4qnv,afpbbnews,0,2008-10-09 06:50:28
952355990,The treacle is flowing over Sarah Palin on Twitter. It's shallow and truly disturbing. (shudder),doggo,0,2008-10-09 06:49:37
952355912,Michelle Obama - http://tinyurl.com/3qczy9 - Make sure you watch the second segment on Sarah Palin . Inspiring!,swhitley,0,2008-10-09 06:49:30
952355173,FOX Freakout Over Unretouched Palin Photo On Newsweek Cover: submitted by polymath22 to politics [lin.. http://is.gd/3KOm,reddit_feed,0,2008-10-09 06:48:31
952354634,"@luna_x hey wasup girl how you doing, yeah i peeped Michelle Obama on u tube, Mcain & Palin make me ill...lol real talk",ronwessmusaq,0,2008-10-09 06:47:51
952354591,http://tinyurl.com/4qwkqp UNF OH PALIN !,thebuttmaster,0,2008-10-09 06:47:47
952353733,Crotchety mccain and clueless palin . A team of mavericks acting real mavericky talking straight talk for you people. FAIL,TheDudeAbides,0,2008-10-09 06:46:39
952353560,"Econ: Torn between letting the markets correct themselves regardless of pain vs govt intervention. Politics: Sarah Palin ? No ""?"", vote Obama",Jeff_McE,0,2008-10-09 06:46:26
952353346,@joshhaber DUDE!! Did you STEAL my Sarah Palin /Putin snl sketch idea and pitch it to Ross?! That is COLD!,mktoon,0,2008-10-09 06:46:09
952353106,"OSHI I just said "" Palin "" in a IM convo where I actually meant ""Kati Mannekin"". AHHAHAH I FAIL",halleluyang,0,2008-10-09 06:45:49
952352683,Video: Nader running mate Gonzalez on the Sarah Palin /Biden Debate http://tweetopolis.com/searchtag/118,twop,0,2008-10-09 06:45:14
952352495,"I really can't believe the racist shit being tossed out at Palin and McCain rallies, really dispicable crap...McCain is lower than low",DJalphabeats,0,2008-10-09 06:45:01
952352011,good for a giggle: Palin Debate Prep Flowchart -- http://tinyurl.com/53j5oy,cermedes,0,2008-10-09 06:44:14
952351309,Uhm: Need more be said about the ignorant fanatics following McCain/ Palin to the gallows? Whoa! http://tinyurl.com/52wyn6,ShilohJenz,0,2008-10-09 06:43:05
952350734,"McCain and Palin look like a bad comedy act with nothing to say, so they go on the attack and become loud +arrogant. not impressed...",Swidub,0,2008-10-09 06:42:07
952350452,Camille Paglia admires Palin (http://bit.ly/1T2ED9); David Brooks sees Palin as a cancer to the Republican party (http://bit.ly/487sV6),c4chaos,0,2008-10-09 06:41:41
952349872,"New shirt in the mail today. Especially for Nov 5. "" I voted for mccain/ palin and all I got was this crappy t-shirt """,TheDudeAbides,0,2008-10-09 06:40:44
952349250,Sarah Palin will drop the puck at the Flyers home opener vs the Rangers Saturday. Will someone PLEASE politely check her.,ThisDateAndTime,0,2008-10-09 06:39:51
952348877,Re-watching the Tina Fey as Sarah Palin SNL sketches with @sunshineamonra . Go Go Huffington Post! http://tinyurl.com/4jd7ug,skairam,0,2008-10-09 06:39:15
952348443,I am sad to say on my way to the hospital i took a side street lined with mccain/ palin signs - i was screamin noooo! on the inside lol,CrimsonMe,0,2008-10-09 06:38:33
952348127,Duck Duck Goose: Senator John McCain and Governor Sarah Palin ’sTv Ad “Hypo”: [...] http://tinyurl.com/45lkh2,marylandBNN,0,2008-10-09 06:38:06
952347813,"Silenced Majority Portal: Conservative Journalist David Brooks: ""Sarah Palin Represents a Fatal Can.. http://tinyurl.com/4olve7",washingtonBNN,0,2008-10-09 06:37:37
952347200,"Also, NYT editorial board slams McCain/ Palin for... wait for it... race baiting and xenophobia. BURN. http://bit.ly/1qyJbW",tjsander,0,2008-10-09 06:36:46
952345789,@deeteezy What don't you like about Palin ?,tyronejones1968,0,2008-10-09 06:34:53
952344446,"page13news home: ACORN to ""Beat McCain Down"": Outside the Northeast Philly office of McCain/ Palin , .. http://tinyurl.com/4tt9eg",new_jerseyBNN,0,2008-10-09 06:33:03
952344026,"The Last Redoubt and Sarah Palin : DaveG, wants to know why we’ve fallen for Sarah Palin. Here&#82.. http://tinyurl.com/3zgtu5",Racefour,0,2008-10-09 06:32:22
952343873,"Alleged Palin Hacker Has Hacking History [Digg]: New information has surfaced showing David Kernell, the.. http://tinyurl.com/4f4ccm",stix1972,0,2008-10-09 06:32:10
952343491,"@markjreuter Palin not completing a sentance is like nearly presidential... Oh, wait. That's there now. W. Need I say more?",KatHulaParks,0,2008-10-09 06:31:37
952343068,Interview with Palin she keeps dodging questions. Even softballs from Fox snooze. What a joke. She had a moose in headlight look again,TheDudeAbides,0,2008-10-09 06:31:03
952342664,twaboutMCCAIN> Shannyn Moore writes about the McCain- Palin association with G. G. .. http://tinyurl.com/49nlok,twaboutMCCAIN,0,2008-10-09 06:30:28
952342606,"usually soft-spoken david gergen is appalled by Palin rallies. slams the rhetoric, ""UGLY scenes."" asserts Palin can control crowds.",marymcnamara,0,2008-10-09 06:30:24
952342535,Lol Fox Paints Todd Palin as the Male Feminist who shoots guns! LOL are they serious???,Bruce4Obama,0,2008-10-09 06:30:18
952342482,Video: Nader running mate Gonzalez on the Sarah Palin /Biden Debate http://tweetopolis.com/searchtag/118,twop,0,2008-10-09 06:30:14
952342124,"Shannyn Moore writes about the McCain- Palin association with G. G. Liddy, and compares that to Ayers and Obama: http://tinyurl.com/4b7blf",Shodoka,0,2008-10-09 06:29:53
952342091,"How is it that Palin has become the cadidate for VP, and yet can't string together a complete and coherent sentence?",markjreuter,0,2008-10-09 06:29:50
952341503,"SR: Blog Digest: Welcome to the weird and wonderful world of US politics maverick, Sarah Palin , in th.. http://tinyurl.com/4b88oe",freenews,0,2008-10-09 06:28:52
952341333,Sometimes Sarah Palin looks like a tranny to me. But mavericky!,RodSchoonover,0,2008-10-09 06:28:35
952340385,"@kimberlii I wasn't talking bout Biden;its not relevant to him. Palin feels that caring for others should fall to charity, but doesn't do so",jayratch,0,2008-10-09 06:27:09
952340307,Palin on Fox news is like a white sheet at a klan rally. Just fits right.,TheDudeAbides,0,2008-10-09 06:27:03
952339830,sarah palin is real people real dumb people,phoenix03,0,2008-10-09 06:26:12
952339809,"Hitting the Wrong Note - Palin Steps Onstage to a Song About an Abused Woman: One week ago tonight, .. http://tinyurl.com/4y5etg",womensissues,0,2008-10-09 06:26:11
952339806,"Yup, Sarah Palin doesn't have to put on airs. Her head is full of it.",doggo,0,2008-10-09 06:26:11
952339465,Palin told Charles Gibson she didn't blink when asked to run. Told Glenn Beck that she wouldn't run if asked.,SuSandStorm,0,2008-10-09 06:25:39
952339164,@saumil FOX is such a Republican network. So if Palin effed up there... then there's absolutely no hope for her.,DustinHasSoul,0,2008-10-09 06:25:10
952338948,CNN breaking: Todd Palin submits responses to subpoena. AK Legislature's report on trooper investigation due on Friday.,ayse,0,2008-10-09 06:24:50
952338446,Tomorrow's OMG SCANDAL: Obama mixed with the Democratic Socialists in Chicago. I'm sure Palin will be repeating that eleventy times a day.,dylanw,0,2008-10-09 06:24:06
952338280,"OMG, Sarah Palin just blew the easiest question EVER on Fox news ""What is the hardest decision you've had to make?""",saumil,0,2008-10-09 06:23:54
952338147,Pitbull or not Palin looks gorgeous with her hair down.,ThisJokersWild,0,2008-10-09 06:23:42
952337985,"What makes no sense to me is that Republicans are calling Obama a ""terrorist""... Palin is married to a traitor: http://tinyurl.com/5hp2yc",tpeterson,0,2008-10-09 06:23:28
952337891,Sarah Palin could never have the grace and composure that comes so naturally to Michelle Obama. Too bad ... so sad.,SuSandStorm,0,2008-10-09 06:23:20
952337303,I wonder how Palin feels knowing that she was actually second pick to Lieberman. That's gotta feel really low. I mean Lieberman?,SuSandStorm,0,2008-10-09 06:22:28
952337267,"@Keljo1991 Ok, then Palin is a traitor. Her husband was/is a member of a group that wants to secede from the union.http://tinyurl.com/5hp2yc",tpeterson,0,2008-10-09 06:22:25
952336749,@markvtorres i hope so. sarah palin is pretty hilarious (which *spoiler alert* is what I wrote my column about this Friday),mikeoz,0,2008-10-09 06:21:38
952335791,"New Blog Entry, ""Indecent Wire Service Pictures of Sarah Palin "" - http://tinyurl.com/4greua",PolitoStan,0,2008-10-09 06:20:24
952335770,"no, I wasn't talking about Biden; its not relevant to him. Palin feels that caring for others should fall to charity, but doesn't do so.",jayratch,0,2008-10-09 06:20:22
952335738,Yeah you google Sarah Palin and See WITCHDOCTOR Pastor!,Bruce4Obama,0,2008-10-09 06:20:19
952335681,"Todd Palin : blue eyes to die for, and now he's testifying. http://is.gd/3KLS",tedfrank,0,2008-10-09 06:20:15
952335412,@amandaisaturd fuck palin haha. She was no one then and is still no one now. I can't believe there was no perez or tmz then!,egb1986,0,2008-10-09 06:20:01
952334105,"Fox has lost its damn mind. Sound was off at the gym, but they were flashing pics of Princess Di and Palin . In true Repub fashion, trot ...",dpwac,0,2008-10-09 06:18:10
952333287,"Blog Digest: Welcome to the weird and wonderful world of US politics maverick, Sarah Palin , in th.. http://tinyurl.com/4b88oe",siliconrepublic,0,2008-10-09 06:17:09
952332791,""" Palin is the Katyusha rocket of red America."" http://tinyurl.com/4jnkcn",unclelarko,0,2008-10-09 06:16:28
952332467,Campaigning with Technology: Palin 's Email Hack Remains One of the Few Negatives http://tinyurl.com/3ee2bp,Dakshinamurti,0,2008-10-09 06:16:02
952331809,I pray Palin gets found guilty of troopergate. If you have nothing to hide. WHY ARE YOU HIDING?,Bruce4Obama,0,2008-10-09 06:15:09
952331800,Video: Nader running mate Gonzalez on the Sarah Palin /Biden Debate http://tweetopolis.com/searchtag/118,twop,0,2008-10-09 06:15:08
952331523,"video added http://snfd.tv/miU You Down With Sarah Palin ?-A hip hop ballad to Alaska's original gun-toting, moose-capping gangster.",snackfeedbuzz,0,2008-10-09 06:14:47
952330467,"why John McCain, Cindy McCain, and Sarah Palin always bad mouthing Barack Obama?",davidhalim,0,2008-10-09 06:13:10
952330056,@markvtorres this was the first big ol' Palin (and small McCain) advert I've seen. got a kick out of it.,mikeoz,0,2008-10-09 06:12:32
952329594,"wonder how Michael Palin , of Monty Python fame, feels about havng the same last name as sarah..must be quite disconcerting",howlvenice,0,2008-10-09 06:11:48
952329465,@netdoc66 at this point I realize that anybody who loves palin can't possibly ride for me or those like me. she's my antithesis in every way,huny,0,2008-10-09 06:11:37
952329365,"Retweeting @infodiva : LGBT Alaskans: ""I'm coming out against Sarah Palin "" http://www.feministing.com/archives/011477.html",ursulas,0,2008-10-09 06:11:27
952329229,@mikeoz I get very confused when I see Palin -McCain stickers on hybrid vehicles. You should do a piece on that :) PS message me your email,markvtorres,0,2008-10-09 06:11:13
952329089,Todd Palin doesn't like beer.,doggo,0,2008-10-09 06:11:00
952328827,"@ryanmf yes Palin is featured on my site bc I don't agree with her politics, if the vid was about Barack's politics instead of his name....",ArielleLoren,0,2008-10-09 06:10:38
952328097,@michelleostya--if you dress up as Gov. Palin for Halloween it would be an improvement,obamaisaliar,0,2008-10-09 06:09:33
952327838,New Post: Thomas Friedman Flattens Sarah Palin : http://tinyurl.com/4w4r9p Priceless.,cburell,0,2008-10-09 06:09:10
952326979,it might be fun to dress up as Gov. Palin for Halloween...,michellekostya,0,2008-10-09 06:07:55
952326252,"RT @bigeasy : RT @gwfrink3 Pastor's invocation at NC Palin rally call 4 God to ""close mouths"" of those who oppose McC/ Palin http://is.gd/3KpH",ursulas,0,2008-10-09 06:06:57
952326185,HD version of The Wasilla Project's first video on Sarah Palin is now on vimeo: http://www.vimeo.com/1917777,brookhinton,0,2008-10-09 06:06:53
952326183,Palin tactic http://tinyurl.com/3oqzux,LJWorld,0,2008-10-09 06:06:53
952325756,Candidate cookie sale shows most ‘voters’ sweet on Palin - Boston Herald: BBC NewsCandidate cooki.. http://tinyurl.com/4awrdf,GoogleNewsIndia,0,2008-10-09 06:06:18
952325589,Todd Palin : Contacts With Wife's Staff Were Proper http://tinyurl.com/4d6pky,FOX13Memphis,0,2008-10-09 06:06:05
952325383,Some quotes of Sarah Palin http://tinyurl.com/45bryl,sphurthy,0,2008-10-09 06:05:50
952324511,"watch http://snfd.tv/miG Video: AP Campaign Minute-Here's the latest from the campaign trail on Wednesday, Oct. 8th: McCain, Palin hammer...",snackfeedbuzz,0,2008-10-09 06:04:47
952324276,Sarah Palin on news week cover photo http://tinyurl.com/49dnso,sphurthy,0,2008-10-09 06:04:29
952324273,":: Yom Kippur, Project Runway, Palin , Michelle Obama, Daily Show, AIG, #ulearn08 , TGS, Pushing Daisies,... http://simpl.es/SibxU3",currentfm,0,2008-10-09 06:04:29
952323515,"New blog post: Exclusive interview with McCain, Palin - 6abc.com http://blog.buckrunoutdoors.com/?p=5410",SRTNCO,0,2008-10-09 06:03:36
952323363,"Como disse o Matt Damon a respeito da Sarah Palin : ""This looks like a bad Disney movie""",_LuckyBastard,0,2008-10-09 06:03:25
952322354,Oi! Palin : The US military justifies killing 33 Afghan civilians. Perhaps it is just conincident that 3.. http://tinyurl.com/3wdpn5,muslams,0,2008-10-09 06:02:06
952322129,"Rumour: Sarah Palin might spoof Tina Fey spoofing Sarah Palin on ""Saturday Night Live""? Funny, but too meta for my already befuddled brain.",fruityoaty,0,2008-10-09 06:01:51
952322002,Sarah Palin on Newsweek cover: Senator John McCain is complaining that Newsweek magazine did not photosho.. http://tinyurl.com/3rlv7c,skumora,0,2008-10-09 06:01:42
952321629,[FreeRepublic] Why Ayers case is risky for McCain- Palin [Barfer]: (CNN) -- During the.. http://tinyurl.com/49fb5p,conservatweet,0,2008-10-09 06:01:12
952320927,@_huny they're just trying to rile joe six pack up. I hate that Palin woman. She can go to hell.,netdoc66,0,2008-10-09 06:00:19
952320909,prietoj shared an item: Accused Palin hacker has a history of intrusion - ComputerworldAccused Palin h.. http://tinyurl.com/3hcdf9,aheneghana,0,2008-10-09 06:00:18
952320809,Video: Nader running mate Gonzalez on the Sarah Palin /Biden Debate http://tweetopolis.com/searchtag/118,twop,0,2008-10-09 06:00:12
952319857,"retweet-INSANE: Wonkette: Sarah Palin Parking Lot: This is phenomenal stuff, courtesy of Blogger Interrupt.. http://tinyurl.com/42s48n",lmc,0,2008-10-09 05:59:07
952319707,"Bloggin on Palin , rape kit, & 2008 election http://tinyurl.com/3n9hnq",victoriaplaceo,0,2008-10-09 05:58:57
952319385,Just watched Sarah Palin Linda Fey SNL - what a hoot!!!!,Preston555,0,2008-10-09 05:58:28
952318937,Breathtaking Ignorance Captured on Film at McCain/ Palin Ohio Rally http://tinyurl.com/3trlyk,Huliq,0,2008-10-09 05:57:51
952318436,Thomas Friedman: Palin ’s Kind of Patriotism http://is.gd/3KJ5,tracysheridan,0,2008-10-09 05:57:09
952318095,"""the eastern seaboard was american enough for al queda, it should be american enough for [ palin ]"" - sarah vowell on jon stewart http://p ...",bmwbzz,0,2008-10-09 05:56:41
952317808,"Reading: ""FactCheck.org: ""Dishonorable""| McCain- Palin ad distorts Obama's remark on Afghanistan and support for troop-funding bills. ( h ...",Faithbasechange,0,2008-10-09 05:56:15
952317481,"sbtodd: GMA also mentioned this morning that Palin has an open offer to appear. If things keep going south, she'll show up in last week.",politicoman,0,2008-10-09 05:55:48
952316233,andrew_galvin: Admires Sarah Palin 's what?,politicoman,0,2008-10-09 05:54:07
952316229,palin only doing fined news,phoenix03,0,2008-10-09 05:54:07
952316023,Election: Jury indicts UT student accused of hacking Palin 's e-mail : The prank took an online .. http://tinyurl.com/4p8ejv,knoxnews,0,2008-10-09 05:53:52
952315960,"Election: McCain- Palin rally electric : BETHLEHEM, Pa. - Republicans John McCain and Sarah Pal.. http://tinyurl.com/3hu676",knoxnews,0,2008-10-09 05:53:47
952315867,Jury indicts UT student accused of hacking Palin 's e-mail http://tinyurl.com/4p8ejv,knoxnews,0,2008-10-09 05:53:40
952315834,"twHILLARY> 9.3M have watched SNL's Clinton- Palin segment online. The ""Couric interview"" ha.. http://tinyurl.com/44ubc8",twHILLARY,0,2008-10-09 05:53:38
952315823,@_huny well can I still kick the laggers in the throat? They need incentive. Did you see the Police chief talking shit at the Palin rally?,netdoc66,0,2008-10-09 05:53:38
952315059,Got into a heated exchange at the gym with a man who admires Sarah Palin .,andrew_galvin,0,2008-10-09 05:52:40
952314533,I scored a 90% on the Palin or Fey quiz. http://tinyurl.com/3ld2o6,jcchurch,0,2008-10-09 05:51:58
952313796,@templesmith Where was this Brooks quote about Palin ?,ScottBieser,0,2008-10-09 05:50:58
952313401,A Close Look at McCain- Palin Fans http://tinyurl.com/4gnmqa,Truthdig,0,2008-10-09 05:50:29
952312866,New Hulu MSNBC Decision 08: McCain’s Botched Game-Changer: Oct. 8: Though Sarah Palin celebrated John McCain’s debate vic..,cedorris,0,2008-10-09 05:49:53
952312351,MSNBC - A Palin ‘SNL’ appearance likely to be a surprise: It seems like the inevitable comed.. http://is.gd/3KIi,USABreakingNews,0,2008-10-09 05:49:14
952311616,"from recent Bill Maher show: Gary Shandling: ""[Biden prepped for Palin debate] by watching tape of Johnny Carson dealing with Charo"" LOL!",mikl_em,0,2008-10-09 05:48:20
952311312,#3News NZ: Sarah Palin to meet impersonator Tina Fey on TV?: It seems like the inevitable comed.. http://tinyurl.com/4oyz5h,3NewsNZ,0,2008-10-09 05:48:01
952311160,"Religion: Camille Paglia on Sarah Palin , Barack Obama, Joe Biden and more | Salon http://tinyurl.com/4gug3w",top_religion,0,2008-10-09 05:47:50
952311040,"@rogermike ""Only McCain can protect America""? From what - his wanna be pitbull Palin ?",SuSandStorm,0,2008-10-09 05:47:41
952310330,Reuters Pics Halos 4 Obama Suggesting He's Christ Upskirt Porn Shots of Palin Suggesting Shes a Chillbilly Jezebel http://tinyurl.com/4mwtom,velvethammer,0,2008-10-09 05:46:47
952310182,"@circa1908 If Bristol Palin wasn't directly involved, she was indeed the inspiration.",thepbg,0,2008-10-09 05:46:36
952309938,Palin /Bush not only scorn liberal ideas but scorn ideas entirely http://twurl.nl/2imhdq,BarrettDavid,0,2008-10-09 05:46:14
952309829,"david seger, ball gag, sarah palin ... did I make it on this election hot topic twitter page: http://tinyurl.com/4gsxnu ??",DelbertShoopman,0,2008-10-09 05:46:05
952309652,no SNL on saturday. boo hoo. but fey does palin on thursday night. rumors abound that the real palin may show up.,ianmal,0,2008-10-09 05:45:53
952309088,Video: Nader running mate Gonzalez on the Sarah Palin /Biden Debate http://tweetopolis.com/searchtag/118,twop,0,2008-10-09 05:45:08
952308191,"Probably old to most, but it was new to me. Lessig on Palin : http://blip.tv/file/1287551",srobbin,0,2008-10-09 05:43:57
952307658,Once again McCain calls Palin one of the foremost experts on energy issues....he uses that yet to be started pipeline as evidence...unreal,roonoid,0,2008-10-09 05:43:09
952307363,"Palin was picked to inspire people? What a joke, she can't answer questions intellegently - well neither can a PIT BULL",bln111257,0,2008-10-09 05:42:45
952307351,"@jmeden And Palin is a NeoCon. And most people know, NeoCon is the new Nazi.",tpeterson,0,2008-10-09 05:42:45
952306571,""" Palin ‘SNL’ appearance likely to be surprise"" Um, not any more.",Jmartens,0,2008-10-09 05:41:45
952306376,"Okay, Halloween costumes are down to: Hobbit/Gnome, ""Sexy Lumberjack"", Sara Palin , and Oregonian.",costumersupport,0,2008-10-09 05:41:31
952306016,"In an interview, McCain said he chose Palin to inspire America. I suppose it is inspiring to think anyone, _anyone_, can be vice president.",cgomez,0,2008-10-09 05:41:02
952305948,New blog post: Palin emparentada con Roosevelt y la princesa Diana http://tinyurl.com/4m8obw,Noticiasdot,0,2008-10-09 05:40:57
952305417,If I type Sarah Palin and Ball Gag in the same sentence I'll turn up at this election hot topic twitter page: http://tinyurl.com/4gsxnu,DaveSeger,0,2008-10-09 05:40:17
952305354,Red County: Why This Young Black Man Is Voting For McCain & Palin : [...] http://tinyurl.com/42maeh,californiaBNN,0,2008-10-09 05:40:12
952304785,"LGBT Alaskans: ""I'm coming out against Sarah Palin "" http://www.feministing.com/archives/011477.html",infodiva,0,2008-10-09 05:39:33
952304033,"Stubborn Liberal: Strongsville, Ohio: Hatred on the March?: McCain and Palin were in Strongsville, Ohio. .. http://tinyurl.com/4727sl",ohioBNN,0,2008-10-09 05:38:34
952303912,Campaigning with Technology: Palin 's Email Hack Remains One of the Few Negatives http://tinyurl.com/3ee2bp,OriginalSignal,0,2008-10-09 05:38:25
952303759,"Tonight @dinner, after a lot of talking about McCain/ Palin - my pastor reminded me that I'm the one who is preaching on Nov 9th. Doh! Fun.",adamwc,0,2008-10-09 05:38:12
952303668,Agorafilms: Palin 312 days per diem for living in her own house. That's an economic plan I could get behind. Pay me for living in my house.,politicoman,0,2008-10-09 05:38:06
952302983,FightingBob.com: Palin by comparison: Honoring Bob Kastenmeier and Dave Obey serves as a reminder of.. http://tinyurl.com/3zp7gx,wisconsinBNN,0,2008-10-09 05:37:17
952302967,Sarah Palin apparently has family roots in Canada. ?!,anaazia,0,2008-10-09 05:37:16
952302923,they put mccain and palin up just to see what they could get away with.will these fools vote for any body no matter how incompetent,ConqueringLion,0,2008-10-09 05:37:13
952302021,"Ind. is having lie detectors at the debate, how wonderful would it be if we could wire McCain and Palin to lie detectors.",carterartist,0,2008-10-09 05:36:13
