id,text,username,retweets,date
953199466,Last twitt is for all the Obama fans :) How Palin fans are so stupid I'll never know.,matthewtanner,0,2008-10-09 20:56:56
953199464,McCain pals around with terrorists-Todd Palin member of AIP wanting to cede from the USA,j9lonehill,0,2008-10-09 20:56:59
953199421,Do you know there's a law in Alaska that says it's a crime if u do NOT stop and pick up hitchhikers on the highway there? Think Palin does?,TheToolWiz,0,2008-10-09 20:56:55
953199044,"“I don't see the other ticket being asked to be truthful and give details,” Sarah Palin http://twurl.nl/58jrx6",BarrettDavid,0,2008-10-09 20:56:36
953198917,"McCain, Palin in Waukesha: Not out of it yet. http://tinyurl.com/2el29m/20081009/GPG0101/81009089/1978",JeffAshGB,0,2008-10-09 20:56:31
953198615,when is Palin AIP connection going to get all of the attention that Ayers has gotten? Is noone concerned about Iran connection to AIP?,LElliottAbraham,0,2008-10-09 20:56:17
953198602,Palin is aligned with neo-nazi secessionist. http://tinyurl.com/455rws,bigskyman,0,2008-10-09 20:56:14
953198367,Palin wants women to carry rapists babies. http://tinyurl.com/43j77h,bigskyman,0,2008-10-09 20:56:04
953198158,Palin on Rape Kits. http://tinyurl.com/43j77h,bigskyman,0,2008-10-09 20:55:51
953197981,Palin 's Kind of Patriotism. http://tinyurl.com/3ubhnh,bigskyman,0,2008-10-09 20:55:44
953197864,New blog post: The McCain Palin Mob http://tinyurl.com/3hcww5,jeffcarter,0,2008-10-09 20:55:38
953197742,I saw Sarah Palin (and a whole lot of security) walking out of a hotel in downtown Milwaukee this morning.,nowpencan,0,2008-10-09 20:55:31
953197737,Don't be fooled. Sarah Palin hates America. http://tinyurl.com/3rdlhk,bigskyman,0,2008-10-09 20:55:33
953197562,"Retweeting @bokardo : truly chilling video of supporters gathering for McCain/ Palin rally in Bethlehem, PA http://tinyurl.com/3hhwyv",nickb,0,2008-10-09 20:55:26
953197549,"oops, Palin . darn dyslexia!",bigbitey,0,2008-10-09 20:55:24
953197344,saw a Palin bumper sticker. Not Mccain- Palin . Not Palin -Mccain. Just Palin .,paulcorrigan,0,2008-10-09 20:55:15
953197076,Hope and Change are Palin and Mcain!,stevebeam,0,2008-10-09 20:55:04
953196889,New Post!: McCain- Palin Rhetoric Goes Over the Top: clipped from rawstory.comShouts .. http://tinyurl.com/44kerw,Wisco,0,2008-10-09 20:54:53
953196885,Palin hacker pleads not guilty http://tinyurl.com/4f7jdb,amandaknpp,0,2008-10-09 20:54:56
953196693,@Sarah_ Palin you are my hero :),backstreet,0,2008-10-09 20:54:46
953196332,"I thought Sarah Palin didn't want the ""filter of the mainstream media"". Now her supporters are screaming because she wasn't retouched?!",2terriervineyrd,0,2008-10-09 20:54:28
953196267,costume place has life-size cut-outs of McCain & Palin . scary.,nightstand,0,2008-10-09 20:54:25
953196233,"Palin Says Obama Would Diminish""The Prestige Of The United States Presidency/she said that really?,does she mean lower the property value",ConqueringLion,0,2008-10-09 20:54:23
953196067,@JaidaG I agree: Who is Sarah Palin really?,codestream,0,2008-10-09 20:54:13
953196014,del *.* c:\mccain\porn\ palin,medeens,0,2008-10-09 20:54:14
953195983,"@chockenberry It is, available exclusively from the McCain/ Palin campaign shop. Search for “The Maverick.”",dsandler,0,2008-10-09 20:54:10
953195748,"'Before Sarah Palin became a professional jabbering folksy idiot, the rabid Alaskan separatist presented sport on TV.' http://is.gd/3MT0",mrnicholasmark,0,2008-10-09 20:53:57
953195274,Who is Sarah Palin really ???,codestream,0,2008-10-09 20:53:35
953194982,"Speaking of Domestic Terror, what's Palin 's position on inner-city gangs fueled by sales of illicit drugs? Are there even gangs in Wasilla?",TheToolWiz,0,2008-10-09 20:53:21
953193987,"So, is anyone making "" Palin == Idiot"" yard signs yet? If so, I would like to buy a couple.",willie,0,2008-10-09 20:52:35
953193515,""" Palin Says Obama Would Diminish ""The Prestige Of The United States Presidency"""" - HAHAHAHAHAHAHAHAHAHAAAA!!! Ahhh she's so FUNNY!",dianadhevi,0,2008-10-09 20:52:14
953193401,I beleive that The McCain/ Palin campaign are lighting a fuse that could spark off a full on race war.,Babynrse,0,2008-10-09 20:52:08
953193369,but I am sure Palin doesn't know what state wall street is in anyway,tarheelguy124,0,2008-10-09 20:52:04
953193238,@ricksanchezcnn the general feel was citizens cant lose with either mccain/obama but not so much now.it was the palin choice and mudslinging,ConqueringLion,0,2008-10-09 20:52:02
953193158,"Palin is the best choice for VP, hands down!",dooleywarren,0,2008-10-09 20:51:55
953193030,"The Anchorage Press on Palin ’s email exploits: We’ve all heard of the infamous “Frank, This not the Gov.. http://tinyurl.com/4plzs5",TMV,0,2008-10-09 20:51:50
953192971,McCain and Palin = Mentos and Diet Coke. Future leaders of our country? Scary. http://tiny.cc/AMNMe,franbellbaruch,0,2008-10-09 20:51:47
953192924,"Is that ""I"" a dildo? That's a kind of Palin Power I don't really want to think about. http://bit.ly/2dpM9y",chockenberry,0,2008-10-09 20:51:43
953192802,"If Obama will only take guns from insane people, then Sarah Palin will lose her guns!",bigbitey,0,2008-10-09 20:51:36
953192575,"After all the spam about penis enlargement, I for one am GLAD that Palin is addressing the common man: ""Joe Six-Inch.""",Halcyon,0,2008-10-09 20:51:26
953192380,Dow is down over 600pts and Mc/ Palin are still talikng about Ayers! Talk about a disconnect. Even Joe 6 pak won't care if his 401 k hits 0.,realmatrix,0,2008-10-09 20:51:21
953192353,"@htdakar @ricksanchezcnn Exactly re: falling 401K & home values Incitements, like picking Palin , = McCain plan 2 distract ppl from ISSUES",Zily_Popygaj,0,2008-10-09 20:51:17
953192299,"Did Sarah Palin get back to Katie Couric yet, or is she a liar? http://tinyurl.com/4hu7uh",bigskyman,0,2008-10-09 20:51:15
953192065,"Stock market crashing, palin going on about Ayers",tarheelguy124,0,2008-10-09 20:51:07
953191807,#catalyst08 and Steven Furtick are both more talked about on Twitter than Sarah Palin and iPhone. Even Apple. Whoa. That's flow.,ScottMagdalein,0,2008-10-09 20:50:54
953191785,"sarah palin a ""fatal cancer"" says conservative David Brooks! http://tinyurl.com/4xbuuq",proben,0,2008-10-09 20:50:53
953191168,Sarah Palin to drop puck in Philly Hockey opener: Shame in the Philadelphia Flyers and Ed Snider.. http://tinyurl.com/4yjcfz,crooksandliars,0,2008-10-09 20:50:20
953190799,"@samharrelson Sam, Theologically speaking, is Sara Palin ""allowed"" to be in the position she soon will be in?",profwebs,0,2008-10-09 20:50:09
953190760,"@lady with mccain / palin sign ""thats not how you spell obama""",djbruce,0,2008-10-09 20:50:07
953190436,I just realized this Halloween's most popular costume will be Sarah Palin .,amboy00,0,2008-10-09 20:49:56
953190404,"@ricksanchezcnn mccain was respected by all till he pulled that palin stunt,its been downhill every sense,they reak of desperation",ConqueringLion,0,2008-10-09 20:49:54
953190153,"Palin 's e-mail hacker indicted, to be kept offline: Yesterday, one David C. Kernell, a 20-year-ol.. http://tinyurl.com/4bqopb",salonmachinist,0,2008-10-09 20:49:40
953190102,@ricksanchezcnn Why anyone be afraid of Barack when it is Sarah Palin who scares the hell out of me does guilt by association scare anyone?,markrjinlv,0,2008-10-09 20:49:39
953190093,Where's the uproar on Palin links to anti-U.S. group? http://www.thestar.com/News/USElection/article/514503,bmorsh,0,2008-10-09 20:49:39
953190019,"Digg: McCain- Palin Rally Attendees: ""Obama is a terrorist"" (VIDEO): huffingtonpost.com — (D.. http://tinyurl.com/3kbec9",top_dedist,0,2008-10-09 20:49:35
953189984,@wakingjonas I'm glad you think Obama is hot. I happen to think Sarah Palin is a doll! My wife rolls her eyes at me!,thoughtbeast,0,2008-10-09 20:49:33
953189726,HELP: Is it PALIN like NAILIN' or PALIN like STALIN ???? #taxiforone,fatherjack,0,2008-10-09 20:49:18
953189187,"After firing the chicken failed to attract visitors, Palin first denied firing it then stated, ""Also, too, besides, God told me to fire it.""",smartasshat,0,2008-10-09 20:48:56
953189065,Todd Palin denies 'Troopergate' influence http://tinyurl.com/485ctb,dailytelegraph,0,2008-10-09 20:48:51
953188825,Todd Palin denies 'Troopergate' influence http://tinyurl.com/3zkbf2,theTiser,0,2008-10-09 20:48:39
953188716,Todd Palin denies 'Troopergate' influence http://tinyurl.com/46cj2q,couriermail,0,2008-10-09 20:48:33
953188591,Dow drops below 9000 on news that Andrew Sullivan is still harping on Trig Palin 's parentage.,johntabin,0,2008-10-09 20:48:30
953188411,"Sarah Palin : ""You had supported John McCain's military strategies pretty adamantly until this race."" http://is.gd/3uSB",ToTellTheTruth,0,2008-10-09 20:48:22
953188112,"Digg: McCain- Palin Rally Attendees: ""Obama is a terrorist"" (VIDEO): huffingtonpost.com — (Digg.. http://tinyurl.com/3kbec9",top_web,0,2008-10-09 20:48:09
953187737,This PBS poll on Palin 's qualification to be vice president is split at 49%. How can that be?? http://tinyurl.com/67kocc,NealMeier,0,2008-10-09 20:47:54
953187718,Babywearing with Sarah Palin http://tinyurl.com/4a3m7n,candaceapril,0,2008-10-09 20:47:54
953187712,"Palin refusal to cooperate in Investigation? This is what we can expect from her? ""We're not buying the Republican Ticket to Nowhere!""",codestream,0,2008-10-09 20:47:52
953187369,i wonder - could palin answer these questions about herself?: http://www.cnn.com/2008/LIVING/studentnews/10/09/cnnce.palin.revealed/,jeniflower72,0,2008-10-09 20:47:38
953187334,Political Whore: GOP complains that Palin wasn’t retouched on Newsweek: Barack Obama got.. http://tinyurl.com/48evrh,cl_tampabay,0,2008-10-09 20:47:36
953186969,"ohio isn't only comprised of ignorant, strange ppl - http://tinyurl.com/3sbmjz - footage from palin /mccain rally.",allisonpeltz,0,2008-10-09 20:47:16
953186653,"McCain- Palin Rally Attendees: ""Obama is a terrorist"" (VIDEO) http://twurl.nl/ra43qd -TheRealMcCain",HuffPostPol,0,2008-10-09 20:47:04
953186650,"McCain- Palin Rally Attendees: ""Obama is a terrorist"" (VIDEO) http://twurl.nl/ra43qd",TheRealMcCain,0,2008-10-09 20:47:04
953186311,"@scott_malish ""Joe Biden spent more time laughing than Governor Palin has answering questions""",teresa_o,0,2008-10-09 20:46:47
953186160,"McCain/ Palin make me sick. This is a new low when you chant that your opponent is a ""Terrorist""? WTF,McCain you pussy.",carterartist,0,2008-10-09 20:46:44
953185993,"McCain- Palin Rally Attendees: ""Obama is a terrorist"" (VIDEO): File this one under the ""give 'em enoug.. http://tinyurl.com/3so653",DiggStories,0,2008-10-09 20:46:33
953185841,"McCain- Palin Rally Attendees: ""Obama is a terrorist"" (VIDEO) http://tinyurl.com/3so653",diggupdates,0,2008-10-09 20:46:29
953185134,Joe Scarsboro ga-ga over Palin . Doesn't realize that she is scripted. Just because she can yell back at a heclker doesn't make her a star,bln111257,0,2008-10-09 20:45:55
953184993,"http://snipr.com/47xpm - Is Sarah Palin ""pallin' around"" with terrorists?",dominickevans,0,2008-10-09 20:45:51
953184767,Late Night with Conan O'Brien: Late Night Sarah Palin Auditions (10/3/08) http://is.gd/3xwG,LateNightClips,0,2008-10-09 20:45:41
953184651,Palin : The Leader of the Evil Idiot Brigade (EIB). http://tinyurl.com/4s7smc,bigskyman,0,2008-10-09 20:45:36
953184497,"McCain- Palin Rally Attendees: ""Obama is a terrorist"" (VIDEO): File this one under the ""give 'em enough.. http://tinyurl.com/3so653",feedzzz,0,2008-10-09 20:45:29
953184238,"Sarah Palin : As mayor, every year I was in office I did reduce taxes. http://is.gd/3upq",ToTellTheTruth,0,2008-10-09 20:45:16
953184017,Video: Nader running mate Gonzalez on the Sarah Palin /Biden Debate http://tweetopolis.com/searchtag/118,twop,0,2008-10-09 20:45:09
953183954,Palin 's Alaskan Independence Movement party sponsored by Iran. Seriously? From Salon.com http://tinyurl.com/3rdlhk,justinkeller,0,2008-10-09 20:45:06
953183743,ZDNet: Student indicted for Palin e-mail hack http://tinyurl.com/3l9b4l,warped0ne,0,2008-10-09 20:44:57
953183715,John McCain and Sarah Palin are actively trying 2 bring out the worst in people--inciting racist tempers w/their terrorist insinuations.,TRUE,0,2008-10-09 20:44:57
953183560,@ricksanchezcnn McCain/ Palin playing dangerous game Encouraging (by winks & chuckles & silence) hatred = trying 2 catch&hold tiger by tail.,Zily_Popygaj,0,2008-10-09 20:44:48
953183076,Why does Palin hate America? http://tinyurl.com/3rdlhk,bigskyman,0,2008-10-09 20:44:24
953183066,On the street taping McCain- Palin supporters at OH rally: http://snurl.com/47utv - Quite revealing. US so divided right now. Needs to unite!,thirdworld,0,2008-10-09 20:44:22
953182705,"Gothamist: Cookie Poll Shows Obama May Bake Back the White House: Photo of Palin , McCain and Obama .. http://tinyurl.com/46wmv6",new_yorkBNN,0,2008-10-09 20:44:06
953182702,"thanx @granitemouse for the Sarah Palin -drome Maker: http://pa.lindro.me (""that's not a palendrome, a palendrome of Bolton would be Not ...",capricornucopia,0,2008-10-09 20:44:05
953181362,"Holy shit, there's a horrifying vid of the 'McCain- Palin Mob' on youtube. Blatant ignorance, racism and hatred. A truly scary video.",helper_sloth,0,2008-10-09 20:42:56
953181342,@dougdaulton We saw Rollins last year and the show was excellent. Looking forward to another great show. Hopefully it's not all about Palin .,vegasgeek,0,2008-10-09 20:42:56
953180804,Wood County GOP Perspective: Palin visit near WV: Team:Gov. Sarah Palin will be visiting St. Clai.. http://tinyurl.com/4v6ctj,westvirginiaBNN,0,2008-10-09 20:42:31
953180771,Late Night with Conan O'Brien: Sarah Palin Debate Camp (10/2/08) http://is.gd/3vDw,LateNightClips,0,2008-10-09 20:42:26
953180731,Palin twists the facts on Darfur http://is.gd/3upa,ToTellTheTruth,0,2008-10-09 20:42:23
953180272,"hey, NWJR (and all you other Sarah Palin fans out there): http://tinyurl.com/67kocc",susie_carroll,0,2008-10-09 20:42:02
953179865,"It's sad that in modern day America that race is such a factor. If McCain and Palin are opposed to this behavior, why not denounce it.",Ipourt,0,2008-10-09 20:41:44
953179379,"Is the Palin mob video not news worthy, because it makes me sick to think that this is who they are reaching to.",sblackdiamond,0,2008-10-09 20:41:19
953179238,"""Are you trying to seduce me, Mrs Palin ?"" http://tinyurl.com/4qmedm",LifeSansBldgs,0,2008-10-09 20:41:13
953178699,AllAccess: Ingraham Talks To Palin http://tinyurl.com/4konty,theradiohorn,0,2008-10-09 20:40:45
953178405,"Let's be honest, Mccain is just a liar. he has his little idiot Palin out lying too",tarheelguy124,0,2008-10-09 20:40:28
953178176,Loretta Nall: OMFG!!: -->I just got around to watching that. They slaughtered Palin ...much to my in.. http://tinyurl.com/484urs,alabamaBNN,0,2008-10-09 20:40:18
953178045,"sarah palin , say it with me: NOO-KLEE-UR",ms_cawley,0,2008-10-09 20:40:13
953177807,retweeting @joetennis The Palin Mob: OMG: http://tinyurl.com/52wyn6,mike_critz,0,2008-10-09 20:40:03
953177459,": So if Biden completely blew his explanation of the VP's duties and Palin didn't, does that change a Dem's mind about who one the debate?",TimTheFoolMan,0,2008-10-09 20:39:49
953177215,Todd Palin denies influencing wife in 'Troopergate' probe (AFP) http://www.newstwit.com?p=13811,breakingstories,0,2008-10-09 20:39:34
953177010,Palin : Obama not telling âtotal truthâ (Politico) http://www.newstwit.com?p=13804,breakingstories,0,2008-10-09 20:39:25
953176754,RT from @TinyFey @LeVarBurton http://tinyurl.com/3ztxxj - sophisticated visual aids clarifying the relationship of Fey to Palin .,quotergal,0,2008-10-09 20:39:13
953176041,@ricksanchezcnn how come nobody is talking about the over tones of McCain/ Palin rally's painting Obama as a terrorist and inciting hate,ProudAmerican6D,0,2008-10-09 20:38:35
953175293,Palin : I am an open book: http://tinyurl.com/4w4ym6,poljunk,0,2008-10-09 20:38:02
953174857,"Lisa Nova's "" Palin Biden Debate"" video... so funny http://tinyurl.com/4af63v",yiannig,0,2008-10-09 20:37:39
953174486,Looking for work. Hey did you catch Tina Fey doing Palin on SNL? - Awesom!,Westrok,0,2008-10-09 20:37:23
953174365,"retweeting @natalielin : For the good of the country, call for Palin to resign from the Republican ticket: http://tinyurl.com/bye-palin",MKraft,0,2008-10-09 20:37:17
953174088,Sarah Palin was the founder and President of the Wasilla Aquarium. It was shut down after the chicken drowned. Look it up.,smartasshat,0,2008-10-09 20:37:04
953174030,"Barrack Hussein Obama is smarter than McCain and Palin combined, no matter what his name is!",bigskyman,0,2008-10-09 20:37:02
953173920,"McCain- Palin Rally Attendees: ""Obama is a terrorist"" (VIDEO) http://tinyurl.com/3so653",mattrowe_test,0,2008-10-09 20:36:56
953173621,"My friends, perhaps Sarah Palin should explain her secessionist activities ... http://tinyurl.com/3zrnhd.",adriancumming,0,2008-10-09 20:36:40
953173599,"I'm not a Palin fan, but why do all of her nicknames have to be totally sexist?",MeaganFrancis,0,2008-10-09 20:36:41
953173107,FactChecking Biden- Palin Debate http://is.gd/3sYr,ToTellTheTruth,0,2008-10-09 20:36:17
953173011,"@ricksanchezcnn The sheriff, McCain, and Palin should be investigated for violation of Public Law #103-322A in regard to hate speeches.",patriot2008,0,2008-10-09 20:36:12
953172830,"Palin has a ""moosestache""",BrnEyeSuss,0,2008-10-09 20:36:04
953172531,"@TinaFey that is truly great! BTW: true, or not? you and Sarah Palin both appearing together on SNL?? (my boss told me :-) )",karma_musings,0,2008-10-09 20:35:48
953172103,@Ilectra http://twitpic.com/fbon - HAHAHA! Awesome! Palin sure is flexible.,aiadriano,0,2008-10-09 20:35:30
953171993,Hugh Hewitt: Fired Up Crowd Cheers warrning To Mccain Palin About Obama-Pelosi http://is.gd/3MPC,hughhewittblog,0,2008-10-09 20:35:24
953171834,"@HardHardTruth I understand minor Photoshopping tho don't always agree with it, esp. making older women look younger, but Palin is fine!",SheilaS,0,2008-10-09 20:35:17
953171641,finally mrs. palin you go girl! --> http://tinyurl.com/3tv39q,PhatEmoKid,0,2008-10-09 20:35:07
953171428,"Ask Palin : http://tinyurl.com/4ef2ca How about ""boxers or briefs?""",yuvalz,0,2008-10-09 20:35:01
953171078,Alaskan Independence Party sponsored By Iran. Check this one out. Another Sarah Palin gotcha. http://tinyurl.com/3qlxzy,xboogerx,0,2008-10-09 20:34:47
953170848,Palin is the mental successor to GW Bush http://www.custompcmax.com,custompcmax,0,2008-10-09 20:34:37
953170816,"@roneyzone re: Standing to the left, careful you might get mistook for a moose and get shot by Palin .",spiritualtramp,0,2008-10-09 20:34:34
953170658,"@telljeeves its so entertaining! Afro-American, v.old man, good looking dumb lady, former 1st lady..interest has shot up aftr Palin happened",gaprocks,0,2008-10-09 20:34:29
953170456,"""government get out of the way and oversight America"" - Palin",BiancaMJackson,0,2008-10-09 20:34:17
953170275,"In Florida, Palin asked 'Who is Barack Obama?' Who the fuck are YOU? You just showed up 5 weeks ago & even wanted to secede from the union!",saamir,0,2008-10-09 20:34:07
953169886,Lunchtime Lyrics: Madonna Slams Sarah Palin : Madonna sang a song about kicking Sarah Palin 'off o.. http://tinyurl.com/4pttex,PCNOnlineGossip,0,2008-10-09 20:33:52
953169342,"@Akula I watched that and got so mad at that woman's lies about how ""bad"" Palin looked that I couldn't finish the segment. What a fake",SheilaS,0,2008-10-09 20:33:28
953168526,"Trig Paxson Van Palin : ""Trig is a Norse word meaning 'true' and 'brave victory'"" and Van Palin because it sounds like the 80's band. Really.",paulkies,0,2008-10-09 20:32:50
953167306,Sarah Palin wants Alaska to be a seperate Nation http://tinyurl.com/4u7jgp,MeccaDonna,0,2008-10-09 20:31:53
953167228,"@N614EF true IMO if you lump in horrible attacks on Palin (Trig not hers, etc) w/ O campaign. Otherwise, look @anti-Lincoln campaign.",skydaddy,0,2008-10-09 20:31:48
953167162,Wonder if Sarah Palin will wear a 'I heart Israel' tee-shirt while campaigning in Florida...,donbart,0,2008-10-09 20:31:47
953167099,@ericmoritz | What do McCain and Palin have to do w/ Muslims?,caseypeters,0,2008-10-09 20:31:43
953167084,Palin 's msg http://tinyurl.com/4tbdko,randomnone,0,2008-10-09 20:31:43
953166280,Sarah Palin at her cleverest --> http://tinyurl.com/3tv39q,JrMozart,0,2008-10-09 20:31:06
953165972,"The McCain/ Palin Mob. This scary stuff, folks. http://preview.tinyurl.com/45v59f",RAReed,0,2008-10-09 20:30:53
953165842,Palin is obviously in over her head. The Couric interview showed that. Her head just exploded with all the things they have been teaching,custompcmax,0,2008-10-09 20:30:47
953165576,"Todd Palin Testifies In ‘Troopergate,’ Is Basically Responsible For Everything: The First La.. http://tinyurl.com/4bx6d3",Wonkette,0,2008-10-09 20:30:34
953165349,The Daily Show with Jon Stewart: Palin Debate Training http://is.gd/3uzD,LateNightClips,0,2008-10-09 20:30:24
953165159,"Palin refusing to cooperate in an investigation? This is what we can expect? ""Americans are not buying the Republican ticket to Nowhere!""",codestream,0,2008-10-09 20:30:13
953164989,Video: Nader running mate Gonzalez on the Sarah Palin /Biden Debate http://tweetopolis.com/searchtag/118,twop,0,2008-10-09 20:30:10
953164848,"Sanchez, Palin mob vid. Scarry stuff. Must see!!!",sblackdiamond,0,2008-10-09 20:30:02
953164763,"Election: for anyone still curious about Sarah Palin , this article provides the best insight I've seen: http://tinyurl.com/3ooe4w",altercloud,0,2008-10-09 20:30:03
953164224,"Assuming Black people would vote Obama just because he's also Black, assumes women would vote for Palin , in kind. It just makes no sense.",coexist1,0,2008-10-09 20:29:31
953164100,"Bob: Sarah Palin is that babysitter you think is really great, but hidden cameras show her shaking your baby and shit.",rsxsr,0,2008-10-09 20:29:27
953163918,Biden tells McCain to look Obama in the eye. McCain sees bright light. Quits campaign. Palin attacks McCain. Newsweek airbrushes,awake247,0,2008-10-09 20:29:16
953163898,Todd Palin has decided to take the fall for Troopergate. http://www.cbsnews.com/stories/2008/10/09/politics/main4511568.shtml,chochacho,0,2008-10-09 20:29:18
953163057,Madonna threatens Sarah Palin with violance: At her concert last night in New York Ci.. http://tinyurl.com/52c684,TruthOrLies,0,2008-10-09 20:28:37
953162776,@fixthebroken Trying to put together a joe six pack and hockey mommas for obama rally at Flyers game sat nite b/c Palin dropping puck,jerseymomma,0,2008-10-09 20:28:18
953162668,"TIME Magazine September 15, 2008 Vol. 172 No. 11: • COVER: Sarah Palin : A Frontier Mom's Roots - Plu.. http://tinyurl.com/4wypep",ETips,0,2008-10-09 20:28:15
953162180,"retweet @stix1972 Thanks To Palin Sarah Palin Visits Greenville, NC: What the Press Didn’t See: Sarah Palin .. http://tinyurl.com/3lh8z2",spcghst440,0,2008-10-09 20:27:51
953161908,Heard on the news that Sarah Palin will be dropping the puck at the Flyers season opener. Seems to me to be a disaster in the making...,keith_beecham,0,2008-10-09 20:27:38
953161887,...bad news is the test was Sarah Palin or Tina Fey: Can you tell the difference? http://tinyurl.com/3ld2o6 Can I add Palintologist to CV?,scottishlass,0,2008-10-09 20:27:35
953161695,McCain/ Palin - behind the scenes http://tinyurl.com/4b6bgl,iWriter,0,2008-10-09 20:27:26
953161399,The controversial Newsweek Sarah Palin cover http://tinyurl.com/4ymmz2,poho,0,2008-10-09 20:27:11
953161219,The Palin Mob: OMG: http://tinyurl.com/52wyn6,JoeTennis,0,2008-10-09 20:27:03
953160958,Sarah Palin —Feminist or Victim of Sexism?: This is what a feminist looks like? Let's not go there. http://is.gd/3MNS,usnews,0,2008-10-09 20:26:49
953160933,Check out Sarah Palin 's superhero video at http://tinyurl.com/4slkcg It's super hilarious!,PR_Beth,0,2008-10-09 20:26:52
953160897,"@mlong44 @ricksanchezcnn THat's exactly the point - As with selection of Palin , McCain allowing incitement etc 2 DISTRCT ppl from events",Zily_Popygaj,0,2008-10-09 20:26:49
953160896,can mccain/ palin be held rspnsbl if they incite angry mobs?,roomerholmes,0,2008-10-09 20:26:48
953160645,@girlmonkey how much we have PRESIDENT Palin ?,lectroidmarc,0,2008-10-09 20:26:35
953160231,"@xenijardin Midnight twitch: rigged election, McCain takes office, kicks it; Palin becomes uberfemme ruler of religio-oligarchic America.",ladyuberbabe,0,2008-10-09 20:26:15
953159882,"http://tinyurl.com/43kq88 Palin : ""Obama would diminish prestige of the presidency."" ""Out of the mainstream"".",pbromberg,0,2008-10-09 20:25:54
953159753,@geekchicohio i so hope it stays that way. did you see this video from the McCain/ Palin rally ystrdy? http://snurl.com/47jx9 so disturbing!,laurelmackenzie,0,2008-10-09 20:25:49
953159638,"For the good of the country, call for Sarah Palin to resign from the Republican ticket: http://tinyurl.com/bye-palin!",NatalieLin,0,2008-10-09 20:25:42
953158983,"This doesn't make me want her to be president, but it does make me like her more: Sarah Palin is a runner http://tinyurl.com/6cnp84",koskim,0,2008-10-09 20:25:10
953158501,I think the right-wing war on facts&truth is criminal and deep in traitor-territory. Why are they still walking around free? #RNC #FOX palin,rongillmore,0,2008-10-09 20:24:49
953158472,@ricksanchezcnn It sickens me every time i see McCain or Palin now because of how racially charged all their rally's are,Sean_Crees,0,2008-10-09 20:24:48
953158336,""" Palin is like Jodie Foster in the movie Nell"" Jon Stewart continued ""They just found her, and she was speaking her own special language.""",castewar,0,2008-10-09 20:24:40
